id,conversation_id,created_at,date,time,timezone,user_id,username,name,place,tweet,language,mentions,urls,photos,replies_count,retweets_count,likes_count,hashtags,cashtags,link,retweet,quote_url,video,thumbnail,near,geo,source,user_rt_id,user_rt,retweet_id,reply_to,retweet_date,translate,trans_src,trans_dest
1372535097094672385,1372531784001392644,2021-03-18 09:07:22 Eastern Daylight Time,2021-03-18,09:07:22,-0500,1623676812,westernuphealth,Western UP Health,,"@michaelhbabcock @TimothyScarlett Also, for anyone who does not have access to the internet, they can call 211 for assistance with getting  onto the WUPHD waitlist.",en,[],[],[],0,0,0,[],[],https://twitter.com/WesternUPHealth/status/1372535097094672385,False,,0,,,,,,,,"[{'screen_name': 'michaelhbabcock', 'name': 'Michael H. Babcock', 'id': '35102542'}, {'screen_name': 'TimothyScarlett', 'name': 'Timothy J Scarlett', 'id': '370703977'}]",,,,
1338141706298933251,1338141706298933251,2020-12-13 10:20:18 Eastern Standard Time,2020-12-13,10:20:18,-0500,1623676812,westernuphealth,Western UP Health,,Historic journey: Pfizer prepares to deliver 6.4 million doses of COVID-19 vaccines  https://t.co/iEFen0bylq via @freep,en,"[{'screen_name': 'freep', 'name': 'detroit free press', 'id': '8795772'}]",['https://www.freep.com/story/news/health/2020/12/13/pfizer-covid-19-vaccines-kalamazoo-michigan/6529215002/'],[],0,0,1,[],[],https://twitter.com/WesternUPHealth/status/1338141706298933251,False,,0,,,,,,,,[],,,,
1244283171044069383,1244283171044069383,2020-03-29 11:20:00 Eastern Daylight Time,2020-03-29,11:20:00,-0500,1623676812,westernuphealth,Western UP Health,,Michigan is looking for volunteers in the #COVID19 fight.  Sign up at  https://t.co/0rtAMqeOvE,en,[],['https://bit.ly/2UrOZev'],[],0,0,0,['covid19'],[],https://twitter.com/WesternUPHealth/status/1244283171044069383,False,,0,,,,,,,,[],,,,
1243969629422268416,1243969629422268416,2020-03-28 14:34:06 Eastern Daylight Time,2020-03-28,14:34:06,-0500,1623676812,westernuphealth,Western UP Health,,Thanks to everyone who is Staying Home and Staying Safe!  Your efforts help protect you and your community.,en,[],[],[],0,0,3,[],[],https://twitter.com/WesternUPHealth/status/1243969629422268416,False,,0,,,,,,,,[],,,,
1228389443100262400,1228389443100262400,2020-02-14 13:44:00 Eastern Standard Time,2020-02-14,13:44:00,-0500,1623676812,westernuphealth,Western UP Health,,Boil water notice for parts of Houghton County has been LIFTED.  Details below...   https://t.co/pH0zhIW824,en,[],['http://www.wupdhd.org/homepage-top-row/houghton-county-boil-water-advisory/'],[],0,0,0,[],[],https://twitter.com/WesternUPHealth/status/1228389443100262400,False,,0,,,,,,,,[],,,,
1228034780366655488,1228034780366655488,2020-02-13 14:14:42 Eastern Standard Time,2020-02-13,14:14:42,-0500,1623676812,westernuphealth,Western UP Health,,Boil water notice in effect for parts of Houghton County.     https://t.co/pH0zhIW824,en,[],['http://www.wupdhd.org/homepage-top-row/houghton-county-boil-water-advisory/'],[],0,1,0,[],[],https://twitter.com/WesternUPHealth/status/1228034780366655488,False,,0,,,,,,,,[],,,,
1215364036964962304,1215364036964962304,2020-01-09 15:05:41 Eastern Standard Time,2020-01-09,15:05:41,-0500,1623676812,westernuphealth,Western UP Health,,"The Western Upper Peninsula Health Department urges residents to test homes for radon.  Kits are free, and easy to use.  Stop by your local WUPHD office today.  #radonactionmonth     https://t.co/9RMOSJISD5",en,[],['http://bit.ly/36EtvyB'],[],0,0,0,['radonactionmonth'],[],https://twitter.com/WesternUPHealth/status/1215364036964962304,False,,0,,,,,,,,[],,,,
1200762951726239749,1200762951726239749,2019-11-30 08:06:11 Eastern Standard Time,2019-11-30,08:06:11,-0500,1623676812,westernuphealth,Western UP Health,, https://t.co/dmJwYhuUOA,und,[],['https://www.foodsafety.gov/food-safety-charts/food-safety-during-power-outage'],[],0,0,0,[],[],https://twitter.com/WesternUPHealth/status/1200762951726239749,False,,0,,,,,,,,[],,,,
1200057885088198656,1200057885088198656,2019-11-28 09:24:30 Eastern Standard Time,2019-11-28,09:24:30,-0500,1623676812,westernuphealth,Western UP Health,, https://t.co/REi3nInvjX,und,[],['https://youtu.be/jgq8fOKYn1A'],[],0,0,0,[],[],https://twitter.com/WesternUPHealth/status/1200057885088198656,False,,0,,,,,,,,[],,,,
1199812866595053569,1199812866595053569,2019-11-27 17:10:53 Eastern Standard Time,2019-11-27,17:10:53,-0500,1623676812,westernuphealth,Western UP Health,,Food Safety During a Power Outage | Food Safety | CDC  https://t.co/jdatxIazlm via @CDCgov,en,"[{'screen_name': 'cdcgov', 'name': 'cdc', 'id': '146569971'}]",['https://www.cdc.gov/foodsafety/food-safety-during-a-power-outage.html'],[],0,0,0,[],[],https://twitter.com/WesternUPHealth/status/1199812866595053569,False,,0,,,,,,,,[],,,,
1197585612733206528,1197585612733206528,2019-11-21 13:40:34 Eastern Standard Time,2019-11-21,13:40:34,-0500,1623676812,westernuphealth,Western UP Health,,Nearly 50 tons of salad products recalled because of E. coli  https://t.co/qgAXaiq6An,en,[],['https://www.foodsafetynews.com/2019/11/97272-pounds-of-salad-products-recalled-because-of-e-coli/'],[],0,0,0,[],[],https://twitter.com/WesternUPHealth/status/1197585612733206528,False,,0,,,,,,,,[],,,,
1192835490841427968,1192835490841427968,2019-11-08 11:05:17 Eastern Standard Time,2019-11-08,11:05:17,-0500,1623676812,westernuphealth,Western UP Health,,"The Western UP Health Department is seeking a part time, seasonal (school year), Health Educator to work out of our Gogebic County office!  More details at  https://t.co/MYKNYdPo3V",en,[],['http://www.wupdhd.org/employment/'],[],0,0,0,[],[],https://twitter.com/WesternUPHealth/status/1192835490841427968,False,,0,,,,,,,,[],,,,
1192816983789588480,1192816983789588480,2019-11-08 09:51:45 Eastern Standard Time,2019-11-08,09:51:45,-0500,1623676812,westernuphealth,Western UP Health,,Visit  https://t.co/2HWIlwmuNO to learn more about how Healthy Kids UP started and to discover ways local school and community programs are helping the UP become a healthier place to live.,en,[],['http://www.healthykidsup.org'],[],0,0,1,[],[],https://twitter.com/WesternUPHealth/status/1192816983789588480,False,,0,,,,,,,,[],,,,
1179040669211357186,1179040669211357186,2019-10-01 10:29:35 Eastern Daylight Time,2019-10-01,10:29:35,-0500,1623676812,westernuphealth,Western UP Health,,The Western Upper Peninsula Health Department has issued a health advisory for areas near the Julio scrapyards in Ripley.  For more information please visit:  https://t.co/NJHbBMf9ag,en,[],['http://bit.ly/2mEWDEb'],[],0,0,0,[],[],https://twitter.com/WesternUPHealth/status/1179040669211357186,False,,0,,,,,,,,[],,,,
1167088508608995328,1167088508608995328,2019-08-29 10:55:58 Eastern Daylight Time,2019-08-29,10:55:58,-0500,1623676812,westernuphealth,Western UP Health,,Western UP Health Department is seeking a Health Education Coordinator - check out the details:  https://t.co/MgToknDyUF,en,[],['http://bit.ly/2Zp1Vpp'],[],0,0,0,[],[],https://twitter.com/WesternUPHealth/status/1167088508608995328,False,,0,,,,,,,,[],,,,
1159924900477321216,1159924900477321216,2019-08-09 16:30:21 Eastern Daylight Time,2019-08-09,16:30:21,-0500,1623676812,westernuphealth,Western UP Health,,Important information for City of Ironwood water customers.   https://t.co/XsmpgEd7uT,en,[],['http://bit.ly/2YUy6vH'],[],0,0,0,[],[],https://twitter.com/WesternUPHealth/status/1159924900477321216,False,,0,,,,,,,,[],,,,
1159509830526066689,1159509830526066689,2019-08-08 13:01:00 Eastern Daylight Time,2019-08-08,13:01:00,-0500,1623676812,westernuphealth,Western UP Health,,The phones at our Hancock office are back up and running...we look forward to hearing from you.  https://t.co/dMpj3voO7Y,en,[],[],['https://pbs.twimg.com/tweet_video_thumb/EBdoCqjVUAEK8Ip.jpg'],0,0,0,[],[],https://twitter.com/WesternUPHealth/status/1159509830526066689,False,,1,https://pbs.twimg.com/tweet_video_thumb/EBdoCqjVUAEK8Ip.jpg,,,,,,,[],,,,
1159461525737869312,1159461525737869312,2019-08-08 09:49:04 Eastern Daylight Time,2019-08-08,09:49:04,-0500,1623676812,westernuphealth,Western UP Health,,The Western UP Health Department office in Hancock is unable to receive incoming phone calls at this time.  We have been informed the problem is linked to a large outage from our service provider.  We apologize for any inconvenience.,en,[],[],[],0,0,0,[],[],https://twitter.com/WesternUPHealth/status/1159461525737869312,False,,0,,,,,,,,[],,,,
1159090347550621698,1159090347550621698,2019-08-07 09:14:08 Eastern Daylight Time,2019-08-07,09:14:08,-0500,1623676812,westernuphealth,Western UP Health,,Public Health Departments in the Western and Central Upper Peninsula announce the search for a Medical Director...   https://t.co/QS5mEOnPcD,en,[],['http://bit.ly/UPMedDirSearch'],[],0,0,0,[],[],https://twitter.com/WesternUPHealth/status/1159090347550621698,False,,0,,,,,,,,[],,,,
1152225000461688832,1152225000461688832,2019-07-19 10:33:42 Eastern Daylight Time,2019-07-19,10:33:42,-0500,1623676812,westernuphealth,Western UP Health,,Its going to be a hot one in the Western UP Today.  Getting too hot can make you sick.  Click the link to explore ways to prevent heat related illness.  https://t.co/QUkAAZF3xW,en,[],['http://bit.ly/2JGmmF1'],[],0,0,0,[],[],https://twitter.com/WesternUPHealth/status/1152225000461688832,False,,0,,,,,,,,[],,,,
