id,conversation_id,created_at,date,time,timezone,user_id,username,name,place,tweet,language,mentions,urls,photos,replies_count,retweets_count,likes_count,hashtags,cashtags,link,retweet,quote_url,video,thumbnail,near,geo,source,user_rt_id,user_rt,retweet_id,reply_to,retweet_date,translate,trans_src,trans_dest
1277679844235542533,1277679844235542533,2020-06-29 15:06:27 Eastern Daylight Time,2020-06-29,15:06:27,-0500,2319139812,wchdmo,WCHD Missouri,,Limited Appointment Spots- CALL TODAY to schedule your kids back to school shots NOW!  https://t.co/quZRVo8BHT,en,[],[],['https://pbs.twimg.com/media/Ebs68nDWoAAyqRp.jpg'],0,0,0,[],[],https://twitter.com/WCHDMO/status/1277679844235542533,False,,1,https://pbs.twimg.com/media/Ebs68nDWoAAyqRp.jpg,,,,,,,[],,,,
1255491436511997953,1255491436511997953,2020-04-29 09:37:39 Eastern Daylight Time,2020-04-29,09:37:39,-0500,2319139812,wchdmo,WCHD Missouri,,Handwashing 101 #ShowMeStrong  https://t.co/4wfssyvNJ6 via @YouTube,en,"[{'screen_name': 'youtube', 'name': 'youtube', 'id': '10228272'}]",['https://youtu.be/rQv1jF99Qzg'],[],0,0,0,['showmestrong'],[],https://twitter.com/WCHDMO/status/1255491436511997953,False,,0,,,,,,,,[],,,,
1239908369164533761,1239908369164533761,2020-03-17 09:36:06 Eastern Daylight Time,2020-03-17,09:36:06,-0500,2319139812,wchdmo,WCHD Missouri,,"CDC link for getting your household ready and planning for a COVID-19 outbreak. Share the information with those that don't have internet. Warren County is wonderful community...let's help our neighbors, comfort our kids, and be patient   https://t.co/sk4whmWB93",en,[],['https://www.cdc.gov/coronavirus/2019-ncov/prepare/get-your-household-ready-for-COVID-19.html'],[],0,0,1,[],[],https://twitter.com/WCHDMO/status/1239908369164533761,False,,0,,,,,,,,[],,,,
1237112231692771328,1237112231692771328,2020-03-09 16:25:15 Eastern Daylight Time,2020-03-09,16:25:15,-0500,2319139812,wchdmo,WCHD Missouri,,Please go to the following link for up-to-date COVID 19 Outbreak information from the Missouri Dept. of Health &amp; Senior Services.  https://t.co/VYruYNNYFh,en,[],['https://health.mo.gov/living/healthcondiseases/communicable/novel-coronavirus/'],[],0,1,0,[],[],https://twitter.com/WCHDMO/status/1237112231692771328,False,,0,,,,,,,,[],,,,
1210593073585111041,1210593073585111041,2019-12-27 11:07:35 Eastern Standard Time,2019-12-27,11:07:35,-0500,2319139812,wchdmo,WCHD Missouri,,UPDATE!!  Diaper delivery will be at 1:00 p.m. today instead of 11:30 p.m.  Sorry for any inconvenience.,en,[],[],[],0,0,0,[],[],https://twitter.com/WCHDMO/status/1210593073585111041,False,,0,,,,,,,,[],,,,
1189912440697446402,1189912440697446402,2019-10-31 10:30:08 Eastern Daylight Time,2019-10-31,10:30:08,-0500,2319139812,wchdmo,WCHD Missouri,,"NEXT WEEK!!  Please share and make sure to attend.  Great, reliable info you and your kids need to know. FREE",en,[],[],[],0,0,1,[],[],https://twitter.com/WCHDMO/status/1189912440697446402,False,https://twitter.com/WarrenCoR3/status/1186692174668189696,0,,,,,,,,[],,,,
1186679455097466882,1186679455097466882,2019-10-22 12:23:24 Eastern Daylight Time,2019-10-22,12:23:24,-0500,2319139812,wchdmo,WCHD Missouri,,"FREE event by BHMS, Warren County Health Dept, WARS and NCADA.  If you have kids you NEED to attend and get this info!  Elementary, middle school and HS kids in Warren County are dealing with this everyday and need your help!  Get the facts.  https://t.co/EJs9SArj9I",en,[],[],['https://pbs.twimg.com/media/EHfupX0WwAEF8It.jpg'],0,0,0,[],[],https://twitter.com/WCHDMO/status/1186679455097466882,False,,1,https://pbs.twimg.com/media/EHfupX0WwAEF8It.jpg,,,,,,,[],,,,
1181944925551767552,1181944925551767552,2019-10-09 10:50:04 Eastern Daylight Time,2019-10-09,10:50:04,-0500,2319139812,wchdmo,WCHD Missouri,,"Cooking in a pressure cooker can be a great way to cook healthy food fast! Produce for Kids has a great article with tips, tricks and recipes!",en,[],[],[],0,0,0,[],[],https://twitter.com/WCHDMO/status/1181944925551767552,False,https://twitter.com/Healthyfamprj/status/1181670358203666432,0,,,,,,,,[],,,,
1181575602941374468,1181575602941374468,2019-10-08 10:22:31 Eastern Daylight Time,2019-10-08,10:22:31,-0500,2319139812,wchdmo,WCHD Missouri,,"Cooking this recipe from @produceforkids in an Air Fryer, makes it deliciously good for you!",en,"[{'screen_name': 'produceforkids', 'name': 'produce for kids', 'id': '1308732229724536835'}]",[],[],0,0,1,[],[],https://twitter.com/WCHDMO/status/1181575602941374468,False,https://twitter.com/Healthyfamprj/status/1178510280671862785,0,,,,,,,,[],,,,
1181227444428328960,1181227444428328960,2019-10-07 11:19:03 Eastern Daylight Time,2019-10-07,11:19:03,-0500,2319139812,wchdmo,WCHD Missouri,,"Try all the bounties of the Fall Harvest and have a happy, healthy, delicious fall! Here is a great Fall Harvest recipe from Produce for Kids!",en,[],[],[],0,0,0,[],[],https://twitter.com/WCHDMO/status/1181227444428328960,False,https://twitter.com/Healthyfamprj/status/1181046996003622912,0,,,,,,,,[],,,,
1167438460006928386,1167438460006928386,2019-08-30 10:06:33 Eastern Daylight Time,2019-08-30,10:06:33,-0500,2319139812,wchdmo,WCHD Missouri,,What a great healthy recipe! Just in time for the weekend!,en,[],[],[],0,0,0,[],[],https://twitter.com/WCHDMO/status/1167438460006928386,False,https://twitter.com/Healthyfamprj/status/1167282803605680128,0,,,,,,,,[],,,,
1167073578669498370,1167073578669498370,2019-08-29 09:56:38 Eastern Daylight Time,2019-08-29,09:56:38,-0500,2319139812,wchdmo,WCHD Missouri,,Read about a new science review revealing benefits of plants!,en,[],[],[],0,0,0,[],[],https://twitter.com/WCHDMO/status/1167073578669498370,False,https://twitter.com/Fruits_Veggies/status/1166789338933420035,0,,,,,,,,[],,,,
1166740089428488192,1166740089428488192,2019-08-28 11:51:28 Eastern Daylight Time,2019-08-28,11:51:28,-0500,2319139812,wchdmo,WCHD Missouri,,"Do you have a family emergency plan? Discuss with your family how you will keep in touch, where you will meet, where emergency supplies are, etc. FEMA has great advice for an emergency family plan!",en,[],[],[],0,0,0,[],[],https://twitter.com/WCHDMO/status/1166740089428488192,False,https://twitter.com/femaregion2/status/1166675662121385984,0,,,,,,,,[],,,,
1166341186719760386,1166341186719760386,2019-08-27 09:26:23 Eastern Daylight Time,2019-08-27,09:26:23,-0500,2319139812,wchdmo,WCHD Missouri,,"This is good advice from the USDA! Young children have underdeveloped immune systems, which cannot fight off infections like adults. Don't feed your children the listed foods!",en,[],[],[],0,0,2,[],[],https://twitter.com/WCHDMO/status/1166341186719760386,False,https://twitter.com/USDAFoodSafety/status/1166004221206028289,0,,,,,,,,[],,,,
1166003336572784640,1166003336572784640,2019-08-26 11:03:53 Eastern Daylight Time,2019-08-26,11:03:53,-0500,2319139812,wchdmo,WCHD Missouri,,"During times of flash flooding, stay safe and don't drive on flooded roadways!",en,[],[],[],0,1,0,[],[],https://twitter.com/WCHDMO/status/1166003336572784640,False,https://twitter.com/StlCoOEM/status/1165962512568868864,0,,,,,,,,[],,,,
1152216920021721088,1152216920021721088,2019-07-19 10:01:35 Eastern Daylight Time,2019-07-19,10:01:35,-0500,2319139812,wchdmo,WCHD Missouri,,"Come visit the Warren County Fitness Center during the Warrenton City Wide Yard Sale tomorrow, 7/20/19! Buy a T-shirt, household decor, or this &amp; that, to support our ongoing efforts! Get your guide and map at:  https://t.co/KlBdhqdus4 We are E-2 on the map!",en,[],['http://www.warrentonmo.org/government/city_departments/special_events_recreation'],[],0,0,0,[],[],https://twitter.com/WCHDMO/status/1152216920021721088,False,,0,,,,,,,,[],,,,
1151887231931572225,1151887231931572225,2019-07-18 12:11:31 Eastern Daylight Time,2019-07-18,12:11:31,-0500,2319139812,wchdmo,WCHD Missouri,,Stay cool during this heat wave with these tips from MO Health and Sr Services!,en,[],[],[],0,0,0,[],[],https://twitter.com/WCHDMO/status/1151887231931572225,False,https://twitter.com/HealthyLivingMo/status/1151545888491409409,0,,,,,,,,[],,,,
1151484598339153923,1151484598339153923,2019-07-17 09:31:36 Eastern Daylight Time,2019-07-17,09:31:36,-0500,2319139812,wchdmo,WCHD Missouri,,More cooling centers!,en,[],[],[],0,0,0,[],[],https://twitter.com/WCHDMO/status/1151484598339153923,False,https://twitter.com/ksdknews/status/888047848159297537,0,,,,,,,,[],,,,
1151482726085795840,1151482726085795840,2019-07-17 09:24:10 Eastern Daylight Time,2019-07-17,09:24:10,-0500,2319139812,wchdmo,WCHD Missouri,,Beat the heat! Get a list of cooling centers in the area here!,en,[],[],[],0,0,0,[],[],https://twitter.com/WCHDMO/status/1151482726085795840,False,https://twitter.com/MUExtNutrHealth/status/1151481576947146752,0,,,,,,,,[],,,,
1151130073921179649,1151130073921179649,2019-07-16 10:02:51 Eastern Daylight Time,2019-07-16,10:02:51,-0500,2319139812,wchdmo,WCHD Missouri,,Get game day nutrition and food safety tips for young athletes from  https://t.co/55t58PdFz9,en,[],['http://eatright.org/fitness/sports'],[],0,0,0,[],[],https://twitter.com/WCHDMO/status/1151130073921179649,False,https://twitter.com/digineatup/status/1150864646385127424,0,,,,,,,,[],,,,
