fips,name,state,state_full,twitter,twitterYN,twitterNotes,twitter_active_COVID,twitter_active_last60,facebookYN,facebookNotes,notes,district,user_id,tweet,date,time,link,year,month,day
1001,Autauga County,Al,Alabama,NA,0,NA,NA,NA,1,Active,NA,NA,NA,NA,NA,NA,NA,NA,NA,NA
1003,Baldwin County,AL,Alabama,baldwinema,1,Emergency Management Agency,Yes,Yes,1,Active,EmergManage,NA,2457581465,#Hurricane Season Countdown - 6 days remaining.  This important skill will help keep you prepared for all disasters: • Have the skills to assess the situation quickly and to take effective action to protect yourself. Decide to stay or change location.   https://t.co/XfRx379mx0  https://t.co/fwJSiWrLAU,11/24/2021,13:30:17,https://twitter.com/BaldwinEMA/status/1463575715719352321,2021,11,24
1005,Barbour County,AL,Alabama,NA,0,NA,NA,NA,1,Active,NA,NA,NA,NA,NA,NA,NA,NA,NA,NA
1007,Bibb County,AL,Alabama,NA,0,NA,NA,NA,1,Active,NA,NA,NA,NA,NA,NA,NA,NA,NA,NA
1009,Blount County,AL,Alabama,NA,0,NA,NA,NA,1,Active,NA,NA,NA,NA,NA,NA,NA,NA,NA,NA
1011,Bullock County,AL,Alabama,NA,0,NA,NA,NA,1,Active,NA,NA,NA,NA,NA,NA,NA,NA,NA,NA
1013,Butler County,AL,Alabama,butlerco_ema,1,Emergency Management Agency,Yes,No,1,Active,EmergManage,NA,9.59E+17,https://t.co/zkwiBhHArE,5/31/2020,18:19:21,https://twitter.com/butlerco_ema/status/1267219140114292737,2020,5,31
1015,Calhoun County,AL,Alabama,bereadycalhoun,1,DoubleCheck,No,No,1,Active,EmergManage,NA,NA,NA,NA,NA,NA,NA,NA,NA
1017,Chambers County,AL,Alabama,NA,0,NA,NA,NA,1,Active,NA,NA,NA,NA,NA,NA,NA,NA,NA,NA
1019,Cherokee County,AL,Alabama,NA,0,NA,NA,NA,1,Active,NA,NA,NA,NA,NA,NA,NA,NA,NA,NA
1021,Chilton County,AL,Alabama,NA,0,NA,NA,NA,1,Active,NA,NA,NA,NA,NA,NA,NA,NA,NA,NA
1023,Choctaw County,AL,Alabama,choctawema,1,DoubleCheck,No,No,1,Active,EmergManage,NA,NA,NA,NA,NA,NA,NA,NA,NA
1025,Clarke County,AL,Alabama,NA,0,NA,NA,NA,1,Active,NA,NA,NA,NA,NA,NA,NA,NA,NA,NA
1027,Clay County,AL,Alabama,NA,0,NA,NA,NA,1,Active,NA,NA,NA,NA,NA,NA,NA,NA,NA,NA
1029,Cleburne County,AL,Alabama,NA,0,NA,NA,NA,1,Active,NA,NA,NA,NA,NA,NA,NA,NA,NA,NA
1031,Coffee County,AL,Alabama,NA,0,NA,NA,NA,1,Active,NA,NA,NA,NA,NA,NA,NA,NA,NA,NA
1033,Colbert County,AL,Alabama,NA,0,NA,NA,NA,1,Active,NA,NA,NA,NA,NA,NA,NA,NA,NA,NA
1035,Conecuh County,AL,Alabama,NA,0,NA,NA,NA,1,Active,NA,NA,NA,NA,NA,NA,NA,NA,NA,NA
1037,Coosa County,AL,Alabama,NA,0,NA,NA,NA,0,Administered at the state level,NA,NA,NA,NA,NA,NA,NA,NA,NA,NA
1039,Covington County,AL,Alabama,NA,0,NA,NA,NA,1,Active,NA,NA,NA,NA,NA,NA,NA,NA,NA,NA
1041,Crenshaw County,AL,Alabama,NA,0,NA,NA,NA,1,Active,NA,NA,NA,NA,NA,NA,NA,NA,NA,NA
1043,Cullman County,AL,Alabama,NA,0,NA,NA,NA,1,Active,NA,NA,NA,NA,NA,NA,NA,NA,NA,NA
1045,Dale County,AL,Alabama,NA,0,NA,NA,NA,1,Active,NA,NA,NA,NA,NA,NA,NA,NA,NA,NA
1047,Dallas County,AL,Alabama,NA,0,NA,NA,NA,1,Active,NA,NA,NA,NA,NA,NA,NA,NA,NA,NA
1049,DeKalb County,AL,Alabama,dekalb_co_ema,1,NA,Yes,Yes,1,Active,EmergManage,NA,414072411,DeKalb County Activities Building will be closed to the public for the remainder of the week due to multiple cases of COVID-19 illnesses.,11/22/2021,20:03:34,https://twitter.com/DeKalb_Co_EMA/status/1462949913944379394,2021,11,22
1051,Elmore County,AL,Alabama,NA,0,NA,NA,NA,1,Active,NA,NA,NA,NA,NA,NA,NA,NA,NA,NA
1053,Escambia County,AL,Alabama,NA,0,NA,NA,NA,1,Active,NA,NA,NA,NA,NA,NA,NA,NA,NA,NA
1055,Etowah County,AL,Alabama,NA,0,NA,NA,NA,1,Active,NA,NA,NA,NA,NA,NA,NA,NA,NA,NA
1057,Fayette County,AL,Alabama,NA,0,NA,NA,NA,1,Active,NA,NA,NA,NA,NA,NA,NA,NA,NA,NA
1059,Franklin County,AL,Alabama,NA,0,NA,NA,NA,1,Active,NA,NA,NA,NA,NA,NA,NA,NA,NA,NA
1061,Geneva County,AL,Alabama,NA,0,NA,NA,NA,1,Active,NA,NA,NA,NA,NA,NA,NA,NA,NA,NA
1063,Greene County,AL,Alabama,NA,0,NA,NA,NA,1,Active,NA,NA,NA,NA,NA,NA,NA,NA,NA,NA
1065,Hale County,AL,Alabama,NA,0,NA,NA,NA,1,Active,NA,NA,NA,NA,NA,NA,NA,NA,NA,NA
1067,Henry County,AL,Alabama,NA,0,NA,NA,NA,1,Active,NA,NA,NA,NA,NA,NA,NA,NA,NA,NA
1069,Houston County,AL,Alabama,NA,0,NA,NA,NA,1,Active,NA,NA,NA,NA,NA,NA,NA,NA,NA,NA
1071,Jackson County,AL,Alabama,NA,0,NA,NA,NA,1,Active,NA,NA,NA,NA,NA,NA,NA,NA,NA,NA
1073,Jefferson County,AL,Alabama,jcdhtweets,1,NA,Yes,Yes,1,Active,NA,NA,7.13E+17,"Thanksgiving is tomorrow! Haskey Bryant, Environmental Health Supervisor, provides some important health and safety tips to prevent foodborne illnesses this holiday season.  https://t.co/i8uJW1a8VD",11/24/2021,14:57:16,https://twitter.com/jcdhtweets/status/1463597607457107976,2021,11,24
1075,Lamar County,AL,Alabama,NA,0,NA,NA,NA,1,Active,NA,NA,NA,NA,NA,NA,NA,NA,NA,NA
1077,Lauderdale County,AL,Alabama,NA,0,NA,NA,NA,1,Active,NA,NA,NA,NA,NA,NA,NA,NA,NA,NA
1079,Lawrence County,AL,Alabama,NA,0,NA,NA,NA,1,Active,NA,NA,NA,NA,NA,NA,NA,NA,NA,NA
1081,Lee County,AL,Alabama,NA,0,NA,NA,NA,1,Active,NA,NA,NA,NA,NA,NA,NA,NA,NA,NA
1083,Limestone County,AL,Alabama,limestoneema,1,NA,Yes,Yes,1,Active,EmergManage,NA,236245075,"Limestone County District 1 Commissioner, Daryl Sammet, will close Oak Grove Rd South of Sweet Springs Rd today (11-23-2021) from 9:00am to 12:30pm to replace culverts.  Please pay attention to road signage and use extreme caution for workers in this area!",11/23/2021,9:50:13,https://twitter.com/LimestoneEMA/status/1463157948042166277,2021,11,23
1085,Lowndes County,AL,Alabama,NA,0,NA,NA,NA,1,Active,NA,NA,NA,NA,NA,NA,NA,NA,NA,NA
1087,Macon County,AL,Alabama,NA,0,NA,NA,NA,1,Active,NA,NA,NA,NA,NA,NA,NA,NA,NA,NA
1089,Madison County,AL,Alabama,NA,0,NA,NA,NA,1,Active,NA,NA,NA,NA,NA,NA,NA,NA,NA,NA
1091,Marengo County,AL,Alabama,NA,0,NA,NA,NA,1,Active,NA,NA,NA,NA,NA,NA,NA,NA,NA,NA
1093,Marion County,AL,Alabama,NA,0,NA,NA,NA,1,Active,NA,NA,NA,NA,NA,NA,NA,NA,NA,NA
1095,Marshall County,AL,Alabama,mcemaal,1,NA,Yes,No,1,Active,EmergManage,NA,552945595,"Alabama | Winter storm warning issued, includes more of Alabama  https://t.co/AhGogqxTtK",2/14/2021,9:21:19,https://twitter.com/McemaAl/status/1360957296684236802,2021,2,14
1097,Mobile County,AL,Alabama,ilovemchd,1,NA,Yes,Yes,1,Active,NA,NA,108606863,"Ty Tover, a peer counselor with MCHD and a contemporary expressionist painter, will be a guest tonight on the ""Health Talk with Shelia White &amp; Friends"" radio show to discuss the art exhibit that MCHD will host for World AIDS Day. The broadcast begins at 7 p.m. on WAVH-FM 106.5.  https://t.co/u3eWp8GpTV",11/24/2021,17:18:00,https://twitter.com/ILoveMCHD/status/1463633022817759232,2021,11,24
1099,Monroe County,AL,Alabama,NA,0,NA,NA,NA,1,Active,NA,NA,NA,NA,NA,NA,NA,NA,NA,NA
1101,Montgomery County,AL,Alabama,mccalabama,1,DoubleCheck,No,No,1,Active,CountyGeneral,NA,NA,NA,NA,NA,NA,NA,NA,NA
1103,Morgan County,AL,Alabama,morgancoema,1,NA,Yes,Yes,1,Active,EmergManage,NA,116798321,Understand winter weather hazards #WinterPrep #WinterSafety  https://t.co/1bzzLDQBUs,11/17/2021,16:10:00,https://twitter.com/morgancoema/status/1461079195774238726,2021,11,17
1105,Perry County,AL,Alabama,NA,0,NA,NA,NA,1,Active,NA,NA,NA,NA,NA,NA,NA,NA,NA,NA
1107,Pickens County,AL,Alabama,NA,0,NA,NA,NA,1,Active,NA,NA,NA,NA,NA,NA,NA,NA,NA,NA
1109,Pike County,AL,Alabama,NA,0,NA,NA,NA,1,Active,NA,NA,NA,NA,NA,NA,NA,NA,NA,NA
1111,Randolph County,AL,Alabama,NA,0,NA,NA,NA,1,Active,NA,NA,NA,NA,NA,NA,NA,NA,NA,NA
1113,Russell County,AL,Alabama,NA,0,NA,NA,NA,1,Active,NA,NA,NA,NA,NA,NA,NA,NA,NA,NA
1115,St. Clair County,AL,Alabama,stclairema,1,DoubleCheck,No,No,1,Active,EmergManage,NA,NA,NA,NA,NA,NA,NA,NA,NA
1117,Shelby County,AL,Alabama,NA,0,NA,NA,NA,1,Active,NA,NA,NA,NA,NA,NA,NA,NA,NA,NA
1119,Sumter County,AL,Alabama,NA,0,NA,NA,NA,1,Active,NA,NA,NA,NA,NA,NA,NA,NA,NA,NA
1121,Talladega County,AL,Alabama,NA,0,NA,NA,NA,1,Active,NA,NA,NA,NA,NA,NA,NA,NA,NA,NA
1123,Tallapoosa County,AL,Alabama,NA,0,NA,NA,NA,1,Active,NA,NA,NA,NA,NA,NA,NA,NA,NA,NA
1125,Tuscaloosa County,AL,Alabama,tuscaloosacoema,1,NA,Yes,Yes,1,Active,EmergManage,NA,2279615438,Traveling by car?  Follow these helpful tips: ☑️ Be sure your vehicle is in good running condition ☑️ Keep an emergency preparedness kit with you ☑️ Know the weather forecast during your travel ☑️ Keep the proper emergency winter road tools in the truck of your automobile  https://t.co/dgF1hfGyml,11/23/2021,21:45:16,https://twitter.com/TuscaloosaCoEMA/status/1463337893708058626,2021,11,23
1127,Walker County,AL,Alabama,NA,0,NA,NA,NA,1,Active,NA,NA,NA,NA,NA,NA,NA,NA,NA,NA
1129,Washington County,AL,Alabama,NA,0,NA,NA,NA,1,Active,NA,NA,NA,NA,NA,NA,NA,NA,NA,NA
1131,Wilcox County,AL,Alabama,NA,0,NA,NA,NA,1,Active,NA,NA,NA,NA,NA,NA,NA,NA,NA,NA
1133,Winston County,AL,Alabama,NA,0,NA,NA,NA,1,Active,NA,NA,NA,NA,NA,NA,NA,NA,NA,NA
2013,Aleutians East Borough,AK,Alaska,NA,0,NA,NA,NA,1,Active,CountyGeneral,NA,NA,NA,NA,NA,NA,NA,NA,NA
2016,Aleutians West Census Area,AK,Alaska,NA,0,NA,NA,NA,0,NA,NA,NA,NA,NA,NA,NA,NA,NA,NA,NA
2020,Anchorage Municipality,AK,Alaska,ancpublichealth,1,NA,Yes,Yes,1,Active,NA,NA,4116084852,#HappyThanksgiving #AnchorageAK  https://t.co/5xPkWVd7Tz,11/24/2021,17:07:36,https://twitter.com/ancpublichealth/status/1463630407824392194,2021,11,24
2050,Bethel Census Area,AK,Alaska,NA,0,NA,NA,NA,0,NA,NA,NA,NA,NA,NA,NA,NA,NA,NA,NA
2060,Bristol Bay Borough,AK,Alaska,NA,0,NA,NA,NA,1,COVID Specific,NA,NA,NA,NA,NA,NA,NA,NA,NA,NA
2068,Denali Borough,AK,Alaska,NA,0,NA,NA,NA,0,NA,NA,NA,NA,NA,NA,NA,NA,NA,NA,NA
2070,Dillingham Census Area,AK,Alaska,NA,0,NA,NA,NA,0,NA,NA,NA,NA,NA,NA,NA,NA,NA,NA,NA
2090,Fairbanks North Star Borough,AK,Alaska,NA,0,NA,NA,NA,0,NA,NA,NA,NA,NA,NA,NA,NA,NA,NA,NA
2100,Haines Borough,AK,Alaska,NA,0,NA,NA,NA,0,NA,Defunct,NA,NA,NA,NA,NA,NA,NA,NA,NA
2105,Hoonah-Angoon Census Area,AK,Alaska,NA,0,NA,NA,NA,0,NA,NA,NA,NA,NA,NA,NA,NA,NA,NA,NA
2110,Juneau City and Borough,AK,Alaska,NA,0,NA,NA,NA,1,Active,CountyGeneral,NA,NA,NA,NA,NA,NA,NA,NA,NA
2122,Kenai Peninsula Borough,AK,Alaska,NA,0,NA,NA,NA,0,NA,NA,NA,NA,NA,NA,NA,NA,NA,NA,NA
2130,Ketchikan Gateway Borough,AK,Alaska,NA,0,NA,NA,NA,0,NA,NA,NA,NA,NA,NA,NA,NA,NA,NA,NA
2150,Kodiak Island Borough,AK,Alaska,NA,0,NA,NA,NA,0,NA,NA,NA,NA,NA,NA,NA,NA,NA,NA,NA
2164,Lake and Peninsula Borough,AK,Alaska,NA,0,NA,NA,NA,0,NA,NA,NA,NA,NA,NA,NA,NA,NA,NA,NA
2170,Matanuska-Susitna Borough,AK,Alaska,healthymatsu,1,NA,Yes,Yes,1,Active,CountyGeneral,NA,86199430,Did you know the Mat-Su Health Foundation building is home to many other tenants?  Check out what other services you can find at 777 N. Crusey St. in Wasilla below👇:   https://t.co/CKmIABQoph  #Alaska #HealthyMatSu  https://t.co/ex2UnUPkwp,11/24/2021,14:59:19,https://twitter.com/healthymatsu/status/1463598121103986689,2021,11,24
2180,Nome Census Area,AK,Alaska,NA,0,NA,NA,NA,0,NA,NA,NA,NA,NA,NA,NA,NA,NA,NA,NA
2185,North Slope Borough,AK,Alaska,NA,0,NA,NA,NA,1,Active,NA,NA,NA,NA,NA,NA,NA,NA,NA,NA
2188,Northwest Arctic Borough,AK,Alaska,NA,0,NA,NA,NA,0,NA,CountyGeneral,NA,NA,NA,NA,NA,NA,NA,NA,NA
2195,Petersburg Borough,AK,Alaska,NA,0,NA,NA,NA,0,NA,NA,NA,NA,NA,NA,NA,NA,NA,NA,NA
2198,Prince of Wales-Hyder Census Area,AK,Alaska,NA,0,NA,NA,NA,0,NA,NA,NA,NA,NA,NA,NA,NA,NA,NA,NA
2220,Sitka City and Borough,AK,Alaska,NA,0,NA,NA,NA,1,Inactive (2016),NA,NA,NA,NA,NA,NA,NA,NA,NA,NA
2230,Skagway Municipality,AK,Alaska,NA,0,NA,NA,NA,0,NA,NA,NA,NA,NA,NA,NA,NA,NA,NA,NA
2240,Southeast Fairbanks Census Area,AK,Alaska,NA,0,NA,NA,NA,0,NA,NA,NA,NA,NA,NA,NA,NA,NA,NA,NA
2261,Valdez-Cordova Census Area,AK,Alaska,cityofvaldezak,1,DoubleCheck,No,No,1,Active,Outdated-Add District,NA,NA,NA,NA,NA,NA,NA,NA,NA
2270,Wade Hampton Census Area,AK,Alaska,NA,0,NA,NA,NA,0,NA,NA,NA,NA,NA,NA,NA,NA,NA,NA,NA
2275,Wrangell City and Borough,AK,Alaska,NA,0,NA,NA,NA,0,NA,CountyGeneral,NA,NA,NA,NA,NA,NA,NA,NA,NA
2282,Yakutat City and Borough,AK,Alaska,NA,0,NA,NA,NA,0,NA,NA,NA,NA,NA,NA,NA,NA,NA,NA,NA
2290,Yukon-Koyukuk Census Area,AK,Alaska,NA,0,NA,NA,NA,0,NA,NA,NA,NA,NA,NA,NA,NA,NA,NA,NA
4001,Apache County,AZ,Arizona,NA,0,NA,NA,NA,1,Active,NA,NA,NA,NA,NA,NA,NA,NA,NA,NA
4003,Cochise County,AZ,Arizona,NA,0,NA,NA,NA,1,Active,CountyGeneral,NA,NA,NA,NA,NA,NA,NA,NA,NA
4005,Coconino County,AZ,Arizona,coconinohhs,1,NA,Yes,Yes,1,Active,NA,NA,24912695,"We are offering a few 'recipes' for a healthy and happy Thanksgiving. Follow these food safety tips this holiday season, and all year round!  https://t.co/MHcW5egc7n",11/24/2021,16:12:05,https://twitter.com/CoconinoHHS/status/1463616436459483138,2021,11,24
4007,Gila County,AZ,Arizona,gilaco_health,1,NA,Yes,No,1,Active,NA,NA,3243843487,https://t.co/g7xDFjq643,8/24/2021,12:11:58,https://twitter.com/GilaCo_Health/status/1430201223446089728,2021,8,24
4009,Graham County,AZ,Arizona,NA,0,NA,NA,NA,1,Active,NA,NA,NA,NA,NA,NA,NA,NA,NA,NA
4011,Greenlee County,AZ,Arizona,NA,0,NA,NA,NA,1,Active,NA,NA,NA,NA,NA,NA,NA,NA,NA,NA
4012,La Paz County,AZ,Arizona,lapazhealthinfo,1,NA,Yes,Yes,1,Active,NA,NA,61522025,YOUR PUBLIC HEALTH NEWS...  https://t.co/W5CZwJA0QD,9/30/2021,20:35:38,https://twitter.com/lapazhealthinfo/status/1443736327615234084,2021,9,30
4013,Maricopa County,AZ,Arizona,maricopahealth,1,NA,Yes,Yes,1,Active,NA,NA,29816986,"Pass the cranberries, not COVID-19. If you go to Grandma's with the sniffles, you could end up passing along a lot more than just green bean casserole. When in doubt, get tested or stay at home to protect others. Find testing at  https://t.co/vrbq8xoy74.  https://t.co/wHrkPpn0Zr",11/24/2021,17:32:01,https://twitter.com/Maricopahealth/status/1463636551099944962,2021,11,24
4015,Mohave County,AZ,Arizona,mohaveinfo,1,DoubleCheck,No,No,1,Active,Outdated-Add District,NA,NA,NA,NA,NA,NA,NA,NA,NA
4017,Navajo County,AZ,Arizona,ncphsd,1,DoubleCheck,No,No,1,Active,CountyGeneral,NA,NA,NA,NA,NA,NA,NA,NA,NA
4019,Pima County,AZ,Arizona,pchd,1,NA,Yes,Yes,1,Active,NA,NA,18508569,"Naloxone doesn’t just reverse the effects of an opioid overdose when it’s happening, it gives that person a second chance at life that they might not have had otherwise.  https://t.co/sN1klY5fmZ  https://t.co/MxjElxvmzN",11/24/2021,14:03:00,https://twitter.com/pchd/status/1463583949687439362,2021,11,24
4021,Pinal County,AZ,Arizona,pinalhealth,1,NA,Yes,Yes,0,No Page,NA,NA,7.76E+17,A Thanksgiving message from our Public Health Director:  https://t.co/2zj9d9zIDp,11/24/2021,16:35:39,https://twitter.com/pinalhealth/status/1463622364223000577,2021,11,24
4023,Santa Cruz County,AZ,Arizona,santacruzaz,1,NA,Yes,Yes,0,No Page,CountyGeneral,NA,2364620611,"COMMUNICABLE DISEASE INVESTIGATOR: Qualified members of the public are encouraged to apply for the following position by submitting a completed Santa Cruz County employment application (now required), resume/curriculum vitae and a letter of interest…  https://t.co/pC4C3PxgQq",11/23/2021,18:56:02,https://twitter.com/santacruzaz/status/1463295308104802305,2021,11,23
4025,Yavapai County,AZ,Arizona,yavapaihealth,1,NA,Yes,No,1,Active,NA,NA,55385884,Yavapai County Community Health Services maintains their website and Facebook page. For up the minute information visit  https://t.co/ZuYQOVRNVL or  https://t.co/EpDoFp6eJI,3/31/2020,11:47:25,https://twitter.com/YavapaiHealth/status/1245014845193211910,2020,3,31
4027,Yuma County,AZ,Arizona,yumacountyaz,1,NA,Yes,Yes,1,Active,CountyGeneral,NA,8.45E+17,"Los funcionarios de salud del condado de Yuma confirman 21 nuevos casos de COVID-19 y *2 nuevas muertes, lo que eleva el total de casos a 42,526.  https://t.co/y87ofKqZTf  https://t.co/r4r2AftCb9",11/23/2021,17:05:02,https://twitter.com/yumacountyaz/status/1463267370651164685,2021,11,23
5001,Arkansas County,AR,Arkansas,NA,0,NA,NA,NA,0,NA,NA,NA,NA,NA,NA,NA,NA,NA,NA,NA
5003,Ashley County,AR,Arkansas,NA,0,NA,NA,NA,1,NA,NA,NA,NA,NA,NA,NA,NA,NA,NA,NA
5005,Baxter County,AR,Arkansas,NA,0,NA,NA,NA,0,NA,NA,NA,NA,NA,NA,NA,NA,NA,NA,NA
5007,Benton County,AR,Arkansas,NA,0,NA,NA,NA,0,NA,NA,NA,NA,NA,NA,NA,NA,NA,NA,NA
5009,Boone County,AR,Arkansas,NA,0,NA,NA,NA,1,NA,NA,NA,NA,NA,NA,NA,NA,NA,NA,NA
5011,Bradley County,AR,Arkansas,NA,0,NA,NA,NA,1,NA,COVIDSpecific,NA,NA,NA,NA,NA,NA,NA,NA,NA
5013,Calhoun County,AR,Arkansas,NA,0,NA,NA,NA,1,NA,NA,NA,NA,NA,NA,NA,NA,NA,NA,NA
5015,Carroll County,AR,Arkansas,NA,0,NA,NA,NA,1,NA,NA,NA,NA,NA,NA,NA,NA,NA,NA,NA
5017,Chicot County,AR,Arkansas,NA,0,NA,NA,NA,1,NA,NA,NA,NA,NA,NA,NA,NA,NA,NA,NA
5019,Clark County,AR,Arkansas,NA,0,NA,NA,NA,0,NA,NA,NA,NA,NA,NA,NA,NA,NA,NA,NA
5021,Clay County,AR,Arkansas,NA,0,NA,NA,NA,1,NA,StateLevel,NA,NA,NA,NA,NA,NA,NA,NA,NA
5023,Cleburne County,AR,Arkansas,NA,0,NA,NA,NA,1,NA,NA,NA,NA,NA,NA,NA,NA,NA,NA,NA
5025,Cleveland County,AR,Arkansas,NA,0,NA,NA,NA,1,NA,NA,NA,NA,NA,NA,NA,NA,NA,NA,NA
5027,Columbia County,AR,Arkansas,NA,0,NA,NA,NA,1,NA,NA,NA,NA,NA,NA,NA,NA,NA,NA,NA
5029,Conway County,AR,Arkansas,NA,0,NA,NA,NA,1,NA,NA,NA,NA,NA,NA,NA,NA,NA,NA,NA
5031,Craighead County,AR,Arkansas,NA,0,NA,NA,NA,1,NA,NA,NA,NA,NA,NA,NA,NA,NA,NA,NA
5033,Crawford County,AR,Arkansas,NA,0,NA,NA,NA,0,NA,NA,NA,NA,NA,NA,NA,NA,NA,NA,NA
5035,Crittenden County,AR,Arkansas,NA,0,NA,NA,NA,0,NA,NA,NA,NA,NA,NA,NA,NA,NA,NA,NA
5037,Cross County,AR,Arkansas,NA,0,NA,NA,NA,0,NA,NA,NA,NA,NA,NA,NA,NA,NA,NA,NA
5039,Dallas County,AR,Arkansas,NA,0,NA,NA,NA,1,NA,NA,NA,NA,NA,NA,NA,NA,NA,NA,NA
5041,Desha County,AR,Arkansas,NA,0,NA,NA,NA,1,NA,NA,NA,NA,NA,NA,NA,NA,NA,NA,NA
5043,Drew County,AR,Arkansas,NA,0,NA,NA,NA,0,NA,NA,NA,NA,NA,NA,NA,NA,NA,NA,NA
5045,Faulkner County,AR,Arkansas,NA,0,NA,NA,NA,1,NA,NA,NA,NA,NA,NA,NA,NA,NA,NA,NA
5047,Franklin County,AR,Arkansas,NA,0,NA,NA,NA,0,NA,NA,NA,NA,NA,NA,NA,NA,NA,NA,NA
5049,Fulton County,AR,Arkansas,NA,0,NA,NA,NA,1,NA,NA,NA,NA,NA,NA,NA,NA,NA,NA,NA
5051,Garland County,AR,Arkansas,NA,0,NA,NA,NA,0,NA,NA,NA,NA,NA,NA,NA,NA,NA,NA,NA
5053,Grant County,AR,Arkansas,NA,0,NA,NA,NA,1,NA,NA,NA,NA,NA,NA,NA,NA,NA,NA,NA
5055,Greene County,AR,Arkansas,NA,0,NA,NA,NA,1,NA,NA,NA,NA,NA,NA,NA,NA,NA,NA,NA
5057,Hempstead County,AR,Arkansas,NA,0,NA,NA,NA,0,NA,NA,NA,NA,NA,NA,NA,NA,NA,NA,NA
5059,Hot Spring County,AR,Arkansas,NA,0,NA,NA,NA,1,NA,NA,NA,NA,NA,NA,NA,NA,NA,NA,NA
5061,Howard County,AR,Arkansas,NA,0,NA,NA,NA,1,NA,NA,NA,NA,NA,NA,NA,NA,NA,NA,NA
5063,Independence County,AR,Arkansas,NA,0,NA,NA,NA,0,NA,NA,NA,NA,NA,NA,NA,NA,NA,NA,NA
5065,Izard County,AR,Arkansas,NA,0,NA,NA,NA,0,NA,NA,NA,NA,NA,NA,NA,NA,NA,NA,NA
5067,Jackson County,AR,Arkansas,NA,0,NA,NA,NA,0,NA,NA,NA,NA,NA,NA,NA,NA,NA,NA,NA
5069,Jefferson County,AR,Arkansas,NA,0,NA,NA,NA,1,NA,NA,NA,NA,NA,NA,NA,NA,NA,NA,NA
5071,Johnson County,AR,Arkansas,NA,0,NA,NA,NA,1,NA,NA,NA,NA,NA,NA,NA,NA,NA,NA,NA
5073,Lafayette County,AR,Arkansas,NA,0,NA,NA,NA,0,NA,NA,NA,NA,NA,NA,NA,NA,NA,NA,NA
5075,Lawrence County,AR,Arkansas,NA,0,NA,NA,NA,1,NA,NA,NA,NA,NA,NA,NA,NA,NA,NA,NA
5077,Lee County,AR,Arkansas,NA,0,NA,NA,NA,0,NA,NA,NA,NA,NA,NA,NA,NA,NA,NA,NA
5079,Lincoln County,AR,Arkansas,NA,0,NA,NA,NA,1,NA,NA,NA,NA,NA,NA,NA,NA,NA,NA,NA
5081,Little River County,AR,Arkansas,NA,0,NA,NA,NA,1,NA,NA,NA,NA,NA,NA,NA,NA,NA,NA,NA
5083,Logan County,AR,Arkansas,NA,0,NA,NA,NA,0,NA,NA,NA,NA,NA,NA,NA,NA,NA,NA,NA
5085,Lonoke County,AR,Arkansas,NA,0,NA,NA,NA,1,NA,NA,NA,NA,NA,NA,NA,NA,NA,NA,NA
5087,Madison County,AR,Arkansas,NA,0,NA,NA,NA,0,NA,NA,NA,NA,NA,NA,NA,NA,NA,NA,NA
5089,Marion County,AR,Arkansas,NA,0,NA,NA,NA,1,NA,NA,NA,NA,NA,NA,NA,NA,NA,NA,NA
5091,Miller County,AR,Arkansas,NA,0,NA,NA,NA,1,NA,NA,NA,NA,NA,NA,NA,NA,NA,NA,NA
5093,Mississippi County,AR,Arkansas,NA,0,NA,NA,NA,0,NA,NA,NA,NA,NA,NA,NA,NA,NA,NA,NA
5095,Monroe County,AR,Arkansas,NA,0,NA,NA,NA,1,NA,NA,NA,NA,NA,NA,NA,NA,NA,NA,NA
5097,Montgomery County,AR,Arkansas,NA,0,NA,NA,NA,1,NA,NA,NA,NA,NA,NA,NA,NA,NA,NA,NA
5099,Nevada County,AR,Arkansas,NA,0,NA,NA,NA,1,NA,NA,NA,NA,NA,NA,NA,NA,NA,NA,NA
5101,Newton County,AR,Arkansas,NA,0,NA,NA,NA,0,NA,NA,NA,NA,NA,NA,NA,NA,NA,NA,NA
5103,Ouachita County,AR,Arkansas,NA,0,NA,NA,NA,0,NA,NA,NA,NA,NA,NA,NA,NA,NA,NA,NA
5105,Perry County,AR,Arkansas,NA,0,NA,NA,NA,0,NA,NA,NA,NA,NA,NA,NA,NA,NA,NA,NA
5107,Phillips County,AR,Arkansas,NA,0,NA,NA,NA,0,NA,NA,NA,NA,NA,NA,NA,NA,NA,NA,NA
5109,Pike County,AR,Arkansas,NA,0,NA,NA,NA,1,NA,NA,NA,NA,NA,NA,NA,NA,NA,NA,NA
5111,Poinsett County,AR,Arkansas,NA,0,NA,NA,NA,1,NA,NA,NA,NA,NA,NA,NA,NA,NA,NA,NA
5113,Polk County,AR,Arkansas,NA,0,NA,NA,NA,1,NA,NA,NA,NA,NA,NA,NA,NA,NA,NA,NA
5115,Pope County,AR,Arkansas,NA,0,NA,NA,NA,0,NA,NA,NA,NA,NA,NA,NA,NA,NA,NA,NA
5117,Prairie County,AR,Arkansas,NA,0,NA,NA,NA,0,NA,NA,NA,NA,NA,NA,NA,NA,NA,NA,NA
5119,Pulaski County,AR,Arkansas,NA,0,NA,NA,NA,1,NA,NA,NA,NA,NA,NA,NA,NA,NA,NA,NA
5121,Randolph County,AR,Arkansas,NA,0,NA,NA,NA,0,NA,NA,NA,NA,NA,NA,NA,NA,NA,NA,NA
5123,St. Francis County,AR,Arkansas,NA,0,NA,NA,NA,0,NA,NA,NA,NA,NA,NA,NA,NA,NA,NA,NA
5125,Saline County,AR,Arkansas,NA,0,NA,NA,NA,1,NA,NA,NA,NA,NA,NA,NA,NA,NA,NA,NA
5127,Scott County,AR,Arkansas,NA,0,NA,NA,NA,0,NA,NA,NA,NA,NA,NA,NA,NA,NA,NA,NA
5129,Searcy County,AR,Arkansas,NA,0,NA,NA,NA,1,NA,NA,NA,NA,NA,NA,NA,NA,NA,NA,NA
5131,Sebastian County,AR,Arkansas,NA,0,NA,NA,NA,1,NA,Individual_PH_Officer,NA,NA,NA,NA,NA,NA,NA,NA,NA
5133,Sevier County,AR,Arkansas,NA,0,NA,NA,NA,1,NA,NA,NA,NA,NA,NA,NA,NA,NA,NA,NA
5135,Sharp County,AR,Arkansas,NA,0,NA,NA,NA,0,NA,NA,NA,NA,NA,NA,NA,NA,NA,NA,NA
5137,Stone County,AR,Arkansas,NA,0,NA,NA,NA,0,NA,NA,NA,NA,NA,NA,NA,NA,NA,NA,NA
5139,Union County,AR,Arkansas,NA,0,NA,NA,NA,1,NA,NA,NA,NA,NA,NA,NA,NA,NA,NA,NA
5141,Van Buren County,AR,Arkansas,NA,0,NA,NA,NA,1,NA,NA,NA,NA,NA,NA,NA,NA,NA,NA,NA
5143,Washington County,AR,Arkansas,NA,0,NA,NA,NA,1,NA,NA,NA,NA,NA,NA,NA,NA,NA,NA,NA
5145,White County,AR,Arkansas,NA,0,NA,NA,NA,1,NA,NA,NA,NA,NA,NA,NA,NA,NA,NA,NA
5147,Woodruff County,AR,Arkansas,NA,0,NA,NA,NA,0,NA,NA,NA,NA,NA,NA,NA,NA,NA,NA,NA
5149,Yell County,AR,Arkansas,NA,0,NA,NA,NA,1,NA,NA,NA,NA,NA,NA,NA,NA,NA,NA,NA
6001,Alameda County,CA,California,dare2bwell,1,NA,Yes,Yes,1,NA,NA,NA,1536811410,"Get tested for COVID-19 before and after gathering for the holidays.   👉 Test 1-3 days before a family gathering, even if you have no symptoms. Test 3-5 days after gathering.  Find a free testing site:  https://t.co/wtVAxuaWiv #GetTested #BeatCOVID  https://t.co/Mll2Cp7DDo",11/24/2021,15:00:13,https://twitter.com/Dare2BWell/status/1463598347403599885,2021,11,24
6003,Alpine County,CA,California,alpinecohealth,1,NA,Yes,No,1,NA,NA,NA,3098350784,4 new cases of COVID-19 in Alpine County today.  https://t.co/fwrfvDJzMC,11/5/2020,19:54:14,https://twitter.com/alpinecohealth/status/1324515402555162626,2020,11,5
6005,Amador County,CA,California,amadorhlthdept,1,NA,Yes,Yes,1,NA,NA,NA,52506340,Revised Flyer!  Pediatric COVID-19 is here. Speak with your child's doctor or visit  https://t.co/xByNX7FwXj to schedule an appointment.  https://t.co/EinYsTJmRF,11/10/2021,20:12:33,https://twitter.com/AmadorHlthDept/status/1458603519716454403,2021,11,10
6007,Butte County,CA,California,bc_pubhealth,1,NA,Yes,Yes,1,NA,NA,NA,2910322189,Butte County Opens Pfizer #COVID19 Vaccine to Children 5-11 Years Old. Federal and State Safety Review Experts Recommend the Vaccine as Safe and Effective for Protecting Young People. View full press release:  https://t.co/KD9Ce9CaTe  https://t.co/WLC21U3QlJ,11/4/2021,11:13:12,https://twitter.com/BC_PubHealth/status/1456278363459362828,2021,11,4
6009,Calaveras County,CA,California,NA,0,NA,NA,NA,1,NA,NA,NA,NA,NA,NA,NA,NA,NA,NA,NA
6011,Colusa County,CA,California,colusadhhs,1,NA,Yes,No,1,NA,NA,NA,1.23E+18,"Park Clean-Up for the Win The students of #ColusaCounty engaged in a park clean up in Arbuckle on May 5th, 2021.  Read the full story here:  https://t.co/l4Et1aUeYG #ColusaCounty #Colusadhhs #TobaccoEducationProgram  https://t.co/QvyVfCALL2",6/8/2021,17:07:05,https://twitter.com/ColusaDHHS/status/1402371629624094720,2021,6,8
6013,Contra Costa County,CA,California,cocohealth,1,NA,Yes,Yes,1,NA,NA,NA,36698008,"What’s on the menu for your #Thanksgiving2021? By following the recipe for a safe and healthy Thanksgiving, you can enjoy the holiday and protect yourself and others from COVID-19. Learn more:  https://t.co/UmKsbQ4ncz  https://t.co/x1ufboYg8x",11/24/2021,15:05:04,https://twitter.com/CoCoHealth/status/1463599570370375680,2021,11,24
6015,Del Norte County,CA,California,NA,0,NA,NA,NA,1,NA,NA,NA,NA,NA,NA,NA,NA,NA,NA,NA
6017,El Dorado County,CA,California,NA,0,NA,NA,NA,1,NA,NA,NA,NA,NA,NA,NA,NA,NA,NA,NA
6019,Fresno County,CA,California,healthyfresnoco,1,DoubleCheck,No,No,1,NA,NA,NA,NA,NA,NA,NA,NA,NA,NA,NA
6021,Glenn County,CA,California,glenncohhsa,1,NA,Yes,No,1,NA,NA,NA,8.73E+17,"It’s great that you check in with others, but you matter, too. Check in and ask yourself, “How am I doing today?” #IAmTraumaAware   If you would like support, Glenn County Behavioral Health is always here to help you. Call us at: (530) 865-6459 or visit:  https://t.co/nBZx0RMY4j  https://t.co/fj8eODtwcg",6/16/2021,18:00:09,https://twitter.com/GlennCoHHSA/status/1405284083328970757,2021,6,16
6023,Humboldt County,CA,California,humcodhhs,1,NA,Yes,Yes,1,NA,NA,NA,97981384,DHHS’s Division of Environmental Health staff is reminding people of safe food handling tips to keep holiday meals healthy and lessen the chance of foodborne illness. Click on the link to read the full release.   https://t.co/kCzf6Tksuc  https://t.co/58P3AJtCq2,11/23/2021,19:00:31,https://twitter.com/HumCoDHHS/status/1463296433465933831,2021,11,23
6025,Imperial County,CA,California,icpublichealth,1,NA,Yes,Yes,1,NA,NA,NA,1061591190,Schedule your appointment  https://t.co/olOa98oMan  https://t.co/GA5xfJeCTm,11/23/2021,21:00:10,https://twitter.com/ICPublicHealth/status/1463326546538737664,2021,11,23
6027,Inyo County,CA,California,NA,0,NA,NA,NA,1,NA,NA,NA,NA,NA,NA,NA,NA,NA,NA,NA
6029,Kern County,CA,California,kcpublichealth,1,NA,Yes,Yes,1,NA,NA,NA,35848505,"Thanks to Erik ￼for protecting himself, his family and our community against COVID-19 by getting vaccinated! Visit our Fairgrounds vaccination clinic today 11/23 and tomorrow 11/24 from 10:30am to 6pm. No appointment needed and we have free flu shots too!  https://t.co/z8cHbiphqA  https://t.co/FhN2bSOqDD",11/23/2021,16:41:15,https://twitter.com/KCPublicHealth/status/1463261386977382400,2021,11,23
6031,Kings County,CA,California,NA,0,NA,NA,NA,0,NA,NA,NA,NA,NA,NA,NA,NA,NA,NA,NA
6033,Lake County,CA,California,NA,0,NA,NA,NA,1,NA,NA,NA,NA,NA,NA,NA,NA,NA,NA,NA
6035,Lassen County,CA,California,NA,0,NA,NA,NA,1,NA,NA,NA,NA,NA,NA,NA,NA,NA,NA,NA
6037,Los Angeles County,CA,California,lapublichealth,1,NA,Yes,Yes,1,NA,NA,NA,38287098,"Hey parents &amp; students at LA County schools! Get FREE tickets to the @UCLAFootball x CAL game this Saturday, 11/27 @RoseBowlStadium. Must be a current student (ages 5-18) &amp; vaccinated (at least one dose). Hurry before tickets run out! Sign up at  https://t.co/qLWZT7cmB7 🎉  https://t.co/Cw4Dz8ERb4",11/24/2021,14:30:00,https://twitter.com/lapublichealth/status/1463590744820576257,2021,11,24
6039,Madera County,CA,California,maderadph,1,NA,Yes,Yes,1,NA,NA,NA,1883995525,"Don’t miss out on the important moments in life by getting sick with the flu. Instead of having a bad case of #FluFOMO, now is the time to get your flu shot. Visit  https://t.co/HMWRICtjF9 to find out more information and where you can get your flu shot.  https://t.co/gRaSO5vXe8",11/24/2021,16:00:01,https://twitter.com/MaderaDPH/status/1463613400228016136,2021,11,24
6041,Marin County,CA,California,marinhhs,1,NA,Yes,Yes,1,NA,NA,NA,596771292,"Our offices will be closed Thursday, November 25th and Friday, November 26th. Emergency and crisis services will remain open. Experiencing a mental health or substance use crisis? We're here to help. Call (888) 818-1115, 24/7 or text MARIN to 741741.  https://t.co/RhXEfPYKmO",11/23/2021,19:36:08,https://twitter.com/MarinHHS/status/1463305398568456192,2021,11,23
6043,Mariposa County,CA,California,NA,0,NA,NA,NA,1,NA,NA,NA,NA,NA,NA,NA,NA,NA,NA,NA
6045,Mendocino County,CA,California,publichealthmc,1,NA,Yes,No,1,NA,NA,NA,1.24E+18,Preventing Childhood Lead Poisoning During the Coronavirus (COVID-19) Pandemic   https://t.co/gqyKBfB5gf,11/24/2020,16:58:16,https://twitter.com/PublicHealthMC/status/1331356487579430912,2020,11,24
6047,Merced County,CA,California,NA,0,NA,NA,NA,1,NA,NA,NA,NA,NA,NA,NA,NA,NA,NA,NA
6049,Modoc County,CA,California,NA,0,NA,NA,NA,1,NA,NA,NA,NA,NA,NA,NA,NA,NA,NA,NA
6051,Mono County,CA,California,countymono,1,NA,Yes,Yes,1,NA,NA,NA,1.24E+18,Mono County Vaccination &amp; Resource Clinics! 🚨 COVID-19 vaccine • Booster shot • Flu shot  https://t.co/IueMCUaN5p,11/3/2021,17:51:23,https://twitter.com/CountyMono/status/1456016179462488068,2021,11,3
6053,Monterey County,CA,California,mchdpio,1,NA,Yes,Yes,1,NA,NA,NA,90519838,The holidays are tough for many people for lots of reasons.  Small gestures go a long way to bring a little joy to those who may need it.   #Thanksgiving #Kindness  https://t.co/nbiMJWj42C,11/24/2021,16:00:27,https://twitter.com/MCHDPIO/status/1463613507505643534,2021,11,24
6055,Napa County,CA,California,NA,0,NA,NA,NA,1,NA,NA,NA,NA,NA,NA,NA,NA,NA,NA,NA
6057,Nevada County,CA,California,NA,0,NA,NA,NA,1,NA,NA,NA,NA,NA,NA,NA,NA,NA,NA,NA
6059,Orange County,CA,California,ochealth,1,NA,Yes,Yes,1,NA,NA,NA,36069538,"Good morning, #OC 🍊. Here are today’s key #OCCOVID19 messages you need to know from @ochealth and @OCGovCA:  https://t.co/fSjuqllDZt",11/24/2021,14:48:30,https://twitter.com/ochealth/status/1463595400363851778,2021,11,24
6061,Placer County,CA,California,NA,0,NA,NA,NA,1,NA,NA,NA,NA,NA,NA,NA,NA,NA,NA,NA
6063,Plumas County,CA,California,plumashealth,1,NA,Yes,Yes,1,NA,NA,NA,606548055,"Tooth tip Tuesday! Don’t forget to floss once per day! For more information about the benefits of flossing, follow this link:  https://t.co/OYpERXbl8g  https://t.co/5BP1PRJ8tC",11/16/2021,20:01:02,https://twitter.com/PlumasHealth/status/1460774948935512072,2021,11,16
6065,Riverside County,CA,California,rivcodoc,1,NA,Yes,Yes,1,NA,Individual_PH_Officer,NA,2964718240,View additional #COVID data for Riverside County here:  https://t.co/800Xfib5wX #RivCoNOW #RUHealth  https://t.co/ndrlKSfjZy,11/23/2021,20:00:49,https://twitter.com/RivCoDoc/status/1463311611511427077,2021,11,23
6067,Sacramento County,CA,California,sacpublichealth,1,NA,Yes,No,1,NA,NA,NA,15088450,Please be aware there is a COVID-19 post-vaccine survey scam.,4/5/2021,17:27:19,https://twitter.com/SacPublicHealth/status/1379183895703216128,2021,4,5
6069,San Benito County,CA,California,publichealthsbc,1,NA,Yes,Yes,1,NA,NA,NA,7.84E+17,Storing greens 🥬 the right way can make them last much longer. Keep them in an airtight container with a damp cloth or paper towel. #CalFreshHealthyLiving #EatMoreVegetables #Greens #TuesdayVibe  https://t.co/G9zdEEWhId,11/23/2021,15:00:01,https://twitter.com/PublicHealthSBC/status/1463235912695910403,2021,11,23
6071,San Bernardino County,CA,California,sbcountyph,1,NA,Yes,Yes,1,NA,NA,NA,3179359837,We're so grateful to be able to meet and support moms in our area. Feel free to share what you're thankful for in the comments!   Contact us today | Riverside (951) 210-1385/San Bernardino (844) 352-3985.  #MelaninMamas #SupportingBlackMoms #IamSupported #MyVillageCares  https://t.co/HdomJEIRuv,11/23/2021,22:00:00,https://twitter.com/SBCountyPH/status/1463341605130285060,2021,11,23
6073,San Diego County,CA,California,sdcountyhhsa,1,NA,Yes,Yes,1,NA,NA,NA,64506942,Influenza cases in the San Diego region have been steadily increasing. County health officials encourage people to get vaccinated.   https://t.co/X1yxqyBobR,11/24/2021,13:39:40,https://twitter.com/SDCountyHHSA/status/1463578077254930435,2021,11,24
6075,San Francisco County,CA,California,sfdph,1,DoubleCheck,No,No,1,NA,NA,NA,NA,NA,NA,NA,NA,NA,NA,NA
6077,San Joaquin County,CA,California,sjcphs,1,NA,Yes,Yes,1,NA,NA,NA,318065652,"COVID-19 vaccine boosters available to all 18+ and older, as long as eligible based on the timing of previous dose of the vaccine. Extra protection during the holiday season. Learn more:  https://t.co/6oGQGHBWZr  https://t.co/uktIxFa5mN",11/24/2021,11:51:28,https://twitter.com/sjcphs/status/1463550850815700992,2021,11,24
6079,San Luis Obispo County,CA,California,slopublichealth,1,NA,Yes,Yes,1,NA,NA,NA,2205635161,Tomorrow! Public Health is hosting 2 pop-up testing clinics—Atascadero and Grover Beach—to encourage testing before holiday travel.  https://t.co/BACr8ZQkSb,11/23/2021,19:00:09,https://twitter.com/SLOPublicHealth/status/1463296342604894220,2021,11,23
6081,San Mateo County,CA,California,smchealth,1,NA,Yes,Yes,1,NA,NA,NA,1362760926,Read the latest community update from San Mateo County Health Chief Louise Rogers.  https://t.co/kmFKy8J8cf,11/24/2021,16:36:04,https://twitter.com/SMCHealth/status/1463622470276059138,2021,11,24
6083,Santa Barbara County,CA,California,sbcpublichealth,1,NA,Yes,Yes,1,NA,NA,NA,77487824,"Escuche a la Dra. Kristine Reyes, pediatra del Centro de Salud de Santa María, dando respuestas en una reciente reunión comunitaria. La Dra. Reyes, madre de 2 niños, comparte su experiencia al llevar a sus hijos a recibir su primera vacuna COVID-19.  https://t.co/Q5rN5ug0Qw  https://t.co/o8zvrm8Acp",11/23/2021,19:30:10,https://twitter.com/SBCPublicHealth/status/1463303896739237890,2021,11,23
6083,Santa Barbara County,CA,California,sbcpublichealth,1,NA,Yes,Yes,1,NA,NA,NA,77487824,"Hear from Dr. Kristine Reyes, Pediatrician at the Santa Maria Health Care Center, providing answers at a recent virtual community meeting. Dr. Reyes, mother of 2, shares her experience taking her kids to receive their 1st COVID-19 vaccine in Santa Maria.   https://t.co/Cth70ksYIM  https://t.co/lagtOjJflK",11/23/2021,19:30:10,https://twitter.com/SBCPublicHealth/status/1463303896563081216,2021,11,23
6085,Santa Clara County,CA,California,healthyscc,1,NA,Yes,Yes,1,NA,NA,NA,500069464,"Join us in our virtual community forum for updates on COVID-19 vaccines for children ages 5-11, the booster shot, and to discuss health and wellness.   https://t.co/AYVJ1UWBXS",11/24/2021,17:30:53,https://twitter.com/HealthySCC/status/1463636266197544960,2021,11,24
6087,Santa Cruz County,CA,California,publichealthscc,1,NA,Yes,No,1,NA,NA,NA,576693954,https://t.co/EQ7AW5HxpX,5/8/2020,11:36:34,https://twitter.com/PublicHealthSCC/status/1258782856358137856,2020,5,8
6089,Shasta County,CA,California,shastahhsa,1,NA,Yes,Yes,1,NA,NA,NA,4447924454,"What’s on the menu for your #Thanksgiving2021? By following the recipe for a safe and healthy Thanksgiving, you can enjoy the holiday and protect yourself and others from COVID-19. Learn more at  https://t.co/rZgXeUNb9f.  https://t.co/vfmHzEWskq",11/24/2021,10:17:00,https://twitter.com/ShastaHHSA/status/1463527074853842951,2021,11,24
6091,Sierra County,CA,California,NA,0,NA,NA,NA,1,NA,NA,NA,NA,NA,NA,NA,NA,NA,NA,NA
6093,Siskiyou County,CA,California,NA,0,NA,NA,NA,1,NA,NA,NA,NA,NA,NA,NA,NA,NA,NA,NA
6095,Solano County,CA,California,NA,0,NA,NA,NA,1,NA,NA,NA,NA,NA,NA,NA,NA,NA,NA,NA
6097,Sonoma County,CA,California,sonomacohealth,1,NA,No,No,1,NA,NA,NA,8.15E+17,Sonoma County Environmental Health and CalRecycle will hold a Debris Removal Training tomorrow 11/20 from 3 to 5 p.m. at 625 5th Street in Santa Rosa. Attend to learn more about the #KincadeFire debris removal process.  https://t.co/lOBo7hM529,11/19/2019,14:31:42,https://twitter.com/SonomaCoHealth/status/1196873705831325696,2019,11,19
6099,Stanislaus County,CA,California,NA,0,NA,NA,NA,1,NA,NA,NA,NA,NA,NA,NA,NA,NA,NA,NA
6101,Sutter County,CA,California,NA,0,NA,NA,NA,1,NA,NA,NA,NA,NA,NA,NA,NA,NA,NA,NA
6103,Tehama County,CA,California,NA,0,NA,NA,NA,1,NA,NA,NA,NA,NA,NA,NA,NA,NA,NA,NA
6105,Trinity County,CA,California,trinityhhsd,1,NA,Yes,No,1,NA,NA,NA,1432209464,"Are you interested in becoming an In-Home Supportive Services (IHSS) Provider? For more information, you can contact the IHSS office by calling 530-623-8209 or via email at hhs.adultservices@trinitycounty.org. Enroll today!",9/2/2020,16:03:13,https://twitter.com/TrinityHHSD/status/1301249338828402688,2020,9,2
6107,Tulare County,CA,California,tulareco_hhsa,1,NA,Yes,Yes,1,NA,NA,NA,136350192,"If cold turkey isn’t for you, quit smart, not hard. Nicotine patches, gum, and some prescription medications can help reduce your cravings and withdrawal symptoms.  Learn more at:  https://t.co/52aPGEbZmD  https://t.co/mPuo9CRebV",11/24/2021,14:02:15,https://twitter.com/TulareCo_HHSA/status/1463583760457342977,2021,11,24
6109,Tuolumne County,CA,California,tuolumnehealth,1,DoubleCheck,No,No,1,NA,NA,NA,NA,NA,NA,NA,NA,NA,NA,NA
6111,Ventura County,CA,California,vcpublichealth,1,NA,Yes,Yes,1,NA,NA,NA,237024183,"¿Sabía que las bacterias pueden multiplicarse rápidamente en temperatura ambiente? Guarda las sobras del Día de Acción de Gracias dentro de 2 horas para prevenir enfermedades alimentarias. Evita la ""zona de peligro"". Aprenda más:  https://t.co/UGaBiHhYlx  #SeguridadAlimentaria  https://t.co/vnYI4oEPw2",11/24/2021,16:05:00,https://twitter.com/vcpublichealth/status/1463614651871023109,2021,11,24
6113,Yolo County,CA,California,yolocountyhhsa,1,DoubleCheck,No,No,1,NA,NA,NA,NA,NA,NA,NA,NA,NA,NA,NA
6115,Yuba County,CA,California,NA,0,NA,NA,NA,1,NA,NA,NA,NA,NA,NA,NA,NA,NA,NA,NA
8001,Adams County,CO,Colorado,tchdhealth,1,NA,Yes,Yes,1,NA,NA,Tri-County Health Department - Colorado,2290292576,"As you prepare for Thanksgiving, there is no need to rinse or wash raw turkey. Poultry juices can spread in the kitchen and contaminate other foods, utensils, and countertops. Find safe food handling tips to keep you and your family from getting sick at  https://t.co/kNDZCPzDJE.  https://t.co/A5OcNZXzss",11/24/2021,9:30:12,https://twitter.com/TCHDHealth/status/1463515296359239682,2021,11,24
8003,Alamosa County,CO,Colorado,alamosacountyph,1,NA,Yes,No,1,NA,NA,NA,1.24E+18,"Update: The Warming Shelter at the Ortega Middle School in Alamosa is only open until 4pm this afternoon. At that time, it will move to the Methodist Church on Mullins Ave. If you are still without power or need a place to warm up, drive safe and come to the shelter if needed.",9/9/2020,17:22:34,https://twitter.com/AlamosaCountyPH/status/1303806024734908418,2020,9,9
8005,Arapahoe County,CO,Colorado,tchdhealth,1,NA,Yes,Yes,1,NA,NA,Tri-County Health Department - Colorado,2290292576,"As you prepare for Thanksgiving, there is no need to rinse or wash raw turkey. Poultry juices can spread in the kitchen and contaminate other foods, utensils, and countertops. Find safe food handling tips to keep you and your family from getting sick at  https://t.co/kNDZCPzDJE.  https://t.co/A5OcNZXzss",11/24/2021,9:30:12,https://twitter.com/TCHDHealth/status/1463515296359239682,2021,11,24
8007,Archuleta County,CO,Colorado,sjbpublichealth,1,NA,Yes,Yes,1,NA,NA,San Juan Basin Public Health - Colorado,7.03E+17,"SJBPH works hard to support our restaurants &amp; retail food establishments to ensure #foodsafety, but it's up to everyone to prevent #foodborneillness. According to @CDC, food poisoning causes 48m illnesses, 128K hospitalizations, &amp; 3K deaths in the U.S. each year. 1/2 👇",11/24/2021,11:05:58,https://twitter.com/SJBPublicHealth/status/1463539397391912962,2021,11,24
8009,Baca County,CO,Colorado,bcpha,1,NA,Yes,No,1,NA,NA,NA,34037984,Good Morning Baca County!   *Notice* The COVID-19 Vaccine Clinic scheduled for May 7th has changed locations! It will now be held out at Minnick Building like before!   #COVID19 #letsgetvaccinated #bacacounty #ruralarea #protectyourcommunity,5/5/2021,12:39:33,https://twitter.com/BCPHA/status/1389983113011474437,2021,5,5
8011,Bent County,CO,Colorado,NA,0,NA,NA,NA,1,NA,NA,NA,NA,NA,NA,NA,NA,NA,NA,NA
8013,Boulder County,CO,Colorado,bouldercohealth,1,NA,Yes,Yes,1,NA,NA,NA,24195976,El Condado de Boulder está experimentando un aumento en los casos de COVID-19 debido a la #VarianteDelta e influenza. Se predice que los casos continuarán aumentando a medida que las personas se reúnan adentro durante las vacaciones.  Lee más:  https://t.co/9obwsUyNhN  https://t.co/m9fBOQE3dy,11/22/2021,18:44:49,https://twitter.com/bouldercohealth/status/1462930096184905728,2021,11,22
8014,Broomfield County,CO,Colorado,NA,0,NA,NA,NA,1,NA,NA,NA,NA,NA,NA,NA,NA,NA,NA,NA
8015,Chaffee County,CO,Colorado,chaffeecountyph,1,DoubleCheck,No,No,1,NA,No_tweets,NA,NA,NA,NA,NA,NA,NA,NA,NA
8017,Cheyenne County,CO,Colorado,NA,0,NA,NA,NA,1,NA,NA,NA,NA,NA,NA,NA,NA,NA,NA,NA
8019,Clear Creek County,CO,Colorado,NA,0,NA,NA,NA,1,NA,NA,NA,NA,NA,NA,NA,NA,NA,NA,NA
8021,Conejos County,CO,Colorado,NA,0,NA,NA,NA,1,NA,NA,NA,NA,NA,NA,NA,NA,NA,NA,NA
8023,Costilla County,CO,Colorado,NA,0,NA,NA,NA,1,NA,NA,NA,NA,NA,NA,NA,NA,NA,NA,NA
8025,Crowley County,CO,Colorado,NA,0,NA,NA,NA,1,NA,NA,NA,NA,NA,NA,NA,NA,NA,NA,NA
8027,Custer County,CO,Colorado,NA,0,NA,NA,NA,1,NA,NA,NA,NA,NA,NA,NA,NA,NA,NA,NA
8029,Delta County,CO,Colorado,NA,0,NA,NA,NA,1,NA,NA,NA,NA,NA,NA,NA,NA,NA,NA,NA
8031,Denver County,CO,Colorado,cityofdenver,1,NA,Yes,Yes,1,NA,CountyGeneral,NA,19414837,Colorado has some of the highest #COVID19 positivity rates in the country. Booster shot eligibility has expanded to include anyone 18 years or older. Get your booster shot to best protect yourself and your family for the holidays. Find appointments at  https://t.co/dN7SqfrG2L  https://t.co/rxaHtAailJ,11/24/2021,16:01:00,https://twitter.com/CityofDenver/status/1463613645586374666,2021,11,24
8033,Dolores County,CO,Colorado,NA,0,NA,NA,NA,1,NA,NA,NA,NA,NA,NA,NA,NA,NA,NA,NA
8035,Douglas County,CO,Colorado,tchdhealth,1,NA,Yes,Yes,1,NA,NA,Tri-County Health Department - Colorado,2290292576,"As you prepare for Thanksgiving, there is no need to rinse or wash raw turkey. Poultry juices can spread in the kitchen and contaminate other foods, utensils, and countertops. Find safe food handling tips to keep you and your family from getting sick at  https://t.co/kNDZCPzDJE.  https://t.co/A5OcNZXzss",11/24/2021,9:30:12,https://twitter.com/TCHDHealth/status/1463515296359239682,2021,11,24
8037,Eagle County,CO,Colorado,ecpublichealth,1,NA,No,No,1,NA,NA,NA,373469281,Eagle County Public Health &amp; Environment is offering the flu vaccine at walk-ins clinics during the month of October. Visit  https://t.co/BRDtg40KrU for more information.,10/5/2018,12:38:11,https://twitter.com/ECPublicHealth/status/1048251011251494912,2018,10,5
8039,Elbert County,CO,Colorado,NA,0,NA,NA,NA,1,NA,NA,NA,NA,NA,NA,NA,NA,NA,NA,NA
8041,El Paso County,CO,Colorado,epcpublichealth,1,NA,Yes,Yes,1,NA,NA,NA,85335667,"Below, you’ll find this week’s Data Download through 11/23:  Incidence Rate: 359.9 Positivity Rate: 11.39% Total Doses Administered: 927,000 Fully Vaccinated Individuals: 404,400   For more comprehensive local COVID-19 data, visit:  https://t.co/F85WulKFty  https://t.co/n14CuaWYX0",11/24/2021,12:19:51,https://twitter.com/EPCPublicHealth/status/1463557990259302405,2021,11,24
8043,Fremont County,CO,Colorado,NA,0,NA,NA,NA,1,NA,NA,NA,NA,NA,NA,NA,NA,NA,NA,NA
8045,Garfield County,CO,Colorado,NA,0,NA,NA,NA,1,NA,NA,NA,NA,NA,NA,NA,NA,NA,NA,NA
8047,Gilpin County,CO,Colorado,NA,0,NA,NA,NA,1,NA,NA,NA,NA,NA,NA,NA,NA,NA,NA,NA
8049,Grand County,CO,Colorado,gc_publichealth,1,NA,Yes,No,1,NA,NA,NA,1.24E+18,Wondering the differences between isolation and quarantine? Check out these infographics.  https://t.co/FJAbNHOR0k,6/4/2020,12:45:00,https://twitter.com/gc_publichealth/status/1268584548146839552,2020,6,4
8051,Gunnison County,CO,Colorado,NA,0,NA,NA,NA,1,NA,NA,NA,NA,NA,NA,NA,NA,NA,NA,NA
8053,Hinsdale County,CO,Colorado,NA,0,NA,NA,NA,1,NA,NA,NA,NA,NA,NA,NA,NA,NA,NA,NA
8055,Huerfano County,CO,Colorado,NA,0,NA,NA,NA,1,NA,NA,NA,NA,NA,NA,NA,NA,NA,NA,NA
8057,Jackson County,CO,Colorado,NA,0,NA,NA,NA,0,NA,NA,NA,NA,NA,NA,NA,NA,NA,NA,NA
8059,Jefferson County,CO,Colorado,jeffcoph,1,NA,Yes,Yes,1,NA,NA,NA,33657166,"Thanksgiving Day is for family and friends. But Thanksgiving weekend is all about you and those amazing leftovers! Before you dig in, keep these tips handy so that leftovers can stay safely stored in the fridge or freezer.  https://t.co/hYrrTbf74f  https://t.co/tIeLBKbR2s",11/24/2021,13:00:02,https://twitter.com/JeffcoPH/status/1463568104949260295,2021,11,24
8061,Kiowa County,CO,Colorado,NA,0,NA,NA,NA,1,NA,NA,NA,NA,NA,NA,NA,NA,NA,NA,NA
8063,Kit Carson County,CO,Colorado,NA,0,NA,NA,NA,1,NA,NA,NA,NA,NA,NA,NA,NA,NA,NA,NA
8065,Lake County,CO,Colorado,NA,0,NA,NA,NA,1,NA,NA,NA,NA,NA,NA,NA,NA,NA,NA,NA
8067,La Plata County,CO,Colorado,sjbpublichealth,1,NA,Yes,Yes,1,NA,NA,San Juan Basin Public Health - Colorado,7.03E+17,"SJBPH works hard to support our restaurants &amp; retail food establishments to ensure #foodsafety, but it's up to everyone to prevent #foodborneillness. According to @CDC, food poisoning causes 48m illnesses, 128K hospitalizations, &amp; 3K deaths in the U.S. each year. 1/2 👇",11/24/2021,11:05:58,https://twitter.com/SJBPublicHealth/status/1463539397391912962,2021,11,24
8069,Larimer County,CO,Colorado,larimerhealth,1,NA,Yes,Yes,1,NA,NA,NA,937978166,@kristika87 There was an error in the Sunday night upload that subsequently got corrected. Sorry for the scare!,11/22/2021,20:53:54,https://twitter.com/larimerhealth/status/1462962581329612810,2021,11,22
8071,Las Animas County,CO,Colorado,NA,0,NA,NA,NA,1,NA,NA,NA,NA,NA,NA,NA,NA,NA,NA,NA
8073,Lincoln County,CO,Colorado,health_lincoln,1,NA,No,No,1,NA,NA,NA,1.12E+18,https://t.co/hJl7tJaikE,5/21/2019,15:47:08,https://twitter.com/health_lincoln/status/1130922995860553731,2019,5,21
8075,Logan County,CO,Colorado,northeasthealth,1,NA,Yes,Yes,1,NA,NA,Northeast Colorado Health Department,47454805,"Be honest and don’t force yourself to push through if you don’t feel well. A fever, cough or other symptoms, might mean you have COVID-19 or some other illness. With our health system being strained, sharing any illness isn’t a good idea. Read our blog &gt;&gt;&gt;  https://t.co/tjVsGVvKZ3  https://t.co/kB0g9nPfpi",11/24/2021,17:10:02,https://twitter.com/NortheastHealth/status/1463631019618230275,2021,11,24
8077,Mesa County,CO,Colorado,mc_publichealth,1,NA,Yes,Yes,1,NA,NA,NA,378630464,Today is Public Health Thank You Day. Join us in saying THANK YOU to the public health professionals committed to the health and wellbeing of all Mesa County residents.   #PHTYD #PublicHealthHeroes #PublicHealth  https://t.co/N7OvJ3ANrV,11/22/2021,16:58:40,https://twitter.com/MC_PublicHealth/status/1462903382453080070,2021,11,22
8079,Mineral County,CO,Colorado,NA,0,NA,NA,NA,1,NA,NA,NA,NA,NA,NA,NA,NA,NA,NA,NA
8081,Moffat County,CO,Colorado,NA,0,NA,NA,NA,0,NA,NA,NA,NA,NA,NA,NA,NA,NA,NA,NA
8083,Montezuma County,CO,Colorado,montezumahealth,1,DoubleCheck,No,No,1,NA,Outdated-Add District,NA,NA,NA,NA,NA,NA,NA,NA,NA
8085,Montrose County,CO,Colorado,NA,0,NA,NA,NA,0,NA,NA,NA,NA,NA,NA,NA,NA,NA,NA,NA
8087,Morgan County,CO,Colorado,northeasthealth,1,NA,Yes,Yes,1,NA,NA,Northeast Colorado Health Department,47454805,"Be honest and don’t force yourself to push through if you don’t feel well. A fever, cough or other symptoms, might mean you have COVID-19 or some other illness. With our health system being strained, sharing any illness isn’t a good idea. Read our blog &gt;&gt;&gt;  https://t.co/tjVsGVvKZ3  https://t.co/kB0g9nPfpi",11/24/2021,17:10:02,https://twitter.com/NortheastHealth/status/1463631019618230275,2021,11,24
8089,Otero County,CO,Colorado,NA,0,NA,NA,NA,1,NA,NA,NA,NA,NA,NA,NA,NA,NA,NA,NA
8091,Ouray County,CO,Colorado,NA,0,NA,NA,NA,1,NA,NA,NA,NA,NA,NA,NA,NA,NA,NA,NA
8093,Park County,CO,Colorado,NA,0,NA,NA,NA,1,NA,NA,NA,NA,NA,NA,NA,NA,NA,NA,NA
8095,Phillips County,CO,Colorado,northeasthealth,1,NA,Yes,Yes,1,NA,NA,Northeast Colorado Health Department,47454805,"Be honest and don’t force yourself to push through if you don’t feel well. A fever, cough or other symptoms, might mean you have COVID-19 or some other illness. With our health system being strained, sharing any illness isn’t a good idea. Read our blog &gt;&gt;&gt;  https://t.co/tjVsGVvKZ3  https://t.co/kB0g9nPfpi",11/24/2021,17:10:02,https://twitter.com/NortheastHealth/status/1463631019618230275,2021,11,24
8097,Pitkin County,CO,Colorado,pitkinhealth,1,NA,Yes,No,1,NA,NA,NA,1.24E+18,Explore our new dashboard for the most up-to-date epidemiological data on the COVID-19 pandemic in Pitkin County residents. Study key indicators of COVID-19 that are being used to shape guidelines and policies around our COVID-19 response.    Visit:  https://t.co/yor81CwcRa  https://t.co/xQV6Dg41dc,2/16/2021,10:00:02,https://twitter.com/PitkinHealth/status/1361691816018530306,2021,2,16
8099,Prowers County,CO,Colorado,NA,0,NA,NA,NA,1,NA,NA,NA,NA,NA,NA,NA,NA,NA,NA,NA
8101,Pueblo County,CO,Colorado,pueblohealth,1,NA,Yes,Yes,1,NA,NA,NA,17353085,Talk openly to your partner AND health care provider about #sexualhealth &amp; #STDs:  https://t.co/wASzxzkaDe #TalkTestTreat  https://t.co/uPS1xYJ2cL,11/24/2021,13:41:00,https://twitter.com/PuebloHealth/status/1463578413093036033,2021,11,24
8103,Rio Blanco County,CO,Colorado,NA,0,NA,NA,NA,1,NA,NA,NA,NA,NA,NA,NA,NA,NA,NA,NA
8105,Rio Grande County,CO,Colorado,NA,0,NA,NA,NA,1,NA,NA,NA,NA,NA,NA,NA,NA,NA,NA,NA
8107,Routt County,CO,Colorado,NA,0,NA,NA,NA,0,NA,NA,NA,NA,NA,NA,NA,NA,NA,NA,NA
8109,Saguache County,CO,Colorado,NA,0,NA,NA,NA,1,NA,NA,NA,NA,NA,NA,NA,NA,NA,NA,NA
8111,San Juan County,CO,Colorado,NA,0,NA,NA,NA,1,NA,NA,NA,NA,NA,NA,NA,NA,NA,NA,NA
8113,San Miguel County,CO,Colorado,smcpublichealth,1,NA,Yes,Yes,1,NA,NA,NA,1.23E+18,"Today is Public Health Thank You Day!   Please take a moment today to tell your Public Health movers and shakers, ""Thank you!""  ¡Hoy es el Día de Gracias de la Salud Pública!  Por favor, tómese un momento hoy para decirle a sus promotores de salud pública: ""¡Gracias!""  https://t.co/H9cGcEyATA",11/22/2021,18:10:01,https://twitter.com/SMCPublicHealth/status/1462921336951607303,2021,11,22
8115,Sedgwick County,CO,Colorado,northeasthealth,1,NA,Yes,Yes,1,NA,NA,Northeast Colorado Health Department,47454805,"Be honest and don’t force yourself to push through if you don’t feel well. A fever, cough or other symptoms, might mean you have COVID-19 or some other illness. With our health system being strained, sharing any illness isn’t a good idea. Read our blog &gt;&gt;&gt;  https://t.co/tjVsGVvKZ3  https://t.co/kB0g9nPfpi",11/24/2021,17:10:02,https://twitter.com/NortheastHealth/status/1463631019618230275,2021,11,24
8117,Summit County,CO,Colorado,NA,0,NA,NA,NA,0,NA,NA,NA,NA,NA,NA,NA,NA,NA,NA,NA
8119,Teller County,CO,Colorado,NA,0,NA,NA,NA,1,NA,NA,NA,NA,NA,NA,NA,NA,NA,NA,NA
8121,Washington County,CO,Colorado,northeasthealth,1,NA,Yes,Yes,1,NA,NA,Northeast Colorado Health Department,47454805,"Be honest and don’t force yourself to push through if you don’t feel well. A fever, cough or other symptoms, might mean you have COVID-19 or some other illness. With our health system being strained, sharing any illness isn’t a good idea. Read our blog &gt;&gt;&gt;  https://t.co/tjVsGVvKZ3  https://t.co/kB0g9nPfpi",11/24/2021,17:10:02,https://twitter.com/NortheastHealth/status/1463631019618230275,2021,11,24
8123,Weld County,CO,Colorado,NA,0,NA,NA,NA,1,NA,NA,NA,NA,NA,NA,NA,NA,NA,NA,NA
8125,Yuma County,CO,Colorado,northeasthealth,1,NA,Yes,Yes,1,NA,NA,Northeast Colorado Health Department,47454805,"Be honest and don’t force yourself to push through if you don’t feel well. A fever, cough or other symptoms, might mean you have COVID-19 or some other illness. With our health system being strained, sharing any illness isn’t a good idea. Read our blog &gt;&gt;&gt;  https://t.co/tjVsGVvKZ3  https://t.co/kB0g9nPfpi",11/24/2021,17:10:02,https://twitter.com/NortheastHealth/status/1463631019618230275,2021,11,24
9001,Fairfield County,CT,Connecticut,fairfieldhd,1,DoubleCheck,No,No,1,NA,NA,NA,NA,NA,NA,NA,NA,NA,NA,NA
9003,Hartford County,CT,Connecticut,hartford311,1,NA,Yes,Yes,1,NA,NA,NA,44625076,"Grateful to the Angelo S. Carrabba, MD Foundation for donating 90 turkey meals to families in need in Hartford for the Thanksgiving holiday￼.  Thank you for thinking of our residents and continuing the legacy of Dr Carrabba￼.  #grateful #thankful #HappyThanksgiving2021  https://t.co/W3HDbF1jlb",11/23/2021,18:55:09,https://twitter.com/Hartford311/status/1463295084804415495,2021,11,23
9005,Litchfield County,CT,Connecticut,NA,0,NA,NA,NA,1,NA,NA,NA,NA,NA,NA,NA,NA,NA,NA,NA
9007,Middlesex County,CT,Connecticut,NA,0,NA,NA,NA,0,NA,NA,NA,NA,NA,NA,NA,NA,NA,NA,NA
9009,New Haven County,CT,Connecticut,nhpublichealth,1,NA,Yes,Yes,1,NA,NA,NA,979118918,"NHV, get your children vaccinated so they can celebrate the holidays safely with loved ones! @MaritzaBondmph  https://t.co/p9Osy0OMYx",11/24/2021,14:51:30,https://twitter.com/NHPublicHealth/status/1463596156005634054,2021,11,24
9011,New London County,CT,Connecticut,NA,0,NA,NA,NA,1,NA,NA,NA,NA,NA,NA,NA,NA,NA,NA,NA
9013,Tolland County,CT,Connecticut,NA,0,NA,NA,NA,0,NA,NA,NA,NA,NA,NA,NA,NA,NA,NA,NA
9015,Windham County,CT,Connecticut,NA,0,NA,NA,NA,0,NA,NA,NA,NA,NA,NA,NA,NA,NA,NA,NA
10001,Kent County,DE,Delaware,NA,0,NA,NA,NA,1,NA,StateLevel,NA,NA,NA,NA,NA,NA,NA,NA,NA
10003,New Castle County,DE,Delaware,NA,0,NA,NA,NA,1,NA,StateLevel,NA,NA,NA,NA,NA,NA,NA,NA,NA
10005,Sussex County,DE,Delaware,healthy_sussex,1,NA,Yes,No,1,NA,StateLevel,NA,1077365467,Have you seen our latest news?  https://t.co/WDnpmKOqmb,9/12/2021,10:00:30,https://twitter.com/Healthy_Sussex/status/1437053511418748934,2021,9,12
11001,District of Columbia,DC,District of Columbia,_dchealth,1,NA,Yes,Yes,1,NA,NA,NA,117793973,"DC COVID-19 vaccine operations will be closed on Thursday, November 25, 2021, in observance of Thanksgiving.    COVID-19 vaccine operations will resume on Friday, November 26, 2021.    Visit  https://t.co/Ko2X2WIQ8L for more Info.  https://t.co/MNplyCZQjo",11/24/2021,17:00:29,https://twitter.com/_DCHealth/status/1463628614679805959,2021,11,24
12001,Alachua County,FL,Florida,NA,0,NA,NA,NA,1,NA,NA,NA,NA,NA,NA,NA,NA,NA,NA,NA
12003,Baker County,FL,Florida,NA,0,NA,NA,NA,1,NA,NA,NA,NA,NA,NA,NA,NA,NA,NA,NA
12005,Bay County,FL,Florida,flhealthemerald,1,NA,Yes,Yes,1,NA,NA,Emerald Coast Health Department - Florida,7.53E+17,"Florida Department of Health Offices are closed Thursday, November 25 and  Friday, November 26 in observance of Thanksgiving. We will reopen on Monday, November 29  https://t.co/tONbbAx8Ew",11/24/2021,9:09:00,https://twitter.com/FLHealthEmerald/status/1463509961997049883,2021,11,24
12007,Bradford County,FL,Florida,NA,0,NA,NA,NA,1,NA,NA,NA,NA,NA,NA,NA,NA,NA,NA,NA
12009,Brevard County,FL,Florida,NA,0,NA,NA,NA,1,NA,NA,NA,NA,NA,NA,NA,NA,NA,NA,NA
12011,Broward County,FL,Florida,flhealthbroward,1,NA,Yes,Yes,1,NA,NA,NA,7.55E+17,"📌 DOH-Broward locations, including vaccination and testing sites, will be closed on Thursday November 25 and Friday November 26 in observance of the Thanksgiving holiday. Wishing you a happy Thanksgiving!  https://t.co/Kv5CSPjIg2",11/24/2021,8:52:20,https://twitter.com/FLHealthBroward/status/1463505767194112002,2021,11,24
12013,Calhoun County,FL,Florida,NA,0,NA,NA,NA,1,NA,NA,NA,NA,NA,NA,NA,NA,NA,NA,NA
12015,Charlotte County,FL,Florida,NA,0,NA,NA,NA,1,NA,NA,NA,NA,NA,NA,NA,NA,NA,NA,NA
12017,Citrus County,FL,Florida,flhealthcitrus,1,NA,Yes,Yes,1,NA,NA,NA,8.70E+17,"Mosquito bites can be more than just annoying and itchy. They can make you sick! #FightTheBite by using insect repellent, covering up and taking steps to control mosquitoes indoors and outdoors.  https://t.co/8ihmCX1xh0  https://t.co/m5ouNpfP1s",11/9/2021,16:16:13,https://twitter.com/FLHealthCitrus/status/1458181659363262466,2021,11,9
12019,Clay County,FL,Florida,NA,0,NA,NA,NA,1,NA,NA,NA,NA,NA,NA,NA,NA,NA,NA,NA
12021,Collier County,FL,Florida,healthycollier,1,NA,Yes,Yes,1,NA,CountyGeneral,NA,7.53E+17,"In observance of Thanksgiving, DOH-Collier will be closed Thursday, Nov 25 through Sunday, Nov 28.  COVID-19 testing and vaccine administration at both DOH-Collier sites will be closed. The COVID-19 Call Center will also be closed.  All services will resume on Monday, Nov 29.  https://t.co/Rsc6eqvnM0",11/24/2021,15:00:01,https://twitter.com/HealthyCollier/status/1463598297948594181,2021,11,24
12023,Columbia County,FL,Florida,NA,0,NA,NA,NA,0,NA,NA,NA,NA,NA,NA,NA,NA,NA,NA,NA
12027,DeSoto County,FL,Florida,desotocohealth,1,DoubleCheck,No,No,1,NA,EmergManage,NA,NA,NA,NA,NA,NA,NA,NA,NA
12029,Dixie County,FL,Florida,NA,0,NA,NA,NA,1,NA,EmergManage,NA,NA,NA,NA,NA,NA,NA,NA,NA
12031,Duval County,FL,Florida,flhealthduval,1,NA,Yes,Yes,1,NA,NA,NA,7.53E+17,"When you gather with your loved ones this #Thanksgiving, have the important conversation about your family’s #health history. Being aware can help you take preventative measures to ensure a longer, healthier life. #WellnessWednesday #HolidayTip  https://t.co/K16UXOQvnc",11/24/2021,14:15:00,https://twitter.com/FLHealthDuval/status/1463586969225609216,2021,11,24
12033,Escambia County,FL,Florida,healthyescambia,1,NA,Yes,Yes,0,NA,NA,NA,8.87E+17,"Reminder: In observance of the #Thanksgiving holiday, @HealthyEscambia will be closed on Thursday, 11/25 and Friday, 11/26. All services will be suspended, including #COVID19 vaccinations. We will resume usual hours and services on Monday, 11/29.  https://t.co/KgGpYmqmvz",11/24/2021,10:57:55,https://twitter.com/HealthyEscambia/status/1463537374688956422,2021,11,24
12035,Flagler County,FL,Florida,NA,0,NA,NA,NA,1,NA,EmergManage,NA,NA,NA,NA,NA,NA,NA,NA,NA
12037,Franklin County,FL,Florida,NA,0,NA,NA,NA,0,NA,NA,NA,NA,NA,NA,NA,NA,NA,NA,NA
12039,Gadsden County,FL,Florida,NA,0,NA,NA,NA,1,NA,NA,NA,NA,NA,NA,NA,NA,NA,NA,NA
12041,Gilchrist County,FL,Florida,NA,0,NA,NA,NA,0,NA,NA,NA,NA,NA,NA,NA,NA,NA,NA,NA
12043,Glades County,FL,Florida,NA,0,NA,NA,NA,1,NA,NA,NA,NA,NA,NA,NA,NA,NA,NA,NA
12045,Gulf County,FL,Florida,NA,0,NA,NA,NA,1,NA,NA,NA,NA,NA,NA,NA,NA,NA,NA,NA
12047,Hamilton County,FL,Florida,NA,0,NA,NA,NA,0,NA,NA,NA,NA,NA,NA,NA,NA,NA,NA,NA
12049,Hardee County,FL,Florida,NA,0,NA,NA,NA,1,NA,NA,NA,NA,NA,NA,NA,NA,NA,NA,NA
12051,Hendry County,FL,Florida,NA,0,NA,NA,NA,1,NA,EmergManage,NA,NA,NA,NA,NA,NA,NA,NA,NA
12053,Hernando County,FL,Florida,healthyhernando,1,NA,Yes,Yes,1,NA,NA,NA,8.45E+17,"Hernando Fit Kids is back for the Thanksgiving break!  Sign your child up for this free, virtual opportunity to be active and engaged in healthy choices during the holiday. Register:  https://t.co/jC778997j6  https://t.co/DQ1lB1EB7e",11/19/2021,7:33:58,https://twitter.com/HealthyHernando/status/1461674108463325195,2021,11,19
12055,Highlands County,FL,Florida,NA,0,NA,NA,NA,0,NA,NA,NA,NA,NA,NA,NA,NA,NA,NA,NA
12057,Hillsborough County,FL,Florida,dohhillsborough,1,NA,Yes,Yes,1,NA,NA,NA,8.62E+17,"Are you #StormReady? Hurricane season lasts until November 30th, which means we're still in the last month of hurricane season. Prepare by building a storm kit over the next 6mos and #KnowYourZone. Take advantage of some #BlackFriday deals. Learn more   https://t.co/2e9IJPaAMS  https://t.co/ipMVtRj0M7",11/24/2021,17:00:01,https://twitter.com/DOHHillsborough/status/1463628497453084675,2021,11,24
12059,Holmes County,FL,Florida,NA,0,NA,NA,NA,1,NA,EmergManage,NA,NA,NA,NA,NA,NA,NA,NA,NA
12061,Indian River County,FL,Florida,NA,0,NA,NA,NA,1,NA,NA,NA,NA,NA,NA,NA,NA,NA,NA,NA
12063,Jackson County,FL,Florida,NA,0,NA,NA,NA,0,NA,NA,NA,NA,NA,NA,NA,NA,NA,NA,NA
12065,Jefferson County,FL,Florida,NA,0,NA,NA,NA,0,NA,NA,NA,NA,NA,NA,NA,NA,NA,NA,NA
12067,Lafayette County,FL,Florida,NA,0,NA,NA,NA,0,NA,NA,NA,NA,NA,NA,NA,NA,NA,NA,NA
12069,Lake County,FL,Florida,flhealthlake,1,NA,Yes,Yes,0,NA,NA,NA,8.93E+17,"Nomi Health is providing No-cost #COVID19 Testing at the Lake County Fairgrounds, 2101 County Road 452, Eustis.  Mon– Sun from 8am-6pm except for Thurs 1pm-8pm. (hours are subject to change)  Walk-ups are welcome but appointments can be made online here:  https://t.co/cnnPGlAAEk",11/22/2021,7:00:02,https://twitter.com/FLHealthLake/status/1462752732993970179,2021,11,22
12071,Lee County,FL,Florida,flhealthlee,1,NA,Yes,Yes,1,NA,CountyGeneral,NA,1.05E+18,"To the entire public health workforce, thank you for your commitment to promote health, prevent disease, and ensure that all communities have access to care.  #PublicHealthHeroes #PHTYD  @NACCHOalerts, @ResearchAmerica, @PublicHealth  https://t.co/kThXZoLj8R",11/22/2021,9:10:16,https://twitter.com/flhealthlee/status/1462785504613699587,2021,11,22
12073,Leon County,FL,Florida,NA,0,NA,NA,NA,1,NA,CountyGeneral,NA,NA,NA,NA,NA,NA,NA,NA,NA
12075,Levy County,FL,Florida,NA,0,NA,NA,NA,1,NA,EmergManage,NA,NA,NA,NA,NA,NA,NA,NA,NA
12077,Liberty County,FL,Florida,NA,0,NA,NA,NA,1,NA,EmergManage,NA,NA,NA,NA,NA,NA,NA,NA,NA
12079,Madison County,FL,Florida,NA,0,NA,NA,NA,0,NA,NA,NA,NA,NA,NA,NA,NA,NA,NA,NA
12081,Manatee County,FL,Florida,NA,0,NA,NA,NA,1,NA,NA,NA,NA,NA,NA,NA,NA,NA,NA,NA
12083,Marion County,FL,Florida,flhealthmarion,1,NA,Yes,Yes,1,NA,NA,NA,1.24E+18,The Florida Department of Health in Marion County would like to wish you and yours a Happy Thanksgiving on Thursday. We also remind you that our offices will be closed on Nov. 25 and 26. We will resume normal operations on Nov. 29. Have a great holiday!  https://t.co/zqdct3NImP,11/24/2021,13:22:39,https://twitter.com/FLHealthMarion/status/1463573795265040394,2021,11,24
12085,Martin County,FL,Florida,gohealthymartin,1,NA,Yes,Yes,1,NA,NA,NA,9.03E+17,"The @GoHealthyMartin team wishes you and yours a safe, happy &amp; healthy #Thanksgiving2021  https://t.co/l2yd0yXRTP",11/24/2021,14:18:15,https://twitter.com/GoHealthyMartin/status/1463587788142620672,2021,11,24
12086,Miami-Dade County,FL,Florida,NA,0,NA,NA,NA,1,NA,NA,NA,NA,NA,NA,NA,NA,NA,NA,NA
12087,Monroe County,FL,Florida,NA,0,NA,NA,NA,1,NA,NA,NA,NA,NA,NA,NA,NA,NA,NA,NA
12089,Nassau County,FL,Florida,NA,0,NA,NA,NA,1,NA,CountyGeneral,NA,NA,NA,NA,NA,NA,NA,NA,NA
12091,Okaloosa County,FL,Florida,flhealthemerald,1,NA,Yes,Yes,1,NA,NA,Emerald Coast Health Department - Florida,7.53E+17,"Florida Department of Health Offices are closed Thursday, November 25 and  Friday, November 26 in observance of Thanksgiving. We will reopen on Monday, November 29  https://t.co/tONbbAx8Ew",11/24/2021,9:09:00,https://twitter.com/FLHealthEmerald/status/1463509961997049883,2021,11,24
12093,Okeechobee County,FL,Florida,NA,0,NA,NA,NA,1,NA,NA,NA,NA,NA,NA,NA,NA,NA,NA,NA
12095,Orange County,FL,Florida,dohorange,1,NA,Yes,Yes,0,NA,NA,NA,9.15E+17,"We wish you a Happy and Healthy Thanksgiving!  Our offices are CLOSED Nov. 25, 2021 and Friday, Nov. 26, 2021.  For medical emergencies, residents should dial 911.  https://t.co/12J7Rrocs7",11/23/2021,14:56:07,https://twitter.com/DohOrange/status/1463234930343915527,2021,11,23
12097,Osceola County,FL,Florida,NA,0,NA,NA,NA,1,NA,EmergManage,NA,NA,NA,NA,NA,NA,NA,NA,NA
12099,Palm Beach County,FL,Florida,healthcaredist,1,NA,Yes,Yes,1,NA,NA,NA,532611966,Planning holiday travel? Get fully vaccinated against #COVID-19 as part of your holiday planning to protect yourself and your loved ones. Find a COVID-19 vaccine near you:  https://t.co/uiGzQaqjY3  https://t.co/mmqX26Az6T,11/23/2021,13:29:06,https://twitter.com/healthcaredist/status/1463213031656148994,2021,11,23
12101,Pasco County,FL,Florida,healthypasco,1,NA,Yes,No,1,NA,CountyGeneral,NA,9.15E+17,"#WIC provides access to healthy foods, nutrition education &amp; counseling, breastfeeding support, and referrals for healthcare &amp; community services at four locations in Pasco to women, infants &amp; children. Go to  https://t.co/4Yxb9IOATn to find out if you're eligible.  https://t.co/dXu0hfbHul",9/21/2021,9:48:45,https://twitter.com/HealthyPasco/status/1440312041743413249,2021,9,21
12103,Pinellas County,FL,Florida,healthypinellas,1,NA,Yes,Yes,1,NA,NA,NA,7.53E+17,"Thank you @cl_tampabay for sharing info about the #WorldAIDSDay2021 community event in Pinellas on Saturday, Nov. 4.",11/24/2021,16:37:10,https://twitter.com/HealthyPinellas/status/1463622749281300480,2021,11,24
12105,Polk County,FL,Florida,flhealthpolk,1,NA,Yes,Yes,1,NA,CountyGeneral,NA,8.70E+17,Wondering where you can get tested for #COVID19 over the holidays? You can schedule an appointment at these sites by visiting  https://t.co/JJxXUXB6Cx. For more testing sites visit  https://t.co/7tdNnB8Fiq.  https://t.co/oOssharaaQ,11/22/2021,17:51:16,https://twitter.com/FLHealthPolk/status/1462916618363838471,2021,11,22
12107,Putnam County,FL,Florida,NA,0,NA,NA,NA,1,NA,EmergManage,NA,NA,NA,NA,NA,NA,NA,NA,NA
12109,St. Johns County,FL,Florida,NA,0,NA,NA,NA,1,NA,EmergManage,NA,NA,NA,NA,NA,NA,NA,NA,NA
12111,St. Lucie County,FL,Florida,fdohstlucie,1,NA,Yes,Yes,1,NA,NA,NA,1.27E+18,"Lower your risk with a proven program to prevent or delay type 2 diabetes.  New program starting in Fort Pierce on Monday, 11/29/21.  Call 772-873-4906 or email DiabetesSLC@flhealth.gov for more information.  https://t.co/FigrqAgepU",11/22/2021,18:10:03,https://twitter.com/FDOHStLucie/status/1462921345159909384,2021,11,22
12113,Santa Rosa County,FL,Florida,flhealthemerald,1,NA,Yes,Yes,0,NA,NA,Emerald Coast Health Department - Florida,7.53E+17,"Florida Department of Health Offices are closed Thursday, November 25 and  Friday, November 26 in observance of Thanksgiving. We will reopen on Monday, November 29  https://t.co/tONbbAx8Ew",11/24/2021,9:09:00,https://twitter.com/FLHealthEmerald/status/1463509961997049883,2021,11,24
12115,Sarasota County,FL,Florida,NA,0,NA,NA,NA,0,NA,NA,NA,NA,NA,NA,NA,NA,NA,NA,NA
12117,Seminole County,FL,Florida,NA,0,NA,NA,NA,1,NA,NA,NA,NA,NA,NA,NA,NA,NA,NA,NA
12119,Sumter County,FL,Florida,NA,0,NA,NA,NA,1,NA,NA,NA,NA,NA,NA,NA,NA,NA,NA,NA
12121,Suwannee County,FL,Florida,NA,0,NA,NA,NA,0,NA,NA,NA,NA,NA,NA,NA,NA,NA,NA,NA
12123,Taylor County,FL,Florida,NA,0,NA,NA,NA,0,NA,NA,NA,NA,NA,NA,NA,NA,NA,NA,NA
12125,Union County,FL,Florida,NA,0,NA,NA,NA,0,NA,NA,NA,NA,NA,NA,NA,NA,NA,NA,NA
12127,Volusia County,FL,Florida,NA,0,NA,NA,NA,1,NA,NA,NA,NA,NA,NA,NA,NA,NA,NA,NA
12129,Wakulla County,FL,Florida,NA,0,NA,NA,NA,0,NA,NA,NA,NA,NA,NA,NA,NA,NA,NA,NA
12131,Walton County,FL,Florida,NA,0,NA,NA,NA,1,NA,CountyGeneral,NA,NA,NA,NA,NA,NA,NA,NA,NA
12133,Washington County,FL,Florida,NA,0,NA,NA,NA,0,NA,NA,NA,NA,NA,NA,NA,NA,NA,NA,NA
13001,Appling County,GA,Georgia,sehdph,1,NA,Yes,Yes,0,NA,NA,Southeast Health District - Georgia,313344456,"HIV can affect anyone, regardless of their sexual orientation, race, gender, or age. This World AIDS Day, we must challenge misinformation, racism, homophobia, and transphobia to #StopHIVStigma.  https://t.co/aGbIVexrqA #WAD2021 #StopHIVTogether  https://t.co/PnFxGsoQak",11/23/2021,8:00:35,https://twitter.com/sehdph/status/1463130355939041280,2021,11,23
13003,Atkinson County,GA,Georgia,sehdph,1,NA,Yes,Yes,1,NA,NA,Southeast Health District - Georgia,313344456,"HIV can affect anyone, regardless of their sexual orientation, race, gender, or age. This World AIDS Day, we must challenge misinformation, racism, homophobia, and transphobia to #StopHIVStigma.  https://t.co/aGbIVexrqA #WAD2021 #StopHIVTogether  https://t.co/PnFxGsoQak",11/23/2021,8:00:35,https://twitter.com/sehdph/status/1463130355939041280,2021,11,23
13005,Bacon County,GA,Georgia,sehdph,1,NA,Yes,Yes,1,NA,NA,Southeast Health District - Georgia,313344456,"HIV can affect anyone, regardless of their sexual orientation, race, gender, or age. This World AIDS Day, we must challenge misinformation, racism, homophobia, and transphobia to #StopHIVStigma.  https://t.co/aGbIVexrqA #WAD2021 #StopHIVTogether  https://t.co/PnFxGsoQak",11/23/2021,8:00:35,https://twitter.com/sehdph/status/1463130355939041280,2021,11,23
13007,Baker County,GA,Georgia,NA,0,NA,NA,NA,0,NA,DoubleCheck,NA,NA,NA,NA,NA,NA,NA,NA,NA
13009,Baldwin County,GA,Georgia,nchd52,1,NA,Yes,Yes,1,NA,NA,North Central Health District - Georgia,354067553,"When you bring your #Thanksgiving groceries home, separate raw meat, poultry, seafood and eggs from other foods in the refrigerator. Place them in containers or sealed plastic bags on the bottom shelf of the refrigerator. #TheStoryOfYourDinner  https://t.co/dtY2qvX19N",11/24/2021,16:00:41,https://twitter.com/NCHD52/status/1463613565940678661,2021,11,24
13011,Banks County,GA,Georgia,NA,0,NA,NA,NA,1,NA,NA,NA,NA,NA,NA,NA,NA,NA,NA,NA
13013,Barrow County,GA,Georgia,nehealthdept,1,NA,No,No,0,NA,NA,Northeast Health District (Georgia Public Health District 10),2255483023,"HOLIDAY CLOSING: All Northeast Health District Health Departments and Offices will be CLOSED on Monday, October 8th in observance of Columbus Day. Regular operating hours resume on Tuesday, October 9th. Have a Safe Holiday!  https://t.co/LURB6dzk1k",10/6/2018,19:30:09,https://twitter.com/NEHealthDept/status/1048717075433361410,2018,10,6
13015,Bartow County,GA,Georgia,NA,0,NA,NA,NA,0,NA,DoubleCheck,NA,NA,NA,NA,NA,NA,NA,NA,NA
13017,Ben Hill County,GA,Georgia,NA,0,NA,NA,NA,0,NA,NA,NA,NA,NA,NA,NA,NA,NA,NA,NA
13019,Berrien County,GA,Georgia,NA,0,NA,NA,NA,0,NA,NA,NA,NA,NA,NA,NA,NA,NA,NA,NA
13021,Bibb County,GA,Georgia,nchd52,1,NA,Yes,Yes,1,NA,NA,North Central Health District - Georgia,354067553,"When you bring your #Thanksgiving groceries home, separate raw meat, poultry, seafood and eggs from other foods in the refrigerator. Place them in containers or sealed plastic bags on the bottom shelf of the refrigerator. #TheStoryOfYourDinner  https://t.co/dtY2qvX19N",11/24/2021,16:00:41,https://twitter.com/NCHD52/status/1463613565940678661,2021,11,24
13023,Bleckley County,GA,Georgia,NA,0,NA,NA,NA,1,NA,NA,NA,NA,NA,NA,NA,NA,NA,NA,NA
13025,Brantley County,GA,Georgia,sehdph,1,NA,Yes,Yes,1,NA,NA,Southeast Health District - Georgia,313344456,"HIV can affect anyone, regardless of their sexual orientation, race, gender, or age. This World AIDS Day, we must challenge misinformation, racism, homophobia, and transphobia to #StopHIVStigma.  https://t.co/aGbIVexrqA #WAD2021 #StopHIVTogether  https://t.co/PnFxGsoQak",11/23/2021,8:00:35,https://twitter.com/sehdph/status/1463130355939041280,2021,11,23
13027,Brooks County,GA,Georgia,NA,0,NA,NA,NA,0,NA,NA,NA,NA,NA,NA,NA,NA,NA,NA,NA
13029,Bryan County,GA,Georgia,coastalhealth91,1,NA,Yes,Yes,0,NA,NA,Georgia Coastal Health District,550096463,https://t.co/O7BEFIr2lD,11/24/2021,14:02:05,https://twitter.com/coastalhealth91/status/1463583718619111432,2021,11,24
13031,Bulloch County,GA,Georgia,sehdph,1,NA,Yes,Yes,1,NA,NA,Southeast Health District - Georgia,313344456,"HIV can affect anyone, regardless of their sexual orientation, race, gender, or age. This World AIDS Day, we must challenge misinformation, racism, homophobia, and transphobia to #StopHIVStigma.  https://t.co/aGbIVexrqA #WAD2021 #StopHIVTogether  https://t.co/PnFxGsoQak",11/23/2021,8:00:35,https://twitter.com/sehdph/status/1463130355939041280,2021,11,23
13033,Burke County,GA,Georgia,NA,0,NA,NA,NA,1,NA,NA,NA,NA,NA,NA,NA,NA,NA,NA,NA
13035,Butts County,GA,Georgia,NA,0,NA,NA,NA,1,NA,NA,NA,NA,NA,NA,NA,NA,NA,NA,NA
13037,Calhoun County,GA,Georgia,NA,0,NA,NA,NA,0,NA,NA,NA,NA,NA,NA,NA,NA,NA,NA,NA
13039,Camden County,GA,Georgia,coastalhealth91,1,NA,Yes,Yes,1,NA,NA,Georgia Coastal Health District,550096463,https://t.co/O7BEFIr2lD,11/24/2021,14:02:05,https://twitter.com/coastalhealth91/status/1463583718619111432,2021,11,24
13043,Candler County,GA,Georgia,sehdph,1,NA,Yes,Yes,1,NA,NA,Southeast Health District - Georgia,313344456,"HIV can affect anyone, regardless of their sexual orientation, race, gender, or age. This World AIDS Day, we must challenge misinformation, racism, homophobia, and transphobia to #StopHIVStigma.  https://t.co/aGbIVexrqA #WAD2021 #StopHIVTogether  https://t.co/PnFxGsoQak",11/23/2021,8:00:35,https://twitter.com/sehdph/status/1463130355939041280,2021,11,23
13045,Carroll County,GA,Georgia,NA,0,NA,NA,NA,1,NA,NA,NA,NA,NA,NA,NA,NA,NA,NA,NA
13047,Catoosa County,GA,Georgia,NA,0,NA,NA,NA,1,NA,NA,NA,NA,NA,NA,NA,NA,NA,NA,NA
13049,Charlton County,GA,Georgia,sehdph,1,NA,Yes,Yes,0,NA,NA,Southeast Health District - Georgia,313344456,"HIV can affect anyone, regardless of their sexual orientation, race, gender, or age. This World AIDS Day, we must challenge misinformation, racism, homophobia, and transphobia to #StopHIVStigma.  https://t.co/aGbIVexrqA #WAD2021 #StopHIVTogether  https://t.co/PnFxGsoQak",11/23/2021,8:00:35,https://twitter.com/sehdph/status/1463130355939041280,2021,11,23
13051,Chatham County,GA,Georgia,coastalhealth91,1,NA,Yes,Yes,1,NA,NA,Georgia Coastal Health District,550096463,https://t.co/O7BEFIr2lD,11/24/2021,14:02:05,https://twitter.com/coastalhealth91/status/1463583718619111432,2021,11,24
13053,Chattahoochee County,GA,Georgia,NA,0,NA,NA,NA,0,NA,NA,NA,NA,NA,NA,NA,NA,NA,NA,NA
13055,Chattooga County,GA,Georgia,NA,0,NA,NA,NA,1,NA,NA,NA,NA,NA,NA,NA,NA,NA,NA,NA
13057,Cherokee County,GA,Georgia,ngahealthdist,1,NA,Yes,Yes,1,NA,NA,North Georgia Health Department,354938433,Preparing a holiday meal this Thanksgiving? Cook your turkey thoroughly and always use a food thermometer. Learn more about meal prep for the holidays:   https://t.co/JNCud3PxEY.  https://t.co/WXZ3lcGoWR,11/24/2021,7:48:03,https://twitter.com/NGAHealthDist/status/1463489590631800832,2021,11,24
13059,Clarke County,GA,Georgia,nehealthdept,1,NA,No,No,1,NA,NA,Northeast Health District (Georgia Public Health District 10),2255483023,"HOLIDAY CLOSING: All Northeast Health District Health Departments and Offices will be CLOSED on Monday, October 8th in observance of Columbus Day. Regular operating hours resume on Tuesday, October 9th. Have a Safe Holiday!  https://t.co/LURB6dzk1k",10/6/2018,19:30:09,https://twitter.com/NEHealthDept/status/1048717075433361410,2018,10,6
13061,Clay County,GA,Georgia,NA,0,NA,NA,NA,0,NA,NA,NA,NA,NA,NA,NA,NA,NA,NA,NA
13063,Clayton County,GA,Georgia,claytoncountyhd,1,NA,Yes,Yes,1,NA,NA,NA,198545526,https://t.co/nyHO0crlna,11/24/2021,13:39:02,https://twitter.com/ClaytonCountyHD/status/1463577918244851714,2021,11,24
13065,Clinch County,GA,Georgia,sehdph,1,NA,Yes,Yes,1,NA,NA,Southeast Health District - Georgia,313344456,"HIV can affect anyone, regardless of their sexual orientation, race, gender, or age. This World AIDS Day, we must challenge misinformation, racism, homophobia, and transphobia to #StopHIVStigma.  https://t.co/aGbIVexrqA #WAD2021 #StopHIVTogether  https://t.co/PnFxGsoQak",11/23/2021,8:00:35,https://twitter.com/sehdph/status/1463130355939041280,2021,11,23
13067,Cobb County,GA,Georgia,NA,0,NA,NA,NA,0,NA,NA,NA,NA,NA,NA,NA,NA,NA,NA,NA
13069,Coffee County,GA,Georgia,sehdph,1,NA,Yes,Yes,1,NA,NA,Southeast Health District - Georgia,313344456,"HIV can affect anyone, regardless of their sexual orientation, race, gender, or age. This World AIDS Day, we must challenge misinformation, racism, homophobia, and transphobia to #StopHIVStigma.  https://t.co/aGbIVexrqA #WAD2021 #StopHIVTogether  https://t.co/PnFxGsoQak",11/23/2021,8:00:35,https://twitter.com/sehdph/status/1463130355939041280,2021,11,23
13071,Colquitt County,GA,Georgia,NA,0,NA,NA,NA,1,NA,NA,NA,NA,NA,NA,NA,NA,NA,NA,NA
13073,Columbia County,GA,Georgia,NA,0,NA,NA,NA,1,NA,NA,NA,NA,NA,NA,NA,NA,NA,NA,NA
13075,Cook County,GA,Georgia,NA,0,NA,NA,NA,0,NA,NA,NA,NA,NA,NA,NA,NA,NA,NA,NA
13077,Coweta County,GA,Georgia,NA,0,NA,NA,NA,1,NA,NA,NA,NA,NA,NA,NA,NA,NA,NA,NA
13079,Crawford County,GA,Georgia,nchd52,1,NA,Yes,Yes,1,NA,NA,North Central Health District - Georgia,354067553,"When you bring your #Thanksgiving groceries home, separate raw meat, poultry, seafood and eggs from other foods in the refrigerator. Place them in containers or sealed plastic bags on the bottom shelf of the refrigerator. #TheStoryOfYourDinner  https://t.co/dtY2qvX19N",11/24/2021,16:00:41,https://twitter.com/NCHD52/status/1463613565940678661,2021,11,24
13081,Crisp County,GA,Georgia,NA,0,NA,NA,NA,0,NA,NA,NA,NA,NA,NA,NA,NA,NA,NA,NA
13083,Dade County,GA,Georgia,NA,0,NA,NA,NA,1,NA,NA,NA,NA,NA,NA,NA,NA,NA,NA,NA
13085,Dawson County,GA,Georgia,NA,0,NA,NA,NA,1,NA,NA,NA,NA,NA,NA,NA,NA,NA,NA,NA
13087,Decatur County,GA,Georgia,NA,0,NA,NA,NA,1,NA,NA,NA,NA,NA,NA,NA,NA,NA,NA,NA
13089,DeKalb County,GA,Georgia,healthydekalb,1,NA,Yes,Yes,0,NA,NA,NA,212317303,"All of our offices, health centers and COVID operations will be CLOSED tomorrow (Nov. 25) and Fri., Nov. 26, for the Thanksgiving holiday. As you gather to give thanks, here are some tips to help you and yours gather safely:  https://t.co/EWd145Qq9K #DeKalbCountyGA #Thanksgiving  https://t.co/wFReAjwCgF",11/24/2021,12:01:50,https://twitter.com/HealthyDeKalb/status/1463553459521822739,2021,11,24
13091,Dodge County,GA,Georgia,NA,0,NA,NA,NA,0,NA,NA,NA,NA,NA,NA,NA,NA,NA,NA,NA
13093,Dooly County,GA,Georgia,NA,0,NA,NA,NA,1,NA,NA,NA,NA,NA,NA,NA,NA,NA,NA,NA
13095,Dougherty County,GA,Georgia,NA,0,NA,NA,NA,0,NA,NA,NA,NA,NA,NA,NA,NA,NA,NA,NA
13097,Douglas County,GA,Georgia,NA,0,NA,NA,NA,1,NA,NA,NA,NA,NA,NA,NA,NA,NA,NA,NA
13099,Early County,GA,Georgia,NA,0,NA,NA,NA,0,NA,NA,NA,NA,NA,NA,NA,NA,NA,NA,NA
13101,Echols County,GA,Georgia,NA,0,NA,NA,NA,0,NA,NA,NA,NA,NA,NA,NA,NA,NA,NA,NA
13103,Effingham County,GA,Georgia,coastalhealth91,1,NA,Yes,Yes,1,NA,NA,Georgia Coastal Health District,550096463,https://t.co/O7BEFIr2lD,11/24/2021,14:02:05,https://twitter.com/coastalhealth91/status/1463583718619111432,2021,11,24
13105,Elbert County,GA,Georgia,nehealthdept,1,NA,No,No,1,NA,NA,Northeast Health District (Georgia Public Health District 10),2255483023,"HOLIDAY CLOSING: All Northeast Health District Health Departments and Offices will be CLOSED on Monday, October 8th in observance of Columbus Day. Regular operating hours resume on Tuesday, October 9th. Have a Safe Holiday!  https://t.co/LURB6dzk1k",10/6/2018,19:30:09,https://twitter.com/NEHealthDept/status/1048717075433361410,2018,10,6
13107,Emanuel County,GA,Georgia,NA,0,NA,NA,NA,0,NA,NA,NA,NA,NA,NA,NA,NA,NA,NA,NA
13109,Evans County,GA,Georgia,sehdph,1,NA,Yes,Yes,0,NA,NA,Southeast Health District - Georgia,313344456,"HIV can affect anyone, regardless of their sexual orientation, race, gender, or age. This World AIDS Day, we must challenge misinformation, racism, homophobia, and transphobia to #StopHIVStigma.  https://t.co/aGbIVexrqA #WAD2021 #StopHIVTogether  https://t.co/PnFxGsoQak",11/23/2021,8:00:35,https://twitter.com/sehdph/status/1463130355939041280,2021,11,23
13111,Fannin County,GA,Georgia,ngahealthdist,1,NA,Yes,Yes,1,NA,NA,North Georgia Health Department,354938433,Preparing a holiday meal this Thanksgiving? Cook your turkey thoroughly and always use a food thermometer. Learn more about meal prep for the holidays:   https://t.co/JNCud3PxEY.  https://t.co/WXZ3lcGoWR,11/24/2021,7:48:03,https://twitter.com/NGAHealthDist/status/1463489590631800832,2021,11,24
13113,Fayette County,GA,Georgia,NA,0,NA,NA,NA,0,NA,NA,NA,NA,NA,NA,NA,NA,NA,NA,NA
13115,Floyd County,GA,Georgia,NA,0,NA,NA,NA,0,NA,NA,NA,NA,NA,NA,NA,NA,NA,NA,NA
13117,Forsyth County,GA,Georgia,NA,0,NA,NA,NA,1,NA,NA,NA,NA,NA,NA,NA,NA,NA,NA,NA
13119,Franklin County,GA,Georgia,NA,0,NA,NA,NA,0,NA,NA,NA,NA,NA,NA,NA,NA,NA,NA,NA
13121,Fulton County,GA,Georgia,fultonhealth,1,NA,Yes,Yes,1,NA,NA,NA,80875046,"A reminder that our Fulton County vaccination sites will be closed Thursday, November 25, and Friday, November 26 for the Thanksgiving holiday weekend.   @CoreResponse @AFCEMA @FultonInfo  https://t.co/PxQPl06H5t",11/23/2021,22:02:35,https://twitter.com/FultonHealth/status/1463342254932869122,2021,11,23
13123,Gilmer County,GA,Georgia,ngahealthdist,1,NA,Yes,Yes,1,NA,NA,North Georgia Health Department,354938433,Preparing a holiday meal this Thanksgiving? Cook your turkey thoroughly and always use a food thermometer. Learn more about meal prep for the holidays:   https://t.co/JNCud3PxEY.  https://t.co/WXZ3lcGoWR,11/24/2021,7:48:03,https://twitter.com/NGAHealthDist/status/1463489590631800832,2021,11,24
13125,Glascock County,GA,Georgia,NA,0,NA,NA,NA,0,NA,NA,NA,NA,NA,NA,NA,NA,NA,NA,NA
13127,Glynn County,GA,Georgia,coastalhealth91,1,NA,Yes,Yes,0,NA,NA,Georgia Coastal Health District,550096463,https://t.co/O7BEFIr2lD,11/24/2021,14:02:05,https://twitter.com/coastalhealth91/status/1463583718619111432,2021,11,24
13129,Gordon County,GA,Georgia,NA,0,NA,NA,NA,1,NA,NA,NA,NA,NA,NA,NA,NA,NA,NA,NA
13131,Grady County,GA,Georgia,NA,0,NA,NA,NA,0,NA,NA,NA,NA,NA,NA,NA,NA,NA,NA,NA
13133,Greene County,GA,Georgia,nehealthdept,1,NA,No,No,1,NA,NA,Northeast Health District (Georgia Public Health District 10),2255483023,"HOLIDAY CLOSING: All Northeast Health District Health Departments and Offices will be CLOSED on Monday, October 8th in observance of Columbus Day. Regular operating hours resume on Tuesday, October 9th. Have a Safe Holiday!  https://t.co/LURB6dzk1k",10/6/2018,19:30:09,https://twitter.com/NEHealthDept/status/1048717075433361410,2018,10,6
13135,Gwinnett County,GA,Georgia,NA,0,NA,NA,NA,0,NA,NA,NA,NA,NA,NA,NA,NA,NA,NA,NA
13137,Habersham County,GA,Georgia,NA,0,NA,NA,NA,0,NA,NA,NA,NA,NA,NA,NA,NA,NA,NA,NA
13139,Hall County,GA,Georgia,NA,0,NA,NA,NA,1,NA,NA,NA,NA,NA,NA,NA,NA,NA,NA,NA
13141,Hancock County,GA,Georgia,nchd52,1,NA,Yes,Yes,1,NA,NA,North Central Health District - Georgia,354067553,"When you bring your #Thanksgiving groceries home, separate raw meat, poultry, seafood and eggs from other foods in the refrigerator. Place them in containers or sealed plastic bags on the bottom shelf of the refrigerator. #TheStoryOfYourDinner  https://t.co/dtY2qvX19N",11/24/2021,16:00:41,https://twitter.com/NCHD52/status/1463613565940678661,2021,11,24
13143,Haralson County,GA,Georgia,NA,0,NA,NA,NA,0,NA,NA,NA,NA,NA,NA,NA,NA,NA,NA,NA
13145,Harris County,GA,Georgia,NA,0,NA,NA,NA,0,NA,NA,NA,NA,NA,NA,NA,NA,NA,NA,NA
13147,Hart County,GA,Georgia,NA,0,NA,NA,NA,0,NA,NA,NA,NA,NA,NA,NA,NA,NA,NA,NA
13149,Heard County,GA,Georgia,NA,0,NA,NA,NA,1,NA,NA,NA,NA,NA,NA,NA,NA,NA,NA,NA
13151,Henry County,GA,Georgia,NA,0,NA,NA,NA,1,NA,NA,NA,NA,NA,NA,NA,NA,NA,NA,NA
13153,Houston County,GA,Georgia,nchd52,1,NA,Yes,Yes,1,NA,NA,North Central Health District - Georgia,354067553,"When you bring your #Thanksgiving groceries home, separate raw meat, poultry, seafood and eggs from other foods in the refrigerator. Place them in containers or sealed plastic bags on the bottom shelf of the refrigerator. #TheStoryOfYourDinner  https://t.co/dtY2qvX19N",11/24/2021,16:00:41,https://twitter.com/NCHD52/status/1463613565940678661,2021,11,24
13155,Irwin County,GA,Georgia,NA,0,NA,NA,NA,1,NA,NA,NA,NA,NA,NA,NA,NA,NA,NA,NA
13157,Jackson County,GA,Georgia,nehealthdept,1,NA,No,No,1,NA,NA,Northeast Health District (Georgia Public Health District 10),2255483023,"HOLIDAY CLOSING: All Northeast Health District Health Departments and Offices will be CLOSED on Monday, October 8th in observance of Columbus Day. Regular operating hours resume on Tuesday, October 9th. Have a Safe Holiday!  https://t.co/LURB6dzk1k",10/6/2018,19:30:09,https://twitter.com/NEHealthDept/status/1048717075433361410,2018,10,6
13159,Jasper County,GA,Georgia,nchd52,1,NA,Yes,Yes,1,NA,NA,North Central Health District - Georgia,354067553,"When you bring your #Thanksgiving groceries home, separate raw meat, poultry, seafood and eggs from other foods in the refrigerator. Place them in containers or sealed plastic bags on the bottom shelf of the refrigerator. #TheStoryOfYourDinner  https://t.co/dtY2qvX19N",11/24/2021,16:00:41,https://twitter.com/NCHD52/status/1463613565940678661,2021,11,24
13161,Jeff Davis County,GA,Georgia,sehdph,1,NA,Yes,Yes,0,NA,NA,Southeast Health District - Georgia,313344456,"HIV can affect anyone, regardless of their sexual orientation, race, gender, or age. This World AIDS Day, we must challenge misinformation, racism, homophobia, and transphobia to #StopHIVStigma.  https://t.co/aGbIVexrqA #WAD2021 #StopHIVTogether  https://t.co/PnFxGsoQak",11/23/2021,8:00:35,https://twitter.com/sehdph/status/1463130355939041280,2021,11,23
13163,Jefferson County,GA,Georgia,NA,0,NA,NA,NA,0,NA,NA,NA,NA,NA,NA,NA,NA,NA,NA,NA
13165,Jenkins County,GA,Georgia,NA,0,NA,NA,NA,1,NA,NA,NA,NA,NA,NA,NA,NA,NA,NA,NA
13167,Johnson County,GA,Georgia,NA,0,NA,NA,NA,0,NA,NA,NA,NA,NA,NA,NA,NA,NA,NA,NA
13169,Jones County,GA,Georgia,nchd52,1,NA,Yes,Yes,1,NA,NA,North Central Health District - Georgia,354067553,"When you bring your #Thanksgiving groceries home, separate raw meat, poultry, seafood and eggs from other foods in the refrigerator. Place them in containers or sealed plastic bags on the bottom shelf of the refrigerator. #TheStoryOfYourDinner  https://t.co/dtY2qvX19N",11/24/2021,16:00:41,https://twitter.com/NCHD52/status/1463613565940678661,2021,11,24
13171,Lamar County,GA,Georgia,NA,0,NA,NA,NA,1,NA,NA,NA,NA,NA,NA,NA,NA,NA,NA,NA
13173,Lanier County,GA,Georgia,NA,0,NA,NA,NA,1,NA,NA,NA,NA,NA,NA,NA,NA,NA,NA,NA
13175,Laurens County,GA,Georgia,NA,0,NA,NA,NA,0,NA,NA,NA,NA,NA,NA,NA,NA,NA,NA,NA
13177,Lee County,GA,Georgia,NA,0,NA,NA,NA,0,NA,NA,NA,NA,NA,NA,NA,NA,NA,NA,NA
13179,Liberty County,GA,Georgia,coastalhealth91,1,NA,Yes,Yes,1,NA,NA,Georgia Coastal Health District,550096463,https://t.co/O7BEFIr2lD,11/24/2021,14:02:05,https://twitter.com/coastalhealth91/status/1463583718619111432,2021,11,24
13181,Lincoln County,GA,Georgia,NA,0,NA,NA,NA,1,NA,NA,NA,NA,NA,NA,NA,NA,NA,NA,NA
13183,Long County,GA,Georgia,coastalhealth91,1,NA,Yes,Yes,0,NA,NA,Georgia Coastal Health District,550096463,https://t.co/O7BEFIr2lD,11/24/2021,14:02:05,https://twitter.com/coastalhealth91/status/1463583718619111432,2021,11,24
13185,Lowndes County,GA,Georgia,NA,0,NA,NA,NA,1,NA,NA,NA,NA,NA,NA,NA,NA,NA,NA,NA
13187,Lumpkin County,GA,Georgia,NA,0,NA,NA,NA,0,NA,NA,NA,NA,NA,NA,NA,NA,NA,NA,NA
13189,McDuffie County,GA,Georgia,NA,0,NA,NA,NA,0,NA,NA,NA,NA,NA,NA,NA,NA,NA,NA,NA
13191,McIntosh County,GA,Georgia,coastalhealth91,1,NA,Yes,Yes,0,NA,NA,Georgia Coastal Health District,550096463,https://t.co/O7BEFIr2lD,11/24/2021,14:02:05,https://twitter.com/coastalhealth91/status/1463583718619111432,2021,11,24
13193,Macon County,GA,Georgia,NA,0,NA,NA,NA,0,NA,NA,NA,NA,NA,NA,NA,NA,NA,NA,NA
13195,Madison County,GA,Georgia,nehealthdept,1,NA,No,No,0,NA,NA,Northeast Health District (Georgia Public Health District 10),2255483023,"HOLIDAY CLOSING: All Northeast Health District Health Departments and Offices will be CLOSED on Monday, October 8th in observance of Columbus Day. Regular operating hours resume on Tuesday, October 9th. Have a Safe Holiday!  https://t.co/LURB6dzk1k",10/6/2018,19:30:09,https://twitter.com/NEHealthDept/status/1048717075433361410,2018,10,6
13197,Marion County,GA,Georgia,NA,0,NA,NA,NA,0,NA,NA,NA,NA,NA,NA,NA,NA,NA,NA,NA
13199,Meriwether County,GA,Georgia,NA,0,NA,NA,NA,0,NA,NA,NA,NA,NA,NA,NA,NA,NA,NA,NA
13201,Miller County,GA,Georgia,NA,0,NA,NA,NA,0,NA,NA,NA,NA,NA,NA,NA,NA,NA,NA,NA
13205,Mitchell County,GA,Georgia,NA,0,NA,NA,NA,0,NA,NA,NA,NA,NA,NA,NA,NA,NA,NA,NA
13207,Monroe County,GA,Georgia,nchd52,1,NA,Yes,Yes,1,NA,NA,North Central Health District - Georgia,354067553,"When you bring your #Thanksgiving groceries home, separate raw meat, poultry, seafood and eggs from other foods in the refrigerator. Place them in containers or sealed plastic bags on the bottom shelf of the refrigerator. #TheStoryOfYourDinner  https://t.co/dtY2qvX19N",11/24/2021,16:00:41,https://twitter.com/NCHD52/status/1463613565940678661,2021,11,24
13209,Montgomery County,GA,Georgia,NA,0,NA,NA,NA,0,NA,NA,NA,NA,NA,NA,NA,NA,NA,NA,NA
13211,Morgan County,GA,Georgia,nehealthdept,1,NA,No,No,1,NA,NA,Northeast Health District (Georgia Public Health District 10),2255483023,"HOLIDAY CLOSING: All Northeast Health District Health Departments and Offices will be CLOSED on Monday, October 8th in observance of Columbus Day. Regular operating hours resume on Tuesday, October 9th. Have a Safe Holiday!  https://t.co/LURB6dzk1k",10/6/2018,19:30:09,https://twitter.com/NEHealthDept/status/1048717075433361410,2018,10,6
13213,Murray County,GA,Georgia,ngahealthdist,1,NA,Yes,Yes,1,NA,NA,North Georgia Health Department,354938433,Preparing a holiday meal this Thanksgiving? Cook your turkey thoroughly and always use a food thermometer. Learn more about meal prep for the holidays:   https://t.co/JNCud3PxEY.  https://t.co/WXZ3lcGoWR,11/24/2021,7:48:03,https://twitter.com/NGAHealthDist/status/1463489590631800832,2021,11,24
13215,Muscogee County,GA,Georgia,NA,0,NA,NA,NA,0,NA,NA,NA,NA,NA,NA,NA,NA,NA,NA,NA
13217,Newton County,GA,Georgia,NA,0,NA,NA,NA,0,NA,NA,NA,NA,NA,NA,NA,NA,NA,NA,NA
13219,Oconee County,GA,Georgia,nehealthdept,1,NA,No,No,1,NA,NA,Northeast Health District (Georgia Public Health District 10),2255483023,"HOLIDAY CLOSING: All Northeast Health District Health Departments and Offices will be CLOSED on Monday, October 8th in observance of Columbus Day. Regular operating hours resume on Tuesday, October 9th. Have a Safe Holiday!  https://t.co/LURB6dzk1k",10/6/2018,19:30:09,https://twitter.com/NEHealthDept/status/1048717075433361410,2018,10,6
13221,Oglethorpe County,GA,Georgia,nehealthdept,1,NA,No,No,1,NA,NA,Northeast Health District (Georgia Public Health District 10),2255483023,"HOLIDAY CLOSING: All Northeast Health District Health Departments and Offices will be CLOSED on Monday, October 8th in observance of Columbus Day. Regular operating hours resume on Tuesday, October 9th. Have a Safe Holiday!  https://t.co/LURB6dzk1k",10/6/2018,19:30:09,https://twitter.com/NEHealthDept/status/1048717075433361410,2018,10,6
13223,Paulding County,GA,Georgia,NA,0,NA,NA,NA,1,NA,NA,NA,NA,NA,NA,NA,NA,NA,NA,NA
13225,Peach County,GA,Georgia,nchd52,1,NA,Yes,Yes,1,NA,NA,North Central Health District - Georgia,354067553,"When you bring your #Thanksgiving groceries home, separate raw meat, poultry, seafood and eggs from other foods in the refrigerator. Place them in containers or sealed plastic bags on the bottom shelf of the refrigerator. #TheStoryOfYourDinner  https://t.co/dtY2qvX19N",11/24/2021,16:00:41,https://twitter.com/NCHD52/status/1463613565940678661,2021,11,24
13227,Pickens County,GA,Georgia,ngahealthdist,1,NA,Yes,Yes,1,NA,NA,North Georgia Health Department,354938433,Preparing a holiday meal this Thanksgiving? Cook your turkey thoroughly and always use a food thermometer. Learn more about meal prep for the holidays:   https://t.co/JNCud3PxEY.  https://t.co/WXZ3lcGoWR,11/24/2021,7:48:03,https://twitter.com/NGAHealthDist/status/1463489590631800832,2021,11,24
13229,Pierce County,GA,Georgia,sehdph,1,NA,Yes,Yes,1,NA,NA,Southeast Health District - Georgia,313344456,"HIV can affect anyone, regardless of their sexual orientation, race, gender, or age. This World AIDS Day, we must challenge misinformation, racism, homophobia, and transphobia to #StopHIVStigma.  https://t.co/aGbIVexrqA #WAD2021 #StopHIVTogether  https://t.co/PnFxGsoQak",11/23/2021,8:00:35,https://twitter.com/sehdph/status/1463130355939041280,2021,11,23
13231,Pike County,GA,Georgia,NA,0,NA,NA,NA,0,NA,NA,NA,NA,NA,NA,NA,NA,NA,NA,NA
13233,Polk County,GA,Georgia,NA,0,NA,NA,NA,1,NA,NA,NA,NA,NA,NA,NA,NA,NA,NA,NA
13235,Pulaski County,GA,Georgia,NA,0,NA,NA,NA,1,NA,NA,NA,NA,NA,NA,NA,NA,NA,NA,NA
13237,Putnam County,GA,Georgia,nchd52,1,NA,Yes,Yes,1,NA,NA,North Central Health District - Georgia,354067553,"When you bring your #Thanksgiving groceries home, separate raw meat, poultry, seafood and eggs from other foods in the refrigerator. Place them in containers or sealed plastic bags on the bottom shelf of the refrigerator. #TheStoryOfYourDinner  https://t.co/dtY2qvX19N",11/24/2021,16:00:41,https://twitter.com/NCHD52/status/1463613565940678661,2021,11,24
13239,Quitman County,GA,Georgia,NA,0,NA,NA,NA,0,NA,NA,NA,NA,NA,NA,NA,NA,NA,NA,NA
13241,Rabun County,GA,Georgia,NA,0,NA,NA,NA,0,NA,NA,NA,NA,NA,NA,NA,NA,NA,NA,NA
13243,Randolph County,GA,Georgia,NA,0,NA,NA,NA,0,NA,NA,NA,NA,NA,NA,NA,NA,NA,NA,NA
13245,Richmond County,GA,Georgia,NA,0,NA,NA,NA,1,NA,NA,NA,NA,NA,NA,NA,NA,NA,NA,NA
13247,Rockdale County,GA,Georgia,NA,0,NA,NA,NA,1,NA,NA,NA,NA,NA,NA,NA,NA,NA,NA,NA
13249,Schley County,GA,Georgia,NA,0,NA,NA,NA,0,NA,NA,NA,NA,NA,NA,NA,NA,NA,NA,NA
13251,Screven County,GA,Georgia,NA,0,NA,NA,NA,1,NA,NA,NA,NA,NA,NA,NA,NA,NA,NA,NA
13253,Seminole County,GA,Georgia,NA,0,NA,NA,NA,0,NA,NA,NA,NA,NA,NA,NA,NA,NA,NA,NA
13255,Spalding County,GA,Georgia,NA,0,NA,NA,NA,1,NA,NA,NA,NA,NA,NA,NA,NA,NA,NA,NA
13257,Stephens County,GA,Georgia,NA,0,NA,NA,NA,0,NA,NA,NA,NA,NA,NA,NA,NA,NA,NA,NA
13259,Stewart County,GA,Georgia,NA,0,NA,NA,NA,0,NA,NA,NA,NA,NA,NA,NA,NA,NA,NA,NA
13261,Sumter County,GA,Georgia,NA,0,NA,NA,NA,1,NA,NA,NA,NA,NA,NA,NA,NA,NA,NA,NA
13263,Talbot County,GA,Georgia,NA,0,NA,NA,NA,0,NA,NA,NA,NA,NA,NA,NA,NA,NA,NA,NA
13265,Taliaferro County,GA,Georgia,NA,0,NA,NA,NA,0,NA,NA,NA,NA,NA,NA,NA,NA,NA,NA,NA
13267,Tattnall County,GA,Georgia,sehdph,1,NA,Yes,Yes,1,NA,NA,Southeast Health District - Georgia,313344456,"HIV can affect anyone, regardless of their sexual orientation, race, gender, or age. This World AIDS Day, we must challenge misinformation, racism, homophobia, and transphobia to #StopHIVStigma.  https://t.co/aGbIVexrqA #WAD2021 #StopHIVTogether  https://t.co/PnFxGsoQak",11/23/2021,8:00:35,https://twitter.com/sehdph/status/1463130355939041280,2021,11,23
13269,Taylor County,GA,Georgia,NA,0,NA,NA,NA,0,NA,NA,NA,NA,NA,NA,NA,NA,NA,NA,NA
13271,Telfair County,GA,Georgia,NA,0,NA,NA,NA,0,NA,NA,NA,NA,NA,NA,NA,NA,NA,NA,NA
13273,Terrell County,GA,Georgia,NA,0,NA,NA,NA,0,NA,NA,NA,NA,NA,NA,NA,NA,NA,NA,NA
13275,Thomas County,GA,Georgia,NA,0,NA,NA,NA,0,NA,NA,NA,NA,NA,NA,NA,NA,NA,NA,NA
13277,Tift County,GA,Georgia,NA,0,NA,NA,NA,0,NA,NA,NA,NA,NA,NA,NA,NA,NA,NA,NA
13279,Toombs County,GA,Georgia,sehdph,1,NA,Yes,Yes,0,NA,NA,Southeast Health District - Georgia,313344456,"HIV can affect anyone, regardless of their sexual orientation, race, gender, or age. This World AIDS Day, we must challenge misinformation, racism, homophobia, and transphobia to #StopHIVStigma.  https://t.co/aGbIVexrqA #WAD2021 #StopHIVTogether  https://t.co/PnFxGsoQak",11/23/2021,8:00:35,https://twitter.com/sehdph/status/1463130355939041280,2021,11,23
13281,Towns County,GA,Georgia,NA,0,NA,NA,NA,0,NA,NA,NA,NA,NA,NA,NA,NA,NA,NA,NA
13283,Treutlen County,GA,Georgia,NA,0,NA,NA,NA,0,NA,NA,NA,NA,NA,NA,NA,NA,NA,NA,NA
13285,Troup County,GA,Georgia,NA,0,NA,NA,NA,0,NA,NA,NA,NA,NA,NA,NA,NA,NA,NA,NA
13287,Turner County,GA,Georgia,NA,0,NA,NA,NA,0,NA,NA,NA,NA,NA,NA,NA,NA,NA,NA,NA
13289,Twiggs County,GA,Georgia,nchd52,1,NA,Yes,Yes,1,NA,NA,North Central Health District - Georgia,354067553,"When you bring your #Thanksgiving groceries home, separate raw meat, poultry, seafood and eggs from other foods in the refrigerator. Place them in containers or sealed plastic bags on the bottom shelf of the refrigerator. #TheStoryOfYourDinner  https://t.co/dtY2qvX19N",11/24/2021,16:00:41,https://twitter.com/NCHD52/status/1463613565940678661,2021,11,24
13291,Union County,GA,Georgia,NA,0,NA,NA,NA,0,NA,NA,NA,NA,NA,NA,NA,NA,NA,NA,NA
13293,Upson County,GA,Georgia,NA,0,NA,NA,NA,1,NA,NA,NA,NA,NA,NA,NA,NA,NA,NA,NA
13295,Walker County,GA,Georgia,NA,0,NA,NA,NA,1,NA,NA,NA,NA,NA,NA,NA,NA,NA,NA,NA
13297,Walton County,GA,Georgia,nehealthdept,1,NA,No,No,1,NA,NA,Northeast Health District (Georgia Public Health District 10),2255483023,"HOLIDAY CLOSING: All Northeast Health District Health Departments and Offices will be CLOSED on Monday, October 8th in observance of Columbus Day. Regular operating hours resume on Tuesday, October 9th. Have a Safe Holiday!  https://t.co/LURB6dzk1k",10/6/2018,19:30:09,https://twitter.com/NEHealthDept/status/1048717075433361410,2018,10,6
13299,Ware County,GA,Georgia,sehdph,1,NA,Yes,Yes,1,NA,NA,Southeast Health District - Georgia,313344456,"HIV can affect anyone, regardless of their sexual orientation, race, gender, or age. This World AIDS Day, we must challenge misinformation, racism, homophobia, and transphobia to #StopHIVStigma.  https://t.co/aGbIVexrqA #WAD2021 #StopHIVTogether  https://t.co/PnFxGsoQak",11/23/2021,8:00:35,https://twitter.com/sehdph/status/1463130355939041280,2021,11,23
13301,Warren County,GA,Georgia,NA,0,NA,NA,NA,0,NA,NA,NA,NA,NA,NA,NA,NA,NA,NA,NA
13303,Washington County,GA,Georgia,nchd52,1,NA,Yes,Yes,1,NA,NA,North Central Health District - Georgia,354067553,"When you bring your #Thanksgiving groceries home, separate raw meat, poultry, seafood and eggs from other foods in the refrigerator. Place them in containers or sealed plastic bags on the bottom shelf of the refrigerator. #TheStoryOfYourDinner  https://t.co/dtY2qvX19N",11/24/2021,16:00:41,https://twitter.com/NCHD52/status/1463613565940678661,2021,11,24
13305,Wayne County,GA,Georgia,sehdph,1,NA,Yes,Yes,1,NA,NA,Southeast Health District - Georgia,313344456,"HIV can affect anyone, regardless of their sexual orientation, race, gender, or age. This World AIDS Day, we must challenge misinformation, racism, homophobia, and transphobia to #StopHIVStigma.  https://t.co/aGbIVexrqA #WAD2021 #StopHIVTogether  https://t.co/PnFxGsoQak",11/23/2021,8:00:35,https://twitter.com/sehdph/status/1463130355939041280,2021,11,23
13307,Webster County,GA,Georgia,NA,0,NA,NA,NA,0,NA,NA,NA,NA,NA,NA,NA,NA,NA,NA,NA
13309,Wheeler County,GA,Georgia,NA,0,NA,NA,NA,0,NA,NA,NA,NA,NA,NA,NA,NA,NA,NA,NA
13311,White County,GA,Georgia,NA,0,NA,NA,NA,0,NA,NA,NA,NA,NA,NA,NA,NA,NA,NA,NA
13313,Whitfield County,GA,Georgia,ngahealthdist,1,NA,Yes,Yes,1,NA,NA,North Georgia Health Department,354938433,Preparing a holiday meal this Thanksgiving? Cook your turkey thoroughly and always use a food thermometer. Learn more about meal prep for the holidays:   https://t.co/JNCud3PxEY.  https://t.co/WXZ3lcGoWR,11/24/2021,7:48:03,https://twitter.com/NGAHealthDist/status/1463489590631800832,2021,11,24
13315,Wilcox County,GA,Georgia,NA,0,NA,NA,NA,0,NA,NA,NA,NA,NA,NA,NA,NA,NA,NA,NA
13317,Wilkes County,GA,Georgia,NA,0,NA,NA,NA,0,NA,NA,NA,NA,NA,NA,NA,NA,NA,NA,NA
13319,Wilkinson County,GA,Georgia,nchd52,1,NA,Yes,Yes,1,NA,NA,North Central Health District - Georgia,354067553,"When you bring your #Thanksgiving groceries home, separate raw meat, poultry, seafood and eggs from other foods in the refrigerator. Place them in containers or sealed plastic bags on the bottom shelf of the refrigerator. #TheStoryOfYourDinner  https://t.co/dtY2qvX19N",11/24/2021,16:00:41,https://twitter.com/NCHD52/status/1463613565940678661,2021,11,24
13321,Worth County,GA,Georgia,NA,0,NA,NA,NA,1,NA,NA,NA,NA,NA,NA,NA,NA,NA,NA,NA
15001,Hawaii County,HI,Hawaii,NA,0,NA,NA,NA,1,NA,CountyGeneral,NA,NA,NA,NA,NA,NA,NA,NA,NA
15003,Honolulu County,HI,Hawaii,oneoahu,1,DoubleCheck,No,No,1,NA,EmergManage-FB,NA,NA,NA,NA,NA,NA,NA,NA,NA
15005,Kalawao County,HI,Hawaii,NA,0,NA,NA,NA,0,NA,NA,NA,NA,NA,NA,NA,NA,NA,NA,NA
15007,Kauai County,HI,Hawaii,NA,0,NA,NA,NA,1,NA,NA,NA,NA,NA,NA,NA,NA,NA,NA,NA
15009,Maui County,HI,Hawaii,NA,0,NA,NA,NA,0,NA,NA,NA,NA,NA,NA,NA,NA,NA,NA,NA
16001,Ada County,ID,Idaho,cdhidaho,1,NA,Yes,Yes,1,NA,NA,Public Health District IV - Idaho,37749338,"CDH will be closed Thursday, Nov. 25, 2021 in observance of Thanksgiving Day. We will reopen on Friday, Nov. 26, 2021. CDH’s COVID-19 numbers will be updated Friday.   Please note, our COVID-19 call center will be closed on Friday, Nov. 26, 2021 &amp; will reopen Monday, Nov. 29.  https://t.co/oRLfxnOkAT",11/24/2021,17:00:01,https://twitter.com/CDHidaho/status/1463628496530546696,2021,11,24
16003,Adams County,ID,Idaho,swdhidaho,1,NA,Yes,Yes,1,NA,NA,Southwest District Health - Idaho,1102086571,Reminder: The COVID-19 Weekly Summary Graphics and Dashboard will not be updated this week (11/24). The next scheduled update of the COVID-19 Weekly Summary Graphics and Dashboard is 12/1.   The 11/17 info may be found on the SWDH website at  https://t.co/EEpNzMh44I.,11/24/2021,16:00:01,https://twitter.com/SWDHIDAHO/status/1463613397946155008,2021,11,24
16005,Bannock County,ID,Idaho,siphidaho,1,NA,Yes,Yes,1,NA,NA,Southeastern Idaho Public Health,16783792,Getting her vaccinated against COVID-19 means less worry and more hugs. To find a COVID-19 vaccine near you visit  https://t.co/gvacYoEBsr.  https://t.co/GZVRe73bhK,11/24/2021,8:20:05,https://twitter.com/siphidaho/status/1463497652860252162,2021,11,24
16007,Bear Lake County,ID,Idaho,siphidaho,1,NA,Yes,Yes,1,NA,NA,Southeastern Idaho Public Health,16783792,Getting her vaccinated against COVID-19 means less worry and more hugs. To find a COVID-19 vaccine near you visit  https://t.co/gvacYoEBsr.  https://t.co/GZVRe73bhK,11/24/2021,8:20:05,https://twitter.com/siphidaho/status/1463497652860252162,2021,11,24
16009,Benewah County,ID,Idaho,phdidaho,1,NA,Outdated-Add District,No,1,NA,NA,Panhandle Health District - Idaho,61523172,What is the Youth Water Summit? A scientific conference for high school students who are learning about our watershed through the Confluence Project using field experiences and hands-on research. They are...  https://t.co/RiVFeca8P9,4/29/2019,11:16:55,https://twitter.com/phdidaho/status/1122882459652247553,2019,4,29
16011,Bingham County,ID,Idaho,siphidaho,1,NA,Yes,Yes,1,NA,NA,Southeastern Idaho Public Health,16783792,Getting her vaccinated against COVID-19 means less worry and more hugs. To find a COVID-19 vaccine near you visit  https://t.co/gvacYoEBsr.  https://t.co/GZVRe73bhK,11/24/2021,8:20:05,https://twitter.com/siphidaho/status/1463497652860252162,2021,11,24
16013,Blaine County,ID,Idaho,scphd,1,NA,Yes,No,1,NA,NA,South Central Public Health District - Idaho,100076441,October is #BreastCancer Month! Did you know there are some things you can do to reduce your risk of breast cancer? Read more:  https://t.co/YSA4s2We6w,10/8/2020,16:12:58,https://twitter.com/SCPHD/status/1314297757792759809,2020,10,8
16015,Boise County,ID,Idaho,cdhidaho,1,NA,Yes,Yes,1,NA,NA,Public Health District IV - Idaho,37749338,"CDH will be closed Thursday, Nov. 25, 2021 in observance of Thanksgiving Day. We will reopen on Friday, Nov. 26, 2021. CDH’s COVID-19 numbers will be updated Friday.   Please note, our COVID-19 call center will be closed on Friday, Nov. 26, 2021 &amp; will reopen Monday, Nov. 29.  https://t.co/oRLfxnOkAT",11/24/2021,17:00:01,https://twitter.com/CDHidaho/status/1463628496530546696,2021,11,24
16017,Bonner County,ID,Idaho,phdidaho,1,NA,Outdated-Add District,No,1,NA,NA,Panhandle Health District - Idaho,61523172,What is the Youth Water Summit? A scientific conference for high school students who are learning about our watershed through the Confluence Project using field experiences and hands-on research. They are...  https://t.co/RiVFeca8P9,4/29/2019,11:16:55,https://twitter.com/phdidaho/status/1122882459652247553,2019,4,29
16019,Bonneville County,ID,Idaho,eiphd,1,DoubleCheck,No,No,1,NA,Outdated-Add District,NA,NA,NA,NA,NA,NA,NA,NA,NA
16021,Boundary County,ID,Idaho,phdidaho,1,NA,Outdated-Add District,No,1,NA,NA,Panhandle Health District - Idaho,61523172,What is the Youth Water Summit? A scientific conference for high school students who are learning about our watershed through the Confluence Project using field experiences and hands-on research. They are...  https://t.co/RiVFeca8P9,4/29/2019,11:16:55,https://twitter.com/phdidaho/status/1122882459652247553,2019,4,29
16023,Butte County,ID,Idaho,siphidaho,1,NA,Yes,Yes,1,NA,NA,Southeastern Idaho Public Health,16783792,Getting her vaccinated against COVID-19 means less worry and more hugs. To find a COVID-19 vaccine near you visit  https://t.co/gvacYoEBsr.  https://t.co/GZVRe73bhK,11/24/2021,8:20:05,https://twitter.com/siphidaho/status/1463497652860252162,2021,11,24
16025,Camas County,ID,Idaho,scphd,1,NA,Yes,No,1,NA,NA,South Central Public Health District - Idaho,100076441,October is #BreastCancer Month! Did you know there are some things you can do to reduce your risk of breast cancer? Read more:  https://t.co/YSA4s2We6w,10/8/2020,16:12:58,https://twitter.com/SCPHD/status/1314297757792759809,2020,10,8
16027,Canyon County,ID,Idaho,swdhidaho,1,NA,Yes,Yes,1,NA,NA,Southwest District Health - Idaho,1102086571,Reminder: The COVID-19 Weekly Summary Graphics and Dashboard will not be updated this week (11/24). The next scheduled update of the COVID-19 Weekly Summary Graphics and Dashboard is 12/1.   The 11/17 info may be found on the SWDH website at  https://t.co/EEpNzMh44I.,11/24/2021,16:00:01,https://twitter.com/SWDHIDAHO/status/1463613397946155008,2021,11,24
16029,Caribou County,ID,Idaho,siphidaho,1,NA,Yes,Yes,1,NA,NA,Southeastern Idaho Public Health,16783792,Getting her vaccinated against COVID-19 means less worry and more hugs. To find a COVID-19 vaccine near you visit  https://t.co/gvacYoEBsr.  https://t.co/GZVRe73bhK,11/24/2021,8:20:05,https://twitter.com/siphidaho/status/1463497652860252162,2021,11,24
16031,Cassia County,ID,Idaho,scphd,1,NA,Yes,No,1,NA,NA,South Central Public Health District - Idaho,100076441,October is #BreastCancer Month! Did you know there are some things you can do to reduce your risk of breast cancer? Read more:  https://t.co/YSA4s2We6w,10/8/2020,16:12:58,https://twitter.com/SCPHD/status/1314297757792759809,2020,10,8
16033,Clark County,ID,Idaho,eiphd,1,DoubleCheck,No,No,1,NA,Outdated-Add District,NA,NA,NA,NA,NA,NA,NA,NA,NA
16035,Clearwater County,ID,Idaho,phincd,1,NA,Yes,Yes,1,NA,NA,Public Health District 2 - Idaho,17851232,Today is Public Health Thank-You Day! The public health workforce work day in and day out to keep us safe every day of the year—and for that we say THANK YOU! #PHTYD  https://t.co/FENcOxKxFR,11/22/2021,10:30:01,https://twitter.com/PHINCD/status/1462805573603414017,2021,11,22
16037,Custer County,ID,Idaho,eiphd,1,DoubleCheck,No,No,1,NA,Outdated-Add District,NA,NA,NA,NA,NA,NA,NA,NA,NA
16039,Elmore County,ID,Idaho,cdhidaho,1,NA,Yes,Yes,1,NA,NA,Public Health District IV - Idaho,37749338,"CDH will be closed Thursday, Nov. 25, 2021 in observance of Thanksgiving Day. We will reopen on Friday, Nov. 26, 2021. CDH’s COVID-19 numbers will be updated Friday.   Please note, our COVID-19 call center will be closed on Friday, Nov. 26, 2021 &amp; will reopen Monday, Nov. 29.  https://t.co/oRLfxnOkAT",11/24/2021,17:00:01,https://twitter.com/CDHidaho/status/1463628496530546696,2021,11,24
16041,Franklin County,ID,Idaho,siphidaho,1,NA,Yes,Yes,1,NA,NA,Southeastern Idaho Public Health,16783792,Getting her vaccinated against COVID-19 means less worry and more hugs. To find a COVID-19 vaccine near you visit  https://t.co/gvacYoEBsr.  https://t.co/GZVRe73bhK,11/24/2021,8:20:05,https://twitter.com/siphidaho/status/1463497652860252162,2021,11,24
16043,Fremont County,ID,Idaho,eiphd,1,DoubleCheck,No,No,1,NA,Outdated-Add District,NA,NA,NA,NA,NA,NA,NA,NA,NA
16045,Gem County,ID,Idaho,swdhidaho,1,NA,Yes,Yes,1,NA,NA,Southwest District Health - Idaho,1102086571,Reminder: The COVID-19 Weekly Summary Graphics and Dashboard will not be updated this week (11/24). The next scheduled update of the COVID-19 Weekly Summary Graphics and Dashboard is 12/1.   The 11/17 info may be found on the SWDH website at  https://t.co/EEpNzMh44I.,11/24/2021,16:00:01,https://twitter.com/SWDHIDAHO/status/1463613397946155008,2021,11,24
16047,Gooding County,ID,Idaho,scphd,1,NA,Yes,No,1,NA,NA,South Central Public Health District - Idaho,100076441,October is #BreastCancer Month! Did you know there are some things you can do to reduce your risk of breast cancer? Read more:  https://t.co/YSA4s2We6w,10/8/2020,16:12:58,https://twitter.com/SCPHD/status/1314297757792759809,2020,10,8
16049,Idaho County,ID,Idaho,phincd,1,NA,Yes,Yes,1,NA,NA,Public Health District 2 - Idaho,17851232,Today is Public Health Thank-You Day! The public health workforce work day in and day out to keep us safe every day of the year—and for that we say THANK YOU! #PHTYD  https://t.co/FENcOxKxFR,11/22/2021,10:30:01,https://twitter.com/PHINCD/status/1462805573603414017,2021,11,22
16051,Jefferson County,ID,Idaho,eiphd,1,DoubleCheck,No,No,1,NA,Outdated-Add District,NA,NA,NA,NA,NA,NA,NA,NA,NA
16053,Jerome County,ID,Idaho,scphd,1,NA,Yes,No,1,NA,NA,South Central Public Health District - Idaho,100076441,October is #BreastCancer Month! Did you know there are some things you can do to reduce your risk of breast cancer? Read more:  https://t.co/YSA4s2We6w,10/8/2020,16:12:58,https://twitter.com/SCPHD/status/1314297757792759809,2020,10,8
16055,Kootenai County,ID,Idaho,phdidaho,1,NA,Outdated-Add District,No,1,NA,NA,Panhandle Health District - Idaho,61523172,What is the Youth Water Summit? A scientific conference for high school students who are learning about our watershed through the Confluence Project using field experiences and hands-on research. They are...  https://t.co/RiVFeca8P9,4/29/2019,11:16:55,https://twitter.com/phdidaho/status/1122882459652247553,2019,4,29
16057,Latah County,ID,Idaho,phincd,1,NA,Yes,Yes,1,NA,NA,Public Health District 2 - Idaho,17851232,Today is Public Health Thank-You Day! The public health workforce work day in and day out to keep us safe every day of the year—and for that we say THANK YOU! #PHTYD  https://t.co/FENcOxKxFR,11/22/2021,10:30:01,https://twitter.com/PHINCD/status/1462805573603414017,2021,11,22
16059,Lemhi County,ID,Idaho,eiphd,1,DoubleCheck,No,No,1,NA,Outdated-Add District,NA,NA,NA,NA,NA,NA,NA,NA,NA
16061,Lewis County,ID,Idaho,phincd,1,NA,Yes,Yes,1,NA,NA,Public Health District 2 - Idaho,17851232,Today is Public Health Thank-You Day! The public health workforce work day in and day out to keep us safe every day of the year—and for that we say THANK YOU! #PHTYD  https://t.co/FENcOxKxFR,11/22/2021,10:30:01,https://twitter.com/PHINCD/status/1462805573603414017,2021,11,22
16063,Lincoln County,ID,Idaho,scphd,1,NA,Yes,No,1,NA,NA,South Central Public Health District - Idaho,100076441,October is #BreastCancer Month! Did you know there are some things you can do to reduce your risk of breast cancer? Read more:  https://t.co/YSA4s2We6w,10/8/2020,16:12:58,https://twitter.com/SCPHD/status/1314297757792759809,2020,10,8
16065,Madison County,ID,Idaho,eiphd,1,DoubleCheck,No,No,1,NA,Outdated-Add District,NA,NA,NA,NA,NA,NA,NA,NA,NA
16067,Minidoka County,ID,Idaho,scphd,1,NA,Yes,No,1,NA,NA,South Central Public Health District - Idaho,100076441,October is #BreastCancer Month! Did you know there are some things you can do to reduce your risk of breast cancer? Read more:  https://t.co/YSA4s2We6w,10/8/2020,16:12:58,https://twitter.com/SCPHD/status/1314297757792759809,2020,10,8
16069,Nez Perce County,ID,Idaho,phincd,1,NA,Yes,Yes,1,NA,NA,Public Health District 2 - Idaho,17851232,Today is Public Health Thank-You Day! The public health workforce work day in and day out to keep us safe every day of the year—and for that we say THANK YOU! #PHTYD  https://t.co/FENcOxKxFR,11/22/2021,10:30:01,https://twitter.com/PHINCD/status/1462805573603414017,2021,11,22
16071,Oneida County,ID,Idaho,siphidaho,1,NA,Yes,Yes,1,NA,NA,Southeastern Idaho Public Health,16783792,Getting her vaccinated against COVID-19 means less worry and more hugs. To find a COVID-19 vaccine near you visit  https://t.co/gvacYoEBsr.  https://t.co/GZVRe73bhK,11/24/2021,8:20:05,https://twitter.com/siphidaho/status/1463497652860252162,2021,11,24
16073,Owyhee County,ID,Idaho,swdhidaho,1,NA,Yes,Yes,1,NA,NA,Southwest District Health - Idaho,1102086571,Reminder: The COVID-19 Weekly Summary Graphics and Dashboard will not be updated this week (11/24). The next scheduled update of the COVID-19 Weekly Summary Graphics and Dashboard is 12/1.   The 11/17 info may be found on the SWDH website at  https://t.co/EEpNzMh44I.,11/24/2021,16:00:01,https://twitter.com/SWDHIDAHO/status/1463613397946155008,2021,11,24
16075,Payette County,ID,Idaho,swdhidaho,1,NA,Yes,Yes,1,NA,NA,Southwest District Health - Idaho,1102086571,Reminder: The COVID-19 Weekly Summary Graphics and Dashboard will not be updated this week (11/24). The next scheduled update of the COVID-19 Weekly Summary Graphics and Dashboard is 12/1.   The 11/17 info may be found on the SWDH website at  https://t.co/EEpNzMh44I.,11/24/2021,16:00:01,https://twitter.com/SWDHIDAHO/status/1463613397946155008,2021,11,24
16077,Power County,ID,Idaho,siphidaho,1,NA,Yes,Yes,1,NA,NA,Southeastern Idaho Public Health,16783792,Getting her vaccinated against COVID-19 means less worry and more hugs. To find a COVID-19 vaccine near you visit  https://t.co/gvacYoEBsr.  https://t.co/GZVRe73bhK,11/24/2021,8:20:05,https://twitter.com/siphidaho/status/1463497652860252162,2021,11,24
16079,Shoshone County,ID,Idaho,phdidaho,1,NA,Outdated-Add District,No,1,NA,NA,Panhandle Health District - Idaho,61523172,What is the Youth Water Summit? A scientific conference for high school students who are learning about our watershed through the Confluence Project using field experiences and hands-on research. They are...  https://t.co/RiVFeca8P9,4/29/2019,11:16:55,https://twitter.com/phdidaho/status/1122882459652247553,2019,4,29
16081,Teton County,ID,Idaho,eiphd,1,DoubleCheck,No,No,1,NA,Outdated-Add District,NA,NA,NA,NA,NA,NA,NA,NA,NA
16083,Twin Falls County,ID,Idaho,scphd,1,NA,Yes,No,1,NA,NA,South Central Public Health District - Idaho,100076441,October is #BreastCancer Month! Did you know there are some things you can do to reduce your risk of breast cancer? Read more:  https://t.co/YSA4s2We6w,10/8/2020,16:12:58,https://twitter.com/SCPHD/status/1314297757792759809,2020,10,8
16085,Valley County,ID,Idaho,cdhidaho,1,NA,Yes,Yes,1,NA,NA,Public Health District IV - Idaho,37749338,"CDH will be closed Thursday, Nov. 25, 2021 in observance of Thanksgiving Day. We will reopen on Friday, Nov. 26, 2021. CDH’s COVID-19 numbers will be updated Friday.   Please note, our COVID-19 call center will be closed on Friday, Nov. 26, 2021 &amp; will reopen Monday, Nov. 29.  https://t.co/oRLfxnOkAT",11/24/2021,17:00:01,https://twitter.com/CDHidaho/status/1463628496530546696,2021,11,24
16087,Washington County,ID,Idaho,swdhidaho,1,NA,Yes,Yes,1,NA,NA,Southwest District Health - Idaho,1102086571,Reminder: The COVID-19 Weekly Summary Graphics and Dashboard will not be updated this week (11/24). The next scheduled update of the COVID-19 Weekly Summary Graphics and Dashboard is 12/1.   The 11/17 info may be found on the SWDH website at  https://t.co/EEpNzMh44I.,11/24/2021,16:00:01,https://twitter.com/SWDHIDAHO/status/1463613397946155008,2021,11,24
17001,Adams County,IL,Illinois,NA,0,NA,NA,NA,0,NA,NA,NA,NA,NA,NA,NA,NA,NA,NA,NA
17003,Alexander County,IL,Illinois,NA,0,NA,NA,NA,0,NA,NA,NA,NA,NA,NA,NA,NA,NA,NA,NA
17005,Bond County,IL,Illinois,NA,0,NA,NA,NA,1,NA,NA,NA,NA,NA,NA,NA,NA,NA,NA,NA
17007,Boone County,IL,Illinois,boonecohealth,1,NA,Yes,No,0,NA,NA,NA,66794828,"As the summer heat continues to intensify, here are five ways to make sure you stay hydrated.  https://t.co/m3D7zPR3RQ",7/22/2021,13:10:04,https://twitter.com/boonecohealth/status/1418257048618389510,2021,7,22
17009,Brown County,IL,Illinois,NA,0,NA,NA,NA,1,NA,NA,NA,NA,NA,NA,NA,NA,NA,NA,NA
17011,Bureau County,IL,Illinois,NA,0,NA,NA,NA,1,NA,NA,NA,NA,NA,NA,NA,NA,NA,NA,NA
17013,Calhoun County,IL,Illinois,NA,0,NA,NA,NA,1,NA,NA,NA,NA,NA,NA,NA,NA,NA,NA,NA
17015,Carroll County,IL,Illinois,NA,0,NA,NA,NA,0,NA,NA,NA,NA,NA,NA,NA,NA,NA,NA,NA
17017,Cass County,IL,Illinois,casscohealthil,1,NA,Yes,Yes,0,NA,NA,NA,282207076,https://t.co/6xVzP6ngyg,11/17/2021,16:46:59,https://twitter.com/casscohealthIL/status/1461088502079275010,2021,11,17
17019,Champaign County,IL,Illinois,cu_publichealth,1,NA,Yes,Yes,0,NA,NA,NA,69265048,CUPHD also has an opening for a full-time Accountant I. Visit our website for details and to apply!  https://t.co/BHuzzNxc7V,11/24/2021,11:47:06,https://twitter.com/CU_PublicHealth/status/1463549750519775237,2021,11,24
17021,Christian County,IL,Illinois,NA,0,NA,NA,NA,1,NA,NA,NA,NA,NA,NA,NA,NA,NA,NA,NA
17023,Clark County,IL,Illinois,NA,0,NA,NA,NA,1,NA,NA,NA,NA,NA,NA,NA,NA,NA,NA,NA
17025,Clay County,IL,Illinois,NA,0,NA,NA,NA,0,NA,NA,NA,NA,NA,NA,NA,NA,NA,NA,NA
17027,Clinton County,IL,Illinois,NA,0,NA,NA,NA,1,NA,NA,NA,NA,NA,NA,NA,NA,NA,NA,NA
17029,Coles County,IL,Illinois,NA,0,NA,NA,NA,1,NA,NA,NA,NA,NA,NA,NA,NA,NA,NA,NA
17031,Cook County,IL,Illinois,cookcohealth,1,NA,Yes,Yes,0,NA,NA,NA,92586353,MIS-C (Multisystem inflammatory syndrome) is a rare but severe complication you can get after contracting COVID-19.  Learn more:  https://t.co/iWlejuZLlK  https://t.co/J9MdnNSZNk,11/24/2021,17:01:08,https://twitter.com/CookCoHealth/status/1463628777934757907,2021,11,24
17033,Crawford County,IL,Illinois,crawford_health,1,DoubleCheck,No,No,0,NA,NA,NA,NA,NA,NA,NA,NA,NA,NA,NA
17035,Cumberland County,IL,Illinois,NA,0,NA,NA,NA,0,NA,NA,NA,NA,NA,NA,NA,NA,NA,NA,NA
17037,DeKalb County,IL,Illinois,dekalbcohd,1,NA,Yes,Yes,0,NA,NA,NA,2563575072,We will be closed tomorrow and Friday in observance of Thanksgiving. Have a safe and happy holiday!  https://t.co/pZZCGf66YN,11/24/2021,13:02:12,https://twitter.com/DeKalbCoHD/status/1463568648187129870,2021,11,24
17039,De Witt County,IL,Illinois,NA,0,NA,NA,NA,1,NA,NA,NA,NA,NA,NA,NA,NA,NA,NA,NA
17041,Douglas County,IL,Illinois,douglascohealth,1,NA,Yes,Yes,0,NA,NA,NA,1284302058,"COVID-19 Update Wed., November 24, 2021 #DCHD 7 New COVID-19 Cases Today (5 Unvaccinated Cases) (2 Fully Vaccinated Cases)  #3572 Total Known COVID-19 Cases #46 Known COVID-19 Deaths #133 Active &amp; Close-Contact Cases Monitored Today  #douglascountyil_covid19_update  https://t.co/AiJ2KYciVs",11/24/2021,18:00:01,https://twitter.com/DOUGLASCOHEALTH/status/1463643597312434176,2021,11,24
17043,DuPage County,IL,Illinois,dupagehd,1,NA,Yes,Yes,0,NA,NA,NA,237460655,"Thanksgiving is tomorrow, have a safe and healthy day. Remember to cook your turkey thoroughly. Use a food thermometer to make sure the turkey has reached a safe internal temperature of 165°F. For more information, visit  https://t.co/vETvk273ae  https://t.co/gEvvpWc7Bs",11/24/2021,18:00:02,https://twitter.com/DuPageHD/status/1463643600915349505,2021,11,24
17045,Edgar County,IL,Illinois,NA,0,NA,NA,NA,0,NA,NA,NA,NA,NA,NA,NA,NA,NA,NA,NA
17047,Edwards County,IL,Illinois,NA,0,NA,NA,NA,1,NA,NA,NA,NA,NA,NA,NA,NA,NA,NA,NA
17049,Effingham County,IL,Illinois,NA,0,NA,NA,NA,1,NA,NA,NA,NA,NA,NA,NA,NA,NA,NA,NA
17051,Fayette County,IL,Illinois,NA,0,NA,NA,NA,1,NA,NA,NA,NA,NA,NA,NA,NA,NA,NA,NA
17053,Ford County,IL,Illinois,fcphd1,1,NA,Yes,No,0,NA,NA,NA,3041504216,"Vaccine Clinic PBL Jr High/High School Commons  700 W. Orleans St.  Paxton, IL 60957 Aug 12 (first dose) / Sept 2 (2nd dose) 5-7pm  https://t.co/zRCCF0blNo",8/6/2021,14:53:17,https://twitter.com/FCPHD1/status/1423718838529634310,2021,8,6
17055,Franklin County,IL,Illinois,NA,0,NA,NA,NA,0,NA,NA,NA,NA,NA,NA,NA,NA,NA,NA,NA
17057,Fulton County,IL,Illinois,NA,0,NA,NA,NA,0,NA,NA,NA,NA,NA,NA,NA,NA,NA,NA,NA
17059,Gallatin County,IL,Illinois,NA,0,NA,NA,NA,0,NA,NA,NA,NA,NA,NA,NA,NA,NA,NA,NA
17061,Greene County,IL,Illinois,gchdhealth,1,DoubleCheck,No,No,0,NA,Outdated-Add District,NA,NA,NA,NA,NA,NA,NA,NA,NA
17063,Grundy County,IL,Illinois,grundyhealth,1,DoubleCheck,No,No,0,NA,NA,NA,NA,NA,NA,NA,NA,NA,NA,NA
17065,Hamilton County,IL,Illinois,NA,0,NA,NA,NA,1,NA,NA,NA,NA,NA,NA,NA,NA,NA,NA,NA
17067,Hancock County,IL,Illinois,NA,0,NA,NA,NA,0,NA,NA,NA,NA,NA,NA,NA,NA,NA,NA,NA
17069,Hardin County,IL,Illinois,s7healthdept,1,NA,Yes,Yes,1,NA,NA,Southern Seven Health Department - lllinois,1.34E+18,"Vienna Head Start Early Learning Center reminded parents to enroll their child in Head Start during the Heritage Festival Parade in Vienna on October 2.  For more information about Head Start, call 618-634-2297 or visit  https://t.co/dvuealnaD0.  https://t.co/i1NCcb6XAy",10/7/2021,12:35:49,https://twitter.com/S7HealthDept/status/1446152294731554821,2021,10,7
17071,Henderson County,IL,Illinois,NA,0,NA,NA,NA,0,NA,NA,NA,NA,NA,NA,NA,NA,NA,NA,NA
17073,Henry County,IL,Illinois,NA,0,NA,NA,NA,0,NA,NA,NA,NA,NA,NA,NA,NA,NA,NA,NA
17075,Iroquois County,IL,Illinois,NA,0,NA,NA,NA,0,NA,NA,NA,NA,NA,NA,NA,NA,NA,NA,NA
17077,Jackson County,IL,Illinois,jchealthdept,1,NA,Yes,Yes,0,NA,NA,NA,778700372,"JCHD was notified today of 12 new cases of COVID-19.  98 active cases. 8,428 cases to date, with 109 related deaths. 8,221 individuals released from isolation, including 3 today.",11/24/2021,16:13:06,https://twitter.com/Jchealthdept/status/1463616690986569732,2021,11,24
17079,Jasper County,IL,Illinois,NA,0,NA,NA,NA,1,NA,NA,NA,NA,NA,NA,NA,NA,NA,NA,NA
17081,Jefferson County,IL,Illinois,NA,0,NA,NA,NA,0,NA,NA,NA,NA,NA,NA,NA,NA,NA,NA,NA
17083,Jersey County,IL,Illinois,NA,0,NA,NA,NA,1,NA,NA,NA,NA,NA,NA,NA,NA,NA,NA,NA
17085,Jo Daviess County,IL,Illinois,NA,0,NA,NA,NA,0,NA,NA,NA,NA,NA,NA,NA,NA,NA,NA,NA
17087,Johnson County,IL,Illinois,s7healthdept,1,NA,Yes,Yes,1,NA,NA,Southern Seven Health Department - lllinois,1.34E+18,"Vienna Head Start Early Learning Center reminded parents to enroll their child in Head Start during the Heritage Festival Parade in Vienna on October 2.  For more information about Head Start, call 618-634-2297 or visit  https://t.co/dvuealnaD0.  https://t.co/i1NCcb6XAy",10/7/2021,12:35:49,https://twitter.com/S7HealthDept/status/1446152294731554821,2021,10,7
17089,Kane County,IL,Illinois,kanecohealth,1,NA,Yes,Yes,0,NA,NA,NA,41399487,"The Kane County Health Department will be closed Thursday, November 25 and Friday, November 26 for Thanksgiving.  https://t.co/8A0DN4Mxos",11/23/2021,16:01:24,https://twitter.com/KaneCoHealth/status/1463251360263114763,2021,11,23
17091,Kankakee County,IL,Illinois,kankakeehealth,1,NA,Yes,No,0,NA,NA,NA,49353890,July is #JuvenileArthritis Awareness Month! Together we can #CureArthritis! Get involved today! #KidsGetArthritis  https://t.co/4CefYVfEfP,7/23/2021,10:37:58,https://twitter.com/kankakeehealth/status/1418581155905949696,2021,7,23
17093,Kendall County,IL,Illinois,kendallhealth,1,DoubleCheck,No,No,0,NA,NA,NA,NA,NA,NA,NA,NA,NA,NA,NA
17095,Knox County,IL,Illinois,kchd92,1,NA,Yes,Yes,0,NA,NA,NA,619370006,Handling poultry (chickens and turkey) incorrectly and undercooking it are the most common problems that lead to foodborne disease outbreaks linked to poultry. Follow these food safety tips for your holiday meal:  https://t.co/U8aTk6wdjp  https://t.co/npX5U3UUuw,11/23/2021,10:21:40,https://twitter.com/kchd92/status/1463165860865101829,2021,11,23
17097,Lake County,IL,Illinois,lakecohealth,1,NA,Yes,Yes,0,NA,NA,NA,18216165,"Mañana en la Clínica de Vacunas COVID-19 para niños de 5 a 11 años en la Escuela Intermedia Magee en Round Lake. La clínica estará abierta de 10 a. M. A 6 p. M. Las citas están disponibles en AllVax. Proteja a su familia contra el COVID-19 en esta temporada navideña, #vacúnese.  https://t.co/PWY3yIVgAU",11/20/2021,10:41:55,https://twitter.com/LakeCoHealth/status/1462083794459049986,2021,11,20
17099,LaSalle County,IL,Illinois,lasallecohealth,1,NA,Yes,Yes,0,NA,NA,NA,2303659783,Anyone in need of rapid antigen testing needs to call the Health Department to pre-register.,11/24/2021,16:06:18,https://twitter.com/LaSalleCoHealth/status/1463614979819687943,2021,11,24
17101,Lawrence County,IL,Illinois,NA,0,NA,NA,NA,0,NA,NA,NA,NA,NA,NA,NA,NA,NA,NA,NA
17103,Lee County,IL,Illinois,lchd_illinois,1,DoubleCheck,No,No,0,NA,Outdated-Add District,NA,NA,NA,NA,NA,NA,NA,NA,NA
17105,Livingston County,IL,Illinois,NA,0,NA,NA,NA,0,NA,NA,NA,NA,NA,NA,NA,NA,NA,NA,NA
17107,Logan County,IL,Illinois,NA,0,NA,NA,NA,1,NA,NA,NA,NA,NA,NA,NA,NA,NA,NA,NA
17109,McDonough County,IL,Illinois,NA,0,NA,NA,NA,1,NA,NA,NA,NA,NA,NA,NA,NA,NA,NA,NA
17111,McHenry County,IL,Illinois,mchenrycohealth,1,DoubleCheck,No,No,0,NA,NA,NA,NA,NA,NA,NA,NA,NA,NA,NA
17113,McLean County,IL,Illinois,mcleanhealth,1,NA,Yes,Yes,0,NA,NA,NA,121220163,https://t.co/9G7Bc6Oo7f,11/24/2021,18:00:01,https://twitter.com/McLeanHealth/status/1463643598151303171,2021,11,24
17115,Macon County,IL,Illinois,maconcountyhd,1,NA,No,No,0,NA,Outdated-Add District,NA,218994349,Check out  https://t.co/GXBUYkQCg5 for new #jobopenings #jobs #DecaturCityLimitless #publichealth,12/14/2016,10:29:45,https://twitter.com/Maconcountyhd/status/809057799808368640,2016,12,14
17117,Macoupin County,IL,Illinois,macoupinhealth,1,NA,Yes,No,0,NA,NA,NA,935381618,"If you have questions regarding COVID-19, call the hotline at 217-313-5078 or email your questions to mcphd@mcphd.net. If you are experiencing symptoms, contact your physician. If you do not have a primary physician, call 217-854-3692 and ask for the Public Health Nurse.  https://t.co/lpRI62Ajxz",3/16/2020,18:39:02,https://twitter.com/MacoupinHealth/status/1239682614002438145,2020,3,16
17119,Madison County,IL,Illinois,madisonchd,1,NA,Yes,Yes,0,NA,NA,NA,334230293,Additional Data Source Links: Data Dashboard:  https://t.co/4JtBrzgiWO Mobile Dashboard:  https://t.co/bMNM39nTW8 COVID Response Hub:  https://t.co/0S320LMAiF IDPH Vaccine Data:  https://t.co/1qFkEaEl5A IDPH COVID Data:  https://t.co/oHXT69uwwG CDC COVID Data:  https://t.co/6PoaGZ0erp,11/24/2021,16:47:02,https://twitter.com/MadisonCHD/status/1463625232552505349,2021,11,24
17121,Marion County,IL,Illinois,s7healthdept,1,NA,Yes,Yes,1,NA,NA,Southern Seven Health Department - lllinois,1.34E+18,"Vienna Head Start Early Learning Center reminded parents to enroll their child in Head Start during the Heritage Festival Parade in Vienna on October 2.  For more information about Head Start, call 618-634-2297 or visit  https://t.co/dvuealnaD0.  https://t.co/i1NCcb6XAy",10/7/2021,12:35:49,https://twitter.com/S7HealthDept/status/1446152294731554821,2021,10,7
17123,Marshall County,IL,Illinois,NA,0,NA,NA,NA,1,NA,NA,NA,NA,NA,NA,NA,NA,NA,NA,NA
17125,Mason County,IL,Illinois,NA,0,NA,NA,NA,1,NA,NA,NA,NA,NA,NA,NA,NA,NA,NA,NA
17127,Massac County,IL,Illinois,s7healthdept,1,NA,Yes,Yes,1,NA,NA,Southern Seven Health Department - lllinois,1.34E+18,"Vienna Head Start Early Learning Center reminded parents to enroll their child in Head Start during the Heritage Festival Parade in Vienna on October 2.  For more information about Head Start, call 618-634-2297 or visit  https://t.co/dvuealnaD0.  https://t.co/i1NCcb6XAy",10/7/2021,12:35:49,https://twitter.com/S7HealthDept/status/1446152294731554821,2021,10,7
17129,Menard County,IL,Illinois,NA,0,NA,NA,NA,0,NA,NA,NA,NA,NA,NA,NA,NA,NA,NA,NA
17131,Mercer County,IL,Illinois,NA,0,NA,NA,NA,0,NA,NA,NA,NA,NA,NA,NA,NA,NA,NA,NA
17133,Monroe County,IL,Illinois,NA,0,NA,NA,NA,1,NA,NA,NA,NA,NA,NA,NA,NA,NA,NA,NA
17135,Montgomery County,IL,Illinois,NA,0,NA,NA,NA,1,NA,NA,NA,NA,NA,NA,NA,NA,NA,NA,NA
17137,Morgan County,IL,Illinois,NA,0,NA,NA,NA,0,NA,NA,NA,NA,NA,NA,NA,NA,NA,NA,NA
17139,Moultrie County,IL,Illinois,NA,0,NA,NA,NA,1,NA,NA,NA,NA,NA,NA,NA,NA,NA,NA,NA
17141,Ogle County,IL,Illinois,oglecountyhd,1,DoubleCheck,No,No,0,NA,NA,NA,NA,NA,NA,NA,NA,NA,NA,NA
17143,Peoria County,IL,Illinois,peoriaprepare,1,DoubleCheck,No,No,0,NA,Outdated-Add District,NA,NA,NA,NA,NA,NA,NA,NA,NA
17145,Perry County,IL,Illinois,pchd_illinois,1,NA,Yes,No,0,NA,NA,NA,1.14E+18,"Responding to the #2020Census is our civic duty and affects the allocation of funding for our community’s public resources, how we plan for the future, and our voice in government. To learn more, visit  https://t.co/uUybKpKAWA.  https://t.co/7ewWxY1bNU",3/30/2020,14:10:50,https://twitter.com/PCHD_Illinois/status/1244688553466122241,2020,3,30
17147,Piatt County,IL,Illinois,NA,0,NA,NA,NA,1,NA,NA,NA,NA,NA,NA,NA,NA,NA,NA,NA
17149,Pike County,IL,Illinois,NA,0,NA,NA,NA,0,NA,NA,NA,NA,NA,NA,NA,NA,NA,NA,NA
17151,Pope County,IL,Illinois,s7healthdept,1,NA,Yes,Yes,1,NA,NA,Southern Seven Health Department - lllinois,1.34E+18,"Vienna Head Start Early Learning Center reminded parents to enroll their child in Head Start during the Heritage Festival Parade in Vienna on October 2.  For more information about Head Start, call 618-634-2297 or visit  https://t.co/dvuealnaD0.  https://t.co/i1NCcb6XAy",10/7/2021,12:35:49,https://twitter.com/S7HealthDept/status/1446152294731554821,2021,10,7
17153,Pulaski County,IL,Illinois,s7healthdept,1,NA,Yes,Yes,1,NA,NA,Southern Seven Health Department - lllinois,1.34E+18,"Vienna Head Start Early Learning Center reminded parents to enroll their child in Head Start during the Heritage Festival Parade in Vienna on October 2.  For more information about Head Start, call 618-634-2297 or visit  https://t.co/dvuealnaD0.  https://t.co/i1NCcb6XAy",10/7/2021,12:35:49,https://twitter.com/S7HealthDept/status/1446152294731554821,2021,10,7
17155,Putnam County,IL,Illinois,NA,0,NA,NA,NA,1,NA,NA,NA,NA,NA,NA,NA,NA,NA,NA,NA
17157,Randolph County,IL,Illinois,NA,0,NA,NA,NA,0,NA,NA,NA,NA,NA,NA,NA,NA,NA,NA,NA
17159,Richland County,IL,Illinois,NA,0,NA,NA,NA,0,NA,NA,NA,NA,NA,NA,NA,NA,NA,NA,NA
17161,Rock Island County,IL,Illinois,rico_healthdept,1,NA,Yes,No,0,NA,NA,NA,1944877686,EVERYONE is susceptible to COVID-19. People of all ages should continue to wear masks and social distance when in public.  https://t.co/ab24ZRp1wh,7/15/2020,16:57:55,https://twitter.com/RICO_HealthDept/status/1283506100218793986,2020,7,15
17163,St. Clair County,IL,Illinois,stclairhealth,1,NA,Yes,Yes,0,NA,NA,NA,1548217442,Today's St. Clair County Health Department's #COVID19 update....  COVID Transmission rate is at HIGH in St. Clair County.  Tune at 3:30 pm every Wednesday for St. Clair County's WEEKLY #COVID19 update on Facebook live @stclaircoilema  #SCCHD #TeamStClair #AllInIllinoisnois  https://t.co/93h9nbcAbc,11/24/2021,14:45:02,https://twitter.com/stclairhealth/status/1463594528900792324,2021,11,24
17165,Saline County,IL,Illinois,NA,0,NA,NA,NA,0,NA,NA,NA,NA,NA,NA,NA,NA,NA,NA,NA
17167,Sangamon County,IL,Illinois,NA,0,NA,NA,NA,1,NA,NA,NA,NA,NA,NA,NA,NA,NA,NA,NA
17169,Schuyler County,IL,Illinois,NA,0,NA,NA,NA,0,NA,NA,NA,NA,NA,NA,NA,NA,NA,NA,NA
17171,Scott County,IL,Illinois,NA,0,NA,NA,NA,0,NA,NA,NA,NA,NA,NA,NA,NA,NA,NA,NA
17173,Shelby County,IL,Illinois,NA,0,NA,NA,NA,0,NA,NA,NA,NA,NA,NA,NA,NA,NA,NA,NA
17175,Stark County,IL,Illinois,NA,0,NA,NA,NA,1,NA,NA,NA,NA,NA,NA,NA,NA,NA,NA,NA
17177,Stephenson County,IL,Illinois,NA,0,NA,NA,NA,0,NA,NA,NA,NA,NA,NA,NA,NA,NA,NA,NA
17179,Tazewell County,IL,Illinois,NA,0,NA,NA,NA,1,NA,NA,NA,NA,NA,NA,NA,NA,NA,NA,NA
17181,Union County,IL,Illinois,s7healthdept,1,NA,Yes,Yes,1,NA,NA,Southern Seven Health Department - lllinois,1.34E+18,"Vienna Head Start Early Learning Center reminded parents to enroll their child in Head Start during the Heritage Festival Parade in Vienna on October 2.  For more information about Head Start, call 618-634-2297 or visit  https://t.co/dvuealnaD0.  https://t.co/i1NCcb6XAy",10/7/2021,12:35:49,https://twitter.com/S7HealthDept/status/1446152294731554821,2021,10,7
17183,Vermilion County,IL,Illinois,NA,0,NA,NA,NA,1,NA,NA,NA,NA,NA,NA,NA,NA,NA,NA,NA
17185,Wabash County,IL,Illinois,NA,0,NA,NA,NA,1,NA,NA,NA,NA,NA,NA,NA,NA,NA,NA,NA
17187,Warren County,IL,Illinois,NA,0,NA,NA,NA,0,NA,NA,NA,NA,NA,NA,NA,NA,NA,NA,NA
17189,Washington County,IL,Illinois,NA,0,NA,NA,NA,0,NA,NA,NA,NA,NA,NA,NA,NA,NA,NA,NA
17191,Wayne County,IL,Illinois,NA,0,NA,NA,NA,1,NA,NA,NA,NA,NA,NA,NA,NA,NA,NA,NA
17193,White County,IL,Illinois,NA,0,NA,NA,NA,0,NA,NA,NA,NA,NA,NA,NA,NA,NA,NA,NA
17195,Whiteside County,IL,Illinois,whiteside_chc,1,NA,Yes,Yes,0,NA,NA,NA,3075547853,The Health Department is well be closed 11/24 and 11/25 in observance of Thanksgiving. We will reopen Monday 11/29.  https://t.co/Vj0SVoYIA7,11/24/2021,18:00:54,https://twitter.com/Whiteside_CHC/status/1463643821347065863,2021,11,24
17197,Will County,IL,Illinois,willcohealth,1,NA,Yes,Yes,0,NA,NA,NA,78036806,Call 815-774-6090 to speak with a certified application counselor about how to enroll for public or private insurance today!  https://t.co/auIUFtUGU2,11/24/2021,9:52:00,https://twitter.com/WillCoHealth/status/1463520783091781634,2021,11,24
17199,Williamson County,IL,Illinois,NA,0,NA,NA,NA,0,NA,NA,NA,NA,NA,NA,NA,NA,NA,NA,NA
17201,Winnebago County,IL,Illinois,winncohealth,1,NA,Yes,Yes,0,NA,NA,NA,62867016,"Use a food thermometer to make sure meat reaches a temp high enough to kill germs: - 160°F - ground meats, like beef &amp; pork - 165°F - all poultry, including ground chicken &amp; turkey - 145°F - whole cuts of beef, pork, veal, &amp; lamb (let rest for 3 min. before carving or eating)  https://t.co/A4GoZEIR1t",11/24/2021,17:00:01,https://twitter.com/WinnCoHealth/status/1463628497276919812,2021,11,24
17203,Woodford County,IL,Illinois,woodfordhealth,1,NA,No,No,0,NA,Outdated-Add District,NA,7.54E+17,"It's the 25th anniversary of National Infant Immunization week. WCHD is here to help keep your children healthy, and our nurses are available to answer all your vaccine questions.  “I love coming to the health department for my...  https://t.co/Qmp2B4aYdq",4/29/2019,11:14:34,https://twitter.com/WoodfordHealth/status/1122881870562254854,2019,4,29
18001,Adams County,IN,Indiana,NA,0,NA,NA,NA,0,NA,DoubleCheck,NA,NA,NA,NA,NA,NA,NA,NA,NA
18003,Allen County,IN,Indiana,allencountyhd,1,NA,Yes,Yes,1,NA,NA,NA,1307941514,"Our offices – including the COVID-19 vaccination site at the Coliseum and the testing site, 5750 Falls Drive – will be closed tomorrow (Thanksgiving) and Friday. Offices will reopen on Monday.   Enjoy a safe and healthy Turkey Day!",11/24/2021,12:05:06,https://twitter.com/AllenCountyHD/status/1463554278119903234,2021,11,24
18005,Bartholomew County,IN,Indiana,NA,0,NA,NA,NA,1,NA,NA,NA,NA,NA,NA,NA,NA,NA,NA,NA
18007,Benton County,IN,Indiana,NA,0,NA,NA,NA,1,NA,NA,NA,NA,NA,NA,NA,NA,NA,NA,NA
18009,Blackford County,IN,Indiana,NA,0,NA,NA,NA,1,NA,NA,NA,NA,NA,NA,NA,NA,NA,NA,NA
18011,Boone County,IN,Indiana,NA,0,NA,NA,NA,1,NA,NA,NA,NA,NA,NA,NA,NA,NA,NA,NA
18013,Brown County,IN,Indiana,NA,0,NA,NA,NA,1,NA,NA,NA,NA,NA,NA,NA,NA,NA,NA,NA
18015,Carroll County,IN,Indiana,NA,0,NA,NA,NA,0,NA,DoubleCheck,NA,NA,NA,NA,NA,NA,NA,NA,NA
18017,Cass County,IN,Indiana,NA,0,NA,NA,NA,0,NA,DoubleCheck,NA,NA,NA,NA,NA,NA,NA,NA,NA
18019,Clark County,IN,Indiana,clark_dept,1,NA,Yes,Yes,1,NA,NA,NA,1.04E+18,https://t.co/I7EBxcMxQT,11/22/2021,10:30:48,https://twitter.com/clark_dept/status/1462805772413382670,2021,11,22
18021,Clay County,IN,Indiana,NA,0,NA,NA,NA,0,NA,DoubleCheck,NA,NA,NA,NA,NA,NA,NA,NA,NA
18023,Clinton County,IN,Indiana,NA,0,NA,NA,NA,1,NA,NA,NA,NA,NA,NA,NA,NA,NA,NA,NA
18025,Crawford County,IN,Indiana,NA,0,NA,NA,NA,0,NA,DoubleCheck,NA,NA,NA,NA,NA,NA,NA,NA,NA
18027,Daviess County,IN,Indiana,NA,0,NA,NA,NA,1,NA,NA,NA,NA,NA,NA,NA,NA,NA,NA,NA
18029,Dearborn County,IN,Indiana,NA,0,NA,NA,NA,1,NA,NA,NA,NA,NA,NA,NA,NA,NA,NA,NA
18031,Decatur County,IN,Indiana,NA,0,NA,NA,NA,0,NA,DoubleCheck,NA,NA,NA,NA,NA,NA,NA,NA,NA
18033,DeKalb County,IN,Indiana,NA,0,NA,NA,NA,0,NA,DoubleCheck,NA,NA,NA,NA,NA,NA,NA,NA,NA
18035,Delaware County,IN,Indiana,NA,0,NA,NA,NA,1,NA,NA,NA,NA,NA,NA,NA,NA,NA,NA,NA
18037,Dubois County,IN,Indiana,NA,0,NA,NA,NA,1,NA,NA,NA,NA,NA,NA,NA,NA,NA,NA,NA
18039,Elkhart County,IN,Indiana,NA,0,NA,NA,NA,0,NA,DoubleCheck,NA,NA,NA,NA,NA,NA,NA,NA,NA
18041,Fayette County,IN,Indiana,NA,0,NA,NA,NA,1,NA,NA,NA,NA,NA,NA,NA,NA,NA,NA,NA
18043,Floyd County,IN,Indiana,floydcountyhd,1,DoubleCheck,No,No,1,NA,NA,NA,NA,NA,NA,NA,NA,NA,NA,NA
18045,Fountain County,IN,Indiana,NA,0,NA,NA,NA,1,NA,NA,NA,NA,NA,NA,NA,NA,NA,NA,NA
18047,Franklin County,IN,Indiana,NA,0,NA,NA,NA,0,NA,DoubleCheck,NA,NA,NA,NA,NA,NA,NA,NA,NA
18049,Fulton County,IN,Indiana,NA,0,NA,NA,NA,0,NA,DoubleCheck,NA,NA,NA,NA,NA,NA,NA,NA,NA
18051,Gibson County,IN,Indiana,NA,0,NA,NA,NA,0,NA,DoubleCheck,NA,NA,NA,NA,NA,NA,NA,NA,NA
18053,Grant County,IN,Indiana,NA,0,NA,NA,NA,1,NA,NA,NA,NA,NA,NA,NA,NA,NA,NA,NA
18055,Greene County,IN,Indiana,NA,0,NA,NA,NA,1,NA,NA,NA,NA,NA,NA,NA,NA,NA,NA,NA
18057,Hamilton County,IN,Indiana,NA,0,NA,NA,NA,1,NA,NA,NA,NA,NA,NA,NA,NA,NA,NA,NA
18059,Hancock County,IN,Indiana,NA,0,NA,NA,NA,1,NA,NA,NA,NA,NA,NA,NA,NA,NA,NA,NA
18061,Harrison County,IN,Indiana,NA,0,NA,NA,NA,1,NA,NA,NA,NA,NA,NA,NA,NA,NA,NA,NA
18063,Hendricks County,IN,Indiana,hendricks_co,1,NA,Yes,Yes,1,NA,NA,NA,19712033,"Let’s talk turkey! Unsafe handling and under-cooking your holiday bird can cause foodborne illnesses. Here are a few tips from the USDA to keep your Thanksgiving safe and delicious! For more information, visit:  https://t.co/3GNlUwP7zZ #FoodSafe @USDAFoodSafety  https://t.co/JRn0wUaT57",11/24/2021,14:26:50,https://twitter.com/Hendricks_Co/status/1463589948330807305,2021,11,24
18065,Henry County,IN,Indiana,henry_health,1,DoubleCheck,No,No,1,NA,NA,NA,NA,NA,NA,NA,NA,NA,NA,NA
18067,Howard County,IN,Indiana,NA,0,NA,NA,NA,1,NA,NA,NA,NA,NA,NA,NA,NA,NA,NA,NA
18069,Huntington County,IN,Indiana,NA,0,NA,NA,NA,1,NA,NA,NA,NA,NA,NA,NA,NA,NA,NA,NA
18071,Jackson County,IN,Indiana,NA,0,NA,NA,NA,1,NA,NA,NA,NA,NA,NA,NA,NA,NA,NA,NA
18073,Jasper County,IN,Indiana,NA,0,NA,NA,NA,1,NA,NA,NA,NA,NA,NA,NA,NA,NA,NA,NA
18075,Jay County,IN,Indiana,NA,0,NA,NA,NA,1,NA,NA,NA,NA,NA,NA,NA,NA,NA,NA,NA
18077,Jefferson County,IN,Indiana,NA,0,NA,NA,NA,1,NA,NA,NA,NA,NA,NA,NA,NA,NA,NA,NA
18079,Jennings County,IN,Indiana,NA,0,NA,NA,NA,0,NA,DoubleCheck,NA,NA,NA,NA,NA,NA,NA,NA,NA
18081,Johnson County,IN,Indiana,NA,0,NA,NA,NA,1,NA,NA,NA,NA,NA,NA,NA,NA,NA,NA,NA
18083,Knox County,IN,Indiana,NA,0,NA,NA,NA,0,NA,DoubleCheck,NA,NA,NA,NA,NA,NA,NA,NA,NA
18085,Kosciusko County,IN,Indiana,NA,0,NA,NA,NA,1,NA,NA,NA,NA,NA,NA,NA,NA,NA,NA,NA
18087,LaGrange County,IN,Indiana,NA,0,NA,NA,NA,1,NA,NA,NA,NA,NA,NA,NA,NA,NA,NA,NA
18089,Lake County,IN,Indiana,NA,0,NA,NA,NA,1,NA,NA,NA,NA,NA,NA,NA,NA,NA,NA,NA
18091,LaPorte County,IN,Indiana,NA,0,NA,NA,NA,1,NA,NA,NA,NA,NA,NA,NA,NA,NA,NA,NA
18093,Lawrence County,IN,Indiana,NA,0,NA,NA,NA,1,NA,NA,NA,NA,NA,NA,NA,NA,NA,NA,NA
18095,Madison County,IN,Indiana,NA,0,NA,NA,NA,1,NA,NA,NA,NA,NA,NA,NA,NA,NA,NA,NA
18097,Marion County,IN,Indiana,marion_health,1,NA,Yes,Yes,1,NA,NA,NA,2153136751,"MCPHD is closed Thu, Nov. 25 &amp; Fri, Nov. 26 for Thanksgiving, including COVID-19 testing and vaccine sites. On Wed, Nov. 24, COVID-19 testing at 3838 N. Rural St. is 10am-2pm, the vaccine clinic on Commercial Dr. is closed, and vaccine sites @indylibrary locations by appt. only.  https://t.co/fUQPBPhDAD",11/23/2021,15:36:38,https://twitter.com/Marion_Health/status/1463245126151684100,2021,11,23
18099,Marshall County,IN,Indiana,NA,0,NA,NA,NA,1,NA,NA,NA,NA,NA,NA,NA,NA,NA,NA,NA
18101,Martin County,IN,Indiana,NA,0,NA,NA,NA,1,NA,NA,NA,NA,NA,NA,NA,NA,NA,NA,NA
18103,Miami County,IN,Indiana,NA,0,NA,NA,NA,1,NA,NA,NA,NA,NA,NA,NA,NA,NA,NA,NA
18105,Monroe County,IN,Indiana,monroecountyhea,1,NA,Yes,Yes,1,NA,NA,NA,361237198,"Mask-Wearing Cuts New COVID-19 Cases by 53%, Study Says  https://t.co/C8f6FslF8h via @medscape",11/24/2021,8:38:11,https://twitter.com/MonroeCountyHea/status/1463502207396061186,2021,11,24
18107,Montgomery County,IN,Indiana,montcohealthdep,1,NA,Yes,Yes,1,NA,NA,NA,1580876149,This is the final week of American Diabetes Month. We will be discussing how to raise awareness for people who are living with diabetes. Ways to spread awareness include utilizing social media and getting involved in events. Visit  https://t.co/dzWjrfs4Ts for more information.  https://t.co/ISupQ6FDl1,11/24/2021,10:02:11,https://twitter.com/MontCoHealthDep/status/1463523347652829184,2021,11,24
18109,Morgan County,IN,Indiana,morgancountyhd,1,DoubleCheck,No,No,1,NA,NA,NA,NA,NA,NA,NA,NA,NA,NA,NA
18111,Newton County,IN,Indiana,NA,0,NA,NA,NA,0,NA,DoubleCheck,NA,NA,NA,NA,NA,NA,NA,NA,NA
18113,Noble County,IN,Indiana,NA,0,NA,NA,NA,1,NA,NA,NA,NA,NA,NA,NA,NA,NA,NA,NA
18115,Ohio County,IN,Indiana,NA,0,NA,NA,NA,1,NA,NA,NA,NA,NA,NA,NA,NA,NA,NA,NA
18117,Orange County,IN,Indiana,NA,0,NA,NA,NA,1,NA,NA,NA,NA,NA,NA,NA,NA,NA,NA,NA
18119,Owen County,IN,Indiana,NA,0,NA,NA,NA,1,NA,NA,NA,NA,NA,NA,NA,NA,NA,NA,NA
18121,Parke County,IN,Indiana,parkehealthdept,1,DoubleCheck,No,No,1,NA,NA,NA,NA,NA,NA,NA,NA,NA,NA,NA
18123,Perry County,IN,Indiana,NA,0,NA,NA,NA,1,NA,NA,NA,NA,NA,NA,NA,NA,NA,NA,NA
18125,Pike County,IN,Indiana,NA,0,NA,NA,NA,1,NA,NA,NA,NA,NA,NA,NA,NA,NA,NA,NA
18127,Porter County,IN,Indiana,county_porter,1,NA,Yes,Yes,1,NA,NA,NA,1.41E+18,Covid vaccines are provided by the PCHD-Valpo from (9 a.m. – 4 p.m.) T/W/TH/F with late hours on Tuesday and Thursday from (4:30 p.m. – 6:45 p.m.).  For appointments please go to:  https://t.co/l3IGnIkRM0 or call (219) 465-3525.  Walk-ins are welcome.  https://t.co/IXrXLbT01B,11/23/2021,14:26:17,https://twitter.com/county_porter/status/1463227423114342410,2021,11,23
18129,Posey County,IN,Indiana,NA,0,NA,NA,NA,0,NA,DoubleCheck,NA,NA,NA,NA,NA,NA,NA,NA,NA
18131,Pulaski County,IN,Indiana,NA,0,NA,NA,NA,1,NA,NA,NA,NA,NA,NA,NA,NA,NA,NA,NA
18133,Putnam County,IN,Indiana,NA,0,NA,NA,NA,1,NA,NA,NA,NA,NA,NA,NA,NA,NA,NA,NA
18135,Randolph County,IN,Indiana,NA,0,NA,NA,NA,1,NA,NA,NA,NA,NA,NA,NA,NA,NA,NA,NA
18137,Ripley County,IN,Indiana,NA,0,NA,NA,NA,0,NA,DoubleCheck,NA,NA,NA,NA,NA,NA,NA,NA,NA
18139,Rush County,IN,Indiana,NA,0,NA,NA,NA,1,NA,NA,NA,NA,NA,NA,NA,NA,NA,NA,NA
18141,St. Joseph County,IN,Indiana,sjchealth,1,NA,Yes,Yes,0,NA,DoubleCheck,NA,4218983362,"The SJC Department of Health COVID-19 Vaccine clinic will have extended hours TOMORROW, SATURDAY, NOVEMBER 6, 2021 from 8:30 a.m. - 3:20 p.m. No appointment is necessary- Walk-ins accepted!  https://t.co/1J1ivTSjvk",11/5/2021,10:25:42,https://twitter.com/sjchealth/status/1456628796434624517,2021,11,5
18143,Scott County,IN,Indiana,NA,0,NA,NA,NA,1,NA,NA,NA,NA,NA,NA,NA,NA,NA,NA,NA
18145,Shelby County,IN,Indiana,NA,0,NA,NA,NA,0,NA,DoubleCheck,NA,NA,NA,NA,NA,NA,NA,NA,NA
18147,Spencer County,IN,Indiana,NA,0,NA,NA,NA,0,NA,DoubleCheck,NA,NA,NA,NA,NA,NA,NA,NA,NA
18149,Starke County,IN,Indiana,NA,0,NA,NA,NA,0,NA,DoubleCheck,NA,NA,NA,NA,NA,NA,NA,NA,NA
18151,Steuben County,IN,Indiana,NA,0,NA,NA,NA,0,NA,DoubleCheck,NA,NA,NA,NA,NA,NA,NA,NA,NA
18153,Sullivan County,IN,Indiana,NA,0,NA,NA,NA,0,NA,DoubleCheck,NA,NA,NA,NA,NA,NA,NA,NA,NA
18155,Switzerland County,IN,Indiana,NA,0,NA,NA,NA,0,NA,DoubleCheck,NA,NA,NA,NA,NA,NA,NA,NA,NA
18157,Tippecanoe County,IN,Indiana,tippeinhealth,1,DoubleCheck,No,No,1,NA,NA,NA,NA,NA,NA,NA,NA,NA,NA,NA
18159,Tipton County,IN,Indiana,tiptoncohd,1,DoubleCheck,No,No,1,NA,NA,NA,NA,NA,NA,NA,NA,NA,NA,NA
18161,Union County,IN,Indiana,NA,0,NA,NA,NA,1,NA,NA,NA,NA,NA,NA,NA,NA,NA,NA,NA
18163,Vanderburgh County,IN,Indiana,vchdevv,1,DoubleCheck,No,No,1,NA,NA,NA,NA,NA,NA,NA,NA,NA,NA,NA
18165,Vermillion County,IN,Indiana,NA,0,NA,NA,NA,0,NA,DoubleCheck,NA,NA,NA,NA,NA,NA,NA,NA,NA
18167,Vigo County,IN,Indiana,vigohealthdept,1,DoubleCheck,No,No,1,NA,NA,NA,NA,NA,NA,NA,NA,NA,NA,NA
18169,Wabash County,IN,Indiana,NA,0,NA,NA,NA,0,NA,DoubleCheck,NA,NA,NA,NA,NA,NA,NA,NA,NA
18171,Warren County,IN,Indiana,NA,0,NA,NA,NA,1,NA,NA,NA,NA,NA,NA,NA,NA,NA,NA,NA
18173,Warrick County,IN,Indiana,NA,0,NA,NA,NA,0,NA,DoubleCheck,NA,NA,NA,NA,NA,NA,NA,NA,NA
18175,Washington County,IN,Indiana,NA,0,NA,NA,NA,1,NA,NA,NA,NA,NA,NA,NA,NA,NA,NA,NA
18177,Wayne County,IN,Indiana,waynecohd,1,DoubleCheck,No,No,0,NA,DoubleCheck,NA,NA,NA,NA,NA,NA,NA,NA,NA
18179,Wells County,IN,Indiana,NA,0,NA,NA,NA,0,NA,DoubleCheck,NA,NA,NA,NA,NA,NA,NA,NA,NA
18181,White County,IN,Indiana,NA,0,NA,NA,NA,1,NA,NA,NA,NA,NA,NA,NA,NA,NA,NA,NA
18183,Whitley County,IN,Indiana,NA,0,NA,NA,NA,1,NA,NA,NA,NA,NA,NA,NA,NA,NA,NA,NA
19001,Adair County,IA,Iowa,NA,0,NA,NA,NA,0,NA,DoubleCheck,NA,NA,NA,NA,NA,NA,NA,NA,NA
19003,Adams County,IA,Iowa,NA,0,NA,NA,NA,1,NA,NA,NA,NA,NA,NA,NA,NA,NA,NA,NA
19005,Allamakee County,IA,Iowa,NA,0,NA,NA,NA,0,NA,DoubleCheck,NA,NA,NA,NA,NA,NA,NA,NA,NA
19007,Appanoose County,IA,Iowa,NA,0,NA,NA,NA,1,NA,NA,NA,NA,NA,NA,NA,NA,NA,NA,NA
19009,Audubon County,IA,Iowa,NA,0,NA,NA,NA,0,NA,DoubleCheck,NA,NA,NA,NA,NA,NA,NA,NA,NA
19011,Benton County,IA,Iowa,NA,0,NA,NA,NA,1,NA,NA,NA,NA,NA,NA,NA,NA,NA,NA,NA
19013,Black Hawk County,IA,Iowa,bhchd,1,NA,Yes,Yes,1,NA,NA,NA,36470808,"11/24/2021 COVID-19 Update – 65 new positive cases since yesterday. 154 new recoveries and 7 new deaths since last reported 11/17/21. @BHCHD will be closed for the upcoming holiday. The next COVID-19 numbers update will be posted Monday, 11/29. #dailynumbers  https://t.co/m7jAPZPOIv",11/24/2021,14:55:58,https://twitter.com/BHCHD/status/1463597279286333442,2021,11,24
19015,Boone County,IA,Iowa,NA,0,NA,NA,NA,0,NA,DoubleCheck,NA,NA,NA,NA,NA,NA,NA,NA,NA
19017,Bremer County,IA,Iowa,NA,0,NA,NA,NA,1,NA,NA,NA,NA,NA,NA,NA,NA,NA,NA,NA
19019,Buchanan County,IA,Iowa,NA,0,NA,NA,NA,0,NA,DoubleCheck,NA,NA,NA,NA,NA,NA,NA,NA,NA
19021,Buena Vista County,IA,Iowa,bvpublichealth,1,NA,Yes,Yes,1,NA,NA,NA,1.40E+18,Anyone that was diagnosed with COVID and received monoclonal antibody treatment should wait 90 days for vaccination.  https://t.co/3s3JqdF0zt,11/24/2021,11:29:03,https://twitter.com/BVPublicHealth/status/1463545206163353613,2021,11,24
19023,Butler County,IA,Iowa,NA,0,NA,NA,NA,1,NA,NA,NA,NA,NA,NA,NA,NA,NA,NA,NA
19025,Calhoun County,IA,Iowa,NA,0,NA,NA,NA,1,NA,NA,NA,NA,NA,NA,NA,NA,NA,NA,NA
19027,Carroll County,IA,Iowa,ccphiowa,1,DoubleCheck,No,No,0,NA,DoubleCheck,NA,NA,NA,NA,NA,NA,NA,NA,NA
19029,Cass County,IA,Iowa,casshealth,1,NA,Yes,Yes,0,NA,DoubleCheck,NA,2928120874,"Happy Thanksgiving! 🦃The Atlantic Medical Center, all Satellite Clinics, and AMC Rapid Care will be closed on Thanksgiving Day. 🍂 Atlantic Medical Center and AMC Rapid Care will resume normal hours Nov 26th.   🦃The Massena Medical Center will remain closed on Nov 26th.  https://t.co/jzw4ECzqT4",11/24/2021,13:02:15,https://twitter.com/CassHealth/status/1463568662435180545,2021,11,24
19031,Cedar County,IA,Iowa,NA,0,NA,NA,NA,0,NA,DoubleCheck,NA,NA,NA,NA,NA,NA,NA,NA,NA
19033,Cerro Gordo County,IA,Iowa,cgpublichealth,1,NA,Yes,Yes,1,NA,NA,NA,32466144,"In observance of the holiday our office will be closed Thursday, November 25th and Friday, November 26th.  https://t.co/0Ubq1xBz6X",11/24/2021,12:02:42,https://twitter.com/CGPublicHealth/status/1463553674224050188,2021,11,24
19035,Cherokee County,IA,Iowa,NA,0,NA,NA,NA,1,NA,NA,NA,NA,NA,NA,NA,NA,NA,NA,NA
19037,Chickasaw County,IA,Iowa,NA,0,NA,NA,NA,0,NA,DoubleCheck,NA,NA,NA,NA,NA,NA,NA,NA,NA
19039,Clarke County,IA,Iowa,NA,0,NA,NA,NA,1,NA,NA,NA,NA,NA,NA,NA,NA,NA,NA,NA
19041,Clay County,IA,Iowa,NA,0,NA,NA,NA,1,NA,NA,NA,NA,NA,NA,NA,NA,NA,NA,NA
19043,Clayton County,IA,Iowa,NA,0,NA,NA,NA,0,NA,DoubleCheck,NA,NA,NA,NA,NA,NA,NA,NA,NA
19045,Clinton County,IA,Iowa,NA,0,NA,NA,NA,1,NA,NA,NA,NA,NA,NA,NA,NA,NA,NA,NA
19047,Crawford County,IA,Iowa,crawfordpublic,1,DoubleCheck,No,No,0,NA,DoubleCheck,NA,NA,NA,NA,NA,NA,NA,NA,NA
19049,Dallas County,IA,Iowa,dallascohealth,1,NA,Yes,Yes,1,NA,NA,NA,1.07E+18,COVID-19 prevention is layered strategy. Risk is reduced with each added layer.  Help us prevent COVID-19 cases this holiday season by following these tips: • Wear your mask • Watch your distance • Wash your hands • Stay home when feeling sick • Get vaccinated • Get tested  https://t.co/hJfddSnNgm,11/24/2021,15:00:55,https://twitter.com/DallasCoHealth/status/1463598524533248003,2021,11,24
19051,Davis County,IA,Iowa,NA,0,NA,NA,NA,1,NA,NA,NA,NA,NA,NA,NA,NA,NA,NA,NA
19053,Decatur County,IA,Iowa,NA,0,NA,NA,NA,0,NA,DoubleCheck,NA,NA,NA,NA,NA,NA,NA,NA,NA
19055,Delaware County,IA,Iowa,NA,0,NA,NA,NA,1,NA,NA,NA,NA,NA,NA,NA,NA,NA,NA,NA
19057,Des Moines County,IA,Iowa,NA,0,NA,NA,NA,0,NA,DoubleCheck,NA,NA,NA,NA,NA,NA,NA,NA,NA
19059,Dickinson County,IA,Iowa,NA,0,NA,NA,NA,0,NA,DoubleCheck,NA,NA,NA,NA,NA,NA,NA,NA,NA
19061,Dubuque County,IA,Iowa,NA,0,NA,NA,NA,1,NA,NA,NA,NA,NA,NA,NA,NA,NA,NA,NA
19063,Emmet County,IA,Iowa,NA,0,NA,NA,NA,0,NA,DoubleCheck,NA,NA,NA,NA,NA,NA,NA,NA,NA
19065,Fayette County,IA,Iowa,NA,0,NA,NA,NA,0,NA,DoubleCheck,NA,NA,NA,NA,NA,NA,NA,NA,NA
19067,Floyd County,IA,Iowa,NA,0,NA,NA,NA,1,NA,NA,NA,NA,NA,NA,NA,NA,NA,NA,NA
19069,Franklin County,IA,Iowa,NA,0,NA,NA,NA,1,NA,NA,NA,NA,NA,NA,NA,NA,NA,NA,NA
19071,Fremont County,IA,Iowa,NA,0,NA,NA,NA,1,NA,NA,NA,NA,NA,NA,NA,NA,NA,NA,NA
19073,Greene County,IA,Iowa,NA,0,NA,NA,NA,1,NA,NA,NA,NA,NA,NA,NA,NA,NA,NA,NA
19075,Grundy County,IA,Iowa,grundycountyph,1,NA,Yes,Yes,1,NA,NA,NA,2983175282,"The @GrundyCountyPH office will be closed Thursday, 11/25, and Friday, 11/26, in observance of Thanksgiving. We will reopen Monday, 11/26. We wish you a safe, healthy, and happy holiday!  https://t.co/NtDxUXfGjm",11/24/2021,10:08:37,https://twitter.com/GrundyCountyPH/status/1463524965739900934,2021,11,24
19077,Guthrie County,IA,Iowa,NA,0,NA,NA,NA,0,NA,DoubleCheck,NA,NA,NA,NA,NA,NA,NA,NA,NA
19079,Hamilton County,IA,Iowa,NA,0,NA,NA,NA,1,NA,NA,NA,NA,NA,NA,NA,NA,NA,NA,NA
19081,Hancock County,IA,Iowa,NA,0,NA,NA,NA,0,NA,DoubleCheck,NA,NA,NA,NA,NA,NA,NA,NA,NA
19083,Hardin County,IA,Iowa,NA,0,NA,NA,NA,0,NA,DoubleCheck,NA,NA,NA,NA,NA,NA,NA,NA,NA
19085,Harrison County,IA,Iowa,hchph,1,NA,No,No,0,NA,Outdated-Add District,NA,1728933726,"February isn't just about Valentine's Day, you can show your support for Women't heart health by wearing red on Friday February 7th. You can also learn the signs and symptoms, as well as preventative care, of heart disease.   https://t.co/ZR0VUpurfF",2/6/2020,10:09:35,https://twitter.com/HCHPH/status/1225436382572797954,2020,2,6
19087,Henry County,IA,Iowa,NA,0,NA,NA,NA,1,NA,NA,NA,NA,NA,NA,NA,NA,NA,NA,NA
19089,Howard County,IA,Iowa,NA,0,NA,NA,NA,0,NA,DoubleCheck,NA,NA,NA,NA,NA,NA,NA,NA,NA
19091,Humboldt County,IA,Iowa,NA,0,NA,NA,NA,1,NA,NA,NA,NA,NA,NA,NA,NA,NA,NA,NA
19093,Ida County,IA,Iowa,NA,0,NA,NA,NA,0,NA,DoubleCheck,NA,NA,NA,NA,NA,NA,NA,NA,NA
19095,Iowa County,IA,Iowa,NA,0,NA,NA,NA,0,NA,DoubleCheck,NA,NA,NA,NA,NA,NA,NA,NA,NA
19097,Jackson County,IA,Iowa,NA,0,NA,NA,NA,0,NA,DoubleCheck,NA,NA,NA,NA,NA,NA,NA,NA,NA
19099,Jasper County,IA,Iowa,jaspercountyia,1,DoubleCheck,No,No,0,NA,DoubleCheck,NA,NA,NA,NA,NA,NA,NA,NA,NA
19101,Jefferson County,IA,Iowa,NA,0,NA,NA,NA,1,NA,NA,NA,NA,NA,NA,NA,NA,NA,NA,NA
19103,Johnson County,IA,Iowa,jciowaph,1,NA,Yes,Yes,1,NA,NA,NA,36764444,Johnson County Public Health offices will be closed on November 25 and 26 in observance of County Holiday and Thanksgiving Day! Thank you!  https://t.co/zefcBsyID5,11/24/2021,12:02:45,https://twitter.com/JCIowaPH/status/1463553689118027777,2021,11,24
19105,Jones County,IA,Iowa,jonescoph,1,NA,Yes,Yes,0,NA,DoubleCheck,NA,3689291722,Send an email to publichealth@jonescountyiowa.gov or call (319) 462-6945 if you have a community health need you would like to discuss.  https://t.co/GwykKYxiwh  https://t.co/hus7sly2tc,11/24/2021,18:00:04,https://twitter.com/JonesCoPH/status/1463643612068167684,2021,11,24
19107,Keokuk County,IA,Iowa,NA,0,NA,NA,NA,1,NA,NA,NA,NA,NA,NA,NA,NA,NA,NA,NA
19109,Kossuth County,IA,Iowa,NA,0,NA,NA,NA,1,NA,NA,NA,NA,NA,NA,NA,NA,NA,NA,NA
19111,Lee County,IA,Iowa,NA,0,NA,NA,NA,1,NA,NA,NA,NA,NA,NA,NA,NA,NA,NA,NA
19113,Linn County,IA,Iowa,lcpublichealth,1,NA,Yes,Yes,0,NA,DoubleCheck,NA,66561298,"As we approach the holiday season, the best way to keep your children safe and healthy is by getting them the #COVID19 vaccine. Children ages 5 and up are eligible. Learn more:  https://t.co/aB87yX6JUr  https://t.co/Xo5kiXVBrf",11/24/2021,11:00:00,https://twitter.com/LCPublicHealth/status/1463537896455954437,2021,11,24
19115,Louisa County,IA,Iowa,NA,0,NA,NA,NA,1,NA,NA,NA,NA,NA,NA,NA,NA,NA,NA,NA
19117,Lucas County,IA,Iowa,NA,0,NA,NA,NA,1,NA,NA,NA,NA,NA,NA,NA,NA,NA,NA,NA
19119,Lyon County,IA,Iowa,NA,0,NA,NA,NA,0,NA,DoubleCheck,NA,NA,NA,NA,NA,NA,NA,NA,NA
19121,Madison County,IA,Iowa,madcoph,1,NA,Yes,Yes,0,NA,DoubleCheck,NA,3165772886,"MCPH offices will be closed Thursday, 11/25 and Friday, 11/26 for #Thanksgiving . May you and your family have a healthy and blessed holiday!  https://t.co/uQkrE6ZCxo",11/24/2021,15:04:43,https://twitter.com/madcoPH/status/1463599482940145679,2021,11,24
19123,Mahaska County,IA,Iowa,NA,0,NA,NA,NA,1,NA,NA,NA,NA,NA,NA,NA,NA,NA,NA,NA
19125,Marion County,IA,Iowa,NA,0,NA,NA,NA,1,NA,NA,NA,NA,NA,NA,NA,NA,NA,NA,NA
19127,Marshall County,IA,Iowa,NA,0,NA,NA,NA,1,NA,NA,NA,NA,NA,NA,NA,NA,NA,NA,NA
19129,Mills County,IA,Iowa,NA,0,NA,NA,NA,1,NA,NA,NA,NA,NA,NA,NA,NA,NA,NA,NA
19131,Mitchell County,IA,Iowa,mitchell_health,1,DoubleCheck,No,No,0,NA,DoubleCheck,NA,NA,NA,NA,NA,NA,NA,NA,NA
19133,Monona County,IA,Iowa,NA,0,NA,NA,NA,1,NA,NA,NA,NA,NA,NA,NA,NA,NA,NA,NA
19135,Monroe County,IA,Iowa,NA,0,NA,NA,NA,0,NA,DoubleCheck,NA,NA,NA,NA,NA,NA,NA,NA,NA
19137,Montgomery County,IA,Iowa,NA,0,NA,NA,NA,1,NA,NA,NA,NA,NA,NA,NA,NA,NA,NA,NA
19139,Muscatine County,IA,Iowa,NA,0,NA,NA,NA,0,NA,DoubleCheck,NA,NA,NA,NA,NA,NA,NA,NA,NA
19141,O'Brien County,IA,Iowa,NA,0,NA,NA,NA,0,NA,DoubleCheck,NA,NA,NA,NA,NA,NA,NA,NA,NA
19143,Osceola County,IA,Iowa,osceolarhc,1,DoubleCheck,No,No,0,NA,No_tweets,NA,NA,NA,NA,NA,NA,NA,NA,NA
19145,Page County,IA,Iowa,NA,0,NA,NA,NA,1,NA,NA,NA,NA,NA,NA,NA,NA,NA,NA,NA
19147,Palo Alto County,IA,Iowa,pachs_iowa,1,NA,No,No,0,NA,Outdated-Add District,NA,3753313695,genius 3D Mammography is available at PACHS beginning October 20.  Call 712-852-5416 for an appt.  Learn more at  https://t.co/lBEIa3P5zt,9/29/2017,16:05:23,https://twitter.com/PACHS_Iowa/status/913857255694635013,2017,9,29
19149,Plymouth County,IA,Iowa,NA,0,NA,NA,NA,0,NA,DoubleCheck,NA,NA,NA,NA,NA,NA,NA,NA,NA
19151,Pocahontas County,IA,Iowa,NA,0,NA,NA,NA,1,NA,NA,NA,NA,NA,NA,NA,NA,NA,NA,NA
19153,Polk County,IA,Iowa,polkcohealth,1,NA,Yes,Yes,1,NA,NA,NA,20592308,A little #foodsafety #humor while you are making your green bean casserole for #Thanksgiving!!  https://t.co/GjBk4gxXGf,11/24/2021,12:04:51,https://twitter.com/polkcohealth/status/1463554215243096065,2021,11,24
19155,Pottawattamie County,IA,Iowa,pottcophd,1,NA,Yes,No,0,NA,DoubleCheck,NA,1.24E+18,Seventh COVID-19 presumptive positive case in Pottawattamie County.  https://t.co/LvPtSHq8ZK,4/3/2020,15:09:01,https://twitter.com/PottCoPHD/status/1246152746358788097,2020,4,3
19157,Poweshiek County,IA,Iowa,NA,0,NA,NA,NA,0,NA,DoubleCheck,NA,NA,NA,NA,NA,NA,NA,NA,NA
19159,Ringgold County,IA,Iowa,NA,0,NA,NA,NA,0,NA,DoubleCheck,NA,NA,NA,NA,NA,NA,NA,NA,NA
19161,Sac County,IA,Iowa,NA,0,NA,NA,NA,0,NA,DoubleCheck,NA,NA,NA,NA,NA,NA,NA,NA,NA
19163,Scott County,IA,Iowa,scotthealthdept,1,NA,Yes,Yes,1,NA,NA,NA,7.10E+17,That lingering tobacco smoke aroma is more than just a bad smell.  It is thirdhand smoke and is not safe for anyone to breathe.  Free quitting help is available.  Call 1-800-QUIT-NOW  https://t.co/amdXTGW2aa  https://t.co/a2VWYIKwHg,11/23/2021,22:52:48,https://twitter.com/scotthealthdept/status/1463354890315575304,2021,11,23
19165,Shelby County,IA,Iowa,NA,0,NA,NA,NA,0,NA,DoubleCheck,NA,NA,NA,NA,NA,NA,NA,NA,NA
19167,Sioux County,IA,Iowa,NA,0,NA,NA,NA,1,NA,NA,NA,NA,NA,NA,NA,NA,NA,NA,NA
19169,Story County,IA,Iowa,NA,0,NA,NA,NA,0,NA,DoubleCheck,NA,NA,NA,NA,NA,NA,NA,NA,NA
19171,Tama County,IA,Iowa,NA,0,NA,NA,NA,0,NA,DoubleCheck,NA,NA,NA,NA,NA,NA,NA,NA,NA
19173,Taylor County,IA,Iowa,taylor_iowa,1,NA,Yes,No,0,NA,DoubleCheck,NA,1.37E+18,"@KMABroadcasting Help us spread the word! We have about 20 spots open at our clinic in Corning on Thursday! Also...plenty of doses for Saturday in Bedford! Sign up, show up, get vaccinated and help stop the spread of Covid!  https://t.co/iYgeEnAn3b",4/6/2021,10:29:03,https://twitter.com/taylor_iowa/status/1379441023047368708,2021,4,6
19175,Union County,IA,Iowa,NA,0,NA,NA,NA,0,NA,DoubleCheck,NA,NA,NA,NA,NA,NA,NA,NA,NA
19177,Van Buren County,IA,Iowa,NA,0,NA,NA,NA,0,NA,DoubleCheck,NA,NA,NA,NA,NA,NA,NA,NA,NA
19179,Wapello County,IA,Iowa,NA,0,NA,NA,NA,0,NA,DoubleCheck,NA,NA,NA,NA,NA,NA,NA,NA,NA
19181,Warren County,IA,Iowa,wchs_ia,1,NA,Yes,Yes,0,NA,DoubleCheck,NA,1.23E+18,If you are still on the fence about whether vaccination is right for your child we encourage you to learn more on the CDC’s page  https://t.co/9dgYSI6i8V and/or talk to your child’s pediatrician.  https://t.co/nh7b8Kar4e,11/24/2021,7:30:00,https://twitter.com/WCHS_IA/status/1463485048527601671,2021,11,24
19183,Washington County,IA,Iowa,NA,0,NA,NA,NA,1,NA,NA,NA,NA,NA,NA,NA,NA,NA,NA,NA
19185,Wayne County,IA,Iowa,NA,0,NA,NA,NA,1,NA,NA,NA,NA,NA,NA,NA,NA,NA,NA,NA
19187,Webster County,IA,Iowa,websterpublic,1,DoubleCheck,No,No,1,NA,NA,NA,NA,NA,NA,NA,NA,NA,NA,NA
19189,Winnebago County,IA,Iowa,NA,0,NA,NA,NA,1,NA,NA,NA,NA,NA,NA,NA,NA,NA,NA,NA
19191,Winneshiek County,IA,Iowa,NA,0,NA,NA,NA,0,NA,DoubleCheck,NA,NA,NA,NA,NA,NA,NA,NA,NA
19193,Woodbury County,IA,Iowa,siouxlandhealth,1,NA,Yes,Yes,0,NA,DoubleCheck,NA,1228087141,Please see the latest COVID data for Woodbury County.  Reminder: everyone is eligible for COVID booster shots regardless of age or risk factor. It just needs to be more than 6 months since you completed your first series.  https://t.co/eleo4t1qSE,11/24/2021,16:00:30,https://twitter.com/SiouxlandHealth/status/1463613520222863380,2021,11,24
19195,Worth County,IA,Iowa,NA,0,NA,NA,NA,0,NA,DoubleCheck,NA,NA,NA,NA,NA,NA,NA,NA,NA
19197,Wright County,IA,Iowa,NA,0,NA,NA,NA,1,NA,NA,NA,NA,NA,NA,NA,NA,NA,NA,NA
20001,Allen County,KS,Kansas,NA,0,NA,NA,NA,0,NA,DoubleCheck,NA,NA,NA,NA,NA,NA,NA,NA,NA
20003,Anderson County,KS,Kansas,NA,0,NA,NA,NA,0,NA,DoubleCheck,NA,NA,NA,NA,NA,NA,NA,NA,NA
20005,Atchison County,KS,Kansas,NA,0,NA,NA,NA,1,NA,NA,NA,NA,NA,NA,NA,NA,NA,NA,NA
20007,Barber County,KS,Kansas,NA,0,NA,NA,NA,1,NA,NA,NA,NA,NA,NA,NA,NA,NA,NA,NA
20009,Barton County,KS,Kansas,NA,0,NA,NA,NA,0,NA,DoubleCheck,NA,NA,NA,NA,NA,NA,NA,NA,NA
20011,Bourbon County,KS,Kansas,NA,0,NA,NA,NA,0,NA,DoubleCheck,NA,NA,NA,NA,NA,NA,NA,NA,NA
20013,Brown County,KS,Kansas,NA,0,NA,NA,NA,1,NA,NA,NA,NA,NA,NA,NA,NA,NA,NA,NA
20015,Butler County,KS,Kansas,NA,0,NA,NA,NA,1,NA,NA,NA,NA,NA,NA,NA,NA,NA,NA,NA
20017,Chase County,KS,Kansas,NA,0,NA,NA,NA,1,NA,NA,NA,NA,NA,NA,NA,NA,NA,NA,NA
20019,Chautauqua County,KS,Kansas,NA,0,NA,NA,NA,0,NA,DoubleCheck,NA,NA,NA,NA,NA,NA,NA,NA,NA
20021,Cherokee County,KS,Kansas,NA,0,NA,NA,NA,1,NA,NA,NA,NA,NA,NA,NA,NA,NA,NA,NA
20023,Cheyenne County,KS,Kansas,NA,0,NA,NA,NA,0,NA,DoubleCheck,NA,NA,NA,NA,NA,NA,NA,NA,NA
20025,Clark County,KS,Kansas,NA,0,NA,NA,NA,1,NA,NA,NA,NA,NA,NA,NA,NA,NA,NA,NA
20027,Clay County,KS,Kansas,NA,0,NA,NA,NA,1,NA,NA,NA,NA,NA,NA,NA,NA,NA,NA,NA
20029,Cloud County,KS,Kansas,NA,0,NA,NA,NA,1,NA,NA,NA,NA,NA,NA,NA,NA,NA,NA,NA
20031,Coffey County,KS,Kansas,NA,0,NA,NA,NA,1,NA,NA,NA,NA,NA,NA,NA,NA,NA,NA,NA
20033,Comanche County,KS,Kansas,NA,0,NA,NA,NA,1,NA,NA,NA,NA,NA,NA,NA,NA,NA,NA,NA
20035,Cowley County,KS,Kansas,cowleyhealth,1,DoubleCheck,No,No,1,NA,NA,NA,NA,NA,NA,NA,NA,NA,NA,NA
20037,Crawford County,KS,Kansas,crcohd,1,NA,Yes,Yes,1,NA,NA,NA,1.30E+18,"UPDATE: 11/24/2021  Due to the Thanksgiving holiday, Community Gating Criteria will be shared next week on Tuesday, November 30th.  https://t.co/l4SNujYxES",11/24/2021,14:54:42,https://twitter.com/crcohd/status/1463596962347986949,2021,11,24
20039,Decatur County,KS,Kansas,NA,0,NA,NA,NA,0,NA,DoubleCheck,NA,NA,NA,NA,NA,NA,NA,NA,NA
20041,Dickinson County,KS,Kansas,NA,0,NA,NA,NA,0,NA,DoubleCheck,NA,NA,NA,NA,NA,NA,NA,NA,NA
20043,Doniphan County,KS,Kansas,NA,0,NA,NA,NA,0,NA,DoubleCheck,NA,NA,NA,NA,NA,NA,NA,NA,NA
20045,Douglas County,KS,Kansas,ldchealth,1,NA,Yes,Yes,0,NA,DoubleCheck,NA,98401031,#DGKSCOVID  Dashboard updated:  https://t.co/irpA2NHG2n COVID-19 update: https://t.co/TPJbJpGSYh  https://t.co/hwkInod3sJ,11/24/2021,17:15:25,https://twitter.com/LDCHEALTH/status/1463632373866807299,2021,11,24
20047,Edwards County,KS,Kansas,countyedwards,1,NA,Yes,No,1,NA,NA,NA,1.10E+18,"Edwards County residents, we need your help!  https://t.co/YOBzVLhdx6",11/30/2020,10:16:18,https://twitter.com/CountyEdwards/status/1333429656175915011,2020,11,30
20049,Elk County,KS,Kansas,NA,0,NA,NA,NA,1,NA,NA,NA,NA,NA,NA,NA,NA,NA,NA,NA
20051,Ellis County,KS,Kansas,ellishealth,1,NA,Yes,Yes,1,NA,NA,NA,1.04E+18,"📣Booster doses for Pfizer, Moderna, and J&amp;J are now available when you schedule with us online at  https://t.co/1Elxt7lC1Y. 📲  If we don't have the availability you need, click the photo to view the other locations offering booster doses in Ellis County!  https://t.co/QEY2pKZvGF",10/26/2021,10:24:40,https://twitter.com/EllisHealth/status/1453004658331504661,2021,10,26
20053,Ellsworth County,KS,Kansas,NA,0,NA,NA,NA,0,NA,DoubleCheck,NA,NA,NA,NA,NA,NA,NA,NA,NA
20055,Finney County,KS,Kansas,NA,0,NA,NA,NA,0,NA,DoubleCheck,NA,NA,NA,NA,NA,NA,NA,NA,NA
20057,Ford County,KS,Kansas,NA,0,NA,NA,NA,0,NA,DoubleCheck,NA,NA,NA,NA,NA,NA,NA,NA,NA
20059,Franklin County,KS,Kansas,NA,0,NA,NA,NA,0,NA,DoubleCheck,NA,NA,NA,NA,NA,NA,NA,NA,NA
20061,Geary County,KS,Kansas,gecohd,1,DoubleCheck,No,No,0,NA,DoubleCheck,NA,NA,NA,NA,NA,NA,NA,NA,NA
20063,Gove County,KS,Kansas,NA,0,NA,NA,NA,1,NA,NA,NA,NA,NA,NA,NA,NA,NA,NA,NA
20065,Graham County,KS,Kansas,NA,0,NA,NA,NA,1,NA,NA,NA,NA,NA,NA,NA,NA,NA,NA,NA
20067,Grant County,KS,Kansas,NA,0,NA,NA,NA,0,NA,DoubleCheck,NA,NA,NA,NA,NA,NA,NA,NA,NA
20069,Gray County,KS,Kansas,NA,0,NA,NA,NA,0,NA,DoubleCheck,NA,NA,NA,NA,NA,NA,NA,NA,NA
20071,Greeley County,KS,Kansas,NA,0,NA,NA,NA,0,NA,DoubleCheck,NA,NA,NA,NA,NA,NA,NA,NA,NA
20073,Greenwood County,KS,Kansas,NA,0,NA,NA,NA,1,NA,NA,NA,NA,NA,NA,NA,NA,NA,NA,NA
20075,Hamilton County,KS,Kansas,NA,0,NA,NA,NA,0,NA,DoubleCheck,NA,NA,NA,NA,NA,NA,NA,NA,NA
20077,Harper County,KS,Kansas,NA,0,NA,NA,NA,0,NA,DoubleCheck,NA,NA,NA,NA,NA,NA,NA,NA,NA
20079,Harvey County,KS,Kansas,NA,0,NA,NA,NA,1,NA,NA,NA,NA,NA,NA,NA,NA,NA,NA,NA
20081,Haskell County,KS,Kansas,NA,0,NA,NA,NA,1,NA,NA,NA,NA,NA,NA,NA,NA,NA,NA,NA
20083,Hodgeman County,KS,Kansas,NA,0,NA,NA,NA,1,NA,NA,NA,NA,NA,NA,NA,NA,NA,NA,NA
20085,Jackson County,KS,Kansas,NA,0,NA,NA,NA,1,NA,NA,NA,NA,NA,NA,NA,NA,NA,NA,NA
20087,Jefferson County,KS,Kansas,NA,0,NA,NA,NA,1,NA,NA,NA,NA,NA,NA,NA,NA,NA,NA,NA
20089,Jewell County,KS,Kansas,NA,0,NA,NA,NA,1,NA,NA,NA,NA,NA,NA,NA,NA,NA,NA,NA
20091,Johnson County,KS,Kansas,NA,0,NA,NA,NA,1,NA,NA,NA,NA,NA,NA,NA,NA,NA,NA,NA
20093,Kearny County,KS,Kansas,NA,0,NA,NA,NA,0,NA,DoubleCheck,NA,NA,NA,NA,NA,NA,NA,NA,NA
20095,Kingman County,KS,Kansas,NA,0,NA,NA,NA,1,NA,NA,NA,NA,NA,NA,NA,NA,NA,NA,NA
20097,Kiowa County,KS,Kansas,NA,0,NA,NA,NA,0,NA,DoubleCheck,NA,NA,NA,NA,NA,NA,NA,NA,NA
20099,Labette County,KS,Kansas,NA,0,NA,NA,NA,1,NA,NA,NA,NA,NA,NA,NA,NA,NA,NA,NA
20101,Lane County,KS,Kansas,NA,0,NA,NA,NA,1,NA,NA,NA,NA,NA,NA,NA,NA,NA,NA,NA
20103,Leavenworth County,KS,Kansas,NA,0,NA,NA,NA,1,NA,NA,NA,NA,NA,NA,NA,NA,NA,NA,NA
20105,Lincoln County,KS,Kansas,NA,0,NA,NA,NA,1,NA,NA,NA,NA,NA,NA,NA,NA,NA,NA,NA
20107,Linn County,KS,Kansas,NA,0,NA,NA,NA,0,NA,DoubleCheck,NA,NA,NA,NA,NA,NA,NA,NA,NA
20109,Logan County,KS,Kansas,NA,0,NA,NA,NA,0,NA,DoubleCheck,NA,NA,NA,NA,NA,NA,NA,NA,NA
20111,Lyon County,KS,Kansas,lyoncountyph,1,NA,Yes,Yes,0,NA,DoubleCheck,NA,1.45E+18,Fllint Hills Community Health Center will be close November 25-26 for Thanksgiving!  https://t.co/a11z6jiLxh,11/23/2021,9:19:37,https://twitter.com/LyonCountyPH/status/1463150247677501454,2021,11,23
20113,McPherson County,KS,Kansas,NA,0,NA,NA,NA,1,NA,NA,NA,NA,NA,NA,NA,NA,NA,NA,NA
20115,Marion County,KS,Kansas,NA,0,NA,NA,NA,0,NA,DoubleCheck,NA,NA,NA,NA,NA,NA,NA,NA,NA
20117,Marshall County,KS,Kansas,NA,0,NA,NA,NA,1,NA,NA,NA,NA,NA,NA,NA,NA,NA,NA,NA
20119,Meade County,KS,Kansas,NA,0,NA,NA,NA,1,NA,NA,NA,NA,NA,NA,NA,NA,NA,NA,NA
20121,Miami County,KS,Kansas,NA,0,NA,NA,NA,1,NA,NA,NA,NA,NA,NA,NA,NA,NA,NA,NA
20123,Mitchell County,KS,Kansas,NA,0,NA,NA,NA,1,NA,NA,NA,NA,NA,NA,NA,NA,NA,NA,NA
20125,Montgomery County,KS,Kansas,NA,0,NA,NA,NA,1,NA,NA,NA,NA,NA,NA,NA,NA,NA,NA,NA
20127,Morris County,KS,Kansas,morris_health,1,DoubleCheck,No,No,1,NA,NA,NA,NA,NA,NA,NA,NA,NA,NA,NA
20129,Morton County,KS,Kansas,NA,0,NA,NA,NA,0,NA,DoubleCheck,NA,NA,NA,NA,NA,NA,NA,NA,NA
20131,Nemaha County,KS,Kansas,NA,0,NA,NA,NA,0,NA,DoubleCheck,NA,NA,NA,NA,NA,NA,NA,NA,NA
20133,Neosho County,KS,Kansas,NA,0,NA,NA,NA,1,NA,NA,NA,NA,NA,NA,NA,NA,NA,NA,NA
20135,Ness County,KS,Kansas,NA,0,NA,NA,NA,1,NA,NA,NA,NA,NA,NA,NA,NA,NA,NA,NA
20137,Norton County,KS,Kansas,NA,0,NA,NA,NA,1,NA,NA,NA,NA,NA,NA,NA,NA,NA,NA,NA
20139,Osage County,KS,Kansas,ochdks,1,DoubleCheck,No,No,1,NA,NA,NA,NA,NA,NA,NA,NA,NA,NA,NA
20141,Osborne County,KS,Kansas,NA,0,NA,NA,NA,1,NA,NA,NA,NA,NA,NA,NA,NA,NA,NA,NA
20143,Ottawa County,KS,Kansas,ottawacountyhd,1,DoubleCheck,No,No,1,NA,NA,NA,NA,NA,NA,NA,NA,NA,NA,NA
20145,Pawnee County,KS,Kansas,pawneehealth,1,NA,Yes,No,1,NA,NA,NA,1.25E+18,"May is Mental Health Awareness Month, and this week is Children's Mental Health Awareness Week.  We will be sharing a post each day to try to raise awareness on this important topic.…  https://t.co/qNzMedWkiS",5/4/2020,10:25:31,https://twitter.com/PawneeHealth/status/1257315425022443521,2020,5,4
20147,Phillips County,KS,Kansas,NA,0,NA,NA,NA,0,NA,DoubleCheck,NA,NA,NA,NA,NA,NA,NA,NA,NA
20149,Pottawatomie County,KS,Kansas,NA,0,NA,NA,NA,1,NA,NA,NA,NA,NA,NA,NA,NA,NA,NA,NA
20151,Pratt County,KS,Kansas,NA,0,NA,NA,NA,1,NA,NA,NA,NA,NA,NA,NA,NA,NA,NA,NA
20153,Rawlins County,KS,Kansas,NA,0,NA,NA,NA,1,NA,NA,NA,NA,NA,NA,NA,NA,NA,NA,NA
20155,Reno County,KS,Kansas,NA,0,NA,NA,NA,0,NA,DoubleCheck,NA,NA,NA,NA,NA,NA,NA,NA,NA
20157,Republic County,KS,Kansas,NA,0,NA,NA,NA,1,NA,NA,NA,NA,NA,NA,NA,NA,NA,NA,NA
20159,Rice County,KS,Kansas,NA,0,NA,NA,NA,1,NA,NA,NA,NA,NA,NA,NA,NA,NA,NA,NA
20161,Riley County,KS,Kansas,rileycohealth,1,DoubleCheck,No,No,0,NA,DoubleCheck,NA,NA,NA,NA,NA,NA,NA,NA,NA
20163,Rooks County,KS,Kansas,NA,0,NA,NA,NA,1,NA,NA,NA,NA,NA,NA,NA,NA,NA,NA,NA
20165,Rush County,KS,Kansas,NA,0,NA,NA,NA,1,NA,NA,NA,NA,NA,NA,NA,NA,NA,NA,NA
20167,Russell County,KS,Kansas,NA,0,NA,NA,NA,1,NA,NA,NA,NA,NA,NA,NA,NA,NA,NA,NA
20169,Saline County,KS,Kansas,salinecohd,1,NA,Yes,Yes,1,NA,NA,NA,3243543918,COVID Case Update for Saline County  There have been 59 new cases of COVID-19 reported in Saline County since our last update. Salina Regional Health Center reports that 16 people are currently hospitalized due to COVID-19.  Get the full story at -  https://t.co/3e2QboCpua  https://t.co/VHjbzGId7J,11/24/2021,17:30:34,https://twitter.com/SalineCoHD/status/1463636186199642119,2021,11,24
20171,Scott County,KS,Kansas,NA,0,NA,NA,NA,1,NA,NA,NA,NA,NA,NA,NA,NA,NA,NA,NA
20173,Sedgwick County,KS,Kansas,NA,0,NA,NA,NA,1,NA,NA,NA,NA,NA,NA,NA,NA,NA,NA,NA
20175,Seward County,KS,Kansas,NA,0,NA,NA,NA,0,NA,DoubleCheck,NA,NA,NA,NA,NA,NA,NA,NA,NA
20177,Shawnee County,KS,Kansas,sncohealth,1,NA,Yes,Yes,1,NA,NA,NA,64519445,Reminder: The Health Department will be closed tomorrow 11/25/21 and Friday 11/26/21 for the Thanksgiving holiday. Thank you.  https://t.co/NDOBTWVsDZ,11/24/2021,13:00:02,https://twitter.com/SnCoHealth/status/1463568103732883458,2021,11,24
20179,Sheridan County,KS,Kansas,NA,0,NA,NA,NA,0,NA,DoubleCheck,NA,NA,NA,NA,NA,NA,NA,NA,NA
20181,Sherman County,KS,Kansas,NA,0,NA,NA,NA,1,NA,NA,NA,NA,NA,NA,NA,NA,NA,NA,NA
20183,Smith County,KS,Kansas,NA,0,NA,NA,NA,0,NA,DoubleCheck,NA,NA,NA,NA,NA,NA,NA,NA,NA
20185,Stafford County,KS,Kansas,NA,0,NA,NA,NA,1,NA,NA,NA,NA,NA,NA,NA,NA,NA,NA,NA
20187,Stanton County,KS,Kansas,NA,0,NA,NA,NA,1,NA,NA,NA,NA,NA,NA,NA,NA,NA,NA,NA
20189,Stevens County,KS,Kansas,NA,0,NA,NA,NA,1,NA,NA,NA,NA,NA,NA,NA,NA,NA,NA,NA
20191,Sumner County,KS,Kansas,NA,0,NA,NA,NA,1,NA,NA,NA,NA,NA,NA,NA,NA,NA,NA,NA
20193,Thomas County,KS,Kansas,NA,0,NA,NA,NA,1,NA,NA,NA,NA,NA,NA,NA,NA,NA,NA,NA
20195,Trego County,KS,Kansas,NA,0,NA,NA,NA,1,NA,NA,NA,NA,NA,NA,NA,NA,NA,NA,NA
20197,Wabaunsee County,KS,Kansas,NA,0,NA,NA,NA,1,NA,NA,NA,NA,NA,NA,NA,NA,NA,NA,NA
20199,Wallace County,KS,Kansas,NA,0,NA,NA,NA,1,NA,NA,NA,NA,NA,NA,NA,NA,NA,NA,NA
20201,Washington County,KS,Kansas,NA,0,NA,NA,NA,1,NA,NA,NA,NA,NA,NA,NA,NA,NA,NA,NA
20203,Wichita County,KS,Kansas,NA,0,NA,NA,NA,1,NA,NA,NA,NA,NA,NA,NA,NA,NA,NA,NA
20205,Wilson County,KS,Kansas,NA,0,NA,NA,NA,1,NA,NA,NA,NA,NA,NA,NA,NA,NA,NA,NA
20207,Woodson County,KS,Kansas,NA,0,NA,NA,NA,0,NA,DoubleCheck,NA,NA,NA,NA,NA,NA,NA,NA,NA
20209,Wyandotte County,KS,Kansas,NA,1,DoubleCheck,No,No,0,NA,DoubleCheck,NA,NA,NA,NA,NA,NA,NA,NA,NA
21001,Adair County,KY,Kentucky,lcdhd,1,NA,Yes,Yes,1,NA,NA,Lake Cumberland District Health Department - Kentucky,67671445,"The Holidays are coming!! If you haven't been vaccinated yet, please consider doing so. We'd like to help as many people as possible gather safely this Holiday Season and for years to come!   👉More info @  https://t.co/Nv2znVPIXL  #kickcovidKY #everybodycounts #vaccinatedbychoice  https://t.co/xN1T3oCWr1",11/23/2021,12:02:03,https://twitter.com/LCDHD/status/1463191125162930183,2021,11,23
21003,Allen County,KY,Kentucky,NA,0,NA,NA,NA,1,NA,NA,NA,NA,NA,NA,NA,NA,NA,NA,NA
21005,Anderson County,KY,Kentucky,NA,0,NA,NA,NA,1,NA,NA,NA,NA,NA,NA,NA,NA,NA,NA,NA
21007,Ballard County,KY,Kentucky,NA,0,NA,NA,NA,1,NA,NA,Purchase District Health Department - Kentucky,NA,NA,NA,NA,NA,NA,NA,NA
21009,Barren County,KY,Kentucky,barrenriverhd,1,NA,Yes,Yes,1,NA,NA,Barren River Health Department - Kentucky,115077040,"The Barren River District Health Department has confirmed a total of 524 new cases and 53,377 total cases, 46,067 of which have recovered. We have 753 deaths reported from COVID-19. We stand in solidarity with those affected during these difficult times.  https://t.co/dxuBJUyFnl",11/24/2021,17:17:52,https://twitter.com/BarrenRiverHD/status/1463632991394095106,2021,11,24
21011,Bath County,KY,Kentucky,gdhd_org,1,NA,No,No,1,NA,NA,Gateway District Health Department - Kentucky,370174296,Gateway District Health Department now has a Twitter account! Follow us for your public health information.,9/8/2011,12:10:05,https://twitter.com/gdhd_org/status/111833694284693504,2011,9,8
21013,Bell County,KY,Kentucky,NA,0,NA,NA,NA,1,NA,NA,NA,NA,NA,NA,NA,NA,NA,NA,NA
21015,Boone County,KY,Kentucky,nkyhealth,1,NA,Yes,Yes,1,NA,NA,Northern Kentucky Health Department,318448920,"NKY Health will be closed Thursday, Nov. 25, and Friday, Nov. 26 in observance of the Thanksgiving holiday. We will reopen on Monday, Nov. 29 at 8 am. We are thankful for your support and wish you a happy and healthy Thanksgiving.  https://t.co/XWsJAkbNyW",11/24/2021,16:00:02,https://twitter.com/nkyhealth/status/1463613402836840454,2021,11,24
21017,Bourbon County,KY,Kentucky,NA,0,NA,NA,NA,1,NA,NA,NA,NA,NA,NA,NA,NA,NA,NA,NA
21019,Boyd County,KY,Kentucky,abchdky,1,NA,Yes,Yes,NA,NA,NA,NA,3086709286,"We currently have 5 open J&amp;J Covid -19 vaccination appointments Thursday, Nov. 18th.  visit  https://t.co/SYpwheB73B for other vaccination options",11/17/2021,10:17:27,https://twitter.com/abchdky/status/1460990472206311428,2021,11,17
21021,Boyle County,KY,Kentucky,NA,0,NA,NA,NA,NA,NA,NA,NA,NA,NA,NA,NA,NA,NA,NA,NA
21023,Bracken County,KY,Kentucky,NA,0,NA,NA,NA,1,NA,NA,NA,NA,NA,NA,NA,NA,NA,NA,NA
21025,Breathitt County,KY,Kentucky,NA,0,NA,NA,NA,1,NA,NA,NA,NA,NA,NA,NA,NA,NA,NA,NA
21027,Breckinridge County,KY,Kentucky,NA,0,NA,NA,NA,1,NA,NA,NA,NA,NA,NA,NA,NA,NA,NA,NA
21029,Bullitt County,KY,Kentucky,bullittkyhealth,1,NA,Yes,Yes,NA,NA,NA,NA,3221825086,Let’s talk turkey! Unsafe handling and inadequate cooking are the most common issues that lead to poultry-associated food-borne disease outbreaks.  Make sure your Thanksgiving dinner is safe and delicious—tips from the US Department of Agriculture Agricultural Research Service.  https://t.co/WH8HkxoZgQ,11/24/2021,14:02:06,https://twitter.com/BullittKYHealth/status/1463583722251472896,2021,11,24
21031,Butler County,KY,Kentucky,barrenriverhd,1,NA,Yes,Yes,1,NA,NA,Barren River Health Department - Kentucky,115077040,"The Barren River District Health Department has confirmed a total of 524 new cases and 53,377 total cases, 46,067 of which have recovered. We have 753 deaths reported from COVID-19. We stand in solidarity with those affected during these difficult times.  https://t.co/dxuBJUyFnl",11/24/2021,17:17:52,https://twitter.com/BarrenRiverHD/status/1463632991394095106,2021,11,24
21033,Caldwell County,KY,Kentucky,NA,0,NA,NA,NA,1,NA,NA,NA,NA,NA,NA,NA,NA,NA,NA,NA
21035,Calloway County,KY,Kentucky,NA,0,NA,NA,NA,1,NA,NA,NA,NA,NA,NA,NA,NA,NA,NA,NA
21037,Campbell County,KY,Kentucky,nkyhealth,1,NA,Yes,Yes,1,NA,NA,Northern Kentucky Health Department,318448920,"NKY Health will be closed Thursday, Nov. 25, and Friday, Nov. 26 in observance of the Thanksgiving holiday. We will reopen on Monday, Nov. 29 at 8 am. We are thankful for your support and wish you a happy and healthy Thanksgiving.  https://t.co/XWsJAkbNyW",11/24/2021,16:00:02,https://twitter.com/nkyhealth/status/1463613402836840454,2021,11,24
21039,Carlisle County,KY,Kentucky,NA,0,NA,NA,NA,1,NA,NA,Purchase District Health Department - Kentucky,NA,NA,NA,NA,NA,NA,NA,NA
21041,Carroll County,KY,Kentucky,trdhd,1,NA,Yes,No,NA,NA,NA,Three Rivers District Health Department - Kentucky,125362867,"TRDHD District Director, Dr. Georgia Heise, presented to the Interim Joint Committee on Local Gov’t today on the effect of the 2021 Special Legislative Session and it's impact on Public Health across KY. We are so thankful for Dr. Heise's leadership during the COVID-19 pandemic.  https://t.co/KlRMPWsBy9",9/21/2021,15:51:47,https://twitter.com/TRDHD/status/1440403403025256450,2021,9,21
21043,Carter County,KY,Kentucky,NA,0,NA,NA,NA,NA,NA,NA,NA,NA,NA,NA,NA,NA,NA,NA,NA
21045,Casey County,KY,Kentucky,lcdhd,1,NA,Yes,Yes,1,NA,NA,Lake Cumberland District Health Department - Kentucky,67671445,"The Holidays are coming!! If you haven't been vaccinated yet, please consider doing so. We'd like to help as many people as possible gather safely this Holiday Season and for years to come!   👉More info @  https://t.co/Nv2znVPIXL  #kickcovidKY #everybodycounts #vaccinatedbychoice  https://t.co/xN1T3oCWr1",11/23/2021,12:02:03,https://twitter.com/LCDHD/status/1463191125162930183,2021,11,23
21047,Christian County,KY,Kentucky,cchd_hoptownky,1,DoubleCheck,No,No,NA,NA,NA,NA,NA,NA,NA,NA,NA,NA,NA,NA
21049,Clark County,KY,Kentucky,cchealthdept,1,NA,Yes,No,NA,NA,NA,NA,59203140,https://t.co/GSMJSMhyHu,7/27/2020,14:26:42,https://twitter.com/CCHealthDept/status/1287816702101721095,2020,7,27
21051,Clay County,KY,Kentucky,NA,0,NA,NA,NA,NA,NA,NA,NA,NA,NA,NA,NA,NA,NA,NA,NA
21053,Clinton County,KY,Kentucky,lcdhd,1,NA,Yes,Yes,1,NA,NA,Lake Cumberland District Health Department - Kentucky,67671445,"The Holidays are coming!! If you haven't been vaccinated yet, please consider doing so. We'd like to help as many people as possible gather safely this Holiday Season and for years to come!   👉More info @  https://t.co/Nv2znVPIXL  #kickcovidKY #everybodycounts #vaccinatedbychoice  https://t.co/xN1T3oCWr1",11/23/2021,12:02:03,https://twitter.com/LCDHD/status/1463191125162930183,2021,11,23
21055,Crittenden County,KY,Kentucky,NA,0,NA,NA,NA,1,NA,NA,NA,NA,NA,NA,NA,NA,NA,NA,NA
21057,Cumberland County,KY,Kentucky,lcdhd,1,NA,Yes,Yes,1,NA,NA,Lake Cumberland District Health Department - Kentucky,67671445,"The Holidays are coming!! If you haven't been vaccinated yet, please consider doing so. We'd like to help as many people as possible gather safely this Holiday Season and for years to come!   👉More info @  https://t.co/Nv2znVPIXL  #kickcovidKY #everybodycounts #vaccinatedbychoice  https://t.co/xN1T3oCWr1",11/23/2021,12:02:03,https://twitter.com/LCDHD/status/1463191125162930183,2021,11,23
21059,Daviess County,KY,Kentucky,grdhd,1,NA,No,No,1,NA,Outdated-Twitter,Green River District Health Department - Kentucky,162090541,January is Radon Awareness Month and GRDHD wants to help you learn more about how to test your home for Radon!  https://t.co/2mnujrkQp0,1/13/2020,9:53:05,https://twitter.com/GRDHD/status/1216734920502063110,2020,1,13
21061,Edmonson County,KY,Kentucky,barrenriverhd,1,NA,Yes,Yes,1,NA,NA,Barren River Health Department - Kentucky,115077040,"The Barren River District Health Department has confirmed a total of 524 new cases and 53,377 total cases, 46,067 of which have recovered. We have 753 deaths reported from COVID-19. We stand in solidarity with those affected during these difficult times.  https://t.co/dxuBJUyFnl",11/24/2021,17:17:52,https://twitter.com/BarrenRiverHD/status/1463632991394095106,2021,11,24
21063,Elliott County,KY,Kentucky,NA,1,DoubleCheck,No,No,1,NA,NA,Gateway District Health Department - Kentucky,NA,NA,NA,NA,NA,NA,NA,NA
21065,Estill County,KY,Kentucky,NA,0,NA,NA,NA,1,NA,NA,NA,NA,NA,NA,NA,NA,NA,NA,NA
21067,Fayette County,KY,Kentucky,lfchd,1,NA,Yes,Yes,NA,NA,NA,NA,39805456,"Here’s a recipe for a healthy #Thanksgiving! Share this to help keep your family, especially those at high risk from COVID-19, as safe as possible.  #LexDoThis  https://t.co/mrMsGfq4aa",11/24/2021,10:15:00,https://twitter.com/LFCHD/status/1463526571663310858,2021,11,24
21069,Fleming County,KY,Kentucky,NA,0,NA,NA,NA,NA,NA,NA,NA,NA,NA,NA,NA,NA,NA,NA,NA
21071,Floyd County,KY,Kentucky,NA,0,NA,NA,NA,1,NA,NA,NA,NA,NA,NA,NA,NA,NA,NA,NA
21073,Franklin County,KY,Kentucky,NA,0,NA,NA,NA,1,NA,NA,NA,NA,NA,NA,NA,NA,NA,NA,NA
21075,Fulton County,KY,Kentucky,NA,0,NA,NA,NA,1,NA,NA,Purchase District Health Department - Kentucky,NA,NA,NA,NA,NA,NA,NA,NA
21077,Gallatin County,KY,Kentucky,trdhd,1,NA,Yes,No,NA,NA,NA,Three Rivers District Health Department - Kentucky,125362867,"TRDHD District Director, Dr. Georgia Heise, presented to the Interim Joint Committee on Local Gov’t today on the effect of the 2021 Special Legislative Session and it's impact on Public Health across KY. We are so thankful for Dr. Heise's leadership during the COVID-19 pandemic.  https://t.co/KlRMPWsBy9",9/21/2021,15:51:47,https://twitter.com/TRDHD/status/1440403403025256450,2021,9,21
21079,Garrard County,KY,Kentucky,NA,0,NA,NA,NA,NA,NA,NA,NA,NA,NA,NA,NA,NA,NA,NA,NA
21081,Grant County,KY,Kentucky,nkyhealth,1,NA,Yes,Yes,1,NA,NA,Northern Kentucky Health Department,318448920,"NKY Health will be closed Thursday, Nov. 25, and Friday, Nov. 26 in observance of the Thanksgiving holiday. We will reopen on Monday, Nov. 29 at 8 am. We are thankful for your support and wish you a happy and healthy Thanksgiving.  https://t.co/XWsJAkbNyW",11/24/2021,16:00:02,https://twitter.com/nkyhealth/status/1463613402836840454,2021,11,24
21083,Graves County,KY,Kentucky,graveshealth,1,Outdated-Add District,No,No,NA,NA,NA,NA,NA,NA,NA,NA,NA,NA,NA,NA
21085,Grayson County,KY,Kentucky,NA,0,NA,NA,NA,NA,NA,NA,NA,NA,NA,NA,NA,NA,NA,NA,NA
21087,Green County,KY,Kentucky,lcdhd,1,NA,Yes,Yes,1,NA,NA,Lake Cumberland District Health Department - Kentucky,67671445,"The Holidays are coming!! If you haven't been vaccinated yet, please consider doing so. We'd like to help as many people as possible gather safely this Holiday Season and for years to come!   👉More info @  https://t.co/Nv2znVPIXL  #kickcovidKY #everybodycounts #vaccinatedbychoice  https://t.co/xN1T3oCWr1",11/23/2021,12:02:03,https://twitter.com/LCDHD/status/1463191125162930183,2021,11,23
21089,Greenup County,KY,Kentucky,greenuphealth,1,NA,Yes,Yes,NA,NA,NA,NA,461239746,"Listening to ""Special Hours for Thanksgiving! / Deer are on the Move and Dangerous! / Rising Covid 19 Numbers / Masks at School? / Vaccines in the Community / And More!  11-23-21"" at   https://t.co/RSp6jgz5pT",11/23/2021,14:51:17,https://twitter.com/GreenupHealth/status/1463233713542770688,2021,11,23
21091,Hancock County,KY,Kentucky,grdhd,1,NA,No,No,1,NA,Outdated-Twitter,Green River District Health Department - Kentucky,162090541,January is Radon Awareness Month and GRDHD wants to help you learn more about how to test your home for Radon!  https://t.co/2mnujrkQp0,1/13/2020,9:53:05,https://twitter.com/GRDHD/status/1216734920502063110,2020,1,13
21093,Hardin County,KY,Kentucky,lincolntrailhd,1,DoubleCheck,No,No,1,NA,NA,Lincoln Trail District Health Department - Kentucky,NA,NA,NA,NA,NA,NA,NA,NA
21095,Harlan County,KY,Kentucky,NA,0,NA,NA,NA,1,NA,NA,NA,NA,NA,NA,NA,NA,NA,NA,NA
21097,Harrison County,KY,Kentucky,wedcohealth,1,NA,Yes,Yes,NA,NA,NA,WEDCO District Health Department - Kentucky,2373804991,Check out these safety tips on how to prepare your #Holiday Turkey.  https://t.co/qcu3ZjjZIq via @CDCgov,11/19/2021,13:15:11,https://twitter.com/wedcohealth/status/1461759976117096452,2021,11,19
21099,Hart County,KY,Kentucky,barrenriverhd,1,NA,Yes,Yes,1,NA,NA,Barren River Health Department - Kentucky,115077040,"The Barren River District Health Department has confirmed a total of 524 new cases and 53,377 total cases, 46,067 of which have recovered. We have 753 deaths reported from COVID-19. We stand in solidarity with those affected during these difficult times.  https://t.co/dxuBJUyFnl",11/24/2021,17:17:52,https://twitter.com/BarrenRiverHD/status/1463632991394095106,2021,11,24
21101,Henderson County,KY,Kentucky,grdhd,1,NA,No,No,1,NA,Outdated-Twitter,Green River District Health Department - Kentucky,162090541,January is Radon Awareness Month and GRDHD wants to help you learn more about how to test your home for Radon!  https://t.co/2mnujrkQp0,1/13/2020,9:53:05,https://twitter.com/GRDHD/status/1216734920502063110,2020,1,13
21103,Henry County,KY,Kentucky,ncdistrict,1,NA,Yes,Yes,1,NA,NA,North Central District Health Department - Kentucky,2875172679,Covid-19 Weekly Update  10/15/2021 #ncdhd  https://t.co/anPNaTIPYS,10/15/2021,14:16:16,https://twitter.com/NCDistrict/status/1449076676202274824,2021,10,15
21105,Hickman County,KY,Kentucky,NA,0,NA,NA,NA,1,NA,NA,Purchase District Health Department - Kentucky,NA,NA,NA,NA,NA,NA,NA,NA
21107,Hopkins County,KY,Kentucky,NA,0,NA,NA,NA,1,NA,NA,NA,NA,NA,NA,NA,NA,NA,NA,NA
21109,Jackson County,KY,Kentucky,NA,0,NA,NA,NA,NA,NA,NA,NA,NA,NA,NA,NA,NA,NA,NA,NA
21111,Jefferson County,KY,Kentucky,loumetrohealth,1,NA,Yes,Yes,NA,NA,NA,NA,1117413841,"Turkey and its juice can be contaminated with germs that can make you and your family sick.  Follow the steps  https://t.co/n65pd306yP to safely store, thaw, handle, and cook your turkey. #ThanksgivingDinner #Turkey  https://t.co/cwactNt6uz",11/24/2021,12:29:00,https://twitter.com/LouMetroHealth/status/1463560293561163782,2021,11,24
21113,Jessamine County,KY,Kentucky,jchd_ky,1,NA,Yes,No,NA,NA,NA,NA,2902326143,"Narcan is available to anyone in the community, no questions asked. You can come see us for training and a free Narcan kit whenever our doors are open. 💜💜💜 #EndOverdose #OverdoseAware #IOAD2020   https://t.co/WXHg7kmbiV via @YouTube",8/31/2020,10:39:31,https://twitter.com/JCHD_KY/status/1300443103527161856,2020,8,31
21115,Johnson County,KY,Kentucky,NA,0,NA,NA,NA,1,NA,NA,NA,NA,NA,NA,NA,NA,NA,NA,NA
21117,Kenton County,KY,Kentucky,nkyhealth,1,NA,Yes,Yes,1,NA,NA,Northern Kentucky Health Department,318448920,"NKY Health will be closed Thursday, Nov. 25, and Friday, Nov. 26 in observance of the Thanksgiving holiday. We will reopen on Monday, Nov. 29 at 8 am. We are thankful for your support and wish you a happy and healthy Thanksgiving.  https://t.co/XWsJAkbNyW",11/24/2021,16:00:02,https://twitter.com/nkyhealth/status/1463613402836840454,2021,11,24
21119,Knott County,KY,Kentucky,krdhd,1,NA,Yes,No,1,NA,NA,Kentucky River District Health Department,9.71E+17,https://t.co/s9C20oewHc,9/17/2021,21:23:31,https://twitter.com/KRDHD/status/1439037335342092295,2021,9,17
21121,Knox County,KY,Kentucky,NA,0,NA,NA,NA,NA,NA,NA,NA,NA,NA,NA,NA,NA,NA,NA,NA
21123,Larue County,KY,Kentucky,lincolntrailhd,1,DoubleCheck,No,No,1,NA,NA,Lincoln Trail District Health Department - Kentucky,NA,NA,NA,NA,NA,NA,NA,NA
21125,Laurel County,KY,Kentucky,laurelcohealth,1,DoubleCheck,No,No,NA,NA,NA,NA,NA,NA,NA,NA,NA,NA,NA,NA
21127,Lawrence County,KY,Kentucky,NA,0,NA,NA,NA,1,NA,NA,NA,NA,NA,NA,NA,NA,NA,NA,NA
21129,Lee County,KY,Kentucky,krdhd,1,NA,Yes,No,1,NA,NA,Kentucky River District Health Department,9.71E+17,https://t.co/s9C20oewHc,9/17/2021,21:23:31,https://twitter.com/KRDHD/status/1439037335342092295,2021,9,17
21131,Leslie County,KY,Kentucky,krdhd,1,NA,Yes,No,1,NA,NA,Kentucky River District Health Department,9.71E+17,https://t.co/s9C20oewHc,9/17/2021,21:23:31,https://twitter.com/KRDHD/status/1439037335342092295,2021,9,17
21133,Letcher County,KY,Kentucky,krdhd,1,NA,Yes,No,1,NA,NA,Kentucky River District Health Department,9.71E+17,https://t.co/s9C20oewHc,9/17/2021,21:23:31,https://twitter.com/KRDHD/status/1439037335342092295,2021,9,17
21135,Lewis County,KY,Kentucky,NA,0,NA,NA,NA,1,NA,NA,NA,NA,NA,NA,NA,NA,NA,NA,NA
21137,Lincoln County,KY,Kentucky,NA,0,NA,NA,NA,1,NA,NA,NA,NA,NA,NA,NA,NA,NA,NA,NA
21139,Livingston County,KY,Kentucky,NA,0,NA,NA,NA,1,NA,NA,NA,NA,NA,NA,NA,NA,NA,NA,NA
21141,Logan County,KY,Kentucky,barrenriverhd,1,NA,Yes,Yes,1,NA,NA,Barren River Health Department - Kentucky,115077040,"The Barren River District Health Department has confirmed a total of 524 new cases and 53,377 total cases, 46,067 of which have recovered. We have 753 deaths reported from COVID-19. We stand in solidarity with those affected during these difficult times.  https://t.co/dxuBJUyFnl",11/24/2021,17:17:52,https://twitter.com/BarrenRiverHD/status/1463632991394095106,2021,11,24
21143,Lyon County,KY,Kentucky,NA,0,NA,NA,NA,1,NA,NA,NA,NA,NA,NA,NA,NA,NA,NA,NA
21145,McCracken County,KY,Kentucky,NA,0,NA,NA,NA,1,NA,NA,Purchase District Health Department - Kentucky,NA,NA,NA,NA,NA,NA,NA,NA
21147,McCreary County,KY,Kentucky,lcdhd,1,NA,Yes,Yes,1,NA,NA,Lake Cumberland District Health Department - Kentucky,67671445,"The Holidays are coming!! If you haven't been vaccinated yet, please consider doing so. We'd like to help as many people as possible gather safely this Holiday Season and for years to come!   👉More info @  https://t.co/Nv2znVPIXL  #kickcovidKY #everybodycounts #vaccinatedbychoice  https://t.co/xN1T3oCWr1",11/23/2021,12:02:03,https://twitter.com/LCDHD/status/1463191125162930183,2021,11,23
21149,McLean County,KY,Kentucky,grdhd,1,NA,No,No,1,NA,Outdated-Twitter,Green River District Health Department - Kentucky,162090541,January is Radon Awareness Month and GRDHD wants to help you learn more about how to test your home for Radon!  https://t.co/2mnujrkQp0,1/13/2020,9:53:05,https://twitter.com/GRDHD/status/1216734920502063110,2020,1,13
21151,Madison County,KY,Kentucky,madisoncountyhd,1,NA,Yes,Yes,NA,NA,NA,NA,705226724,https://t.co/ywIVWjMX6A,11/22/2021,12:05:04,https://twitter.com/MadisonCountyHD/status/1462829494159425542,2021,11,22
21153,Magoffin County,KY,Kentucky,NA,0,NA,NA,NA,1,NA,NA,NA,NA,NA,NA,NA,NA,NA,NA,NA
21155,Marion County,KY,Kentucky,lincolntrailhd,1,DoubleCheck,No,No,1,NA,NA,Lincoln Trail District Health Department - Kentucky,NA,NA,NA,NA,NA,NA,NA,NA
21157,Marshall County,KY,Kentucky,NA,0,NA,NA,NA,1,NA,NA,NA,NA,NA,NA,NA,NA,NA,NA,NA
21159,Martin County,KY,Kentucky,NA,0,NA,NA,NA,NA,NA,NA,NA,NA,NA,NA,NA,NA,NA,NA,NA
21161,Mason County,KY,Kentucky,mason_health,1,DoubleCheck,No,No,NA,NA,Outdated-Add District,Buffalo Trace District Health Department - Kentucky,NA,NA,NA,NA,NA,NA,NA,NA
21163,Meade County,KY,Kentucky,lincolntrailhd,1,DoubleCheck,No,No,1,NA,NA,Lincoln Trail District Health Department - Kentucky,NA,NA,NA,NA,NA,NA,NA,NA
21165,Menifee County,KY,Kentucky,gdhd_org,1,NA,No,No,1,NA,NA,Gateway District Health Department - Kentucky,370174296,Gateway District Health Department now has a Twitter account! Follow us for your public health information.,9/8/2011,12:10:05,https://twitter.com/gdhd_org/status/111833694284693504,2011,9,8
21167,Mercer County,KY,Kentucky,mercercountyhd,1,DoubleCheck,No,No,NA,NA,NA,NA,NA,NA,NA,NA,NA,NA,NA,NA
21169,Metcalfe County,KY,Kentucky,barrenriverhd,1,NA,Yes,Yes,1,NA,NA,Barren River Health Department - Kentucky,115077040,"The Barren River District Health Department has confirmed a total of 524 new cases and 53,377 total cases, 46,067 of which have recovered. We have 753 deaths reported from COVID-19. We stand in solidarity with those affected during these difficult times.  https://t.co/dxuBJUyFnl",11/24/2021,17:17:52,https://twitter.com/BarrenRiverHD/status/1463632991394095106,2021,11,24
21171,Monroe County,KY,Kentucky,monroekyhd,1,NA,No,No,NA,NA,NA,NA,1689005340,A special thank you to local firefighters for teaching fire safety today to 5th grade students! It is important to have a fire escape plan and to know your family meeting place!   https://t.co/e2ag3W8GD0 #ReadyKids@Readygov!  https://t.co/X5jb90qA7J,5/16/2019,15:12:24,https://twitter.com/monroekyhd/status/1129102315972173824,2019,5,16
21173,Montgomery County,KY,Kentucky,NA,0,NA,NA,NA,1,NA,NA,NA,NA,NA,NA,NA,NA,NA,NA,NA
21175,Morgan County,KY,Kentucky,gdhd_org,1,NA,No,No,1,NA,NA,Gateway District Health Department - Kentucky,370174296,Gateway District Health Department now has a Twitter account! Follow us for your public health information.,9/8/2011,12:10:05,https://twitter.com/gdhd_org/status/111833694284693504,2011,9,8
21177,Muhlenberg County,KY,Kentucky,NA,0,NA,NA,NA,NA,NA,NA,NA,NA,NA,NA,NA,NA,NA,NA,NA
21179,Nelson County,KY,Kentucky,lincolntrailhd,1,DoubleCheck,No,No,1,NA,NA,Lincoln Trail District Health Department - Kentucky,NA,NA,NA,NA,NA,NA,NA,NA
21181,Nicholas County,KY,Kentucky,wedcohealth,1,NA,Yes,Yes,NA,NA,NA,WEDCO District Health Department - Kentucky,2373804991,Check out these safety tips on how to prepare your #Holiday Turkey.  https://t.co/qcu3ZjjZIq via @CDCgov,11/19/2021,13:15:11,https://twitter.com/wedcohealth/status/1461759976117096452,2021,11,19
21183,Ohio County,KY,Kentucky,grdhd,1,NA,No,No,1,NA,Outdated-Twitter,Green River District Health Department - Kentucky,162090541,January is Radon Awareness Month and GRDHD wants to help you learn more about how to test your home for Radon!  https://t.co/2mnujrkQp0,1/13/2020,9:53:05,https://twitter.com/GRDHD/status/1216734920502063110,2020,1,13
21185,Oldham County,KY,Kentucky,NA,0,NA,NA,NA,1,NA,NA,NA,NA,NA,NA,NA,NA,NA,NA,NA
21187,Owen County,KY,Kentucky,trdhd,1,NA,Yes,No,NA,NA,NA,Three Rivers District Health Department - Kentucky,125362867,"TRDHD District Director, Dr. Georgia Heise, presented to the Interim Joint Committee on Local Gov’t today on the effect of the 2021 Special Legislative Session and it's impact on Public Health across KY. We are so thankful for Dr. Heise's leadership during the COVID-19 pandemic.  https://t.co/KlRMPWsBy9",9/21/2021,15:51:47,https://twitter.com/TRDHD/status/1440403403025256450,2021,9,21
21189,Owsley County,KY,Kentucky,krdhd,1,NA,Yes,No,1,NA,NA,Kentucky River District Health Department,9.71E+17,https://t.co/s9C20oewHc,9/17/2021,21:23:31,https://twitter.com/KRDHD/status/1439037335342092295,2021,9,17
21191,Pendleton County,KY,Kentucky,trdhd,1,NA,Yes,No,NA,NA,NA,Three Rivers District Health Department - Kentucky,125362867,"TRDHD District Director, Dr. Georgia Heise, presented to the Interim Joint Committee on Local Gov’t today on the effect of the 2021 Special Legislative Session and it's impact on Public Health across KY. We are so thankful for Dr. Heise's leadership during the COVID-19 pandemic.  https://t.co/KlRMPWsBy9",9/21/2021,15:51:47,https://twitter.com/TRDHD/status/1440403403025256450,2021,9,21
21193,Perry County,KY,Kentucky,krdhd,1,NA,Yes,No,1,NA,NA,Kentucky River District Health Department,9.71E+17,https://t.co/s9C20oewHc,9/17/2021,21:23:31,https://twitter.com/KRDHD/status/1439037335342092295,2021,9,17
21195,Pike County,KY,Kentucky,pikecountyhd,1,NA,Yes,No,NA,NA,NA,NA,2609641297,WIC Farmer's Market Summer Voucher Program  https://t.co/g2iRx4TH1s,8/12/2021,14:17:54,https://twitter.com/PikeCountyHD/status/1425884264223191041,2021,8,12
21197,Powell County,KY,Kentucky,NA,0,NA,NA,NA,1,NA,NA,NA,NA,NA,NA,NA,NA,NA,NA,NA
21199,Pulaski County,KY,Kentucky,lcdhd,1,NA,Yes,Yes,1,NA,NA,Lake Cumberland District Health Department - Kentucky,67671445,"The Holidays are coming!! If you haven't been vaccinated yet, please consider doing so. We'd like to help as many people as possible gather safely this Holiday Season and for years to come!   👉More info @  https://t.co/Nv2znVPIXL  #kickcovidKY #everybodycounts #vaccinatedbychoice  https://t.co/xN1T3oCWr1",11/23/2021,12:02:03,https://twitter.com/LCDHD/status/1463191125162930183,2021,11,23
21201,Robertson County,KY,Kentucky,mason_health,1,DoubleCheck,No,No,NA,NA,Outdated-Add District,Buffalo Trace District Health Department - Kentucky,NA,NA,NA,NA,NA,NA,NA,NA
21203,Rockcastle County,KY,Kentucky,NA,0,NA,NA,NA,NA,NA,NA,NA,NA,NA,NA,NA,NA,NA,NA,NA
21205,Rowan County,KY,Kentucky,gdhd_org,1,NA,No,No,1,NA,NA,Gateway District Health Department - Kentucky,370174296,Gateway District Health Department now has a Twitter account! Follow us for your public health information.,9/8/2011,12:10:05,https://twitter.com/gdhd_org/status/111833694284693504,2011,9,8
21207,Russell County,KY,Kentucky,lcdhd,1,NA,Yes,Yes,1,NA,NA,Lake Cumberland District Health Department - Kentucky,67671445,"The Holidays are coming!! If you haven't been vaccinated yet, please consider doing so. We'd like to help as many people as possible gather safely this Holiday Season and for years to come!   👉More info @  https://t.co/Nv2znVPIXL  #kickcovidKY #everybodycounts #vaccinatedbychoice  https://t.co/xN1T3oCWr1",11/23/2021,12:02:03,https://twitter.com/LCDHD/status/1463191125162930183,2021,11,23
21209,Scott County,KY,Kentucky,wedcohealth,1,NA,Yes,Yes,NA,NA,NA,WEDCO District Health Department - Kentucky,2373804991,Check out these safety tips on how to prepare your #Holiday Turkey.  https://t.co/qcu3ZjjZIq via @CDCgov,11/19/2021,13:15:11,https://twitter.com/wedcohealth/status/1461759976117096452,2021,11,19
21211,Shelby County,KY,Kentucky,ncdistrict,1,NA,Yes,Yes,1,NA,NA,North Central District Health Department - Kentucky,2875172679,Covid-19 Weekly Update  10/15/2021 #ncdhd  https://t.co/anPNaTIPYS,10/15/2021,14:16:16,https://twitter.com/NCDistrict/status/1449076676202274824,2021,10,15
21213,Simpson County,KY,Kentucky,barrenriverhd,1,NA,Yes,Yes,1,NA,NA,Barren River Health Department - Kentucky,115077040,"The Barren River District Health Department has confirmed a total of 524 new cases and 53,377 total cases, 46,067 of which have recovered. We have 753 deaths reported from COVID-19. We stand in solidarity with those affected during these difficult times.  https://t.co/dxuBJUyFnl",11/24/2021,17:17:52,https://twitter.com/BarrenRiverHD/status/1463632991394095106,2021,11,24
21215,Spencer County,KY,Kentucky,ncdistrict,1,NA,Yes,Yes,1,NA,NA,North Central District Health Department - Kentucky,2875172679,Covid-19 Weekly Update  10/15/2021 #ncdhd  https://t.co/anPNaTIPYS,10/15/2021,14:16:16,https://twitter.com/NCDistrict/status/1449076676202274824,2021,10,15
21217,Taylor County,KY,Kentucky,lcdhd,1,NA,Yes,Yes,1,NA,NA,Lake Cumberland District Health Department - Kentucky,67671445,"The Holidays are coming!! If you haven't been vaccinated yet, please consider doing so. We'd like to help as many people as possible gather safely this Holiday Season and for years to come!   👉More info @  https://t.co/Nv2znVPIXL  #kickcovidKY #everybodycounts #vaccinatedbychoice  https://t.co/xN1T3oCWr1",11/23/2021,12:02:03,https://twitter.com/LCDHD/status/1463191125162930183,2021,11,23
21219,Todd County,KY,Kentucky,NA,0,NA,NA,NA,NA,NA,NA,NA,NA,NA,NA,NA,NA,NA,NA,NA
21221,Trigg County,KY,Kentucky,NA,0,NA,NA,NA,1,NA,NA,NA,NA,NA,NA,NA,NA,NA,NA,NA
21223,Trimble County,KY,Kentucky,ncdistrict,1,NA,Yes,Yes,1,NA,NA,North Central District Health Department - Kentucky,2875172679,Covid-19 Weekly Update  10/15/2021 #ncdhd  https://t.co/anPNaTIPYS,10/15/2021,14:16:16,https://twitter.com/NCDistrict/status/1449076676202274824,2021,10,15
21225,Union County,KY,Kentucky,grdhd,1,Outdated-Add District,No,No,NA,NA,NA,NA,162090541,January is Radon Awareness Month and GRDHD wants to help you learn more about how to test your home for Radon!  https://t.co/2mnujrkQp0,1/13/2020,9:53:05,https://twitter.com/GRDHD/status/1216734920502063110,2020,1,13
21227,Warren County,KY,Kentucky,barrenriverhd,1,NA,Yes,Yes,1,NA,NA,Barren River Health Department - Kentucky,115077040,"The Barren River District Health Department has confirmed a total of 524 new cases and 53,377 total cases, 46,067 of which have recovered. We have 753 deaths reported from COVID-19. We stand in solidarity with those affected during these difficult times.  https://t.co/dxuBJUyFnl",11/24/2021,17:17:52,https://twitter.com/BarrenRiverHD/status/1463632991394095106,2021,11,24
21229,Washington County,KY,Kentucky,lincolntrailhd,1,DoubleCheck,No,No,1,NA,NA,Lincoln Trail District Health Department - Kentucky,NA,NA,NA,NA,NA,NA,NA,NA
21231,Wayne County,KY,Kentucky,lcdhd,1,NA,Yes,Yes,1,NA,NA,Lake Cumberland District Health Department - Kentucky,67671445,"The Holidays are coming!! If you haven't been vaccinated yet, please consider doing so. We'd like to help as many people as possible gather safely this Holiday Season and for years to come!   👉More info @  https://t.co/Nv2znVPIXL  #kickcovidKY #everybodycounts #vaccinatedbychoice  https://t.co/xN1T3oCWr1",11/23/2021,12:02:03,https://twitter.com/LCDHD/status/1463191125162930183,2021,11,23
21233,Webster County,KY,Kentucky,grdhd,1,Outdated-Add District,No,No,NA,NA,NA,NA,162090541,January is Radon Awareness Month and GRDHD wants to help you learn more about how to test your home for Radon!  https://t.co/2mnujrkQp0,1/13/2020,9:53:05,https://twitter.com/GRDHD/status/1216734920502063110,2020,1,13
21235,Whitley County,KY,Kentucky,healthwhitley,1,NA,Yes,Yes,NA,NA,NA,NA,1.40E+18,"Even without the added stress of COVID-19, anxiety and depression often spike during the holiday season.  Simple gestures like a call, text, or holiday card can go a long way in bringing some joy to those that may need it.  https://t.co/M4xRHboWzb",11/24/2021,11:30:17,https://twitter.com/HealthWhitley/status/1463545515950415873,2021,11,24
21237,Wolfe County,KY,Kentucky,krdhd,1,NA,Yes,No,1,NA,NA,Kentucky River District Health Department,9.71E+17,https://t.co/s9C20oewHc,9/17/2021,21:23:31,https://twitter.com/KRDHD/status/1439037335342092295,2021,9,17
21239,Woodford County,KY,Kentucky,healthwoodford,1,NA,Yes,Yes,NA,NA,NA,NA,1.39E+18,"Due to the holiday week, the Health Department will have special hours this week:  • 8 a.m.- 4:30 p.m. Monday • 8 a.m.- 4:30 p.m. Tuesday • 8 a.m.- 3 p.m. Wednesday • CLOSED Thursday/Friday.  https://t.co/xr01RFz3zH",11/22/2021,9:01:22,https://twitter.com/HealthWoodford/status/1462783264624717829,2021,11,22
22001,Acadia Parish,LA,Louisiana,NA,0,NA,NA,NA,NA,NA,NA,NA,NA,NA,NA,NA,NA,NA,NA,NA
22003,Allen Parish,LA,Louisiana,NA,0,NA,NA,NA,NA,NA,NA,NA,NA,NA,NA,NA,NA,NA,NA,NA
22005,Ascension Parish,LA,Louisiana,NA,0,NA,NA,NA,1,NA,NA,NA,NA,NA,NA,NA,NA,NA,NA,NA
22007,Assumption Parish,LA,Louisiana,NA,0,NA,NA,NA,NA,NA,NA,NA,NA,NA,NA,NA,NA,NA,NA,NA
22009,Avoyelles Parish,LA,Louisiana,NA,0,NA,NA,NA,NA,NA,NA,NA,NA,NA,NA,NA,NA,NA,NA,NA
22011,Beauregard Parish,LA,Louisiana,NA,0,NA,NA,NA,NA,NA,NA,NA,NA,NA,NA,NA,NA,NA,NA,NA
22013,Bienville Parish,LA,Louisiana,NA,0,NA,NA,NA,NA,NA,NA,NA,NA,NA,NA,NA,NA,NA,NA,NA
22015,Bossier Parish,LA,Louisiana,NA,0,NA,NA,NA,NA,NA,NA,NA,NA,NA,NA,NA,NA,NA,NA,NA
22017,Caddo Parish,LA,Louisiana,NA,0,NA,NA,NA,NA,NA,NA,NA,NA,NA,NA,NA,NA,NA,NA,NA
22019,Calcasieu Parish,LA,Louisiana,NA,0,NA,NA,NA,NA,NA,NA,NA,NA,NA,NA,NA,NA,NA,NA,NA
22021,Caldwell Parish,LA,Louisiana,NA,0,NA,NA,NA,NA,NA,NA,NA,NA,NA,NA,NA,NA,NA,NA,NA
22023,Cameron Parish,LA,Louisiana,NA,0,NA,NA,NA,NA,NA,NA,NA,NA,NA,NA,NA,NA,NA,NA,NA
22025,Catahoula Parish,LA,Louisiana,NA,0,NA,NA,NA,NA,NA,NA,NA,NA,NA,NA,NA,NA,NA,NA,NA
22027,Claiborne Parish,LA,Louisiana,NA,0,NA,NA,NA,NA,NA,NA,NA,NA,NA,NA,NA,NA,NA,NA,NA
22029,Concordia Parish,LA,Louisiana,NA,0,NA,NA,NA,NA,NA,NA,NA,NA,NA,NA,NA,NA,NA,NA,NA
22031,De Soto Parish,LA,Louisiana,NA,0,NA,NA,NA,NA,NA,NA,NA,NA,NA,NA,NA,NA,NA,NA,NA
22033,East Baton Rouge Parish,LA,Louisiana,NA,0,NA,NA,NA,NA,NA,NA,NA,NA,NA,NA,NA,NA,NA,NA,NA
22035,East Carroll Parish,LA,Louisiana,NA,0,NA,NA,NA,NA,NA,NA,NA,NA,NA,NA,NA,NA,NA,NA,NA
22037,East Feliciana Parish,LA,Louisiana,NA,0,NA,NA,NA,NA,NA,NA,NA,NA,NA,NA,NA,NA,NA,NA,NA
22039,Evangeline Parish,LA,Louisiana,NA,0,NA,NA,NA,NA,NA,NA,NA,NA,NA,NA,NA,NA,NA,NA,NA
22041,Franklin Parish,LA,Louisiana,NA,0,NA,NA,NA,NA,NA,NA,NA,NA,NA,NA,NA,NA,NA,NA,NA
22043,Grant Parish,LA,Louisiana,NA,0,NA,NA,NA,NA,NA,NA,NA,NA,NA,NA,NA,NA,NA,NA,NA
22045,Iberia Parish,LA,Louisiana,NA,0,NA,NA,NA,NA,NA,NA,NA,NA,NA,NA,NA,NA,NA,NA,NA
22047,Iberville Parish,LA,Louisiana,NA,0,NA,NA,NA,NA,NA,NA,NA,NA,NA,NA,NA,NA,NA,NA,NA
22049,Jackson Parish,LA,Louisiana,NA,0,NA,NA,NA,NA,NA,NA,NA,NA,NA,NA,NA,NA,NA,NA,NA
22051,Jefferson Parish,LA,Louisiana,NA,0,NA,NA,NA,NA,NA,NA,NA,NA,NA,NA,NA,NA,NA,NA,NA
22053,Jefferson Davis Parish,LA,Louisiana,NA,0,NA,NA,NA,NA,NA,NA,NA,NA,NA,NA,NA,NA,NA,NA,NA
22055,Lafayette Parish,LA,Louisiana,NA,0,NA,NA,NA,NA,NA,NA,NA,NA,NA,NA,NA,NA,NA,NA,NA
22057,Lafourche Parish,LA,Louisiana,NA,0,NA,NA,NA,NA,NA,NA,NA,NA,NA,NA,NA,NA,NA,NA,NA
22059,La Salle Parish,LA,Louisiana,NA,0,NA,NA,NA,NA,NA,NA,NA,NA,NA,NA,NA,NA,NA,NA,NA
22061,Lincoln Parish,LA,Louisiana,NA,0,NA,NA,NA,NA,NA,NA,NA,NA,NA,NA,NA,NA,NA,NA,NA
22063,Livingston Parish,LA,Louisiana,NA,0,NA,NA,NA,NA,NA,NA,NA,NA,NA,NA,NA,NA,NA,NA,NA
22065,Madison Parish,LA,Louisiana,NA,0,NA,NA,NA,NA,NA,NA,NA,NA,NA,NA,NA,NA,NA,NA,NA
22067,Morehouse Parish,LA,Louisiana,NA,0,NA,NA,NA,NA,NA,NA,NA,NA,NA,NA,NA,NA,NA,NA,NA
22069,Natchitoches Parish,LA,Louisiana,NA,0,NA,NA,NA,NA,NA,NA,NA,NA,NA,NA,NA,NA,NA,NA,NA
22071,Orleans Parish,LA,Louisiana,NA,0,NA,NA,NA,NA,NA,NA,NA,NA,NA,NA,NA,NA,NA,NA,NA
22073,Ouachita Parish,LA,Louisiana,NA,0,NA,NA,NA,NA,NA,NA,NA,NA,NA,NA,NA,NA,NA,NA,NA
22075,Plaquemines Parish,LA,Louisiana,NA,0,NA,NA,NA,NA,NA,NA,NA,NA,NA,NA,NA,NA,NA,NA,NA
22077,Pointe Coupee Parish,LA,Louisiana,NA,0,NA,NA,NA,NA,NA,NA,NA,NA,NA,NA,NA,NA,NA,NA,NA
22079,Rapides Parish,LA,Louisiana,NA,0,NA,NA,NA,NA,NA,NA,NA,NA,NA,NA,NA,NA,NA,NA,NA
22081,Red River Parish,LA,Louisiana,NA,0,NA,NA,NA,NA,NA,NA,NA,NA,NA,NA,NA,NA,NA,NA,NA
22083,Richland Parish,LA,Louisiana,NA,0,NA,NA,NA,NA,NA,NA,NA,NA,NA,NA,NA,NA,NA,NA,NA
22085,Sabine Parish,LA,Louisiana,NA,0,NA,NA,NA,NA,NA,NA,NA,NA,NA,NA,NA,NA,NA,NA,NA
22087,St. Bernard Parish,LA,Louisiana,NA,0,NA,NA,NA,NA,NA,NA,NA,NA,NA,NA,NA,NA,NA,NA,NA
22089,St. Charles Parish,LA,Louisiana,NA,0,NA,NA,NA,NA,NA,NA,NA,NA,NA,NA,NA,NA,NA,NA,NA
22091,St. Helena Parish,LA,Louisiana,NA,0,NA,NA,NA,NA,NA,NA,NA,NA,NA,NA,NA,NA,NA,NA,NA
22093,St. James Parish,LA,Louisiana,NA,0,NA,NA,NA,NA,NA,NA,NA,NA,NA,NA,NA,NA,NA,NA,NA
22095,St. John the Baptist Parish,LA,Louisiana,NA,0,NA,NA,NA,NA,NA,NA,NA,NA,NA,NA,NA,NA,NA,NA,NA
22097,St. Landry Parish,LA,Louisiana,NA,0,NA,NA,NA,NA,NA,NA,NA,NA,NA,NA,NA,NA,NA,NA,NA
22099,St. Martin Parish,LA,Louisiana,NA,0,NA,NA,NA,NA,NA,NA,NA,NA,NA,NA,NA,NA,NA,NA,NA
22101,St. Mary Parish,LA,Louisiana,NA,0,NA,NA,NA,NA,NA,NA,NA,NA,NA,NA,NA,NA,NA,NA,NA
22103,St. Tammany Parish,LA,Louisiana,NA,0,NA,NA,NA,NA,NA,NA,NA,NA,NA,NA,NA,NA,NA,NA,NA
22105,Tangipahoa Parish,LA,Louisiana,NA,0,NA,NA,NA,NA,NA,NA,NA,NA,NA,NA,NA,NA,NA,NA,NA
22107,Tensas Parish,LA,Louisiana,NA,0,NA,NA,NA,NA,NA,NA,NA,NA,NA,NA,NA,NA,NA,NA,NA
22109,Terrebonne Parish,LA,Louisiana,NA,0,NA,NA,NA,NA,NA,NA,NA,NA,NA,NA,NA,NA,NA,NA,NA
22111,Union Parish,LA,Louisiana,NA,0,NA,NA,NA,NA,NA,NA,NA,NA,NA,NA,NA,NA,NA,NA,NA
22113,Vermilion Parish,LA,Louisiana,NA,0,NA,NA,NA,NA,NA,NA,NA,NA,NA,NA,NA,NA,NA,NA,NA
22115,Vernon Parish,LA,Louisiana,NA,0,NA,NA,NA,NA,NA,NA,NA,NA,NA,NA,NA,NA,NA,NA,NA
22117,Washington Parish,LA,Louisiana,NA,0,NA,NA,NA,NA,NA,NA,NA,NA,NA,NA,NA,NA,NA,NA,NA
22119,Webster Parish,LA,Louisiana,NA,0,NA,NA,NA,NA,NA,NA,NA,NA,NA,NA,NA,NA,NA,NA,NA
22121,West Baton Rouge Parish,LA,Louisiana,NA,0,NA,NA,NA,NA,NA,NA,NA,NA,NA,NA,NA,NA,NA,NA,NA
22123,West Carroll Parish,LA,Louisiana,NA,0,NA,NA,NA,NA,NA,NA,NA,NA,NA,NA,NA,NA,NA,NA,NA
22125,West Feliciana Parish,LA,Louisiana,NA,0,NA,NA,NA,NA,NA,NA,NA,NA,NA,NA,NA,NA,NA,NA,NA
22127,Winn Parish,LA,Louisiana,NA,0,NA,NA,NA,NA,NA,NA,NA,NA,NA,NA,NA,NA,NA,NA,NA
23001,Androscoggin County,ME,Maine,NA,0,NA,NA,NA,1,NA,NA,NA,NA,NA,NA,NA,NA,NA,NA,NA
23003,Aroostook County,ME,Maine,NA,0,NA,NA,NA,0,NA,NA,NA,NA,NA,NA,NA,NA,NA,NA,NA
23005,Cumberland County,ME,Maine,NA,0,NA,NA,NA,1,NA,Portland,NA,NA,NA,NA,NA,NA,NA,NA,NA
23007,Franklin County,ME,Maine,NA,0,NA,NA,NA,1,NA,NA,NA,NA,NA,NA,NA,NA,NA,NA,NA
23009,Hancock County,ME,Maine,NA,0,NA,NA,NA,0,NA,NA,NA,NA,NA,NA,NA,NA,NA,NA,NA
23011,Kennebec County,ME,Maine,NA,0,NA,NA,NA,0,NA,NA,NA,NA,NA,NA,NA,NA,NA,NA,NA
23013,Knox County,ME,Maine,kcchc,1,NA,No,No,1,NA,NA,NA,3903716353,https://t.co/mBQMi6uig2,4/27/2019,19:36:29,https://twitter.com/KCCHC/status/1122283406820290566,2019,4,27
23015,Lincoln County,ME,Maine,NA,0,NA,NA,NA,0,NA,NA,NA,NA,NA,NA,NA,NA,NA,NA,NA
23017,Oxford County,ME,Maine,NA,0,NA,NA,NA,0,NA,NA,NA,NA,NA,NA,NA,NA,NA,NA,NA
23019,Penobscot County,ME,Maine,NA,0,NA,NA,NA,1,NA,NA,NA,NA,NA,NA,NA,NA,NA,NA,NA
23021,Piscataquis County,ME,Maine,NA,0,NA,NA,NA,1,NA,NA,NA,NA,NA,NA,NA,NA,NA,NA,NA
23023,Sagadahoc County,ME,Maine,NA,0,NA,NA,NA,1,NA,NA,NA,NA,NA,NA,NA,NA,NA,NA,NA
23025,Somerset County,ME,Maine,NA,0,NA,NA,NA,1,NA,NA,NA,NA,NA,NA,NA,NA,NA,NA,NA
23027,Waldo County,ME,Maine,kcchc,1,NA,No,No,0,NA,NA,NA,3903716353,https://t.co/mBQMi6uig2,4/27/2019,19:36:29,https://twitter.com/KCCHC/status/1122283406820290566,2019,4,27
23029,Washington County,ME,Maine,NA,0,NA,NA,NA,1,NA,EmergManage-FB,NA,NA,NA,NA,NA,NA,NA,NA,NA
23031,York County,ME,Maine,NA,0,NA,NA,NA,1,NA,NA,NA,NA,NA,NA,NA,NA,NA,NA,NA
24001,Allegany County,MD,Maryland,alleganyhlthmd,1,NA,Yes,Yes,1,NA,NA,NA,139837497,"COVID-19 VACCINE WALK-IN WEDNESDAY!  Allegany Co. Fairgrounds, 11400 Moss Avenue, Cumberland, MD from 9 a.m. to 1 p.m.   No appointment needed for 1st, 2nd, or booster Pfizer dose (12+) or 1st or 2nd Moderna (18+).  (Appt. required for Moderna booster:    https://t.co/qrujhEZoMn.)",11/17/2021,8:33:04,https://twitter.com/AlleganyHlthMD/status/1460964203066396675,2021,11,17
24003,Anne Arundel County,MD,Maryland,aahealth,1,NA,Yes,Yes,1,NA,NA,NA,29259173,Here are more Tips for a Safe &amp; #HealthyThanksgiving:  https://t.co/QMpRDVklbQ  -   #Thanksgiving2021 #Thanksgiving  #holiday #holidayseason #HappyThanksgiving #COVID19  #StaySafeAnneArundel,11/24/2021,14:18:34,https://twitter.com/AAHealth/status/1463587867515658241,2021,11,24
24005,Baltimore County,MD,Maryland,NA,0,NA,NA,NA,1,NA,NA,NA,NA,NA,NA,NA,NA,NA,NA,NA
24009,Calvert County,MD,Maryland,calverthealth,1,NA,Yes,Yes,1,NA,NA,NA,78973718,"For those who decide to receive a Covid booster or begin their first Covid vaccination, please keep in mind that it is safe to have a flu shot administered at the same time.  The Calvert County Health Department staff wish everyone a happy and healthy Thanksgiving!",11/22/2021,14:00:32,https://twitter.com/CalvertHealth/status/1462858554109415424,2021,11,22
24009,Calvert County,MD,Maryland,calverthealth,1,NA,Yes,Yes,1,NA,NA,NA,78973718,"This better ensures that you and your loved ones are able to receive the immediate care they need for heart attacks, strokes, car crashes, appendicitis, and cancer.",11/22/2021,14:00:32,https://twitter.com/CalvertHealth/status/1462858551903227906,2021,11,22
24011,Caroline County,MD,Maryland,NA,0,NA,NA,NA,1,NA,NA,NA,NA,NA,NA,NA,NA,NA,NA,NA
24013,Carroll County,MD,Maryland,carrollhealthmd,1,NA,Yes,No,1,NA,NA,NA,8.87E+17,"We're looking for a part-time Deputy Health/Chief Medical Officer to work with our health services, clinical policies, and health planning.  Must have a degree in and a license to practice medicine in Maryland and a public health degree or experience.  https://t.co/m0I6BKMUHR  https://t.co/CKJRIDKNj0",7/19/2021,16:12:03,https://twitter.com/CarrollHealthMD/status/1417215681557254151,2021,7,19
24015,Cecil County,MD,Maryland,cecilcohealth,1,NA,Yes,Yes,1,NA,NA,NA,271972834,"Daily COVID-19 Data Update for Nov. 20, 2021. Definitions: The 7-day positivity rate reflects the seven-day moving average of each day's positivity percentage. The 7-day case rate reflects the seven-day moving average of each day's case rate per 100,000 population.""  https://t.co/44meZ2o7Uk",11/24/2021,8:53:21,https://twitter.com/CecilCoHealth/status/1463506024049037313,2021,11,24
24017,Charles County,MD,Maryland,ccdh_maryland,1,NA,Yes,Yes,1,NA,NA,NA,1402527847,"The Charles County Department of Health will be closed on Thursday, November 25th, and Friday, November 26th in observance of the holidays.  https://t.co/EyCMio1Fzj",11/24/2021,10:00:03,https://twitter.com/CCDH_Maryland/status/1463522811356585989,2021,11,24
24019,Dorchester County,MD,Maryland,NA,0,NA,NA,NA,1,NA,NA,NA,NA,NA,NA,NA,NA,NA,NA,NA
24021,Frederick County,MD,Maryland,fchealthdept,1,NA,Yes,Yes,1,NA,NA,NA,519618540,Wondering how to tell if your turkey is done?   Your #Thanksgiving #turkey must be cooked to 165 °F. Always use a food thermometer to ensure turkey is done &amp; safe to eat.  Learn more:  https://t.co/f3o0tVMXcx   #foodsafety  https://t.co/xGJuSOaHYL,11/24/2021,18:00:31,https://twitter.com/FCHealthDept/status/1463643722055405575,2021,11,24
24023,Garrett County,MD,Maryland,garretthealth,1,NA,Yes,Yes,1,NA,NA,NA,8.07E+17,Help Wanted – Consultant: Recovery Housing  https://t.co/0FQ0mLnIS1  https://t.co/ucb9IgyH9u,11/24/2021,8:14:47,https://twitter.com/garretthealth/status/1463496317003513860,2021,11,24
24025,Harford County,MD,Maryland,harcohealthdept,1,NA,Yes,Yes,1,NA,NA,NA,2201745967,November is National Diabetes Month. Did you know that 9 out 10 people with prediabetes don't know they have it? You can take a 60-second quiz to see if you are at risk for type 2 diabetes by clicking here:  https://t.co/zPifdhHsS8  https://t.co/ouNfib7F5F,11/24/2021,14:30:03,https://twitter.com/HarCoHealthDept/status/1463590758016077831,2021,11,24
24027,Howard County,MD,Maryland,hocohealth,1,NA,Yes,Yes,1,NA,NA,NA,22646424,Quick hit for your holiday weekend: please find two new GoVax Maryland clinics for 5- to 11-year-olds at  https://t.co/WYOxeDgebP,11/24/2021,17:52:07,https://twitter.com/HoCoHealth/status/1463641609904570369,2021,11,24
24029,Kent County,MD,Maryland,NA,0,NA,NA,NA,1,NA,NA,NA,NA,NA,NA,NA,NA,NA,NA,NA
24031,Montgomery County,MD,Maryland,mocodhhs,1,NA,Yes,Yes,1,NA,NA,NA,16419934,"If you are due to renew your Medicaid coverage, Maryland Medical Assistance is extending your renewal until March 31, 2022. Medicaid will not cancel your coverage during this time. Check this page for updates  https://t.co/7HneBGWuZD.  https://t.co/cS0NTnmxWz",11/24/2021,18:00:30,https://twitter.com/MoCoDHHS/status/1463643717424885766,2021,11,24
24033,Prince George's County,MD,Maryland,pgchealth,1,NA,Yes,Yes,1,NA,NA,NA,300857864,Please have a safe and healthy #Thanksgiving holiday 🦃  Visit  https://t.co/OFguiq7KMz for the holiday schedules of our testing sites and to find other nearby testing sites. #COVID19  https://t.co/eG14RR9ZEn,11/24/2021,17:10:02,https://twitter.com/PGCHealth/status/1463631020553605123,2021,11,24
24035,Queen Anne's County,MD,Maryland,NA,0,NA,NA,NA,1,NA,NA,NA,NA,NA,NA,NA,NA,NA,NA,NA
24037,St. Mary's County,MD,Maryland,smchd_gov,1,NA,Yes,Yes,1,NA,NA,NA,1599741265,"Everyone 18 years and older is eligible for a #COVID19 booster shot. Some groups should get a booster, and some groups may get a booster based on assessment of their individual risks and benefits. SMCHD COVID-19 vaccine appointments are available at:  https://t.co/u2UqzBQMqF.  https://t.co/cYz0y0wNtq",11/24/2021,9:02:21,https://twitter.com/SMCHD_gov/status/1463508287975006212,2021,11,24
24039,Somerset County,MD,Maryland,NA,0,NA,NA,NA,1,NA,NA,NA,NA,NA,NA,NA,NA,NA,NA,NA
24041,Talbot County,MD,Maryland,NA,0,NA,NA,NA,1,NA,NA,NA,NA,NA,NA,NA,NA,NA,NA,NA
24043,Washington County,MD,Maryland,washcohealth,1,NA,Yes,No,1,NA,NA,NA,9.77E+17,Condom Access Survey  Read More:  https://t.co/sDk4NLyn1i,5/28/2021,10:28:25,https://twitter.com/washcohealth/status/1398285031798415361,2021,5,28
24045,Wicomico County,MD,Maryland,wicomicohealth,1,NA,Yes,Yes,1,NA,NA,NA,851330372,https://t.co/2ov48c2XUs,11/24/2021,15:55:44,https://twitter.com/WicomicoHealth/status/1463612319561306118,2021,11,24
24047,Worcester County,MD,Maryland,worcesterhealth,1,NA,Yes,Yes,1,NA,NA,NA,85322921,Wishing you and your loved ones a very Happy Thanksgiving. The Worcester County Health Department will be closed tomorrow and Friday in observance of Thanksgiving and American Indian Heritage Day. We look forward to seeing you next week!  https://t.co/3nSg07IDLf,11/24/2021,16:15:45,https://twitter.com/WorcesterHealth/status/1463617358329573376,2021,11,24
24510,Baltimore city,MD,Maryland,bmore_healthy,1,NA,Yes,Yes,1,NA,NA,NA,83684370,"@Mo_Rease The Baltimore City Health Department, that’s who.  https://t.co/CuHLmBmt5u",11/24/2021,12:47:00,https://twitter.com/BMore_Healthy/status/1463564825481592841,2021,11,24
25001,Barnstable County,MA,Massachusetts,bchdcapecod,1,NA,Yes,Yes,1,NA,NA,NA,3064533147,"🍁#BarnstableCounty wishes all residents and visitors a wonderful 🦃 Thanksgiving Day!    🍂 All County offices will be closed in observance of the holiday, Thursday, November 25, 2021. #Grateful #Thankful #WorkingForYou #CapeCod  https://t.co/wFNccFaHoM",11/24/2021,13:33:28,https://twitter.com/BCHDCapeCod/status/1463576518035230728,2021,11,24
25003,Berkshire County,MA,Massachusetts,NA,0,NA,NA,NA,0,NA,SmallTowns,NA,NA,NA,NA,NA,NA,NA,NA,NA
25005,Bristol County,MA,Massachusetts,NA,0,NA,NA,NA,0,NA,SmallTowns,NA,NA,NA,NA,NA,NA,NA,NA,NA
25007,Dukes County,MA,Massachusetts,NA,0,NA,NA,NA,0,NA,SmallTowns,NA,NA,NA,NA,NA,NA,NA,NA,NA
25009,Essex County,MA,Massachusetts,NA,0,NA,NA,NA,1,NA,NA,NA,NA,NA,NA,NA,NA,NA,NA,NA
25011,Franklin County,MA,Massachusetts,NA,0,NA,NA,NA,0,NA,SmallTowns,NA,NA,NA,NA,NA,NA,NA,NA,NA
25013,Hampden County,MA,Massachusetts,NA,0,NA,NA,NA,1,NA,NA,NA,NA,NA,NA,NA,NA,NA,NA,NA
25015,Hampshire County,MA,Massachusetts,NA,0,NA,NA,NA,0,NA,SmallTowns,NA,NA,NA,NA,NA,NA,NA,NA,NA
25017,Middlesex County,MA,Massachusetts,NA,0,NA,NA,NA,0,NA,SmallTowns,NA,NA,NA,NA,NA,NA,NA,NA,NA
25019,Nantucket County,MA,Massachusetts,ackhealthdept,1,NA,Yes,No,1,NA,NA,NA,3087056555,"Currently, there is no confirmation of a new COVID variant on Nantucket. We are investigating the possible presence of the South African variant B1.3.5.1 and the P.1 Brazilian variant. Sorry for any confusion an early email that originated in this office may have caused.",4/13/2021,13:33:10,https://twitter.com/ackhealthdept/status/1382024074155679749,2021,4,13
25021,Norfolk County,MA,Massachusetts,NA,0,NA,NA,NA,0,NA,SmallTowns,NA,NA,NA,NA,NA,NA,NA,NA,NA
25023,Plymouth County,MA,Massachusetts,plymouthph,1,DoubleCheck,No,No,1,NA,Outdated,NA,NA,NA,NA,NA,NA,NA,NA,NA
25025,Suffolk County,MA,Massachusetts,NA,0,NA,NA,NA,0,NA,SmallTowns,NA,NA,NA,NA,NA,NA,NA,NA,NA
25027,Worcester County,MA,Massachusetts,worcesterdph,1,DoubleCheck,No,No,1,NA,NA,NA,NA,NA,NA,NA,NA,NA,NA,NA
26001,Alcona County,MI,Michigan,NA,0,NA,NA,NA,1,NA,NA,NA,NA,NA,NA,NA,NA,NA,NA,NA
26003,Alger County,MI,Michigan,lmasdhd,1,NA,No,No,1,NA,NA,Luce-Mackinac-Alger-Schoolcraft Health District - Michigan,2962338622,https://t.co/br0NQQruQd,4/29/2019,21:04:50,https://twitter.com/LMASDHD/status/1123030416951316482,2019,4,29
26005,Allegan County,MI,Michigan,allegancountyhd,1,NA,Yes,Yes,1,NA,NA,NA,2414300695,"This week is US Antibiotic Awareness Week (#USAAW) - Antibiotics can save lives when needed, but do not treat viruses and are only needed for treating certain infections caused by bacteria. Learn how to #BeAntibioticsAware by visiting:  https://t.co/lqfnjPccBz  https://t.co/cyxU3ZURw8",11/19/2021,14:30:02,https://twitter.com/AlleganCountyHD/status/1461778813956739075,2021,11,19
26007,Alpena County,MI,Michigan,NA,0,NA,NA,NA,1,NA,NA,NA,NA,NA,NA,NA,NA,NA,NA,NA
26009,Antrim County,MI,Michigan,nwhealthorg,1,NA,Yes,Yes,0,NA,NA,Health Department of Northwest Michigan,531498598,"RECALL NOTICE: Select code dates of Country Time Lemonade, Tang, Arizona Tea powdered beverages and limited Kool- Aid powdered beverages are being voluntarily recalled in the U.S. due to the potential presence of foreign material.   For full recall list:  https://t.co/Iskr557eiH  https://t.co/5ocyhAkwlG",11/24/2021,14:30:20,https://twitter.com/nwhealthorg/status/1463590827242971140,2021,11,24
26011,Arenac County,MI,Michigan,cmidhd,1,NA,Yes,No,0,NA,NA,Central Michigan District Health Department,148836418,"Turn over a new leaf and quit today. For free help, visit  https://t.co/Zj943yMUJ2.  https://t.co/sZSP2GHSdX",10/27/2020,8:02:30,https://twitter.com/CMiDHD/status/1321059694992121858,2020,10,27
26013,Baraga County,MI,Michigan,westernuphealth,1,NA,Yes,No,0,NA,NA,Western Upper Peninsula Health Department - Michigan,1623676812,"@michaelhbabcock @TimothyScarlett Also, for anyone who does not have access to the internet, they can call 211 for assistance with getting  onto the WUPHD waitlist.",3/18/2021,9:07:22,https://twitter.com/WesternUPHealth/status/1372535097094672385,2021,3,18
26015,Barry County,MI,Michigan,barryeaton_hd,1,NA,Yes,No,1,NA,NA,Barry - Eaton District Health Department - Michigan,7.59E+17,"Community member Sam is sharing why he got the COVID-19 vaccine!  ""By getting the vaccine, I'm setting an example for my community. I aim to protect by getting the vaccine. #MIDoseOfHope  Schedule your appointment now and get vaccinated:  https://t.co/lYncMMcpdk  https://t.co/j8wrHP2jyX",7/23/2021,10:53:03,https://twitter.com/BarryEaton_HD/status/1418584953001029642,2021,7,23
26017,Bay County,MI,Michigan,NA,0,NA,NA,NA,1,NA,NA,NA,NA,NA,NA,NA,NA,NA,NA,NA
26019,Benzie County,MI,Michigan,NA,0,NA,NA,NA,1,NA,NA,NA,NA,NA,NA,NA,NA,NA,NA,NA
26021,Berrien County,MI,Michigan,NA,0,NA,NA,NA,1,NA,NA,NA,NA,NA,NA,NA,NA,NA,NA,NA
26023,Branch County,MI,Michigan,NA,0,NA,NA,NA,1,NA,NA,NA,NA,NA,NA,NA,NA,NA,NA,NA
26025,Calhoun County,MI,Michigan,NA,0,NA,NA,NA,1,NA,NA,NA,NA,NA,NA,NA,NA,NA,NA,NA
26027,Cass County,MI,Michigan,NA,0,NA,NA,NA,1,NA,NA,NA,NA,NA,NA,NA,NA,NA,NA,NA
26029,Charlevoix County,MI,Michigan,nwhealthorg,1,NA,Yes,Yes,0,NA,NA,Health Department of Northwest Michigan,531498598,"RECALL NOTICE: Select code dates of Country Time Lemonade, Tang, Arizona Tea powdered beverages and limited Kool- Aid powdered beverages are being voluntarily recalled in the U.S. due to the potential presence of foreign material.   For full recall list:  https://t.co/Iskr557eiH  https://t.co/5ocyhAkwlG",11/24/2021,14:30:20,https://twitter.com/nwhealthorg/status/1463590827242971140,2021,11,24
26031,Cheboygan County,MI,Michigan,NA,0,NA,NA,NA,1,NA,NA,NA,NA,NA,NA,NA,NA,NA,NA,NA
26033,Chippewa County,MI,Michigan,NA,0,NA,NA,NA,1,NA,NA,NA,NA,NA,NA,NA,NA,NA,NA,NA
26035,Clare County,MI,Michigan,cmidhd,1,NA,Yes,No,0,NA,NA,Central Michigan District Health Department,148836418,"Turn over a new leaf and quit today. For free help, visit  https://t.co/Zj943yMUJ2.  https://t.co/sZSP2GHSdX",10/27/2020,8:02:30,https://twitter.com/CMiDHD/status/1321059694992121858,2020,10,27
26037,Clinton County,MI,Michigan,mmdhd2,1,NA,Yes,Yes,1,NA,NA,Mid-Michigan Health Department,2227272378,The flu and COVID-19 cases are rising. Get vaccinated now!  https://t.co/cPJEGGpef5,11/24/2021,9:11:00,https://twitter.com/MMDHD2/status/1463510465196150785,2021,11,24
26039,Crawford County,MI,Michigan,midhd10,1,NA,Yes,Yes,0,NA,NA,District Health Department 10 - Michigan,8.77E+17,PFIZER COVID-19 BOOSTER DOSE NOW APPROVED FOR SOME;  MODERNA AND J&amp;J NOT CURRENTLY APPROVED   District Health Department #10 (DHD#10) reports that the Advisory Committee on Immunization Practices (ACIP) voted on September 23 to recommend a single Pfizer-…  https://t.co/cvad0Jj70h  https://t.co/nQtc10gPwg,9/27/2021,16:40:52,https://twitter.com/MiDHD10/status/1442590084117630977,2021,9,27
26041,Delta County,MI,Michigan,NA,0,NA,NA,NA,1,NA,NA,NA,NA,NA,NA,NA,NA,NA,NA,NA
26043,Dickinson County,MI,Michigan,NA,0,NA,NA,NA,1,NA,NA,NA,NA,NA,NA,NA,NA,NA,NA,NA
26045,Eaton County,MI,Michigan,barryeaton_hd,1,NA,Yes,No,1,NA,NA,Barry - Eaton District Health Department - Michigan,7.59E+17,"Community member Sam is sharing why he got the COVID-19 vaccine!  ""By getting the vaccine, I'm setting an example for my community. I aim to protect by getting the vaccine. #MIDoseOfHope  Schedule your appointment now and get vaccinated:  https://t.co/lYncMMcpdk  https://t.co/j8wrHP2jyX",7/23/2021,10:53:03,https://twitter.com/BarryEaton_HD/status/1418584953001029642,2021,7,23
26047,Emmet County,MI,Michigan,nwhealthorg,1,NA,Yes,Yes,0,NA,NA,Health Department of Northwest Michigan,531498598,"RECALL NOTICE: Select code dates of Country Time Lemonade, Tang, Arizona Tea powdered beverages and limited Kool- Aid powdered beverages are being voluntarily recalled in the U.S. due to the potential presence of foreign material.   For full recall list:  https://t.co/Iskr557eiH  https://t.co/5ocyhAkwlG",11/24/2021,14:30:20,https://twitter.com/nwhealthorg/status/1463590827242971140,2021,11,24
26049,Genesee County,MI,Michigan,gchd_mi,1,NA,Yes,Yes,1,NA,NA,NA,1704913046,"Reading is a great way for dads to bond with their children, and it’s never too early to start. Using age appropriate books, dad can use reading time to both teach and learn about their children. Reading early also helps children to develop language skills faster.  https://t.co/HNy2SIhVqt",11/24/2021,10:30:00,https://twitter.com/GCHD_MI/status/1463530347107389443,2021,11,24
26051,Gladwin County,MI,Michigan,cmidhd,1,NA,Yes,No,1,NA,NA,Central Michigan District Health Department,148836418,"Turn over a new leaf and quit today. For free help, visit  https://t.co/Zj943yMUJ2.  https://t.co/sZSP2GHSdX",10/27/2020,8:02:30,https://twitter.com/CMiDHD/status/1321059694992121858,2020,10,27
26053,Gogebic County,MI,Michigan,westernuphealth,1,NA,Yes,No,0,NA,NA,Western Upper Peninsula Health Department - Michigan,1623676812,"@michaelhbabcock @TimothyScarlett Also, for anyone who does not have access to the internet, they can call 211 for assistance with getting  onto the WUPHD waitlist.",3/18/2021,9:07:22,https://twitter.com/WesternUPHealth/status/1372535097094672385,2021,3,18
26055,Grand Traverse County,MI,Michigan,gtchd,1,DoubleCheck,No,No,1,NA,NA,NA,NA,NA,NA,NA,NA,NA,NA,NA
26057,Gratiot County,MI,Michigan,mmdhd2,1,NA,Yes,Yes,1,NA,NA,Mid-Michigan Health Department,2227272378,The flu and COVID-19 cases are rising. Get vaccinated now!  https://t.co/cPJEGGpef5,11/24/2021,9:11:00,https://twitter.com/MMDHD2/status/1463510465196150785,2021,11,24
26059,Hillsdale County,MI,Michigan,NA,0,NA,NA,NA,1,NA,NA,NA,NA,NA,NA,NA,NA,NA,NA,NA
26061,Houghton County,MI,Michigan,westernuphealth,1,NA,Yes,No,0,NA,NA,Western Upper Peninsula Health Department - Michigan,1623676812,"@michaelhbabcock @TimothyScarlett Also, for anyone who does not have access to the internet, they can call 211 for assistance with getting  onto the WUPHD waitlist.",3/18/2021,9:07:22,https://twitter.com/WesternUPHealth/status/1372535097094672385,2021,3,18
26063,Huron County,MI,Michigan,NA,0,NA,NA,NA,1,NA,NA,NA,NA,NA,NA,NA,NA,NA,NA,NA
26065,Ingham County,MI,Michigan,inghamhealth,1,NA,Yes,Yes,1,NA,NA,NA,31844065,What’s on the menu for your Thanksgiving? The Public Health Communications Collaborative shared a new recipe to help you enjoy the holiday safely and to protect yourself and others from COVID-19. #Thanksgiving2021  Learn more:  https://t.co/oBR1Hjo1M9 or  https://t.co/WILKJaNUGj  https://t.co/SvlL7HC7Nd,11/22/2021,11:46:51,https://twitter.com/InghamHealth/status/1462824912457019397,2021,11,22
26067,Ionia County,MI,Michigan,NA,0,NA,NA,NA,1,NA,NA,NA,NA,NA,NA,NA,NA,NA,NA,NA
26069,Iosco County,MI,Michigan,NA,0,NA,NA,NA,1,NA,NA,NA,NA,NA,NA,NA,NA,NA,NA,NA
26071,Iron County,MI,Michigan,NA,0,NA,NA,NA,1,NA,NA,NA,NA,NA,NA,NA,NA,NA,NA,NA
26073,Isabella County,MI,Michigan,cmidhd,1,NA,Yes,No,0,NA,NA,Central Michigan District Health Department,148836418,"Turn over a new leaf and quit today. For free help, visit  https://t.co/Zj943yMUJ2.  https://t.co/sZSP2GHSdX",10/27/2020,8:02:30,https://twitter.com/CMiDHD/status/1321059694992121858,2020,10,27
26075,Jackson County,MI,Michigan,NA,0,NA,NA,NA,1,NA,NA,NA,NA,NA,NA,NA,NA,NA,NA,NA
26077,Kalamazoo County,MI,Michigan,kzoocountyhcs,1,NA,Yes,No,0,NA,NA,NA,3342835029,including a dedicated public health workforce. This recognition of Dr. Nettleton reflects the dedication of all of our employees who are working to improve our community’s health. Congratulations to all the honorees!   https://t.co/9e7l4rijQo 2/2,9/14/2021,14:25:34,https://twitter.com/KzooCountyHCS/status/1437844990504415237,2021,9,14
26079,Kalkaska County,MI,Michigan,midhd10,1,NA,Yes,Yes,0,NA,NA,District Health Department 10 - Michigan,8.77E+17,PFIZER COVID-19 BOOSTER DOSE NOW APPROVED FOR SOME;  MODERNA AND J&amp;J NOT CURRENTLY APPROVED   District Health Department #10 (DHD#10) reports that the Advisory Committee on Immunization Practices (ACIP) voted on September 23 to recommend a single Pfizer-…  https://t.co/cvad0Jj70h  https://t.co/nQtc10gPwg,9/27/2021,16:40:52,https://twitter.com/MiDHD10/status/1442590084117630977,2021,9,27
26081,Kent County,MI,Michigan,kchd,1,NA,No,No,0,NA,Outdated-Add District,NA,22488919,https://t.co/j5tkAdSveX,4/24/2019,9:41:42,https://twitter.com/KCHD/status/1121046558814932994,2019,4,24
26083,Keweenaw County,MI,Michigan,westernuphealth,1,NA,Yes,No,0,NA,NA,Western Upper Peninsula Health Department - Michigan,1623676812,"@michaelhbabcock @TimothyScarlett Also, for anyone who does not have access to the internet, they can call 211 for assistance with getting  onto the WUPHD waitlist.",3/18/2021,9:07:22,https://twitter.com/WesternUPHealth/status/1372535097094672385,2021,3,18
26085,Lake County,MI,Michigan,midhd10,1,NA,Yes,Yes,0,NA,NA,District Health Department 10 - Michigan,8.77E+17,PFIZER COVID-19 BOOSTER DOSE NOW APPROVED FOR SOME;  MODERNA AND J&amp;J NOT CURRENTLY APPROVED   District Health Department #10 (DHD#10) reports that the Advisory Committee on Immunization Practices (ACIP) voted on September 23 to recommend a single Pfizer-…  https://t.co/cvad0Jj70h  https://t.co/nQtc10gPwg,9/27/2021,16:40:52,https://twitter.com/MiDHD10/status/1442590084117630977,2021,9,27
26087,Lapeer County,MI,Michigan,NA,0,NA,NA,NA,1,NA,NA,NA,NA,NA,NA,NA,NA,NA,NA,NA
26089,Leelanau County,MI,Michigan,NA,0,NA,NA,NA,1,NA,NA,NA,NA,NA,NA,NA,NA,NA,NA,NA
26091,Lenawee County,MI,Michigan,NA,0,NA,NA,NA,1,NA,NA,NA,NA,NA,NA,NA,NA,NA,NA,NA
26093,Livingston County,MI,Michigan,NA,0,NA,NA,NA,1,NA,NA,NA,NA,NA,NA,NA,NA,NA,NA,NA
26095,Luce County,MI,Michigan,lmasdhd,1,NA,No,No,1,NA,NA,Luce-Mackinac-Alger-Schoolcraft Health District - Michigan,2962338622,https://t.co/br0NQQruQd,4/29/2019,21:04:50,https://twitter.com/LMASDHD/status/1123030416951316482,2019,4,29
26097,Mackinac County,MI,Michigan,lmasdhd,1,NA,No,No,1,NA,NA,Luce-Mackinac-Alger-Schoolcraft Health District - Michigan,2962338622,https://t.co/br0NQQruQd,4/29/2019,21:04:50,https://twitter.com/LMASDHD/status/1123030416951316482,2019,4,29
26099,Macomb County,MI,Michigan,mchdhealth,1,DoubleCheck,No,No,1,NA,NA,NA,NA,NA,NA,NA,NA,NA,NA,NA
26101,Manistee County,MI,Michigan,midhd10,1,NA,Yes,Yes,0,NA,NA,District Health Department 10 - Michigan,8.77E+17,PFIZER COVID-19 BOOSTER DOSE NOW APPROVED FOR SOME;  MODERNA AND J&amp;J NOT CURRENTLY APPROVED   District Health Department #10 (DHD#10) reports that the Advisory Committee on Immunization Practices (ACIP) voted on September 23 to recommend a single Pfizer-…  https://t.co/cvad0Jj70h  https://t.co/nQtc10gPwg,9/27/2021,16:40:52,https://twitter.com/MiDHD10/status/1442590084117630977,2021,9,27
26103,Marquette County,MI,Michigan,NA,0,NA,NA,NA,1,NA,NA,NA,NA,NA,NA,NA,NA,NA,NA,NA
26105,Mason County,MI,Michigan,midhd10,1,NA,Yes,Yes,0,NA,NA,District Health Department 10 - Michigan,8.77E+17,PFIZER COVID-19 BOOSTER DOSE NOW APPROVED FOR SOME;  MODERNA AND J&amp;J NOT CURRENTLY APPROVED   District Health Department #10 (DHD#10) reports that the Advisory Committee on Immunization Practices (ACIP) voted on September 23 to recommend a single Pfizer-…  https://t.co/cvad0Jj70h  https://t.co/nQtc10gPwg,9/27/2021,16:40:52,https://twitter.com/MiDHD10/status/1442590084117630977,2021,9,27
26107,Mecosta County,MI,Michigan,midhd10,1,NA,Yes,Yes,0,NA,NA,District Health Department 10 - Michigan,8.77E+17,PFIZER COVID-19 BOOSTER DOSE NOW APPROVED FOR SOME;  MODERNA AND J&amp;J NOT CURRENTLY APPROVED   District Health Department #10 (DHD#10) reports that the Advisory Committee on Immunization Practices (ACIP) voted on September 23 to recommend a single Pfizer-…  https://t.co/cvad0Jj70h  https://t.co/nQtc10gPwg,9/27/2021,16:40:52,https://twitter.com/MiDHD10/status/1442590084117630977,2021,9,27
26109,Menominee County,MI,Michigan,NA,0,NA,NA,NA,1,NA,NA,NA,NA,NA,NA,NA,NA,NA,NA,NA
26111,Midland County,MI,Michigan,NA,0,NA,NA,NA,1,NA,NA,NA,NA,NA,NA,NA,NA,NA,NA,NA
26113,Missaukee County,MI,Michigan,midhd10,1,NA,Yes,Yes,0,NA,NA,District Health Department 10 - Michigan,8.77E+17,PFIZER COVID-19 BOOSTER DOSE NOW APPROVED FOR SOME;  MODERNA AND J&amp;J NOT CURRENTLY APPROVED   District Health Department #10 (DHD#10) reports that the Advisory Committee on Immunization Practices (ACIP) voted on September 23 to recommend a single Pfizer-…  https://t.co/cvad0Jj70h  https://t.co/nQtc10gPwg,9/27/2021,16:40:52,https://twitter.com/MiDHD10/status/1442590084117630977,2021,9,27
26115,Monroe County,MI,Michigan,NA,0,NA,NA,NA,1,NA,NA,NA,NA,NA,NA,NA,NA,NA,NA,NA
26117,Montcalm County,MI,Michigan,mmdhd2,1,NA,Yes,Yes,1,NA,NA,Mid-Michigan Health Department,2227272378,The flu and COVID-19 cases are rising. Get vaccinated now!  https://t.co/cPJEGGpef5,11/24/2021,9:11:00,https://twitter.com/MMDHD2/status/1463510465196150785,2021,11,24
26119,Montmorency County,MI,Michigan,NA,0,NA,NA,NA,1,NA,NA,NA,NA,NA,NA,NA,NA,NA,NA,NA
26121,Muskegon County,MI,Michigan,NA,0,NA,NA,NA,1,NA,NA,NA,NA,NA,NA,NA,NA,NA,NA,NA
26123,Newaygo County,MI,Michigan,midhd10,1,NA,Yes,Yes,0,NA,NA,District Health Department 10 - Michigan,8.77E+17,PFIZER COVID-19 BOOSTER DOSE NOW APPROVED FOR SOME;  MODERNA AND J&amp;J NOT CURRENTLY APPROVED   District Health Department #10 (DHD#10) reports that the Advisory Committee on Immunization Practices (ACIP) voted on September 23 to recommend a single Pfizer-…  https://t.co/cvad0Jj70h  https://t.co/nQtc10gPwg,9/27/2021,16:40:52,https://twitter.com/MiDHD10/status/1442590084117630977,2021,9,27
26125,Oakland County,MI,Michigan,publichealthoc,1,NA,Yes,Yes,1,NA,NA,NA,1093058394,There are rising flu and #COVID19 cases in #OaklandCounty. Wearing a mask protects others in your community.  https://t.co/eDbW5Akdwf @MichiganHHS  https://t.co/Fgc4QgrKR4,11/24/2021,15:50:02,https://twitter.com/publichealthOC/status/1463610887579729920,2021,11,24
26127,Oceana County,MI,Michigan,midhd10,1,NA,Yes,Yes,0,NA,NA,District Health Department 10 - Michigan,8.77E+17,PFIZER COVID-19 BOOSTER DOSE NOW APPROVED FOR SOME;  MODERNA AND J&amp;J NOT CURRENTLY APPROVED   District Health Department #10 (DHD#10) reports that the Advisory Committee on Immunization Practices (ACIP) voted on September 23 to recommend a single Pfizer-…  https://t.co/cvad0Jj70h  https://t.co/nQtc10gPwg,9/27/2021,16:40:52,https://twitter.com/MiDHD10/status/1442590084117630977,2021,9,27
26129,Ogemaw County,MI,Michigan,NA,0,NA,NA,NA,1,NA,NA,NA,NA,NA,NA,NA,NA,NA,NA,NA
26131,Ontonagon County,MI,Michigan,westernuphealth,1,NA,Yes,No,0,NA,NA,Western Upper Peninsula Health Department - Michigan,1623676812,"@michaelhbabcock @TimothyScarlett Also, for anyone who does not have access to the internet, they can call 211 for assistance with getting  onto the WUPHD waitlist.",3/18/2021,9:07:22,https://twitter.com/WesternUPHealth/status/1372535097094672385,2021,3,18
26133,Osceola County,MI,Michigan,cmidhd,1,NA,Yes,No,0,NA,NA,Central Michigan District Health Department,148836418,"Turn over a new leaf and quit today. For free help, visit  https://t.co/Zj943yMUJ2.  https://t.co/sZSP2GHSdX",10/27/2020,8:02:30,https://twitter.com/CMiDHD/status/1321059694992121858,2020,10,27
26135,Oscoda County,MI,Michigan,NA,0,NA,NA,NA,1,NA,NA,NA,NA,NA,NA,NA,NA,NA,NA,NA
26137,Otsego County,MI,Michigan,nwhealthorg,1,NA,Yes,Yes,0,NA,NA,Health Department of Northwest Michigan,531498598,"RECALL NOTICE: Select code dates of Country Time Lemonade, Tang, Arizona Tea powdered beverages and limited Kool- Aid powdered beverages are being voluntarily recalled in the U.S. due to the potential presence of foreign material.   For full recall list:  https://t.co/Iskr557eiH  https://t.co/5ocyhAkwlG",11/24/2021,14:30:20,https://twitter.com/nwhealthorg/status/1463590827242971140,2021,11,24
26139,Ottawa County,MI,Michigan,miocdph,1,NA,Yes,Yes,0,NA,NA,NA,309128411,View the latest food safety inspection report.  https://t.co/Po5JI9ge1E,11/18/2021,8:12:10,https://twitter.com/miOCDPH/status/1461321332814233603,2021,11,18
26141,Presque Isle County,MI,Michigan,NA,0,NA,NA,NA,1,NA,NA,NA,NA,NA,NA,NA,NA,NA,NA,NA
26143,Roscommon County,MI,Michigan,cmidhd,1,NA,Yes,No,0,NA,NA,Central Michigan District Health Department,148836418,"Turn over a new leaf and quit today. For free help, visit  https://t.co/Zj943yMUJ2.  https://t.co/sZSP2GHSdX",10/27/2020,8:02:30,https://twitter.com/CMiDHD/status/1321059694992121858,2020,10,27
26145,Saginaw County,MI,Michigan,saginawhd,1,DoubleCheck,No,No,1,NA,NA,NA,NA,NA,NA,NA,NA,NA,NA,NA
26147,St. Clair County,MI,Michigan,scchdmi,1,NA,Yes,No,1,NA,NA,NA,2677649364,"We hope everyone is safe after the severe weather our area experienced yesterday. Due to power outages associated with the storms, the St. Clair County Health Department is closed today.  https://t.co/8cHUofPMjn",9/23/2021,8:12:57,https://twitter.com/scchdmi/status/1441012708242075648,2021,9,23
26149,St. Joseph County,MI,Michigan,NA,0,NA,NA,NA,1,NA,NA,NA,NA,NA,NA,NA,NA,NA,NA,NA
26151,Sanilac County,MI,Michigan,NA,0,NA,NA,NA,1,NA,NA,NA,NA,NA,NA,NA,NA,NA,NA,NA
26153,Schoolcraft County,MI,Michigan,lmasdhd,1,NA,No,No,1,NA,NA,Luce-Mackinac-Alger-Schoolcraft Health District - Michigan,2962338622,https://t.co/br0NQQruQd,4/29/2019,21:04:50,https://twitter.com/LMASDHD/status/1123030416951316482,2019,4,29
26155,Shiawassee County,MI,Michigan,shiahealthdept,1,DoubleCheck,No,No,1,NA,Outdated-Add District,NA,NA,NA,NA,NA,NA,NA,NA,NA
26157,Tuscola County,MI,Michigan,tuscolacountyhd,1,NA,Yes,No,0,NA,NA,NA,1.16E+18,Map to new testing location:  https://t.co/YDIF5gGIeN,10/26/2020,15:35:18,https://twitter.com/TuscolaCountyHD/status/1320811260280213504,2020,10,26
26159,Van Buren County,MI,Michigan,NA,0,NA,NA,NA,1,NA,NA,NA,NA,NA,NA,NA,NA,NA,NA,NA
26161,Washtenaw County,MI,Michigan,wcpublichealth,1,NA,Yes,Yes,1,NA,NA,NA,69577137,"People who may get a booster include: ➡ All adults age 18+ who originally got Moderna or Pfizer, at least 6 months after the second dose  Learn more:  https://t.co/kyOwkqSunt (3/3)",11/24/2021,15:59:55,https://twitter.com/wcpublichealth/status/1463613373262688258,2021,11,24
26161,Washtenaw County,MI,Michigan,wcpublichealth,1,NA,Yes,Yes,1,NA,NA,NA,69577137,"People who should get a booster include: ➡ Those who originally got J&amp;J, at least 2 months after the initial dose ➡ Those who originally got Moderna or Pfizer who are 50+ or who are 18+ and living in long-term care settings, at least 6 months after the 2nd dose (2/3)",11/24/2021,15:59:55,https://twitter.com/wcpublichealth/status/1463613371601723392,2021,11,24
26163,Wayne County,MI,Michigan,NA,0,NA,NA,NA,1,NA,NA,NA,NA,NA,NA,NA,NA,NA,NA,NA
26165,Wexford County,MI,Michigan,midhd10,1,NA,Yes,Yes,0,NA,NA,District Health Department 10 - Michigan,8.77E+17,PFIZER COVID-19 BOOSTER DOSE NOW APPROVED FOR SOME;  MODERNA AND J&amp;J NOT CURRENTLY APPROVED   District Health Department #10 (DHD#10) reports that the Advisory Committee on Immunization Practices (ACIP) voted on September 23 to recommend a single Pfizer-…  https://t.co/cvad0Jj70h  https://t.co/nQtc10gPwg,9/27/2021,16:40:52,https://twitter.com/MiDHD10/status/1442590084117630977,2021,9,27
27001,Aitkin County,MN,Minnesota,NA,0,NA,NA,NA,1,NA,NA,NA,NA,NA,NA,NA,NA,NA,NA,NA
27003,Anoka County,MN,Minnesota,NA,0,NA,NA,NA,0,NA,DoubleCheck,NA,NA,NA,NA,NA,NA,NA,NA,NA
27005,Becker County,MN,Minnesota,NA,0,NA,NA,NA,0,NA,DoubleCheck,NA,NA,NA,NA,NA,NA,NA,NA,NA
27007,Beltrami County,MN,Minnesota,NA,0,NA,NA,NA,0,NA,DoubleCheck,NA,NA,NA,NA,NA,NA,NA,NA,NA
27009,Benton County,MN,Minnesota,NA,0,NA,NA,NA,1,NA,NA,NA,NA,NA,NA,NA,NA,NA,NA,NA
27011,Big Stone County,MN,Minnesota,NA,0,NA,NA,NA,0,NA,DoubleCheck,NA,NA,NA,NA,NA,NA,NA,NA,NA
27013,Blue Earth County,MN,Minnesota,NA,0,NA,NA,NA,0,NA,DoubleCheck,NA,NA,NA,NA,NA,NA,NA,NA,NA
27015,Brown County,MN,Minnesota,NA,0,NA,NA,NA,0,NA,DoubleCheck,NA,NA,NA,NA,NA,NA,NA,NA,NA
27017,Carlton County,MN,Minnesota,NA,0,NA,NA,NA,0,NA,DoubleCheck,NA,NA,NA,NA,NA,NA,NA,NA,NA
27019,Carver County,MN,Minnesota,carvercoph,1,NA,Yes,Yes,0,NA,DoubleCheck,NA,612777633,Use hand sanitizer the right way. Read the label to apply the correct amount and rub into all hand surfaces until hands are dry.  https://t.co/gQWpCJJB4n  https://t.co/yb0J1MwLO2,11/24/2021,16:40:03,https://twitter.com/CarverCoPH/status/1463623471288700931,2021,11,24
27021,Cass County,MN,Minnesota,NA,0,NA,NA,NA,0,NA,DoubleCheck,NA,NA,NA,NA,NA,NA,NA,NA,NA
27023,Chippewa County,MN,Minnesota,NA,0,NA,NA,NA,0,NA,DoubleCheck,NA,NA,NA,NA,NA,NA,NA,NA,NA
27025,Chisago County,MN,Minnesota,NA,0,NA,NA,NA,1,NA,NA,NA,NA,NA,NA,NA,NA,NA,NA,NA
27027,Clay County,MN,Minnesota,claycophmn,1,DoubleCheck,No,No,0,NA,Outdated-Add District - DoubleCheck,NA,NA,NA,NA,NA,NA,NA,NA,NA
27029,Clearwater County,MN,Minnesota,NA,0,NA,NA,NA,0,NA,DoubleCheck,NA,NA,NA,NA,NA,NA,NA,NA,NA
27031,Cook County,MN,Minnesota,NA,0,NA,NA,NA,0,NA,DoubleCheck,NA,NA,NA,NA,NA,NA,NA,NA,NA
27033,Cottonwood County,MN,Minnesota,NA,0,NA,NA,NA,0,NA,DoubleCheck,NA,NA,NA,NA,NA,NA,NA,NA,NA
27035,Crow Wing County,MN,Minnesota,NA,0,NA,NA,NA,0,NA,DoubleCheck,NA,NA,NA,NA,NA,NA,NA,NA,NA
27037,Dakota County,MN,Minnesota,NA,0,NA,NA,NA,0,NA,DoubleCheck,NA,NA,NA,NA,NA,NA,NA,NA,NA
27039,Dodge County,MN,Minnesota,NA,0,NA,NA,NA,1,NA,NA,NA,NA,NA,NA,NA,NA,NA,NA,NA
27041,Douglas County,MN,Minnesota,NA,0,NA,NA,NA,0,NA,DoubleCheck,NA,NA,NA,NA,NA,NA,NA,NA,NA
27043,Faribault County,MN,Minnesota,NA,0,NA,NA,NA,0,NA,DoubleCheck,NA,NA,NA,NA,NA,NA,NA,NA,NA
27045,Fillmore County,MN,Minnesota,NA,0,NA,NA,NA,0,NA,DoubleCheck,NA,NA,NA,NA,NA,NA,NA,NA,NA
27047,Freeborn County,MN,Minnesota,NA,0,NA,NA,NA,0,NA,DoubleCheck,NA,NA,NA,NA,NA,NA,NA,NA,NA
27049,Goodhue County,MN,Minnesota,NA,0,NA,NA,NA,0,NA,DoubleCheck,NA,NA,NA,NA,NA,NA,NA,NA,NA
27051,Grant County,MN,Minnesota,NA,0,NA,NA,NA,0,NA,DoubleCheck,NA,NA,NA,NA,NA,NA,NA,NA,NA
27053,Hennepin County,MN,Minnesota,NA,0,NA,NA,NA,1,NA,NA,NA,NA,NA,NA,NA,NA,NA,NA,NA
27055,Houston County,MN,Minnesota,NA,0,NA,NA,NA,0,NA,DoubleCheck,NA,NA,NA,NA,NA,NA,NA,NA,NA
27057,Hubbard County,MN,Minnesota,NA,0,NA,NA,NA,0,NA,DoubleCheck,NA,NA,NA,NA,NA,NA,NA,NA,NA
27059,Isanti County,MN,Minnesota,NA,0,NA,NA,NA,1,NA,NA,NA,NA,NA,NA,NA,NA,NA,NA,NA
27061,Itasca County,MN,Minnesota,NA,0,NA,NA,NA,0,NA,DoubleCheck,NA,NA,NA,NA,NA,NA,NA,NA,NA
27063,Jackson County,MN,Minnesota,NA,0,NA,NA,NA,0,NA,DoubleCheck,NA,NA,NA,NA,NA,NA,NA,NA,NA
27065,Kanabec County,MN,Minnesota,NA,0,NA,NA,NA,1,NA,NA,NA,NA,NA,NA,NA,NA,NA,NA,NA
27067,Kandiyohi County,MN,Minnesota,NA,0,NA,NA,NA,0,NA,DoubleCheck,NA,NA,NA,NA,NA,NA,NA,NA,NA
27069,Kittson County,MN,Minnesota,NA,0,NA,NA,NA,0,NA,DoubleCheck,NA,NA,NA,NA,NA,NA,NA,NA,NA
27071,Koochiching County,MN,Minnesota,NA,0,NA,NA,NA,0,NA,DoubleCheck,NA,NA,NA,NA,NA,NA,NA,NA,NA
27073,Lac qui Parle County,MN,Minnesota,NA,0,NA,NA,NA,0,NA,DoubleCheck,NA,NA,NA,NA,NA,NA,NA,NA,NA
27075,Lake County,MN,Minnesota,NA,0,NA,NA,NA,0,NA,DoubleCheck,NA,NA,NA,NA,NA,NA,NA,NA,NA
27077,Lake of the Woods County,MN,Minnesota,NA,0,NA,NA,NA,0,NA,DoubleCheck,NA,NA,NA,NA,NA,NA,NA,NA,NA
27079,Le Sueur County,MN,Minnesota,NA,0,NA,NA,NA,1,NA,NA,NA,NA,NA,NA,NA,NA,NA,NA,NA
27081,Lincoln County,MN,Minnesota,NA,0,NA,NA,NA,0,NA,DoubleCheck,NA,NA,NA,NA,NA,NA,NA,NA,NA
27083,Lyon County,MN,Minnesota,NA,0,NA,NA,NA,0,NA,DoubleCheck,NA,NA,NA,NA,NA,NA,NA,NA,NA
27085,McLeod County,MN,Minnesota,mcleodcohealth,1,NA,Yes,No,0,NA,DoubleCheck,NA,1322772554,Please share this information with someone who may benefit from learning more! Thank you McLeod Alliance for all you do!  https://t.co/LfRey32l9q,7/8/2021,10:03:45,https://twitter.com/McLeodCoHealth/status/1413136730215960601,2021,7,8
27087,Mahnomen County,MN,Minnesota,NA,0,NA,NA,NA,0,NA,DoubleCheck,NA,NA,NA,NA,NA,NA,NA,NA,NA
27089,Marshall County,MN,Minnesota,NA,0,NA,NA,NA,0,NA,DoubleCheck,NA,NA,NA,NA,NA,NA,NA,NA,NA
27091,Martin County,MN,Minnesota,NA,0,NA,NA,NA,0,NA,DoubleCheck,NA,NA,NA,NA,NA,NA,NA,NA,NA
27093,Meeker County,MN,Minnesota,NA,0,NA,NA,NA,1,NA,NA,NA,NA,NA,NA,NA,NA,NA,NA,NA
27095,Mille Lacs County,MN,Minnesota,NA,0,NA,NA,NA,0,NA,DoubleCheck,NA,NA,NA,NA,NA,NA,NA,NA,NA
27097,Morrison County,MN,Minnesota,NA,0,NA,NA,NA,0,NA,DoubleCheck,NA,NA,NA,NA,NA,NA,NA,NA,NA
27099,Mower County,MN,Minnesota,NA,0,NA,NA,NA,0,NA,DoubleCheck,NA,NA,NA,NA,NA,NA,NA,NA,NA
27101,Murray County,MN,Minnesota,NA,0,NA,NA,NA,0,NA,DoubleCheck,NA,NA,NA,NA,NA,NA,NA,NA,NA
27103,Nicollet County,MN,Minnesota,NA,0,NA,NA,NA,0,NA,DoubleCheck,NA,NA,NA,NA,NA,NA,NA,NA,NA
27105,Nobles County,MN,Minnesota,NA,0,NA,NA,NA,0,NA,DoubleCheck,NA,NA,NA,NA,NA,NA,NA,NA,NA
27107,Norman County,MN,Minnesota,NA,0,NA,NA,NA,0,NA,DoubleCheck,NA,NA,NA,NA,NA,NA,NA,NA,NA
27109,Olmsted County,MN,Minnesota,NA,0,NA,NA,NA,1,NA,NA,NA,NA,NA,NA,NA,NA,NA,NA,NA
27111,Otter Tail County,MN,Minnesota,NA,0,NA,NA,NA,0,NA,DoubleCheck,NA,NA,NA,NA,NA,NA,NA,NA,NA
27113,Pennington County,MN,Minnesota,NA,0,NA,NA,NA,0,NA,DoubleCheck,NA,NA,NA,NA,NA,NA,NA,NA,NA
27115,Pine County,MN,Minnesota,NA,0,NA,NA,NA,0,NA,DoubleCheck,NA,NA,NA,NA,NA,NA,NA,NA,NA
27117,Pipestone County,MN,Minnesota,NA,0,NA,NA,NA,0,NA,DoubleCheck,NA,NA,NA,NA,NA,NA,NA,NA,NA
27119,Polk County,MN,Minnesota,NA,0,NA,NA,NA,0,NA,DoubleCheck,NA,NA,NA,NA,NA,NA,NA,NA,NA
27121,Pope County,MN,Minnesota,NA,0,NA,NA,NA,0,NA,DoubleCheck,NA,NA,NA,NA,NA,NA,NA,NA,NA
27123,Ramsey County,MN,Minnesota,NA,0,NA,NA,NA,1,NA,NA,NA,NA,NA,NA,NA,NA,NA,NA,NA
27125,Red Lake County,MN,Minnesota,NA,0,NA,NA,NA,0,NA,DoubleCheck,NA,NA,NA,NA,NA,NA,NA,NA,NA
27127,Redwood County,MN,Minnesota,NA,0,NA,NA,NA,0,NA,DoubleCheck,NA,NA,NA,NA,NA,NA,NA,NA,NA
27129,Renville County,MN,Minnesota,NA,0,NA,NA,NA,1,NA,NA,NA,NA,NA,NA,NA,NA,NA,NA,NA
27131,Rice County,MN,Minnesota,NA,0,NA,NA,NA,1,NA,NA,NA,NA,NA,NA,NA,NA,NA,NA,NA
27133,Rock County,MN,Minnesota,NA,0,NA,NA,NA,0,NA,DoubleCheck,NA,NA,NA,NA,NA,NA,NA,NA,NA
27135,Roseau County,MN,Minnesota,NA,0,NA,NA,NA,0,NA,DoubleCheck,NA,NA,NA,NA,NA,NA,NA,NA,NA
27137,St. Louis County,MN,Minnesota,NA,0,NA,NA,NA,0,NA,DoubleCheck,NA,NA,NA,NA,NA,NA,NA,NA,NA
27139,Scott County,MN,Minnesota,NA,0,NA,NA,NA,0,NA,DoubleCheck,NA,NA,NA,NA,NA,NA,NA,NA,NA
27141,Sherburne County,MN,Minnesota,shercoph,1,NA,No,No,1,NA,NA,NA,4292061072,Talk with your kids about Severe Weather Prep. Know the facts:  https://t.co/RG65BXEk2N,4/30/2018,10:25:06,https://twitter.com/SherCoPH/status/990960236633690113,2018,4,30
27143,Sibley County,MN,Minnesota,NA,0,NA,NA,NA,0,NA,DoubleCheck,NA,NA,NA,NA,NA,NA,NA,NA,NA
27145,Stearns County,MN,Minnesota,NA,0,NA,NA,NA,0,NA,DoubleCheck,NA,NA,NA,NA,NA,NA,NA,NA,NA
27147,Steele County,MN,Minnesota,NA,0,NA,NA,NA,0,NA,DoubleCheck,NA,NA,NA,NA,NA,NA,NA,NA,NA
27149,Stevens County,MN,Minnesota,NA,0,NA,NA,NA,0,NA,DoubleCheck,NA,NA,NA,NA,NA,NA,NA,NA,NA
27151,Swift County,MN,Minnesota,NA,0,NA,NA,NA,0,NA,DoubleCheck,NA,NA,NA,NA,NA,NA,NA,NA,NA
27153,Todd County,MN,Minnesota,NA,0,NA,NA,NA,0,NA,DoubleCheck,NA,NA,NA,NA,NA,NA,NA,NA,NA
27155,Traverse County,MN,Minnesota,NA,0,NA,NA,NA,0,NA,DoubleCheck,NA,NA,NA,NA,NA,NA,NA,NA,NA
27157,Wabasha County,MN,Minnesota,NA,0,NA,NA,NA,0,NA,DoubleCheck,NA,NA,NA,NA,NA,NA,NA,NA,NA
27159,Wadena County,MN,Minnesota,NA,0,NA,NA,NA,1,NA,NA,NA,NA,NA,NA,NA,NA,NA,NA,NA
27161,Waseca County,MN,Minnesota,NA,0,NA,NA,NA,0,NA,DoubleCheck,NA,NA,NA,NA,NA,NA,NA,NA,NA
27163,Washington County,MN,Minnesota,NA,0,NA,NA,NA,0,NA,DoubleCheck,NA,NA,NA,NA,NA,NA,NA,NA,NA
27165,Watonwan County,MN,Minnesota,NA,0,NA,NA,NA,1,NA,NA,NA,NA,NA,NA,NA,NA,NA,NA,NA
27167,Wilkin County,MN,Minnesota,NA,0,NA,NA,NA,0,NA,DoubleCheck,NA,NA,NA,NA,NA,NA,NA,NA,NA
27169,Winona County,MN,Minnesota,NA,0,NA,NA,NA,1,NA,NA,NA,NA,NA,NA,NA,NA,NA,NA,NA
27171,Wright County,MN,Minnesota,NA,0,NA,NA,NA,1,NA,NA,NA,NA,NA,NA,NA,NA,NA,NA,NA
27173,Yellow Medicine County,MN,Minnesota,NA,0,NA,NA,NA,0,NA,DoubleCheck,NA,NA,NA,NA,NA,NA,NA,NA,NA
28001,Adams County,MS,Mississippi,NA,0,NA,NA,NA,1,NA,NA,NA,NA,NA,NA,NA,NA,NA,NA,NA
28003,Alcorn County,MS,Mississippi,NA,0,NA,NA,NA,1,NA,NA,NA,NA,NA,NA,NA,NA,NA,NA,NA
28005,Amite County,MS,Mississippi,NA,0,NA,NA,NA,1,NA,NA,NA,NA,NA,NA,NA,NA,NA,NA,NA
28007,Attala County,MS,Mississippi,NA,0,NA,NA,NA,1,NA,NA,NA,NA,NA,NA,NA,NA,NA,NA,NA
28009,Benton County,MS,Mississippi,NA,0,NA,NA,NA,0,NA,DoubleCheck,NA,NA,NA,NA,NA,NA,NA,NA,NA
28011,Bolivar County,MS,Mississippi,NA,0,NA,NA,NA,1,NA,NA,NA,NA,NA,NA,NA,NA,NA,NA,NA
28013,Calhoun County,MS,Mississippi,NA,0,NA,NA,NA,1,NA,NA,NA,NA,NA,NA,NA,NA,NA,NA,NA
28015,Carroll County,MS,Mississippi,NA,0,NA,NA,NA,0,NA,DoubleCheck,NA,NA,NA,NA,NA,NA,NA,NA,NA
28017,Chickasaw County,MS,Mississippi,NA,0,NA,NA,NA,0,NA,DoubleCheck,NA,NA,NA,NA,NA,NA,NA,NA,NA
28019,Choctaw County,MS,Mississippi,NA,0,NA,NA,NA,1,NA,NA,NA,NA,NA,NA,NA,NA,NA,NA,NA
28021,Claiborne County,MS,Mississippi,NA,0,NA,NA,NA,1,NA,NA,NA,NA,NA,NA,NA,NA,NA,NA,NA
28023,Clarke County,MS,Mississippi,NA,0,NA,NA,NA,0,NA,DoubleCheck,NA,NA,NA,NA,NA,NA,NA,NA,NA
28025,Clay County,MS,Mississippi,NA,0,NA,NA,NA,0,NA,DoubleCheck,NA,NA,NA,NA,NA,NA,NA,NA,NA
28027,Coahoma County,MS,Mississippi,NA,0,NA,NA,NA,1,NA,NA,NA,NA,NA,NA,NA,NA,NA,NA,NA
28029,Copiah County,MS,Mississippi,NA,0,NA,NA,NA,0,NA,DoubleCheck,NA,NA,NA,NA,NA,NA,NA,NA,NA
28031,Covington County,MS,Mississippi,NA,0,NA,NA,NA,1,NA,NA,NA,NA,NA,NA,NA,NA,NA,NA,NA
28033,DeSoto County,MS,Mississippi,NA,0,NA,NA,NA,0,NA,DoubleCheck,NA,NA,NA,NA,NA,NA,NA,NA,NA
28035,Forrest County,MS,Mississippi,NA,0,NA,NA,NA,0,NA,DoubleCheck,NA,NA,NA,NA,NA,NA,NA,NA,NA
28037,Franklin County,MS,Mississippi,NA,0,NA,NA,NA,0,NA,DoubleCheck,NA,NA,NA,NA,NA,NA,NA,NA,NA
28039,George County,MS,Mississippi,NA,0,NA,NA,NA,1,NA,NA,NA,NA,NA,NA,NA,NA,NA,NA,NA
28041,Greene County,MS,Mississippi,NA,0,NA,NA,NA,0,NA,DoubleCheck,NA,NA,NA,NA,NA,NA,NA,NA,NA
28043,Grenada County,MS,Mississippi,NA,0,NA,NA,NA,0,NA,DoubleCheck,NA,NA,NA,NA,NA,NA,NA,NA,NA
28045,Hancock County,MS,Mississippi,NA,0,NA,NA,NA,0,NA,DoubleCheck,NA,NA,NA,NA,NA,NA,NA,NA,NA
28047,Harrison County,MS,Mississippi,NA,0,NA,NA,NA,1,NA,NA,NA,NA,NA,NA,NA,NA,NA,NA,NA
28049,Hinds County,MS,Mississippi,NA,0,NA,NA,NA,1,NA,NA,NA,NA,NA,NA,NA,NA,NA,NA,NA
28051,Holmes County,MS,Mississippi,NA,0,NA,NA,NA,1,NA,NA,NA,NA,NA,NA,NA,NA,NA,NA,NA
28053,Humphreys County,MS,Mississippi,NA,0,NA,NA,NA,0,NA,DoubleCheck,NA,NA,NA,NA,NA,NA,NA,NA,NA
28055,Issaquena County,MS,Mississippi,NA,0,NA,NA,NA,0,NA,DoubleCheck,NA,NA,NA,NA,NA,NA,NA,NA,NA
28057,Itawamba County,MS,Mississippi,NA,0,NA,NA,NA,0,NA,DoubleCheck,NA,NA,NA,NA,NA,NA,NA,NA,NA
28059,Jackson County,MS,Mississippi,NA,0,NA,NA,NA,1,NA,NA,NA,NA,NA,NA,NA,NA,NA,NA,NA
28061,Jasper County,MS,Mississippi,NA,0,NA,NA,NA,0,NA,DoubleCheck,NA,NA,NA,NA,NA,NA,NA,NA,NA
28063,Jefferson County,MS,Mississippi,NA,0,NA,NA,NA,0,NA,DoubleCheck,NA,NA,NA,NA,NA,NA,NA,NA,NA
28065,Jefferson Davis County,MS,Mississippi,NA,0,NA,NA,NA,0,NA,DoubleCheck,NA,NA,NA,NA,NA,NA,NA,NA,NA
28067,Jones County,MS,Mississippi,NA,0,NA,NA,NA,1,NA,NA,NA,NA,NA,NA,NA,NA,NA,NA,NA
28069,Kemper County,MS,Mississippi,NA,0,NA,NA,NA,1,NA,NA,NA,NA,NA,NA,NA,NA,NA,NA,NA
28071,Lafayette County,MS,Mississippi,NA,0,NA,NA,NA,1,NA,NA,NA,NA,NA,NA,NA,NA,NA,NA,NA
28073,Lamar County,MS,Mississippi,NA,0,NA,NA,NA,0,NA,DoubleCheck,NA,NA,NA,NA,NA,NA,NA,NA,NA
28075,Lauderdale County,MS,Mississippi,NA,0,NA,NA,NA,1,NA,NA,NA,NA,NA,NA,NA,NA,NA,NA,NA
28077,Lawrence County,MS,Mississippi,NA,0,NA,NA,NA,1,NA,NA,NA,NA,NA,NA,NA,NA,NA,NA,NA
28079,Leake County,MS,Mississippi,NA,0,NA,NA,NA,1,NA,NA,NA,NA,NA,NA,NA,NA,NA,NA,NA
28081,Lee County,MS,Mississippi,NA,0,NA,NA,NA,1,NA,NA,NA,NA,NA,NA,NA,NA,NA,NA,NA
28083,Leflore County,MS,Mississippi,NA,0,NA,NA,NA,0,NA,DoubleCheck,NA,NA,NA,NA,NA,NA,NA,NA,NA
28085,Lincoln County,MS,Mississippi,NA,0,NA,NA,NA,1,NA,NA,NA,NA,NA,NA,NA,NA,NA,NA,NA
28087,Lowndes County,MS,Mississippi,NA,0,NA,NA,NA,1,NA,NA,NA,NA,NA,NA,NA,NA,NA,NA,NA
28089,Madison County,MS,Mississippi,NA,0,NA,NA,NA,0,NA,DoubleCheck,NA,NA,NA,NA,NA,NA,NA,NA,NA
28091,Marion County,MS,Mississippi,NA,0,NA,NA,NA,1,NA,NA,NA,NA,NA,NA,NA,NA,NA,NA,NA
28093,Marshall County,MS,Mississippi,NA,0,NA,NA,NA,0,NA,DoubleCheck,NA,NA,NA,NA,NA,NA,NA,NA,NA
28095,Monroe County,MS,Mississippi,NA,0,NA,NA,NA,1,NA,NA,NA,NA,NA,NA,NA,NA,NA,NA,NA
28097,Montgomery County,MS,Mississippi,NA,0,NA,NA,NA,0,NA,DoubleCheck,NA,NA,NA,NA,NA,NA,NA,NA,NA
28099,Neshoba County,MS,Mississippi,NA,0,NA,NA,NA,1,NA,NA,NA,NA,NA,NA,NA,NA,NA,NA,NA
28101,Newton County,MS,Mississippi,NA,0,NA,NA,NA,1,NA,NA,NA,NA,NA,NA,NA,NA,NA,NA,NA
28103,Noxubee County,MS,Mississippi,NA,0,NA,NA,NA,1,NA,NA,NA,NA,NA,NA,NA,NA,NA,NA,NA
28105,Oktibbeha County,MS,Mississippi,NA,0,NA,NA,NA,0,NA,DoubleCheck,NA,NA,NA,NA,NA,NA,NA,NA,NA
28107,Panola County,MS,Mississippi,NA,0,NA,NA,NA,0,NA,DoubleCheck,NA,NA,NA,NA,NA,NA,NA,NA,NA
28109,Pearl River County,MS,Mississippi,NA,0,NA,NA,NA,1,NA,NA,NA,NA,NA,NA,NA,NA,NA,NA,NA
28111,Perry County,MS,Mississippi,NA,0,NA,NA,NA,0,NA,DoubleCheck,NA,NA,NA,NA,NA,NA,NA,NA,NA
28113,Pike County,MS,Mississippi,NA,0,NA,NA,NA,1,NA,NA,NA,NA,NA,NA,NA,NA,NA,NA,NA
28115,Pontotoc County,MS,Mississippi,NA,0,NA,NA,NA,1,NA,NA,NA,NA,NA,NA,NA,NA,NA,NA,NA
28117,Prentiss County,MS,Mississippi,NA,0,NA,NA,NA,0,NA,DoubleCheck,NA,NA,NA,NA,NA,NA,NA,NA,NA
28119,Quitman County,MS,Mississippi,NA,0,NA,NA,NA,0,NA,DoubleCheck,NA,NA,NA,NA,NA,NA,NA,NA,NA
28121,Rankin County,MS,Mississippi,NA,0,NA,NA,NA,1,NA,NA,NA,NA,NA,NA,NA,NA,NA,NA,NA
28123,Scott County,MS,Mississippi,NA,0,NA,NA,NA,1,NA,NA,NA,NA,NA,NA,NA,NA,NA,NA,NA
28125,Sharkey County,MS,Mississippi,NA,0,NA,NA,NA,0,NA,DoubleCheck,NA,NA,NA,NA,NA,NA,NA,NA,NA
28127,Simpson County,MS,Mississippi,NA,0,NA,NA,NA,1,NA,NA,NA,NA,NA,NA,NA,NA,NA,NA,NA
28129,Smith County,MS,Mississippi,NA,0,NA,NA,NA,0,NA,DoubleCheck,NA,NA,NA,NA,NA,NA,NA,NA,NA
28131,Stone County,MS,Mississippi,NA,0,NA,NA,NA,1,NA,NA,NA,NA,NA,NA,NA,NA,NA,NA,NA
28133,Sunflower County,MS,Mississippi,NA,0,NA,NA,NA,0,NA,DoubleCheck,NA,NA,NA,NA,NA,NA,NA,NA,NA
28135,Tallahatchie County,MS,Mississippi,NA,0,NA,NA,NA,0,NA,DoubleCheck,NA,NA,NA,NA,NA,NA,NA,NA,NA
28137,Tate County,MS,Mississippi,NA,0,NA,NA,NA,0,NA,DoubleCheck,NA,NA,NA,NA,NA,NA,NA,NA,NA
28139,Tippah County,MS,Mississippi,NA,0,NA,NA,NA,1,NA,NA,NA,NA,NA,NA,NA,NA,NA,NA,NA
28141,Tishomingo County,MS,Mississippi,NA,0,NA,NA,NA,1,NA,NA,NA,NA,NA,NA,NA,NA,NA,NA,NA
28143,Tunica County,MS,Mississippi,NA,0,NA,NA,NA,0,NA,DoubleCheck,NA,NA,NA,NA,NA,NA,NA,NA,NA
28145,Union County,MS,Mississippi,NA,0,NA,NA,NA,1,NA,NA,NA,NA,NA,NA,NA,NA,NA,NA,NA
28147,Walthall County,MS,Mississippi,NA,0,NA,NA,NA,0,NA,DoubleCheck,NA,NA,NA,NA,NA,NA,NA,NA,NA
28149,Warren County,MS,Mississippi,NA,0,NA,NA,NA,1,NA,NA,NA,NA,NA,NA,NA,NA,NA,NA,NA
28151,Washington County,MS,Mississippi,NA,0,NA,NA,NA,1,NA,NA,NA,NA,NA,NA,NA,NA,NA,NA,NA
28153,Wayne County,MS,Mississippi,NA,0,NA,NA,NA,0,NA,DoubleCheck,NA,NA,NA,NA,NA,NA,NA,NA,NA
28155,Webster County,MS,Mississippi,NA,0,NA,NA,NA,0,NA,DoubleCheck,NA,NA,NA,NA,NA,NA,NA,NA,NA
28157,Wilkinson County,MS,Mississippi,NA,0,NA,NA,NA,0,NA,DoubleCheck,NA,NA,NA,NA,NA,NA,NA,NA,NA
28159,Winston County,MS,Mississippi,NA,0,NA,NA,NA,0,NA,DoubleCheck,NA,NA,NA,NA,NA,NA,NA,NA,NA
28161,Yalobusha County,MS,Mississippi,NA,0,NA,NA,NA,0,NA,DoubleCheck,NA,NA,NA,NA,NA,NA,NA,NA,NA
28163,Yazoo County,MS,Mississippi,NA,0,NA,NA,NA,1,NA,NA,NA,NA,NA,NA,NA,NA,NA,NA,NA
29001,Adair County,MO,Missouri,adair_health,1,NA,Yes,No,1,NA,NA,NA,1.24E+18,https://t.co/Y23WJ3siX0,7/30/2020,12:33:28,https://twitter.com/adair_health/status/1288875365977468931,2020,7,30
29003,Andrew County,MO,Missouri,NA,0,NA,NA,NA,1,NA,NA,NA,NA,NA,NA,NA,NA,NA,NA,NA
29005,Atchison County,MO,Missouri,NA,0,NA,NA,NA,1,NA,NA,NA,NA,NA,NA,NA,NA,NA,NA,NA
29007,Audrain County,MO,Missouri,my_achd,1,NA,Yes,No,1,NA,NA,NA,1.42E+18,"Pins are only available to citizens of Audrain County, MO.",7/26/2021,15:43:06,https://twitter.com/My_ACHD/status/1419745111563513866,2021,7,26
29009,Barry County,MO,Missouri,NA,0,NA,NA,NA,1,NA,NA,NA,NA,NA,NA,NA,NA,NA,NA,NA
29011,Barton County,MO,Missouri,NA,0,NA,NA,NA,1,NA,NA,NA,NA,NA,NA,NA,NA,NA,NA,NA
29013,Bates County,MO,Missouri,NA,0,NA,NA,NA,1,NA,NA,NA,NA,NA,NA,NA,NA,NA,NA,NA
29015,Benton County,MO,Missouri,NA,0,NA,NA,NA,1,NA,NA,NA,NA,NA,NA,NA,NA,NA,NA,NA
29017,Bollinger County,MO,Missouri,NA,0,NA,NA,NA,0,NA,DoubleCheck,NA,NA,NA,NA,NA,NA,NA,NA,NA
29019,Boone County,MO,Missouri,NA,0,NA,NA,NA,1,NA,NA,NA,NA,NA,NA,NA,NA,NA,NA,NA
29021,Buchanan County,MO,Missouri,NA,0,NA,NA,NA,0,NA,DoubleCheck,NA,NA,NA,NA,NA,NA,NA,NA,NA
29023,Butler County,MO,Missouri,butlercohealth,1,DoubleCheck,No,No,0,NA,DoubleCheck,NA,NA,NA,NA,NA,NA,NA,NA,NA
29025,Caldwell County,MO,Missouri,county_caldwell,1,NA,Yes,No,1,NA,NA,NA,1.24E+18,"As of 4pm 3/24/2020, there are no reported positive cases of COVID19 in Caldwell County.  There is also no stay at home ordered for our county as of now.",3/24/2020,17:05:37,https://twitter.com/county_caldwell/status/1242558210927542272,2020,3,24
29027,Callaway County,MO,Missouri,NA,0,NA,NA,NA,1,NA,NA,NA,NA,NA,NA,NA,NA,NA,NA,NA
29029,Camden County,MO,Missouri,NA,0,NA,NA,NA,1,NA,NA,NA,NA,NA,NA,NA,NA,NA,NA,NA
29031,Cape Girardeau County,MO,Missouri,capecohealth,1,NA,Yes,Yes,0,NA,DoubleCheck,NA,266130715,11/24/2021 @ 3PM: COVID-19 Update.  7-Day Positivity Rate = 10.3%.  https://t.co/IhElJLiqyW,11/24/2021,16:19:33,https://twitter.com/CapeCoHealth/status/1463618315239182340,2021,11,24
29033,Carroll County,MO,Missouri,NA,0,NA,NA,NA,0,NA,DoubleCheck,NA,NA,NA,NA,NA,NA,NA,NA,NA
29035,Carter County,MO,Missouri,NA,0,NA,NA,NA,0,NA,DoubleCheck,NA,NA,NA,NA,NA,NA,NA,NA,NA
29037,Cass County,MO,Missouri,NA,0,NA,NA,NA,1,NA,NA,NA,NA,NA,NA,NA,NA,NA,NA,NA
29039,Cedar County,MO,Missouri,NA,0,NA,NA,NA,0,NA,DoubleCheck,NA,NA,NA,NA,NA,NA,NA,NA,NA
29041,Chariton County,MO,Missouri,NA,0,NA,NA,NA,1,NA,NA,NA,NA,NA,NA,NA,NA,NA,NA,NA
29043,Christian County,MO,Missouri,NA,0,NA,NA,NA,1,NA,NA,NA,NA,NA,NA,NA,NA,NA,NA,NA
29045,Clark County,MO,Missouri,NA,0,NA,NA,NA,1,NA,NA,NA,NA,NA,NA,NA,NA,NA,NA,NA
29047,Clay County,MO,Missouri,claymohealth,1,NA,Yes,Yes,0,NA,DoubleCheck,NA,132928701,Avoid a cold turkey. Always use a food thermometer to make sure your turkey is cooked to at least 165 degrees to kill germs that can cause food poisoning.  Learn more about safe meal prep:  https://t.co/OXxQ4B4Zza  https://t.co/HQPeFjuqYh,11/24/2021,13:41:01,https://twitter.com/claymohealth/status/1463578418440716293,2021,11,24
29049,Clinton County,MO,Missouri,NA,0,NA,NA,NA,1,NA,NA,NA,NA,NA,NA,NA,NA,NA,NA,NA
29051,Cole County,MO,Missouri,healthiercole,1,NA,Yes,Yes,1,NA,NA,NA,1308220656,Are you pregnant and not sure how you are going to afford a crib for your baby? Maybe we can help! Call the Cole County Health Department at 636-2181 and ask for our nurse Jill to see if you qualify!  https://t.co/JOTyCveGMq,10/12/2021,16:37:02,https://twitter.com/Healthiercole/status/1448024936363302919,2021,10,12
29053,Cooper County,MO,Missouri,NA,0,NA,NA,NA,1,NA,NA,NA,NA,NA,NA,NA,NA,NA,NA,NA
29055,Crawford County,MO,Missouri,NA,0,NA,NA,NA,0,NA,DoubleCheck,NA,NA,NA,NA,NA,NA,NA,NA,NA
29057,Dade County,MO,Missouri,dadehealthmo,1,DoubleCheck,No,No,1,NA,NA,NA,NA,NA,NA,NA,NA,NA,NA,NA
29059,Dallas County,MO,Missouri,dallascountyhe1,1,DoubleCheck,No,No,1,NA,NA,NA,NA,NA,NA,NA,NA,NA,NA,NA
29061,Daviess County,MO,Missouri,NA,0,NA,NA,NA,1,NA,NA,NA,NA,NA,NA,NA,NA,NA,NA,NA
29063,DeKalb County,MO,Missouri,NA,0,NA,NA,NA,1,NA,NA,Tri-County Health Department - Missouri,NA,NA,NA,NA,NA,NA,NA,NA
29065,Dent County,MO,Missouri,NA,0,NA,NA,NA,0,NA,DoubleCheck,NA,NA,NA,NA,NA,NA,NA,NA,NA
29067,Douglas County,MO,Missouri,NA,0,NA,NA,NA,1,NA,NA,NA,NA,NA,NA,NA,NA,NA,NA,NA
29069,Dunklin County,MO,Missouri,NA,0,NA,NA,NA,1,NA,NA,NA,NA,NA,NA,NA,NA,NA,NA,NA
29071,Franklin County,MO,Missouri,NA,0,NA,NA,NA,1,NA,NA,NA,NA,NA,NA,NA,NA,NA,NA,NA
29073,Gasconade County,MO,Missouri,NA,0,NA,NA,NA,1,NA,NA,NA,NA,NA,NA,NA,NA,NA,NA,NA
29075,Gentry County,MO,Missouri,NA,0,NA,NA,NA,1,NA,NA,Tri-County Health Department - Missouri,NA,NA,NA,NA,NA,NA,NA,NA
29077,Greene County,MO,Missouri,NA,0,NA,NA,NA,1,NA,NA,NA,NA,NA,NA,NA,NA,NA,NA,NA
29079,Grundy County,MO,Missouri,NA,0,NA,NA,NA,0,NA,DoubleCheck,NA,NA,NA,NA,NA,NA,NA,NA,NA
29081,Harrison County,MO,Missouri,NA,0,NA,NA,NA,1,NA,NA,NA,NA,NA,NA,NA,NA,NA,NA,NA
29083,Henry County,MO,Missouri,NA,0,NA,NA,NA,0,NA,DoubleCheck,NA,NA,NA,NA,NA,NA,NA,NA,NA
29085,Hickory County,MO,Missouri,NA,0,NA,NA,NA,1,NA,NA,NA,NA,NA,NA,NA,NA,NA,NA,NA
29087,Holt County,MO,Missouri,NA,0,NA,NA,NA,1,NA,NA,NA,NA,NA,NA,NA,NA,NA,NA,NA
29089,Howard County,MO,Missouri,NA,0,NA,NA,NA,1,NA,NA,NA,NA,NA,NA,NA,NA,NA,NA,NA
29091,Howell County,MO,Missouri,NA,0,NA,NA,NA,0,NA,DoubleCheck,NA,NA,NA,NA,NA,NA,NA,NA,NA
29093,Iron County,MO,Missouri,NA,0,NA,NA,NA,1,NA,NA,NA,NA,NA,NA,NA,NA,NA,NA,NA
29095,Jackson County,MO,Missouri,jacksoncountyhd,1,NA,Yes,Yes,1,NA,NA,NA,3806820266,"Thanksgiving is almost here! 🦃  For those worried about preparing this special meal, @USDA has you covered. Their Meat and Poultry Hotline is available all week + on Thanksgiving Day to answer your questions. Here are some quick tips to stay #foodsafe:  https://t.co/QjM21SFdJr.  https://t.co/hnQqIOnef4",11/24/2021,13:05:51,https://twitter.com/JacksonCountyHD/status/1463569569860128779,2021,11,24
29097,Jasper County,MO,Missouri,NA,0,NA,NA,NA,1,NA,NA,NA,NA,NA,NA,NA,NA,NA,NA,NA
29099,Jefferson County,MO,Missouri,jeffcohealthmo,1,NA,Yes,Yes,0,NA,DoubleCheck,NA,334032791,Week 46 Respiratory Update: COVID County Status- RED This week is the first time we are utilizing our combined respiratory disease surveillance report. This report includes data on both influenza and COVID for Week 46.   Click the link for the full update:  https://t.co/9FxAdvQmmo  https://t.co/ClVuKYNlYB,11/24/2021,15:27:51,https://twitter.com/JeffCoHealthMO/status/1463605303061192717,2021,11,24
29101,Johnson County,MO,Missouri,NA,0,NA,NA,NA,0,NA,DoubleCheck,NA,NA,NA,NA,NA,NA,NA,NA,NA
29103,Knox County,MO,Missouri,NA,0,NA,NA,NA,1,NA,NA,NA,NA,NA,NA,NA,NA,NA,NA,NA
29105,Laclede County,MO,Missouri,NA,0,NA,NA,NA,1,NA,NA,NA,NA,NA,NA,NA,NA,NA,NA,NA
29107,Lafayette County,MO,Missouri,NA,0,NA,NA,NA,1,NA,NA,NA,NA,NA,NA,NA,NA,NA,NA,NA
29109,Lawrence County,MO,Missouri,NA,0,NA,NA,NA,1,NA,NA,NA,NA,NA,NA,NA,NA,NA,NA,NA
29111,Lewis County,MO,Missouri,NA,0,NA,NA,NA,1,NA,NA,NA,NA,NA,NA,NA,NA,NA,NA,NA
29113,Lincoln County,MO,Missouri,lincolncountyhd,1,NA,Yes,Yes,1,NA,NA,NA,1325130608,Cooking for a group this week? Please be sure to keep hot foods at their proper temperature! Cooked foods should be held at or above 140 degrees.  https://t.co/0bNtuBF5Qu,11/24/2021,12:31:10,https://twitter.com/LincolnCountyHD/status/1463560839068536834,2021,11,24
29115,Linn County,MO,Missouri,NA,0,NA,NA,NA,1,NA,NA,NA,NA,NA,NA,NA,NA,NA,NA,NA
29117,Livingston County,MO,Missouri,NA,0,NA,NA,NA,0,NA,DoubleCheck,NA,NA,NA,NA,NA,NA,NA,NA,NA
29119,McDonald County,MO,Missouri,NA,0,NA,NA,NA,1,NA,NA,NA,NA,NA,NA,NA,NA,NA,NA,NA
29121,Macon County,MO,Missouri,maconhealthdept,1,DoubleCheck,No,No,1,NA,NA,NA,NA,NA,NA,NA,NA,NA,NA,NA
29123,Madison County,MO,Missouri,NA,0,NA,NA,NA,0,NA,DoubleCheck,NA,NA,NA,NA,NA,NA,NA,NA,NA
29125,Maries County,MO,Missouri,NA,0,NA,NA,NA,1,NA,NA,NA,NA,NA,NA,NA,NA,NA,NA,NA
29127,Marion County,MO,Missouri,NA,0,NA,NA,NA,1,NA,NA,NA,NA,NA,NA,NA,NA,NA,NA,NA
29129,Mercer County,MO,Missouri,NA,0,NA,NA,NA,1,NA,NA,NA,NA,NA,NA,NA,NA,NA,NA,NA
29131,Miller County,MO,Missouri,NA,0,NA,NA,NA,1,NA,NA,NA,NA,NA,NA,NA,NA,NA,NA,NA
29133,Mississippi County,MO,Missouri,NA,0,NA,NA,NA,1,NA,NA,NA,NA,NA,NA,NA,NA,NA,NA,NA
29135,Moniteau County,MO,Missouri,NA,0,NA,NA,NA,1,NA,NA,NA,NA,NA,NA,NA,NA,NA,NA,NA
29137,Monroe County,MO,Missouri,NA,0,NA,NA,NA,1,NA,NA,NA,NA,NA,NA,NA,NA,NA,NA,NA
29139,Montgomery County,MO,Missouri,NA,0,NA,NA,NA,1,NA,NA,NA,NA,NA,NA,NA,NA,NA,NA,NA
29141,Morgan County,MO,Missouri,NA,0,NA,NA,NA,0,NA,DoubleCheck,NA,NA,NA,NA,NA,NA,NA,NA,NA
29143,New Madrid County,MO,Missouri,NA,0,NA,NA,NA,1,NA,NA,NA,NA,NA,NA,NA,NA,NA,NA,NA
29145,Newton County,MO,Missouri,NA,0,NA,NA,NA,1,NA,NA,NA,NA,NA,NA,NA,NA,NA,NA,NA
29147,Nodaway County,MO,Missouri,NA,0,NA,NA,NA,1,NA,NA,NA,NA,NA,NA,NA,NA,NA,NA,NA
29149,Oregon County,MO,Missouri,NA,0,NA,NA,NA,1,NA,NA,NA,NA,NA,NA,NA,NA,NA,NA,NA
29151,Osage County,MO,Missouri,NA,0,NA,NA,NA,1,NA,NA,NA,NA,NA,NA,NA,NA,NA,NA,NA
29153,Ozark County,MO,Missouri,NA,0,NA,NA,NA,1,NA,NA,NA,NA,NA,NA,NA,NA,NA,NA,NA
29155,Pemiscot County,MO,Missouri,NA,0,NA,NA,NA,0,NA,DoubleCheck,NA,NA,NA,NA,NA,NA,NA,NA,NA
29157,Perry County,MO,Missouri,NA,0,NA,NA,NA,1,NA,NA,NA,NA,NA,NA,NA,NA,NA,NA,NA
29159,Pettis County,MO,Missouri,NA,0,NA,NA,NA,1,NA,NA,NA,NA,NA,NA,NA,NA,NA,NA,NA
29161,Phelps County,MO,Missouri,phelpshealth,1,DoubleCheck,No,No,0,NA,DoubleCheck,NA,NA,NA,NA,NA,NA,NA,NA,NA
29163,Pike County,MO,Missouri,bgpchd,1,NA,Yes,Yes,1,NA,NA,NA,2614624728,Don't forget about our Annual Turkey Trot 5k Run/Walk happening Thanksgiving morning!  - Thanksgiving Morning: 11/25/2021 - Registration @ BG High School 7:00 am - Race Begins @ 8:00 am - $25 Per Person,11/19/2021,12:09:38,https://twitter.com/bgpchd/status/1461743482964430848,2021,11,19
29165,Platte County,MO,Missouri,plattehealth,1,NA,Yes,Yes,0,NA,DoubleCheck,NA,21626834,"REMINDER: We will be closed Thursday, Nov. 25 and Friday, Nov 26 in observance of the Thanksgiving holiday. We will be back open Monday, Nov. 29.  https://t.co/UESmp6d0k8",11/23/2021,17:00:35,https://twitter.com/plattehealth/status/1463266253439655936,2021,11,23
29167,Polk County,MO,Missouri,NA,0,NA,NA,NA,0,NA,DoubleCheck,NA,NA,NA,NA,NA,NA,NA,NA,NA
29169,Pulaski County,MO,Missouri,NA,0,NA,NA,NA,0,NA,DoubleCheck,NA,NA,NA,NA,NA,NA,NA,NA,NA
29171,Putnam County,MO,Missouri,NA,0,NA,NA,NA,1,NA,NA,NA,NA,NA,NA,NA,NA,NA,NA,NA
29173,Ralls County,MO,Missouri,NA,0,NA,NA,NA,0,NA,DoubleCheck,NA,NA,NA,NA,NA,NA,NA,NA,NA
29175,Randolph County,MO,Missouri,randolphchd,1,DoubleCheck,No,No,1,NA,NA,NA,NA,NA,NA,NA,NA,NA,NA,NA
29177,Ray County,MO,Missouri,NA,0,NA,NA,NA,1,NA,NA,NA,NA,NA,NA,NA,NA,NA,NA,NA
29179,Reynolds County,MO,Missouri,NA,0,NA,NA,NA,0,NA,DoubleCheck,NA,NA,NA,NA,NA,NA,NA,NA,NA
29181,Ripley County,MO,Missouri,NA,0,NA,NA,NA,0,NA,DoubleCheck,NA,NA,NA,NA,NA,NA,NA,NA,NA
29183,St. Charles County,MO,Missouri,scchealth,1,NA,Yes,Yes,0,NA,DoubleCheck,NA,46204875,Reminder:  All St. Charles County Public Health facilities and clinics — including the Pet Adoption Center and Recycle Works facilities — are closed Thurs through Sunday (11/25/21 through 11/28/21) for the Thanksgiving holiday.  https://t.co/gJv0O2oANF,11/24/2021,18:00:00,https://twitter.com/SCCHealth/status/1463643595223748612,2021,11,24
29185,St. Clair County,MO,Missouri,NA,0,NA,NA,NA,0,NA,DoubleCheck,NA,NA,NA,NA,NA,NA,NA,NA,NA
29186,Ste. Genevieve County,MO,Missouri,NA,0,NA,NA,NA,1,NA,NA,NA,NA,NA,NA,NA,NA,NA,NA,NA
29187,St. Francois County,MO,Missouri,NA,0,NA,NA,NA,1,NA,NA,NA,NA,NA,NA,NA,NA,NA,NA,NA
29189,St. Louis County,MO,Missouri,stlcountydoh,1,NA,Yes,Yes,1,NA,NA,NA,76351588,"DPH offices, clinics and testing sites will be closed November 25 and November 26 in observance of Thanksgiving. We will resume normal business hours and operation on Monday, November 29.  https://t.co/Gj97FR0W63",11/24/2021,18:00:24,https://twitter.com/StLCountyDOH/status/1463643694570086400,2021,11,24
29195,Saline County,MO,Missouri,NA,0,NA,NA,NA,1,NA,NA,NA,NA,NA,NA,NA,NA,NA,NA,NA
29197,Schuyler County,MO,Missouri,NA,0,NA,NA,NA,1,NA,NA,NA,NA,NA,NA,NA,NA,NA,NA,NA
29199,Scotland County,MO,Missouri,NA,0,NA,NA,NA,1,NA,NA,NA,NA,NA,NA,NA,NA,NA,NA,NA
29201,Scott County,MO,Missouri,NA,0,NA,NA,NA,1,NA,NA,NA,NA,NA,NA,NA,NA,NA,NA,NA
29203,Shannon County,MO,Missouri,NA,0,NA,NA,NA,0,NA,DoubleCheck,NA,NA,NA,NA,NA,NA,NA,NA,NA
29205,Shelby County,MO,Missouri,NA,0,NA,NA,NA,1,NA,NA,NA,NA,NA,NA,NA,NA,NA,NA,NA
29207,Stoddard County,MO,Missouri,NA,0,NA,NA,NA,0,NA,DoubleCheck,NA,NA,NA,NA,NA,NA,NA,NA,NA
29209,Stone County,MO,Missouri,NA,0,NA,NA,NA,1,NA,NA,NA,NA,NA,NA,NA,NA,NA,NA,NA
29211,Sullivan County,MO,Missouri,NA,0,NA,NA,NA,1,NA,NA,NA,NA,NA,NA,NA,NA,NA,NA,NA
29213,Taney County,MO,Missouri,taneycohealth,1,DoubleCheck,No,No,1,NA,NA,NA,NA,NA,NA,NA,NA,NA,NA,NA
29215,Texas County,MO,Missouri,NA,0,NA,NA,NA,1,NA,NA,NA,NA,NA,NA,NA,NA,NA,NA,NA
29217,Vernon County,MO,Missouri,NA,0,NA,NA,NA,0,NA,DoubleCheck,NA,NA,NA,NA,NA,NA,NA,NA,NA
29219,Warren County,MO,Missouri,wchdmo,1,NA,Yes,No,1,NA,NA,NA,2319139812,Limited Appointment Spots- CALL TODAY to schedule your kids back to school shots NOW!  https://t.co/quZRVo8BHT,6/29/2020,15:06:27,https://twitter.com/WCHDMO/status/1277679844235542533,2020,6,29
29221,Washington County,MO,Missouri,NA,0,NA,NA,NA,1,NA,NA,NA,NA,NA,NA,NA,NA,NA,NA,NA
29223,Wayne County,MO,Missouri,NA,0,NA,NA,NA,0,NA,DoubleCheck,NA,NA,NA,NA,NA,NA,NA,NA,NA
29225,Webster County,MO,Missouri,NA,0,NA,NA,NA,0,NA,DoubleCheck,NA,NA,NA,NA,NA,NA,NA,NA,NA
29227,Worth County,MO,Missouri,NA,0,NA,NA,NA,1,NA,NA,Tri-County Health Department - Missouri,NA,NA,NA,NA,NA,NA,NA,NA
29229,Wright County,MO,Missouri,NA,0,NA,NA,NA,1,NA,NA,NA,NA,NA,NA,NA,NA,NA,NA,NA
29510,St. Louis city,MO,Missouri,NA,0,NA,NA,NA,1,NA,DoubleCheck,NA,NA,NA,NA,NA,NA,NA,NA,NA
30001,Beaverhead County,MT,Montana,NA,0,NA,NA,NA,1,NA,NA,NA,NA,NA,NA,NA,NA,NA,NA,NA
30003,Big Horn County,MT,Montana,NA,0,NA,NA,NA,1,NA,NA,NA,NA,NA,NA,NA,NA,NA,NA,NA
30005,Blaine County,MT,Montana,NA,0,NA,NA,NA,1,NA,NA,NA,NA,NA,NA,NA,NA,NA,NA,NA
30007,Broadwater County,MT,Montana,NA,0,NA,NA,NA,0,NA,DoubleCheck,NA,NA,NA,NA,NA,NA,NA,NA,NA
30009,Carbon County,MT,Montana,NA,0,NA,NA,NA,1,NA,NA,NA,NA,NA,NA,NA,NA,NA,NA,NA
30011,Carter County,MT,Montana,NA,0,NA,NA,NA,0,NA,DoubleCheck,NA,NA,NA,NA,NA,NA,NA,NA,NA
30013,Cascade County,MT,Montana,cchdmt,1,NA,Yes,Yes,1,NA,NA,NA,1.06E+18,"Good afternoon, Cascade County! Here is your weekly COVID-19 report. Big drop in new cases this week!! 🙌  https://t.co/dHDROYhFFZ",11/24/2021,15:51:30,https://twitter.com/CCHDMT/status/1463611256590553088,2021,11,24
30015,Chouteau County,MT,Montana,NA,0,NA,NA,NA,1,NA,NA,NA,NA,NA,NA,NA,NA,NA,NA,NA
30017,Custer County,MT,Montana,NA,0,NA,NA,NA,0,NA,DoubleCheck,NA,NA,NA,NA,NA,NA,NA,NA,NA
30019,Daniels County,MT,Montana,NA,0,NA,NA,NA,1,NA,NA,NA,NA,NA,NA,NA,NA,NA,NA,NA
30021,Dawson County,MT,Montana,NA,0,NA,NA,NA,1,NA,NA,NA,NA,NA,NA,NA,NA,NA,NA,NA
30023,Deer Lodge County,MT,Montana,NA,0,NA,NA,NA,1,NA,NA,NA,NA,NA,NA,NA,NA,NA,NA,NA
30025,Fallon County,MT,Montana,NA,0,NA,NA,NA,1,NA,NA,NA,NA,NA,NA,NA,NA,NA,NA,NA
30027,Fergus County,MT,Montana,NA,0,NA,NA,NA,0,NA,DoubleCheck,NA,NA,NA,NA,NA,NA,NA,NA,NA
30029,Flathead County,MT,Montana,NA,0,NA,NA,NA,1,NA,NA,NA,NA,NA,NA,NA,NA,NA,NA,NA
30031,Gallatin County,MT,Montana,gallatinhealth,1,NA,Yes,Yes,1,NA,NA,NA,36702724,The Gallatin City-County Health Department is saddened to announce that one more Gallatin County resident has passed away from complications due to COVID-19.  See the full press release here:  https://t.co/BtExmxU5Hk  https://t.co/BfX4ilIMul,11/23/2021,18:10:00,https://twitter.com/GallatinHealth/status/1463283720865996800,2021,11,23
30033,Garfield County,MT,Montana,NA,0,NA,NA,NA,1,NA,NA,NA,NA,NA,NA,NA,NA,NA,NA,NA
30035,Glacier County,MT,Montana,NA,0,NA,NA,NA,1,NA,NA,NA,NA,NA,NA,NA,NA,NA,NA,NA
30037,Golden Valley County,MT,Montana,NA,0,NA,NA,NA,0,NA,DoubleCheck,NA,NA,NA,NA,NA,NA,NA,NA,NA
30039,Granite County,MT,Montana,NA,0,NA,NA,NA,0,NA,DoubleCheck,NA,NA,NA,NA,NA,NA,NA,NA,NA
30041,Hill County,MT,Montana,NA,0,NA,NA,NA,1,NA,NA,NA,NA,NA,NA,NA,NA,NA,NA,NA
30043,Jefferson County,MT,Montana,county_mt,1,DoubleCheck,No,No,1,NA,NA,NA,NA,NA,NA,NA,NA,NA,NA,NA
30045,Judith Basin County,MT,Montana,NA,0,NA,NA,NA,0,NA,DoubleCheck,NA,NA,NA,NA,NA,NA,NA,NA,NA
30047,Lake County,MT,Montana,NA,0,NA,NA,NA,1,NA,NA,NA,NA,NA,NA,NA,NA,NA,NA,NA
30049,Lewis and Clark County,MT,Montana,NA,0,NA,NA,NA,0,NA,DoubleCheck,NA,NA,NA,NA,NA,NA,NA,NA,NA
30051,Liberty County,MT,Montana,NA,0,NA,NA,NA,1,NA,NA,NA,NA,NA,NA,NA,NA,NA,NA,NA
30053,Lincoln County,MT,Montana,NA,0,NA,NA,NA,1,NA,NA,NA,NA,NA,NA,NA,NA,NA,NA,NA
30055,McCone County,MT,Montana,NA,0,NA,NA,NA,0,NA,DoubleCheck,NA,NA,NA,NA,NA,NA,NA,NA,NA
30057,Madison County,MT,Montana,NA,0,NA,NA,NA,1,NA,NA,NA,NA,NA,NA,NA,NA,NA,NA,NA
30059,Meagher County,MT,Montana,NA,0,NA,NA,NA,1,NA,NA,NA,NA,NA,NA,NA,NA,NA,NA,NA
30061,Mineral County,MT,Montana,NA,0,NA,NA,NA,1,NA,NA,NA,NA,NA,NA,NA,NA,NA,NA,NA
30063,Missoula County,MT,Montana,NA,0,NA,NA,NA,1,NA,NA,NA,NA,NA,NA,NA,NA,NA,NA,NA
30065,Musselshell County,MT,Montana,NA,0,NA,NA,NA,0,NA,DoubleCheck,NA,NA,NA,NA,NA,NA,NA,NA,NA
30067,Park County,MT,Montana,NA,0,NA,NA,NA,1,NA,NA,NA,NA,NA,NA,NA,NA,NA,NA,NA
30069,Petroleum County,MT,Montana,NA,0,NA,NA,NA,0,NA,DoubleCheck,NA,NA,NA,NA,NA,NA,NA,NA,NA
30071,Phillips County,MT,Montana,NA,0,NA,NA,NA,1,NA,NA,NA,NA,NA,NA,NA,NA,NA,NA,NA
30073,Pondera County,MT,Montana,NA,0,NA,NA,NA,1,NA,NA,NA,NA,NA,NA,NA,NA,NA,NA,NA
30075,Powder River County,MT,Montana,NA,0,NA,NA,NA,0,NA,DoubleCheck,NA,NA,NA,NA,NA,NA,NA,NA,NA
30077,Powell County,MT,Montana,NA,0,NA,NA,NA,0,NA,DoubleCheck,NA,NA,NA,NA,NA,NA,NA,NA,NA
30079,Prairie County,MT,Montana,NA,0,NA,NA,NA,0,NA,DoubleCheck,NA,NA,NA,NA,NA,NA,NA,NA,NA
30081,Ravalli County,MT,Montana,NA,0,NA,NA,NA,1,NA,NA,NA,NA,NA,NA,NA,NA,NA,NA,NA
30083,Richland County,MT,Montana,NA,0,NA,NA,NA,1,NA,NA,NA,NA,NA,NA,NA,NA,NA,NA,NA
30085,Roosevelt County,MT,Montana,NA,0,NA,NA,NA,1,NA,NA,NA,NA,NA,NA,NA,NA,NA,NA,NA
30087,Rosebud County,MT,Montana,NA,0,NA,NA,NA,0,NA,DoubleCheck,NA,NA,NA,NA,NA,NA,NA,NA,NA
30089,Sanders County,MT,Montana,NA,0,NA,NA,NA,0,NA,DoubleCheck,NA,NA,NA,NA,NA,NA,NA,NA,NA
30091,Sheridan County,MT,Montana,NA,0,NA,NA,NA,1,NA,NA,NA,NA,NA,NA,NA,NA,NA,NA,NA
30093,Silver Bow County,MT,Montana,NA,0,NA,NA,NA,1,NA,NA,NA,NA,NA,NA,NA,NA,NA,NA,NA
30095,Stillwater County,MT,Montana,NA,0,NA,NA,NA,0,NA,DoubleCheck,NA,NA,NA,NA,NA,NA,NA,NA,NA
30097,Sweet Grass County,MT,Montana,NA,0,NA,NA,NA,1,NA,NA,NA,NA,NA,NA,NA,NA,NA,NA,NA
30099,Teton County,MT,Montana,NA,0,NA,NA,NA,1,NA,NA,NA,NA,NA,NA,NA,NA,NA,NA,NA
30101,Toole County,MT,Montana,NA,0,NA,NA,NA,1,NA,NA,NA,NA,NA,NA,NA,NA,NA,NA,NA
30103,Treasure County,MT,Montana,NA,0,NA,NA,NA,0,NA,DoubleCheck,NA,NA,NA,NA,NA,NA,NA,NA,NA
30105,Valley County,MT,Montana,NA,0,NA,NA,NA,1,NA,NA,NA,NA,NA,NA,NA,NA,NA,NA,NA
30107,Wheatland County,MT,Montana,NA,0,NA,NA,NA,0,NA,DoubleCheck,NA,NA,NA,NA,NA,NA,NA,NA,NA
30109,Wibaux County,MT,Montana,NA,0,NA,NA,NA,1,NA,NA,NA,NA,NA,NA,NA,NA,NA,NA,NA
30111,Yellowstone County,MT,Montana,NA,0,NA,NA,NA,0,NA,DoubleCheck,NA,NA,NA,NA,NA,NA,NA,NA,NA
31001,Adams County,NE,Nebraska,shdhdhealth,1,NA,Yes,Yes,1,NA,NA,South Heartland Health District - Nebraska,3010816881,"Every year, flu vaccination prevents illnesses, medical visits, hospitalizations, and deaths. Get your flu vaccine!  https://t.co/Bl6AXsJa3I",10/24/2021,13:00:00,https://twitter.com/shdhdhealth/status/1452318971294797836,2021,10,24
31003,Antelope County,NE,Nebraska,ncdhealth,1,NA,Yes,Yes,1,NA,NA,North Central Health District - Nebraska,7.06E+17,"Becky started smoking cigarettes in high school and now suffers from chronic obstructive pulmonary disease (COPD). This COPD Awareness Month, make a plan to quit smoking and reduce your risk for respiratory diseases. #CDCTips #NEQuitline  https://t.co/gm20Am2VgY",11/22/2021,17:00:00,https://twitter.com/ncdhealth/status/1462903717452083201,2021,11,22
31005,Arthur County,NE,Nebraska,wcdhd,1,NA,Yes,Yes,1,NA,NA,West Central District Health Department - Nebraska,515958611,"#WCDHDvaccine #COVID19 #Vaccine clinics happening this week!  For future clinic dates, see the WCDHD event calendar:  https://t.co/MPa9zoHMVE  **Please be sure to read all details of the specific clinic**  https://t.co/bHApYKQQ2g",11/22/2021,9:00:00,https://twitter.com/WCDHD/status/1462782921652248588,2021,11,22
31007,Banner County,NE,Nebraska,NA,0,NA,NA,NA,1,NA,NA,Panhandle Public Health District - Nebraska,NA,NA,NA,NA,NA,NA,NA,NA
31009,Blaine County,NE,Nebraska,lbphd,1,NA,No,No,1,NA,Outdated-Add District,Loup Basin Public Health Department - Nebraska,49687591,https://t.co/ZcD1y0VzrQ,6/26/2019,16:28:14,https://twitter.com/LBPHD/status/1143979303324925952,2019,6,26
31011,Boone County,NE,Nebraska,NA,0,NA,NA,NA,1,NA,NA,East Central District Health Department - Nebraska,NA,NA,NA,NA,NA,NA,NA,NA
31013,Box Butte County,NE,Nebraska,NA,0,NA,NA,NA,1,NA,NA,Panhandle Public Health District - Nebraska,NA,NA,NA,NA,NA,NA,NA,NA
31015,Boyd County,NE,Nebraska,ncdhealth,1,NA,Yes,Yes,1,NA,NA,North Central Health District - Nebraska,7.06E+17,"Becky started smoking cigarettes in high school and now suffers from chronic obstructive pulmonary disease (COPD). This COPD Awareness Month, make a plan to quit smoking and reduce your risk for respiratory diseases. #CDCTips #NEQuitline  https://t.co/gm20Am2VgY",11/22/2021,17:00:00,https://twitter.com/ncdhealth/status/1462903717452083201,2021,11,22
31017,Brown County,NE,Nebraska,ncdhealth,1,NA,Yes,Yes,1,NA,NA,North Central Health District - Nebraska,7.06E+17,"Becky started smoking cigarettes in high school and now suffers from chronic obstructive pulmonary disease (COPD). This COPD Awareness Month, make a plan to quit smoking and reduce your risk for respiratory diseases. #CDCTips #NEQuitline  https://t.co/gm20Am2VgY",11/22/2021,17:00:00,https://twitter.com/ncdhealth/status/1462903717452083201,2021,11,22
31019,Buffalo County,NE,Nebraska,trpublichealth,1,NA,Yes,No,1,NA,NA,Two Rivers Public Health Department - Nebraska,116565463,"Congratulations, Lt. Kowalek!",9/14/2021,9:57:05,https://twitter.com/TRPublicHealth/status/1437777425618833423,2021,9,14
31021,Burt County,NE,Nebraska,elvphd,1,NA,Yes,No,1,NA,NA,Elkhorn Logan Valley Public Health Department - Nebraska,409523475,https://t.co/hUORF2eYrS,3/22/2021,19:16:26,https://twitter.com/ELVPHD/status/1374137926121033729,2021,3,22
31023,Butler County,NE,Nebraska,fc_healthdept,1,NA,Yes,Yes,1,NA,NA,Four Corners Health Department - Nebraska,2241443028,"It's COVID-19 Vaccine Day at Four Corners!  Stop in to get your vaccine from 12pm - 4pm on Tuesday, November 23rd.  We will not have a vaccination clinic on Friday, November 26th, but clinic Tuesday/Friday 12-4 schedule will resume next week.   https://t.co/Z0RwcE2xNO",11/23/2021,12:09:28,https://twitter.com/FC_HealthDept/status/1463192990353133580,2021,11,23
31025,Cass County,NE,Nebraska,sarpycasshealth,1,NA,Yes,Yes,1,NA,NA,Sarpy-Cass Health Department - Nebraska,2871716635,https://t.co/jZH1rKesmo,11/22/2021,13:10:00,https://twitter.com/SarpyCassHealth/status/1462845835872329728,2021,11,22
31027,Cedar County,NE,Nebraska,nnephd,1,NA,No,No,1,NA,Outdated-Add District,Northeast Nebraska Public Health Department,3805186934,"Turn Around Don’t Drown Know What to do Before, During and After a Flood  https://t.co/FNO8pVxckz",3/13/2019,9:54:21,https://twitter.com/NNEPHD/status/1105829451978428416,2019,3,13
31029,Chase County,NE,Nebraska,swpublichealth,1,NA,Yes,Yes,1,NA,NA,Southwest Nebraska Public Health Department,475178622,Give them each their own cutting board. #FoodSafety  https://t.co/lsauVPyMlJ,11/24/2021,15:10:05,https://twitter.com/swpublichealth/status/1463600831039684609,2021,11,24
31031,Cherry County,NE,Nebraska,ncdhealth,1,NA,Yes,Yes,1,NA,NA,North Central Health District - Nebraska,7.06E+17,"Becky started smoking cigarettes in high school and now suffers from chronic obstructive pulmonary disease (COPD). This COPD Awareness Month, make a plan to quit smoking and reduce your risk for respiratory diseases. #CDCTips #NEQuitline  https://t.co/gm20Am2VgY",11/22/2021,17:00:00,https://twitter.com/ncdhealth/status/1462903717452083201,2021,11,22
31033,Cheyenne County,NE,Nebraska,NA,0,NA,NA,NA,1,NA,NA,Panhandle Public Health District - Nebraska,NA,NA,NA,NA,NA,NA,NA,NA
31035,Clay County,NE,Nebraska,shdhdhealth,1,NA,Yes,Yes,1,NA,NA,South Heartland Health District - Nebraska,3010816881,"Every year, flu vaccination prevents illnesses, medical visits, hospitalizations, and deaths. Get your flu vaccine!  https://t.co/Bl6AXsJa3I",10/24/2021,13:00:00,https://twitter.com/shdhdhealth/status/1452318971294797836,2021,10,24
31037,Colfax County,NE,Nebraska,NA,0,NA,NA,NA,1,NA,NA,East Central District Health Department - Nebraska,NA,NA,NA,NA,NA,NA,NA,NA
31039,Cuming County,NE,Nebraska,elvphd,1,NA,Yes,No,1,NA,NA,Elkhorn Logan Valley Public Health Department - Nebraska,409523475,https://t.co/hUORF2eYrS,3/22/2021,19:16:26,https://twitter.com/ELVPHD/status/1374137926121033729,2021,3,22
31041,Custer County,NE,Nebraska,lbphd,1,NA,No,No,1,NA,Outdated-Add District,Loup Basin Public Health Department - Nebraska,49687591,https://t.co/ZcD1y0VzrQ,6/26/2019,16:28:14,https://twitter.com/LBPHD/status/1143979303324925952,2019,6,26
31043,Dakota County,NE,Nebraska,NA,0,NA,NA,NA,1,NA,NA,NA,NA,NA,NA,NA,NA,NA,NA,NA
31045,Dawes County,NE,Nebraska,NA,0,NA,NA,NA,1,NA,NA,Panhandle Public Health District - Nebraska,NA,NA,NA,NA,NA,NA,NA,NA
31047,Dawson County,NE,Nebraska,trpublichealth,1,NA,Yes,No,1,NA,NA,Two Rivers Public Health Department - Nebraska,116565463,"Congratulations, Lt. Kowalek!",9/14/2021,9:57:05,https://twitter.com/TRPublicHealth/status/1437777425618833423,2021,9,14
31049,Deuel County,NE,Nebraska,NA,0,NA,NA,NA,1,NA,NA,Panhandle Public Health District - Nebraska,NA,NA,NA,NA,NA,NA,NA,NA
31051,Dixon County,NE,Nebraska,nnephd,1,NA,No,No,1,NA,Outdated-Add District,Northeast Nebraska Public Health Department,3805186934,"Turn Around Don’t Drown Know What to do Before, During and After a Flood  https://t.co/FNO8pVxckz",3/13/2019,9:54:21,https://twitter.com/NNEPHD/status/1105829451978428416,2019,3,13
31053,Dodge County,NE,Nebraska,threerivers_ph,1,NA,Yes,Yes,1,NA,NA,Three Rivers Public Health - Nebraska,4714971972,"Question:  I have been around someone who is positive for COVID-19 and I am not vaccinated, what do I do?  Visit  https://t.co/Jzibhw4zsT to learn more.  https://t.co/UQVnAgR8S5",11/24/2021,16:30:06,https://twitter.com/threerivers_ph/status/1463620968769802240,2021,11,24
31055,Douglas County,NE,Nebraska,healthdouglasco,1,NA,Yes,Yes,1,NA,NA,NA,2178680628,Today's #Covid19 Update is right here:  https://t.co/RXCstO2YcW @DouglasCountyNE @UNMC @NEDHHS @OmahaScanner @OmahaFire @OWHnews @DCSheriffNE @KETV @WOWT6News @FOX42KPTM  https://t.co/2oH8qPud3L,11/24/2021,15:30:06,https://twitter.com/HealthDouglasCo/status/1463605868923138054,2021,11,24
31057,Dundy County,NE,Nebraska,swpublichealth,1,NA,Yes,Yes,1,NA,NA,Southwest Nebraska Public Health Department,475178622,Give them each their own cutting board. #FoodSafety  https://t.co/lsauVPyMlJ,11/24/2021,15:10:05,https://twitter.com/swpublichealth/status/1463600831039684609,2021,11,24
31059,Fillmore County,NE,Nebraska,phshealthdept,1,NA,No,No,1,NA,NA,Public Health Solutions - Nebraska,27115268,Meet some of the new faces at the health department! Welcome to the team!  https://t.co/bpdwhdAb30,1/23/2020,13:18:15,https://twitter.com/PHSHealthDept/status/1220410431589822464,2020,1,23
31061,Franklin County,NE,Nebraska,trpublichealth,1,NA,Yes,No,1,NA,NA,Two Rivers Public Health Department - Nebraska,116565463,"Congratulations, Lt. Kowalek!",9/14/2021,9:57:05,https://twitter.com/TRPublicHealth/status/1437777425618833423,2021,9,14
31063,Frontier County,NE,Nebraska,swpublichealth,1,NA,Yes,Yes,1,NA,NA,Southwest Nebraska Public Health Department,475178622,Give them each their own cutting board. #FoodSafety  https://t.co/lsauVPyMlJ,11/24/2021,15:10:05,https://twitter.com/swpublichealth/status/1463600831039684609,2021,11,24
31065,Furnas County,NE,Nebraska,swpublichealth,1,NA,Yes,Yes,1,NA,NA,Southwest Nebraska Public Health Department,475178622,Give them each their own cutting board. #FoodSafety  https://t.co/lsauVPyMlJ,11/24/2021,15:10:05,https://twitter.com/swpublichealth/status/1463600831039684609,2021,11,24
31067,Gage County,NE,Nebraska,phshealthdept,1,NA,No,No,1,NA,NA,Public Health Solutions - Nebraska,27115268,Meet some of the new faces at the health department! Welcome to the team!  https://t.co/bpdwhdAb30,1/23/2020,13:18:15,https://twitter.com/PHSHealthDept/status/1220410431589822464,2020,1,23
31069,Garden County,NE,Nebraska,NA,0,NA,NA,NA,1,NA,NA,Panhandle Public Health District - Nebraska,NA,NA,NA,NA,NA,NA,NA,NA
31071,Garfield County,NE,Nebraska,lbphd,1,NA,No,No,1,NA,Outdated-Add District,Loup Basin Public Health Department - Nebraska,49687591,https://t.co/ZcD1y0VzrQ,6/26/2019,16:28:14,https://twitter.com/LBPHD/status/1143979303324925952,2019,6,26
31073,Gosper County,NE,Nebraska,trpublichealth,1,NA,Yes,No,1,NA,NA,Two Rivers Public Health Department - Nebraska,116565463,"Congratulations, Lt. Kowalek!",9/14/2021,9:57:05,https://twitter.com/TRPublicHealth/status/1437777425618833423,2021,9,14
31075,Grant County,NE,Nebraska,NA,0,NA,NA,NA,0,NA,NA,NA,NA,NA,NA,NA,NA,NA,NA,NA
31077,Greeley County,NE,Nebraska,lbphd,1,NA,No,No,1,NA,Outdated-Add District,Loup Basin Public Health Department - Nebraska,49687591,https://t.co/ZcD1y0VzrQ,6/26/2019,16:28:14,https://twitter.com/LBPHD/status/1143979303324925952,2019,6,26
31079,Hall County,NE,Nebraska,NA,0,NA,NA,NA,1,NA,NA,Central District Health Department - Nebraska,NA,NA,NA,NA,NA,NA,NA,NA
31081,Hamilton County,NE,Nebraska,NA,0,NA,NA,NA,1,NA,NA,Central District Health Department - Nebraska,NA,NA,NA,NA,NA,NA,NA,NA
31083,Harlan County,NE,Nebraska,trpublichealth,1,NA,Yes,No,1,NA,NA,Two Rivers Public Health Department - Nebraska,116565463,"Congratulations, Lt. Kowalek!",9/14/2021,9:57:05,https://twitter.com/TRPublicHealth/status/1437777425618833423,2021,9,14
31085,Hayes County,NE,Nebraska,swpublichealth,1,NA,Yes,Yes,1,NA,NA,Southwest Nebraska Public Health Department,475178622,Give them each their own cutting board. #FoodSafety  https://t.co/lsauVPyMlJ,11/24/2021,15:10:05,https://twitter.com/swpublichealth/status/1463600831039684609,2021,11,24
31087,Hitchcock County,NE,Nebraska,swpublichealth,1,NA,Yes,Yes,1,NA,NA,Southwest Nebraska Public Health Department,475178622,Give them each their own cutting board. #FoodSafety  https://t.co/lsauVPyMlJ,11/24/2021,15:10:05,https://twitter.com/swpublichealth/status/1463600831039684609,2021,11,24
31089,Holt County,NE,Nebraska,ncdhealth,1,NA,Yes,Yes,1,NA,NA,North Central Health District - Nebraska,7.06E+17,"Becky started smoking cigarettes in high school and now suffers from chronic obstructive pulmonary disease (COPD). This COPD Awareness Month, make a plan to quit smoking and reduce your risk for respiratory diseases. #CDCTips #NEQuitline  https://t.co/gm20Am2VgY",11/22/2021,17:00:00,https://twitter.com/ncdhealth/status/1462903717452083201,2021,11,22
31091,Hooker County,NE,Nebraska,wcdhd,1,NA,Yes,Yes,1,NA,NA,West Central District Health Department - Nebraska,515958611,"#WCDHDvaccine #COVID19 #Vaccine clinics happening this week!  For future clinic dates, see the WCDHD event calendar:  https://t.co/MPa9zoHMVE  **Please be sure to read all details of the specific clinic**  https://t.co/bHApYKQQ2g",11/22/2021,9:00:00,https://twitter.com/WCDHD/status/1462782921652248588,2021,11,22
31093,Howard County,NE,Nebraska,lbphd,1,NA,No,No,1,NA,Outdated-Add District,Loup Basin Public Health Department - Nebraska,49687591,https://t.co/ZcD1y0VzrQ,6/26/2019,16:28:14,https://twitter.com/LBPHD/status/1143979303324925952,2019,6,26
31095,Jefferson County,NE,Nebraska,phshealthdept,1,NA,No,No,1,NA,NA,Public Health Solutions - Nebraska,27115268,Meet some of the new faces at the health department! Welcome to the team!  https://t.co/bpdwhdAb30,1/23/2020,13:18:15,https://twitter.com/PHSHealthDept/status/1220410431589822464,2020,1,23
31097,Johnson County,NE,Nebraska,sedisthd,1,NA,Yes,Yes,1,NA,NA,Southeast Health District - Nebraska,4895232027,"In observance of Thanksgiving, our offices will be closed from Thursday, Nov. 25th through Sunday, Nov. 28th. We will resume normal hours on Monday, November 29th. Happy Thanksgiving!!  Message from the Southeast District Health Department. Cooperating for Your Good Health.  https://t.co/ablAuh5ftg",11/24/2021,18:10:00,https://twitter.com/SEDistHD/status/1463646108760956931,2021,11,24
31099,Kearney County,NE,Nebraska,trpublichealth,1,NA,Yes,No,1,NA,NA,Two Rivers Public Health Department - Nebraska,116565463,"Congratulations, Lt. Kowalek!",9/14/2021,9:57:05,https://twitter.com/TRPublicHealth/status/1437777425618833423,2021,9,14
31101,Keith County,NE,Nebraska,swpublichealth,1,NA,Yes,Yes,1,NA,NA,Southwest Nebraska Public Health Department,475178622,Give them each their own cutting board. #FoodSafety  https://t.co/lsauVPyMlJ,11/24/2021,15:10:05,https://twitter.com/swpublichealth/status/1463600831039684609,2021,11,24
31103,Keya Paha County,NE,Nebraska,ncdhealth,1,NA,Yes,Yes,1,NA,NA,North Central Health District - Nebraska,7.06E+17,"Becky started smoking cigarettes in high school and now suffers from chronic obstructive pulmonary disease (COPD). This COPD Awareness Month, make a plan to quit smoking and reduce your risk for respiratory diseases. #CDCTips #NEQuitline  https://t.co/gm20Am2VgY",11/22/2021,17:00:00,https://twitter.com/ncdhealth/status/1462903717452083201,2021,11,22
31105,Kimball County,NE,Nebraska,NA,0,NA,NA,NA,1,NA,NA,Panhandle Public Health District - Nebraska,NA,NA,NA,NA,NA,NA,NA,NA
31107,Knox County,NE,Nebraska,ncdhealth,1,NA,Yes,Yes,1,NA,NA,North Central Health District - Nebraska,7.06E+17,"Becky started smoking cigarettes in high school and now suffers from chronic obstructive pulmonary disease (COPD). This COPD Awareness Month, make a plan to quit smoking and reduce your risk for respiratory diseases. #CDCTips #NEQuitline  https://t.co/gm20Am2VgY",11/22/2021,17:00:00,https://twitter.com/ncdhealth/status/1462903717452083201,2021,11,22
31109,Lancaster County,NE,Nebraska,lnkhealth,1,NA,Yes,Yes,1,NA,NA,NA,3982877112,#DYK Smoking can prematurely age your skin? Keep your skin looking healthy and youthful by quitting tobacco today. Call 1-800-QUIT-NOW for free support.#LNK #NEQuitline  https://t.co/1ioyiRXG7A,11/23/2021,11:34:00,https://twitter.com/LNKhealth/status/1463184064660357123,2021,11,23
31111,Lincoln County,NE,Nebraska,wcdhd,1,NA,Yes,Yes,1,NA,NA,West Central District Health Department - Nebraska,515958611,"#WCDHDvaccine #COVID19 #Vaccine clinics happening this week!  For future clinic dates, see the WCDHD event calendar:  https://t.co/MPa9zoHMVE  **Please be sure to read all details of the specific clinic**  https://t.co/bHApYKQQ2g",11/22/2021,9:00:00,https://twitter.com/WCDHD/status/1462782921652248588,2021,11,22
31113,Logan County,NE,Nebraska,wcdhd,1,NA,Yes,Yes,1,NA,NA,West Central District Health Department - Nebraska,515958611,"#WCDHDvaccine #COVID19 #Vaccine clinics happening this week!  For future clinic dates, see the WCDHD event calendar:  https://t.co/MPa9zoHMVE  **Please be sure to read all details of the specific clinic**  https://t.co/bHApYKQQ2g",11/22/2021,9:00:00,https://twitter.com/WCDHD/status/1462782921652248588,2021,11,22
31115,Loup County,NE,Nebraska,lbphd,1,NA,No,No,1,NA,Outdated-Add District,Loup Basin Public Health Department - Nebraska,49687591,https://t.co/ZcD1y0VzrQ,6/26/2019,16:28:14,https://twitter.com/LBPHD/status/1143979303324925952,2019,6,26
31117,McPherson County,NE,Nebraska,wcdhd,1,NA,Yes,Yes,1,NA,NA,West Central District Health Department - Nebraska,515958611,"#WCDHDvaccine #COVID19 #Vaccine clinics happening this week!  For future clinic dates, see the WCDHD event calendar:  https://t.co/MPa9zoHMVE  **Please be sure to read all details of the specific clinic**  https://t.co/bHApYKQQ2g",11/22/2021,9:00:00,https://twitter.com/WCDHD/status/1462782921652248588,2021,11,22
31119,Madison County,NE,Nebraska,elvphd,1,NA,Yes,No,1,NA,NA,Elkhorn Logan Valley Public Health Department - Nebraska,409523475,https://t.co/hUORF2eYrS,3/22/2021,19:16:26,https://twitter.com/ELVPHD/status/1374137926121033729,2021,3,22
31121,Merrick County,NE,Nebraska,NA,0,NA,NA,NA,1,NA,NA,Central District Health Department - Nebraska,NA,NA,NA,NA,NA,NA,NA,NA
31123,Morrill County,NE,Nebraska,NA,0,NA,NA,NA,1,NA,NA,Panhandle Public Health District - Nebraska,NA,NA,NA,NA,NA,NA,NA,NA
31125,Nance County,NE,Nebraska,NA,0,NA,NA,NA,1,NA,NA,East Central District Health Department - Nebraska,NA,NA,NA,NA,NA,NA,NA,NA
31127,Nemaha County,NE,Nebraska,sedisthd,1,NA,Yes,Yes,1,NA,NA,Southeast Health District - Nebraska,4895232027,"In observance of Thanksgiving, our offices will be closed from Thursday, Nov. 25th through Sunday, Nov. 28th. We will resume normal hours on Monday, November 29th. Happy Thanksgiving!!  Message from the Southeast District Health Department. Cooperating for Your Good Health.  https://t.co/ablAuh5ftg",11/24/2021,18:10:00,https://twitter.com/SEDistHD/status/1463646108760956931,2021,11,24
31129,Nuckolls County,NE,Nebraska,shdhdhealth,1,NA,Yes,Yes,1,NA,NA,South Heartland Health District - Nebraska,3010816881,"Every year, flu vaccination prevents illnesses, medical visits, hospitalizations, and deaths. Get your flu vaccine!  https://t.co/Bl6AXsJa3I",10/24/2021,13:00:00,https://twitter.com/shdhdhealth/status/1452318971294797836,2021,10,24
31131,Otoe County,NE,Nebraska,sedisthd,1,NA,Yes,Yes,1,NA,NA,Southeast Health District - Nebraska,4895232027,"In observance of Thanksgiving, our offices will be closed from Thursday, Nov. 25th through Sunday, Nov. 28th. We will resume normal hours on Monday, November 29th. Happy Thanksgiving!!  Message from the Southeast District Health Department. Cooperating for Your Good Health.  https://t.co/ablAuh5ftg",11/24/2021,18:10:00,https://twitter.com/SEDistHD/status/1463646108760956931,2021,11,24
31133,Pawnee County,NE,Nebraska,sedisthd,1,NA,Yes,Yes,1,NA,NA,Southeast Health District - Nebraska,4895232027,"In observance of Thanksgiving, our offices will be closed from Thursday, Nov. 25th through Sunday, Nov. 28th. We will resume normal hours on Monday, November 29th. Happy Thanksgiving!!  Message from the Southeast District Health Department. Cooperating for Your Good Health.  https://t.co/ablAuh5ftg",11/24/2021,18:10:00,https://twitter.com/SEDistHD/status/1463646108760956931,2021,11,24
31135,Perkins County,NE,Nebraska,swpublichealth,1,NA,Yes,Yes,1,NA,NA,Southwest Nebraska Public Health Department,475178622,Give them each their own cutting board. #FoodSafety  https://t.co/lsauVPyMlJ,11/24/2021,15:10:05,https://twitter.com/swpublichealth/status/1463600831039684609,2021,11,24
31137,Phelps County,NE,Nebraska,trpublichealth,1,NA,Yes,No,1,NA,NA,Two Rivers Public Health Department - Nebraska,116565463,"Congratulations, Lt. Kowalek!",9/14/2021,9:57:05,https://twitter.com/TRPublicHealth/status/1437777425618833423,2021,9,14
31139,Pierce County,NE,Nebraska,ncdhealth,1,NA,Yes,Yes,1,NA,NA,North Central Health District - Nebraska,7.06E+17,"Becky started smoking cigarettes in high school and now suffers from chronic obstructive pulmonary disease (COPD). This COPD Awareness Month, make a plan to quit smoking and reduce your risk for respiratory diseases. #CDCTips #NEQuitline  https://t.co/gm20Am2VgY",11/22/2021,17:00:00,https://twitter.com/ncdhealth/status/1462903717452083201,2021,11,22
31141,Platte County,NE,Nebraska,NA,0,NA,NA,NA,1,NA,NA,East Central District Health Department - Nebraska,NA,NA,NA,NA,NA,NA,NA,NA
31143,Polk County,NE,Nebraska,fc_healthdept,1,NA,Yes,Yes,1,NA,NA,Four Corners Health Department - Nebraska,2241443028,"It's COVID-19 Vaccine Day at Four Corners!  Stop in to get your vaccine from 12pm - 4pm on Tuesday, November 23rd.  We will not have a vaccination clinic on Friday, November 26th, but clinic Tuesday/Friday 12-4 schedule will resume next week.   https://t.co/Z0RwcE2xNO",11/23/2021,12:09:28,https://twitter.com/FC_HealthDept/status/1463192990353133580,2021,11,23
31145,Red Willow County,NE,Nebraska,swpublichealth,1,NA,Yes,Yes,1,NA,NA,Southwest Nebraska Public Health Department,475178622,Give them each their own cutting board. #FoodSafety  https://t.co/lsauVPyMlJ,11/24/2021,15:10:05,https://twitter.com/swpublichealth/status/1463600831039684609,2021,11,24
31147,Richardson County,NE,Nebraska,sedisthd,1,NA,Yes,Yes,1,NA,NA,Southeast Health District - Nebraska,4895232027,"In observance of Thanksgiving, our offices will be closed from Thursday, Nov. 25th through Sunday, Nov. 28th. We will resume normal hours on Monday, November 29th. Happy Thanksgiving!!  Message from the Southeast District Health Department. Cooperating for Your Good Health.  https://t.co/ablAuh5ftg",11/24/2021,18:10:00,https://twitter.com/SEDistHD/status/1463646108760956931,2021,11,24
31149,Rock County,NE,Nebraska,NA,0,NA,NA,NA,1,NA,NA,North Central Health District - Nebraska,NA,NA,NA,NA,NA,NA,NA,NA
31151,Saline County,NE,Nebraska,phshealthdept,1,NA,No,No,1,NA,NA,Public Health Solutions - Nebraska,27115268,Meet some of the new faces at the health department! Welcome to the team!  https://t.co/bpdwhdAb30,1/23/2020,13:18:15,https://twitter.com/PHSHealthDept/status/1220410431589822464,2020,1,23
31153,Sarpy County,NE,Nebraska,sarpycasshealth,1,NA,Yes,Yes,1,NA,NA,Sarpy-Cass Health Department - Nebraska,2871716635,https://t.co/jZH1rKesmo,11/22/2021,13:10:00,https://twitter.com/SarpyCassHealth/status/1462845835872329728,2021,11,22
31155,Saunders County,NE,Nebraska,threerivers_ph,1,NA,Yes,Yes,1,NA,NA,Three Rivers Public Health - Nebraska,4714971972,"Question:  I have been around someone who is positive for COVID-19 and I am not vaccinated, what do I do?  Visit  https://t.co/Jzibhw4zsT to learn more.  https://t.co/UQVnAgR8S5",11/24/2021,16:30:06,https://twitter.com/threerivers_ph/status/1463620968769802240,2021,11,24
31157,Scotts Bluff County,NE,Nebraska,NA,0,NA,NA,NA,0,NA,NA,NA,NA,NA,NA,NA,NA,NA,NA,NA
31159,Seward County,NE,Nebraska,fc_healthdept,1,NA,Yes,Yes,1,NA,NA,Four Corners Health Department - Nebraska,2241443028,"It's COVID-19 Vaccine Day at Four Corners!  Stop in to get your vaccine from 12pm - 4pm on Tuesday, November 23rd.  We will not have a vaccination clinic on Friday, November 26th, but clinic Tuesday/Friday 12-4 schedule will resume next week.   https://t.co/Z0RwcE2xNO",11/23/2021,12:09:28,https://twitter.com/FC_HealthDept/status/1463192990353133580,2021,11,23
31161,Sheridan County,NE,Nebraska,NA,0,NA,NA,NA,1,NA,NA,Panhandle Public Health District - Nebraska,NA,NA,NA,NA,NA,NA,NA,NA
31163,Sherman County,NE,Nebraska,lbphd,1,NA,No,No,1,NA,Outdated-Add District,Loup Basin Public Health Department - Nebraska,49687591,https://t.co/ZcD1y0VzrQ,6/26/2019,16:28:14,https://twitter.com/LBPHD/status/1143979303324925952,2019,6,26
31165,Sioux County,NE,Nebraska,NA,0,NA,NA,NA,1,NA,NA,Panhandle Public Health District - Nebraska,NA,NA,NA,NA,NA,NA,NA,NA
31167,Stanton County,NE,Nebraska,elvphd,1,NA,Yes,No,1,NA,NA,Elkhorn Logan Valley Public Health Department - Nebraska,409523475,https://t.co/hUORF2eYrS,3/22/2021,19:16:26,https://twitter.com/ELVPHD/status/1374137926121033729,2021,3,22
31169,Thayer County,NE,Nebraska,tchsne,1,NA,Yes,Yes,1,NA,NA,Public Health Solutions - Nebraska,67105405,"TCHS Clinic Schedule for next week; Nov 29 to Dec 3. A friendly reminder that the clinics will be closed on Nov 25th and 26th for the Thanksgiving holiday. The Saturday clinic in Hebron is OPEN on Nov 27th, 9:00 am - 12:00 pm Have a great holiday weekend!  https://t.co/MfStIuaJhJ",11/24/2021,15:16:20,https://twitter.com/tchsne/status/1463602406420361219,2021,11,24
31171,Thomas County,NE,Nebraska,wcdhd,1,NA,Yes,Yes,1,NA,NA,West Central District Health Department - Nebraska,515958611,"#WCDHDvaccine #COVID19 #Vaccine clinics happening this week!  For future clinic dates, see the WCDHD event calendar:  https://t.co/MPa9zoHMVE  **Please be sure to read all details of the specific clinic**  https://t.co/bHApYKQQ2g",11/22/2021,9:00:00,https://twitter.com/WCDHD/status/1462782921652248588,2021,11,22
31173,Thurston County,NE,Nebraska,nnephd,1,NA,No,No,1,NA,Outdated-Add District,Northeast Nebraska Public Health Department,3805186934,"Turn Around Don’t Drown Know What to do Before, During and After a Flood  https://t.co/FNO8pVxckz",3/13/2019,9:54:21,https://twitter.com/NNEPHD/status/1105829451978428416,2019,3,13
31175,Valley County,NE,Nebraska,lbphd,1,NA,No,No,1,NA,Outdated-Add District,Loup Basin Public Health Department - Nebraska,49687591,https://t.co/ZcD1y0VzrQ,6/26/2019,16:28:14,https://twitter.com/LBPHD/status/1143979303324925952,2019,6,26
31177,Washington County,NE,Nebraska,threerivers_ph,1,NA,Yes,Yes,1,NA,NA,Three Rivers Public Health - Nebraska,4714971972,"Question:  I have been around someone who is positive for COVID-19 and I am not vaccinated, what do I do?  Visit  https://t.co/Jzibhw4zsT to learn more.  https://t.co/UQVnAgR8S5",11/24/2021,16:30:06,https://twitter.com/threerivers_ph/status/1463620968769802240,2021,11,24
31179,Wayne County,NE,Nebraska,nnephd,1,NA,No,No,1,NA,Outdated-Add District,Northeast Nebraska Public Health Department,3805186934,"Turn Around Don’t Drown Know What to do Before, During and After a Flood  https://t.co/FNO8pVxckz",3/13/2019,9:54:21,https://twitter.com/NNEPHD/status/1105829451978428416,2019,3,13
31181,Webster County,NE,Nebraska,shdhdhealth,1,NA,Yes,Yes,1,NA,NA,South Heartland Health District - Nebraska,3010816881,"Every year, flu vaccination prevents illnesses, medical visits, hospitalizations, and deaths. Get your flu vaccine!  https://t.co/Bl6AXsJa3I",10/24/2021,13:00:00,https://twitter.com/shdhdhealth/status/1452318971294797836,2021,10,24
31183,Wheeler County,NE,Nebraska,lbphd,1,NA,No,No,1,NA,Outdated-Add District,Loup Basin Public Health Department - Nebraska,49687591,https://t.co/ZcD1y0VzrQ,6/26/2019,16:28:14,https://twitter.com/LBPHD/status/1143979303324925952,2019,6,26
31185,York County,NE,Nebraska,fc_healthdept,1,NA,Yes,Yes,1,NA,NA,Four Corners Health Department - Nebraska,2241443028,"It's COVID-19 Vaccine Day at Four Corners!  Stop in to get your vaccine from 12pm - 4pm on Tuesday, November 23rd.  We will not have a vaccination clinic on Friday, November 26th, but clinic Tuesday/Friday 12-4 schedule will resume next week.   https://t.co/Z0RwcE2xNO",11/23/2021,12:09:28,https://twitter.com/FC_HealthDept/status/1463192990353133580,2021,11,23
32001,Churchill County,NV,Nevada,NA,0,NA,NA,NA,0,NA,DoubleCheck,NA,NA,NA,NA,NA,NA,NA,NA,NA
32003,Clark County,NV,Nevada,NA,0,NA,NA,NA,0,NA,DoubleCheck,NA,NA,NA,NA,NA,NA,NA,NA,NA
32005,Douglas County,NV,Nevada,NA,0,NA,NA,NA,0,NA,DoubleCheck,NA,NA,NA,NA,NA,NA,NA,NA,NA
32007,Elko County,NV,Nevada,NA,0,NA,NA,NA,0,NA,DoubleCheck,NA,NA,NA,NA,NA,NA,NA,NA,NA
32009,Esmeralda County,NV,Nevada,NA,0,NA,NA,NA,0,NA,DoubleCheck,NA,NA,NA,NA,NA,NA,NA,NA,NA
32011,Eureka County,NV,Nevada,NA,0,NA,NA,NA,0,NA,DoubleCheck,NA,NA,NA,NA,NA,NA,NA,NA,NA
32013,Humboldt County,NV,Nevada,NA,0,NA,NA,NA,0,NA,DoubleCheck,NA,NA,NA,NA,NA,NA,NA,NA,NA
32015,Lander County,NV,Nevada,NA,0,NA,NA,NA,0,NA,DoubleCheck,NA,NA,NA,NA,NA,NA,NA,NA,NA
32017,Lincoln County,NV,Nevada,NA,0,NA,NA,NA,0,NA,DoubleCheck,NA,NA,NA,NA,NA,NA,NA,NA,NA
32019,Lyon County,NV,Nevada,NA,0,NA,NA,NA,0,NA,DoubleCheck,NA,NA,NA,NA,NA,NA,NA,NA,NA
32021,Mineral County,NV,Nevada,NA,0,NA,NA,NA,0,NA,DoubleCheck,NA,NA,NA,NA,NA,NA,NA,NA,NA
32023,Nye County,NV,Nevada,NA,0,NA,NA,NA,0,NA,DoubleCheck,NA,NA,NA,NA,NA,NA,NA,NA,NA
32027,Pershing County,NV,Nevada,NA,0,NA,NA,NA,0,NA,DoubleCheck,NA,NA,NA,NA,NA,NA,NA,NA,NA
32029,Storey County,NV,Nevada,NA,0,NA,NA,NA,0,NA,DoubleCheck,NA,NA,NA,NA,NA,NA,NA,NA,NA
32031,Washoe County,NV,Nevada,washoehealth,1,NA,Yes,Yes,1,NA,NA,NA,34052834,Un recordatorio que las oficinas del Distrito de Salud estarán cerradas nov. 25-26 incluyendo pruebas y vacunaciones de COVID-19 en el Reno-Sparks Livestock Events Center. Resumiremos los horarios y operaciones normales la próxima semana:  https://t.co/4IrPeuGBsp  https://t.co/9onyryYhae,11/24/2021,18:00:01,https://twitter.com/WashoeHealth/status/1463643596733575169,2021,11,24
32033,White Pine County,NV,Nevada,NA,0,NA,NA,NA,0,NA,NA,NA,NA,NA,NA,NA,NA,NA,NA,NA
32510,Carson City,NV,Nevada,NA,0,NA,NA,NA,1,NA,NA,NA,NA,NA,NA,NA,NA,NA,NA,NA
33001,Belknap County,NH,New Hampshire,NA,0,NA,NA,NA,0,NA,NA,NA,NA,NA,NA,NA,NA,NA,NA,NA
33003,Carroll County,NH,New Hampshire,NA,0,NA,NA,NA,1,NA,NA,NA,NA,NA,NA,NA,NA,NA,NA,NA
33005,Cheshire County,NH,New Hampshire,NA,0,NA,NA,NA,0,NA,NA,NA,NA,NA,NA,NA,NA,NA,NA,NA
33007,Coos County,NH,New Hampshire,NA,0,NA,NA,NA,1,NA,NA,NA,NA,NA,NA,NA,NA,NA,NA,NA
33009,Grafton County,NH,New Hampshire,NA,0,NA,NA,NA,0,NA,NA,NA,NA,NA,NA,NA,NA,NA,NA,NA
33011,Hillsborough County,NH,New Hampshire,NA,0,NA,NA,NA,0,NA,NA,NA,NA,NA,NA,NA,NA,NA,NA,NA
33013,Merrimack County,NH,New Hampshire,NA,0,NA,NA,NA,0,NA,NA,NA,NA,NA,NA,NA,NA,NA,NA,NA
33015,Rockingham County,NH,New Hampshire,NA,0,NA,NA,NA,0,NA,NA,NA,NA,NA,NA,NA,NA,NA,NA,NA
33017,Strafford County,NH,New Hampshire,scphcovid19,1,NA,Yes,Yes,1,NA,DoubleCheck,NA,1.24E+18,There are so many ways you can have in impact on your community's health. Keeping warm and safe during the coldest months of the year is important - and you can help! Learn about other ways to donate here:  https://t.co/DHzSqT4WJs  https://t.co/jnqYeEWY0M,11/21/2021,10:05:03,https://twitter.com/SCPHCOVID19/status/1462436904461340683,2021,11,21
33019,Sullivan County,NH,New Hampshire,NA,0,NA,NA,NA,0,NA,NA,NA,NA,NA,NA,NA,NA,NA,NA,NA
34001,Atlantic County,NJ,New Jersey,NA,0,NA,NA,NA,0,NA,DoubleCheck,NA,NA,NA,NA,NA,NA,NA,NA,NA
34003,Bergen County,NJ,New Jersey,NA,0,NA,NA,NA,0,NA,DoubleCheck,NA,NA,NA,NA,NA,NA,NA,NA,NA
34005,Burlington County,NJ,New Jersey,NA,0,NA,NA,NA,1,NA,NA,NA,NA,NA,NA,NA,NA,NA,NA,NA
34007,Camden County,NJ,New Jersey,NA,0,NA,NA,NA,0,NA,DoubleCheck,NA,NA,NA,NA,NA,NA,NA,NA,NA
34009,Cape May County,NJ,New Jersey,NA,0,NA,NA,NA,1,NA,NA,NA,NA,NA,NA,NA,NA,NA,NA,NA
34011,Cumberland County,NJ,New Jersey,NA,0,NA,NA,NA,1,NA,NA,NA,NA,NA,NA,NA,NA,NA,NA,NA
34013,Essex County,NJ,New Jersey,NA,0,NA,NA,NA,0,NA,DoubleCheck,NA,NA,NA,NA,NA,NA,NA,NA,NA
34015,Gloucester County,NJ,New Jersey,NA,0,NA,NA,NA,0,NA,DoubleCheck,NA,NA,NA,NA,NA,NA,NA,NA,NA
34017,Hudson County,NJ,New Jersey,NA,0,NA,NA,NA,0,NA,DoubleCheck,NA,NA,NA,NA,NA,NA,NA,NA,NA
34019,Hunterdon County,NJ,New Jersey,hunterdondoh,1,NA,Yes,No,1,NA,NA,NA,2829944112,We are slowing the rate by which new cases are doubling.  https://t.co/upge8mf24o,4/11/2020,14:20:20,https://twitter.com/HunterdonDOH/status/1249039594823323648,2020,4,11
34021,Mercer County,NJ,New Jersey,NA,0,NA,NA,NA,0,NA,DoubleCheck,NA,NA,NA,NA,NA,NA,NA,NA,NA
34023,Middlesex County,NJ,New Jersey,NA,0,NA,NA,NA,1,NA,NA,NA,NA,NA,NA,NA,NA,NA,NA,NA
34025,Monmouth County,NJ,New Jersey,healthmcrhc,1,NA,Yes,Yes,1,NA,NA,NA,2830473127,Check out our in-house COVID-19 vaccination clinic that we are having this Saturday! #CovidVaccine #PublicHealth  https://t.co/AjEU4eX27q,11/16/2021,10:47:33,https://twitter.com/healthmcrhc/status/1460635662458183695,2021,11,16
34027,Morris County,NJ,New Jersey,NA,0,NA,NA,NA,0,NA,DoubleCheck,NA,NA,NA,NA,NA,NA,NA,NA,NA
34029,Ocean County,NJ,New Jersey,ocpublichealth,1,NA,Yes,Yes,1,NA,NA,NA,1307578034,"OCHD DAILY COVID-19 CASES FOR NOVEMBER 24, 2021  https://t.co/7wtQn19IMe  https://t.co/JNmrj37zro",11/24/2021,12:27:23,https://twitter.com/OCpublichealth/status/1463559887674294273,2021,11,24
34031,Passaic County,NJ,New Jersey,NA,0,NA,NA,NA,0,NA,DoubleCheck,NA,NA,NA,NA,NA,NA,NA,NA,NA
34033,Salem County,NJ,New Jersey,sc_healthdept,1,NA,Yes,Yes,1,NA,NA,NA,1.24E+18,Check out Salem County's Office on Aging and Disabilities' flyer below for information on upcoming Legal Talks for the month of December.  https://t.co/elGDxJY0MT,11/24/2021,12:03:38,https://twitter.com/SC_HealthDept/status/1463553910552076289,2021,11,24
34035,Somerset County,NJ,New Jersey,schealthdept,1,NA,Yes,Yes,0,NA,DoubleCheck,NA,49710229,Every #lungcancer patient &amp; caregiver needs a guide. Access resources to get you on the right track:  https://t.co/866ClTAMbq  https://t.co/JvtzchkFf0,11/24/2021,9:42:00,https://twitter.com/SCHealthDept/status/1463518266547216384,2021,11,24
34037,Sussex County,NJ,New Jersey,NA,0,NA,NA,NA,1,NA,NA,NA,NA,NA,NA,NA,NA,NA,NA,NA
34039,Union County,NJ,New Jersey,NA,0,NA,NA,NA,0,NA,DoubleCheck,NA,NA,NA,NA,NA,NA,NA,NA,NA
34041,Warren County,NJ,New Jersey,wchealth,1,NA,Yes,Yes,1,NA,NA,NA,1020461864,Nov 18 is the Great American Smokeout! @WCHealth,11/18/2021,15:49:22,https://twitter.com/WCHealth/status/1461436390445625344,2021,11,18
35001,Bernalillo County,NM,New Mexico,NA,0,NA,NA,NA,0,NA,NA,NA,NA,NA,NA,NA,NA,NA,NA,NA
35003,Catron County,NM,New Mexico,NA,0,NA,NA,NA,0,NA,NA,NA,NA,NA,NA,NA,NA,NA,NA,NA
35005,Chaves County,NM,New Mexico,NA,0,NA,NA,NA,1,NA,NA,NA,NA,NA,NA,NA,NA,NA,NA,NA
35006,Cibola County,NM,New Mexico,NA,0,NA,NA,NA,0,NA,NA,NA,NA,NA,NA,NA,NA,NA,NA,NA
35007,Colfax County,NM,New Mexico,NA,0,NA,NA,NA,0,NA,NA,NA,NA,NA,NA,NA,NA,NA,NA,NA
35009,Curry County,NM,New Mexico,NA,0,NA,NA,NA,0,NA,NA,NA,NA,NA,NA,NA,NA,NA,NA,NA
35011,De Baca County,NM,New Mexico,NA,0,NA,NA,NA,0,NA,NA,NA,NA,NA,NA,NA,NA,NA,NA,NA
35013,Dona Ana County,NM,New Mexico,NA,0,NA,NA,NA,0,NA,NA,NA,NA,NA,NA,NA,NA,NA,NA,NA
35015,Eddy County,NM,New Mexico,NA,0,NA,NA,NA,0,NA,NA,NA,NA,NA,NA,NA,NA,NA,NA,NA
35017,Grant County,NM,New Mexico,NA,0,NA,NA,NA,0,NA,NA,NA,NA,NA,NA,NA,NA,NA,NA,NA
35019,Guadalupe County,NM,New Mexico,NA,0,NA,NA,NA,0,NA,NA,NA,NA,NA,NA,NA,NA,NA,NA,NA
35021,Harding County,NM,New Mexico,NA,0,NA,NA,NA,0,NA,NA,NA,NA,NA,NA,NA,NA,NA,NA,NA
35023,Hidalgo County,NM,New Mexico,NA,0,NA,NA,NA,1,NA,NA,NA,NA,NA,NA,NA,NA,NA,NA,NA
35025,Lea County,NM,New Mexico,NA,0,NA,NA,NA,0,NA,NA,NA,NA,NA,NA,NA,NA,NA,NA,NA
35027,Lincoln County,NM,New Mexico,NA,0,NA,NA,NA,0,NA,NA,NA,NA,NA,NA,NA,NA,NA,NA,NA
35028,Los Alamos County,NM,New Mexico,NA,0,NA,NA,NA,1,General County,NA,NA,NA,NA,NA,NA,NA,NA,NA,NA
35029,Luna County,NM,New Mexico,NA,0,NA,NA,NA,0,NA,NA,NA,NA,NA,NA,NA,NA,NA,NA,NA
35031,McKinley County,NM,New Mexico,NA,0,NA,NA,NA,1,Emergency Management Agency,NA,NA,NA,NA,NA,NA,NA,NA,NA,NA
35033,Mora County,NM,New Mexico,NA,0,NA,NA,NA,0,NA,NA,NA,NA,NA,NA,NA,NA,NA,NA,NA
35035,Otero County,NM,New Mexico,NA,0,NA,NA,NA,0,NA,NA,NA,NA,NA,NA,NA,NA,NA,NA,NA
35037,Quay County,NM,New Mexico,NA,0,NA,NA,NA,1,NA,NA,NA,NA,NA,NA,NA,NA,NA,NA,NA
35039,Rio Arriba County,NM,New Mexico,NA,0,NA,NA,NA,1,NA,NA,NA,NA,NA,NA,NA,NA,NA,NA,NA
35041,Roosevelt County,NM,New Mexico,NA,0,NA,NA,NA,0,NA,NA,NA,NA,NA,NA,NA,NA,NA,NA,NA
35043,Sandoval County,NM,New Mexico,NA,0,NA,NA,NA,0,NA,NA,NA,NA,NA,NA,NA,NA,NA,NA,NA
35045,San Juan County,NM,New Mexico,NA,0,NA,NA,NA,1,NA,NA,NA,NA,NA,NA,NA,NA,NA,NA,NA
35047,San Miguel County,NM,New Mexico,NA,0,NA,NA,NA,0,NA,NA,NA,NA,NA,NA,NA,NA,NA,NA,NA
35049,Santa Fe County,NM,New Mexico,NA,0,NA,NA,NA,0,NA,NA,NA,NA,NA,NA,NA,NA,NA,NA,NA
35051,Sierra County,NM,New Mexico,NA,0,NA,NA,NA,0,NA,NA,NA,NA,NA,NA,NA,NA,NA,NA,NA
35053,Socorro County,NM,New Mexico,NA,0,NA,NA,NA,0,NA,NA,NA,NA,NA,NA,NA,NA,NA,NA,NA
35055,Taos County,NM,New Mexico,NA,0,NA,NA,NA,0,NA,NA,NA,NA,NA,NA,NA,NA,NA,NA,NA
35057,Torrance County,NM,New Mexico,NA,0,NA,NA,NA,0,NA,NA,NA,NA,NA,NA,NA,NA,NA,NA,NA
35059,Union County,NM,New Mexico,NA,0,NA,NA,NA,0,NA,NA,NA,NA,NA,NA,NA,NA,NA,NA,NA
35061,Valencia County,NM,New Mexico,NA,0,NA,NA,NA,0,NA,NA,NA,NA,NA,NA,NA,NA,NA,NA,NA
36001,Albany County,NY,New York,NA,0,NA,NA,NA,1,NA,NA,NA,NA,NA,NA,NA,NA,NA,NA,NA
36003,Allegany County,NY,New York,NA,0,NA,NA,NA,1,NA,NA,NA,NA,NA,NA,NA,NA,NA,NA,NA
36005,Bronx County,NY,New York,NA,0,NA,NA,NA,1,NA,NA,NA,NA,NA,NA,NA,NA,NA,NA,NA
36007,Broome County,NY,New York,NA,0,NA,NA,NA,1,NA,NA,NA,NA,NA,NA,NA,NA,NA,NA,NA
36009,Cattaraugus County,NY,New York,NA,0,NA,NA,NA,0,NA,NA,NA,NA,NA,NA,NA,NA,NA,NA,NA
36011,Cayuga County,NY,New York,NA,0,NA,NA,NA,1,NA,NA,NA,NA,NA,NA,NA,NA,NA,NA,NA
36013,Chautauqua County,NY,New York,myhealthycounty,1,DoubleCheck,No,No,1,NA,NA,NA,NA,NA,NA,NA,NA,NA,NA,NA
36015,Chemung County,NY,New York,chemunghealth,1,NA,Yes,No,1,NA,NA,NA,3904431914,"A local teen from Steuben County has won the ""Get a Shot to Make Your Future"" scholarship!  New Yorkers, ages 12 to 17, who received their first COVID-19 vaccine dose can win a full-ride scholarship to any NYS public college or university.  https://t.co/y9eSthyhnW",6/11/2021,14:21:38,https://twitter.com/ChemungHealth/status/1403417154330968064,2021,6,11
36017,Chenango County,NY,New York,NA,0,NA,NA,NA,1,NA,NA,NA,NA,NA,NA,NA,NA,NA,NA,NA
36019,Clinton County,NY,New York,clintoncountyhd,1,NA,Yes,Yes,1,NA,NA,NA,3905354660,"""Knock, knock! Who’s there? Arthur. Arthur who? Arthur any leftovers?""    What do you do with your #TurkeyDay leftovers?     https://t.co/o45as20s0S #eatsmartwastelessclintoncounty  https://t.co/kBy3ScpMQM",11/24/2021,14:38:33,https://twitter.com/ClintonCountyHD/status/1463592896179941378,2021,11,24
36021,Columbia County,NY,New York,NA,0,NA,NA,NA,1,NA,NA,NA,NA,NA,NA,NA,NA,NA,NA,NA
36023,Cortland County,NY,New York,cortgovhealth,1,NA,Yes,Yes,1,NA,NA,NA,1.06E+18,#NewProfilePic  https://t.co/17Jps5Osay,11/16/2021,10:20:04,https://twitter.com/CortGovHealth/status/1460628746424176644,2021,11,16
36025,Delaware County,NY,New York,NA,0,NA,NA,NA,1,NA,NA,NA,NA,NA,NA,NA,NA,NA,NA,NA
36027,Dutchess County,NY,New York,NA,0,NA,NA,NA,1,NA,NA,NA,NA,NA,NA,NA,NA,NA,NA,NA
36029,Erie County,NY,New York,ecdoh,1,NA,Yes,Yes,1,NA,NA,NA,557670851,@B_Marzullo @markpoloncarz Try this    https://t.co/yhiDBvUcgB,11/24/2021,16:14:45,https://twitter.com/ECDOH/status/1463617104838549513,2021,11,24
36031,Essex County,NY,New York,NA,0,NA,NA,NA,1,NA,NA,NA,NA,NA,NA,NA,NA,NA,NA,NA
36033,Franklin County,NY,New York,NA,0,NA,NA,NA,0,NA,NA,NA,NA,NA,NA,NA,NA,NA,NA,NA
36035,Fulton County,NY,New York,NA,0,NA,NA,NA,1,NA,NA,NA,NA,NA,NA,NA,NA,NA,NA,NA
36037,Genesee County,NY,New York,NA,0,NA,NA,NA,1,NA,NA,NA,NA,NA,NA,NA,NA,NA,NA,NA
36039,Greene County,NY,New York,greenenyhealth,1,DoubleCheck,No,No,1,NA,NA,NA,NA,NA,NA,NA,NA,NA,NA,NA
36041,Hamilton County,NY,New York,NA,0,NA,NA,NA,1,NA,NA,NA,NA,NA,NA,NA,NA,NA,NA,NA
36043,Herkimer County,NY,New York,NA,0,NA,NA,NA,1,General County,NA,NA,NA,NA,NA,NA,NA,NA,NA,NA
36045,Jefferson County,NY,New York,NA,0,NA,NA,NA,1,NA,NA,NA,NA,NA,NA,NA,NA,NA,NA,NA
36047,Kings County,NY,New York,kingscountyhosp,1,NA,Yes,Yes,1,NA,NA,NA,1.13E+18,"💡If you are gathering with a group of people from multiple households &amp; potentially from different parts of the country, you could consider additional precautions (e.g., avoiding crowded indoor spaces before travel, taking a test) in advance of gathering to further reduce risk✅  https://t.co/tbaxf9Rdva",11/24/2021,13:50:02,https://twitter.com/KingsCountyHosp/status/1463580687617998857,2021,11,24
36049,Lewis County,NY,New York,healthlewis,1,NA,Yes,No,1,NA,NA,NA,3115709093,"In 2019, over 1,000 cases of measles were confirmed across 31 states, with the majority of cases among people who were not vaccinated. This shows, while many serious diseases are no longer common in the US, they can still spread when vaccination rates are low. #NIAM #ivax2protect  https://t.co/NQHNxlrnOh",8/13/2021,17:00:35,https://twitter.com/HealthLewis/status/1426287592778211329,2021,8,13
36051,Livingston County,NY,New York,NA,0,NA,NA,NA,1,NA,NA,NA,NA,NA,NA,NA,NA,NA,NA,NA
36053,Madison County,NY,New York,NA,0,NA,NA,NA,0,NA,NA,NA,NA,NA,NA,NA,NA,NA,NA,NA
36055,Monroe County,NY,New York,monroehealth,1,NA,Yes,Yes,1,NA,NA,NA,36764315,"Our IMPACT team is at the International Plaza for the Hope Dealers BTC Hopesgiving until 4pm today - providing education about substance use disorder, Narcan, and harm reduction.  https://t.co/HIf1TCSYCV",11/19/2021,14:11:31,https://twitter.com/MonroeHealth/status/1461774153497948160,2021,11,19
36057,Montgomery County,NY,New York,NA,0,NA,NA,NA,0,NA,NA,NA,NA,NA,NA,NA,NA,NA,NA,NA
36059,Nassau County,NY,New York,NA,0,NA,NA,NA,1,NA,NA,NA,NA,NA,NA,NA,NA,NA,NA,NA
36061,New York County,NY,New York,NA,0,NA,NA,NA,1,NA,NA,NA,NA,NA,NA,NA,NA,NA,NA,NA
36063,Niagara County,NY,New York,NA,0,NA,NA,NA,1,NA,NA,NA,NA,NA,NA,NA,NA,NA,NA,NA
36065,Oneida County,NY,New York,NA,0,NA,NA,NA,1,NA,NA,NA,NA,NA,NA,NA,NA,NA,NA,NA
36067,Onondaga County,NY,New York,NA,0,NA,NA,NA,1,NA,NA,NA,NA,NA,NA,NA,NA,NA,NA,NA
36069,Ontario County,NY,New York,choosehealthoc,1,DoubleCheck,No,No,1,NA,NA,NA,NA,NA,NA,NA,NA,NA,NA,NA
36071,Orange County,NY,New York,NA,0,NA,NA,NA,1,NA,NA,NA,NA,NA,NA,NA,NA,NA,NA,NA
36073,Orleans County,NY,New York,gohealthny,1,NA,Yes,Yes,1,NA,NA,NA,95320733,Recall alert for Design Within Reach Arc Collection Furniture that contain levels of lead.  https://t.co/0pcbFYHNQL,11/23/2021,14:05:05,https://twitter.com/GOHealthNY/status/1463222087741587458,2021,11,23
36075,Oswego County,NY,New York,oswegohealthdpt,1,DoubleCheck,No,No,1,NA,NA,NA,NA,NA,NA,NA,NA,NA,NA,NA
36077,Otsego County,NY,New York,NA,0,NA,NA,NA,1,NA,NA,NA,NA,NA,NA,NA,NA,NA,NA,NA
36079,Putnam County,NY,New York,NA,0,NA,NA,NA,1,NA,NA,NA,NA,NA,NA,NA,NA,NA,NA,NA
36081,Queens County,NY,New York,NA,0,NA,NA,NA,1,NA,NA,NA,NA,NA,NA,NA,NA,NA,NA,NA
36083,Rensselaer County,NY,New York,NA,0,NA,NA,NA,1,NA,NA,NA,NA,NA,NA,NA,NA,NA,NA,NA
36085,Richmond County,NY,New York,NA,0,NA,NA,NA,1,NA,NA,NA,NA,NA,NA,NA,NA,NA,NA,NA
36087,Rockland County,NY,New York,rockhealth,1,NA,Yes,Yes,1,NA,NA,NA,135628383,Today is Public Health Thank You Day. Show your thanks by supporting your local health department today! #PHTYD #PublicHealthHeroes  https://t.co/mis9Z5pjtZ,11/22/2021,11:39:30,https://twitter.com/rockhealth/status/1462823061040807951,2021,11,22
36089,St. Lawrence County,NY,New York,NA,0,NA,NA,NA,1,NA,NA,NA,NA,NA,NA,NA,NA,NA,NA,NA
36091,Saratoga County,NY,New York,saratogacoph,1,DoubleCheck,No,No,1,NA,NA,NA,NA,NA,NA,NA,NA,NA,NA,NA
36093,Schenectady County,NY,New York,NA,0,NA,NA,NA,0,NA,NA,NA,NA,NA,NA,NA,NA,NA,NA,NA
36095,Schoharie County,NY,New York,NA,0,NA,NA,NA,1,NA,NA,NA,NA,NA,NA,NA,NA,NA,NA,NA
36097,Schuyler County,NY,New York,schuylercoph,1,NA,Yes,Yes,1,NA,NA,NA,1586339035,"Please see the image for the update. Due to the holiday, the next update will be on Tuesday, November 30. Visit our COVID-19 dashboard at  https://t.co/kXrPpxGN9M.  https://t.co/SsYRVCnf8J",11/24/2021,9:30:23,https://twitter.com/SchuylerCoPH/status/1463515344803438601,2021,11,24
36099,Seneca County,NY,New York,NA,0,NA,NA,NA,1,NA,NA,NA,NA,NA,NA,NA,NA,NA,NA,NA
36101,Steuben County,NY,New York,steubencohealth,1,NA,No,No,1,NA,NA,NA,1357545955,Congratulations to our partners  https://t.co/JInfR61uRo on becoming accredited!  We work closely with Healthy Families to make sure the families in our community are getting off to the...  https://t.co/q1Y1ZCutuU,4/18/2019,8:41:11,https://twitter.com/steubencohealth/status/1118857004510892033,2019,4,18
36103,Suffolk County,NY,New York,suffolkcohealth,1,NA,Yes,Yes,1,NA,NA,NA,102122156,"PolitiFact - PolitiFact’s guide to commonly misunderstood vaccine terms, and how to talk about them  https://t.co/wnlICRxyAs",11/24/2021,16:11:40,https://twitter.com/SuffolkCoHealth/status/1463616330213564421,2021,11,24
36105,Sullivan County,NY,New York,NA,0,NA,NA,NA,1,NA,NA,NA,NA,NA,NA,NA,NA,NA,NA,NA
36107,Tioga County,NY,New York,tiogacountyph,1,NA,No,No,1,NA,NA,NA,154537400,"Do you have unused medications that you need to dispose of? This Saturday, April 27 is National Prescription Drug Take Back Day. From 10:00am - 2:00pm you can Drive up &amp; Drop off your medications for FREE...  https://t.co/eH52430ipK",4/25/2019,15:59:20,https://twitter.com/TiogaCountyPH/status/1121503983846039552,2019,4,25
36109,Tompkins County,NY,New York,tompkinshealth,1,NA,Yes,Yes,1,NA,NA,NA,1.00E+18,"Updated Table: 5 hospitalizations, 34 new positive cases, 187 active cases.  Attn: There will not be a daily table update tomorrow, Thursday 11/25, due to the Thanksgiving holiday.  Booster doses are available for everyone ages 18+:  https://t.co/ygVee7dgfC  #COVID19 #twithaca  https://t.co/rlelTz9Dnd",11/24/2021,7:20:56,https://twitter.com/TompkinsHealth/status/1463482765597462528,2021,11,24
36111,Ulster County,NY,New York,ucdepthealth,1,NA,Yes,Yes,1,NA,NA,NA,3824793435,"There is a nationwide chronic blood shortage from the ongoing pandemic. Please, make an appointment to donate your blood. Use this link to search by zip code for all donor centers and community blood drives near you. ➡️  https://t.co/YEhNidrrpR  https://t.co/pZyXdP60r5",11/24/2021,17:11:05,https://twitter.com/UCDeptHealth/status/1463631282756272141,2021,11,24
36113,Warren County,NY,New York,warrenconyph,1,DoubleCheck,No,No,1,NA,NA,NA,NA,NA,NA,NA,NA,NA,NA,NA
36115,Washington County,NY,New York,washingtoncoph,1,NA,Yes,Yes,1,NA,NA,NA,2676877736,Rabies Clinic Cancelled- November 6th Kingsbury  https://t.co/DSdOy5SFZe  https://t.co/sxIPViAWeO,10/5/2021,14:35:33,https://twitter.com/WashingtonCoPH/status/1445457648938147850,2021,10,5
36117,Wayne County,NY,New York,NA,0,NA,NA,NA,1,NA,NA,NA,NA,NA,NA,NA,NA,NA,NA,NA
36119,Westchester County,NY,New York,wchealthdept,1,NA,Yes,Yes,1,NA,NA,NA,253206840,"The FDA and CDC have approved the use of heterologous or “mix and match” booster doses for COVID-19 vaccines. People who are eligible can get a booster shot with any available COVID-19 vaccine, regardless of whether they initially received the J&amp;J, Moderna, or Pfizer vaccine.  https://t.co/fVEN3Kd3tx",11/6/2021,10:01:38,https://twitter.com/wchealthdept/status/1456985126794141704,2021,11,6
36121,Wyoming County,NY,New York,wycohealthsys,1,NA,Yes,No,1,NA,NA,NA,1.21E+18,New primary care clinic in Attica!  https://t.co/XWyPcqmhjM,6/12/2021,11:13:29,https://twitter.com/wycohealthsys/status/1403732192791044098,2021,6,12
36123,Yates County,NY,New York,yatescountyph,1,NA,Yes,Yes,1,NA,NA,NA,1.35E+18,"It’s almost Turkey Time! Always use a food thermometer to make sure turkey is cooked thoroughly, to 165 degrees. Practice healthy food safety tips this holiday season. Click the link to learn more  https://t.co/T2viqkb0vO  https://t.co/MhOJfA43jQ",11/23/2021,16:01:04,https://twitter.com/YatesCountyPH/status/1463251276632895498,2021,11,23
37001,Alamance County,NC,North Carolina,achealthdept,1,NA,Yes,Yes,1,NA,NA,NA,190299917,"COVID Vaccines for Ages 5-11 Saturday, November 20. For more information go to  https://t.co/2ZFFNiCxuk or   call 336-890-1188  https://t.co/zlLaKw25V6",11/16/2021,10:20:13,https://twitter.com/ACHealthDept/status/1460628780226125840,2021,11,16
37003,Alexander County,NC,North Carolina,NA,0,NA,NA,NA,0,NA,DoubleCheck,NA,NA,NA,NA,NA,NA,NA,NA,NA
37005,Alleghany County,NC,North Carolina,NA,0,NA,NA,NA,1,NA,NA,NA,NA,NA,NA,NA,NA,NA,NA,NA
37007,Anson County,NC,North Carolina,NA,0,NA,NA,NA,1,NA,NA,NA,NA,NA,NA,NA,NA,NA,NA,NA
37009,Ashe County,NC,North Carolina,NA,0,NA,NA,NA,1,NA,NA,NA,NA,NA,NA,NA,NA,NA,NA,NA
37011,Avery County,NC,North Carolina,healthavery,1,NA,Yes,Yes,1,NA,NA,NA,1.41E+18,https://t.co/SIWvG0VJsL,10/7/2021,14:48:10,https://twitter.com/HealthAvery/status/1446185599157735438,2021,10,7
37013,Beaufort County,NC,North Carolina,NA,0,NA,NA,NA,0,NA,DoubleCheck,NA,NA,NA,NA,NA,NA,NA,NA,NA
37015,Bertie County,NC,North Carolina,arhs_nc,1,NA,Yes,Yes,1,NA,NA,Albemarle Regional Health Services - North Carolina,1267151060,https://t.co/HwFKhggk0k,11/24/2021,9:02:37,https://twitter.com/ARHS_NC/status/1463508355465555976,2021,11,24
37017,Bladen County,NC,North Carolina,NA,0,NA,NA,NA,0,NA,DoubleCheck,NA,NA,NA,NA,NA,NA,NA,NA,NA
37019,Brunswick County,NC,North Carolina,NA,0,NA,NA,NA,0,NA,DoubleCheck,NA,NA,NA,NA,NA,NA,NA,NA,NA
37021,Buncombe County,NC,North Carolina,NA,0,NA,NA,NA,0,NA,DoubleCheck,NA,NA,NA,NA,NA,NA,NA,NA,NA
37023,Burke County,NC,North Carolina,bcnchealthdept,1,NA,Yes,Yes,1,NA,NA,NA,1.42E+18,"Join us this Saturday, November 20th, for our drive-thru pediatric vaccine clinics at BCHD and Valdese Express Care! Make an appointment at:  https://t.co/ZJVSrBw21B  https://t.co/qZKOZy05qQ",11/16/2021,14:10:50,https://twitter.com/bcnchealthdept/status/1460686818291167236,2021,11,16
37025,Cabarrus County,NC,North Carolina,cabarrushealth,1,DoubleCheck,No,No,0,NA,DoubleCheck,NA,NA,NA,NA,NA,NA,NA,NA,NA
37027,Caldwell County,NC,North Carolina,cchdhealthed,1,NA,Yes,Yes,1,NA,NA,NA,2994731079,https://t.co/8AyHJlOOWr,11/23/2021,9:51:56,https://twitter.com/CCHDHealthEd/status/1463158380663648256,2021,11,23
37029,Camden County,NC,North Carolina,arhs_nc,1,NA,Yes,Yes,1,NA,NA,Albemarle Regional Health Services - North Carolina,1267151060,https://t.co/HwFKhggk0k,11/24/2021,9:02:37,https://twitter.com/ARHS_NC/status/1463508355465555976,2021,11,24
37031,Carteret County,NC,North Carolina,NA,0,NA,NA,NA,1,NA,NA,NA,NA,NA,NA,NA,NA,NA,NA,NA
37033,Caswell County,NC,North Carolina,NA,0,NA,NA,NA,1,NA,NA,NA,NA,NA,NA,NA,NA,NA,NA,NA
37035,Catawba County,NC,North Carolina,NA,0,NA,NA,NA,0,NA,DoubleCheck,NA,NA,NA,NA,NA,NA,NA,NA,NA
37037,Chatham County,NC,North Carolina,NA,0,NA,NA,NA,1,NA,NA,NA,NA,NA,NA,NA,NA,NA,NA,NA
37039,Cherokee County,NC,North Carolina,cchealthdept_nc,1,DoubleCheck,No,No,1,NA,Outdated-Add District,NA,NA,NA,NA,NA,NA,NA,NA,NA
37041,Chowan County,NC,North Carolina,arhs_nc,1,NA,Yes,Yes,1,NA,NA,Albemarle Regional Health Services - North Carolina,1267151060,https://t.co/HwFKhggk0k,11/24/2021,9:02:37,https://twitter.com/ARHS_NC/status/1463508355465555976,2021,11,24
37043,Clay County,NC,North Carolina,NA,0,NA,NA,NA,1,NA,NA,NA,NA,NA,NA,NA,NA,NA,NA,NA
37045,Cleveland County,NC,North Carolina,NA,0,NA,NA,NA,1,NA,NA,NA,NA,NA,NA,NA,NA,NA,NA,NA
37047,Columbus County,NC,North Carolina,NA,0,NA,NA,NA,1,NA,NA,NA,NA,NA,NA,NA,NA,NA,NA,NA
37049,Craven County,NC,North Carolina,NA,0,NA,NA,NA,1,NA,NA,NA,NA,NA,NA,NA,NA,NA,NA,NA
37051,Cumberland County,NC,North Carolina,NA,0,NA,NA,NA,1,NA,NA,NA,NA,NA,NA,NA,NA,NA,NA,NA
37053,Currituck County,NC,North Carolina,arhs_nc,1,NA,Yes,Yes,1,NA,NA,Albemarle Regional Health Services - North Carolina,1267151060,https://t.co/HwFKhggk0k,11/24/2021,9:02:37,https://twitter.com/ARHS_NC/status/1463508355465555976,2021,11,24
37055,Dare County,NC,North Carolina,NA,0,NA,NA,NA,1,NA,NA,NA,NA,NA,NA,NA,NA,NA,NA,NA
37057,Davidson County,NC,North Carolina,NA,0,NA,NA,NA,1,NA,NA,NA,NA,NA,NA,NA,NA,NA,NA,NA
37059,Davie County,NC,North Carolina,NA,0,NA,NA,NA,1,NA,NA,NA,NA,NA,NA,NA,NA,NA,NA,NA
37061,Duplin County,NC,North Carolina,NA,0,NA,NA,NA,1,NA,NA,NA,NA,NA,NA,NA,NA,NA,NA,NA
37063,Durham County,NC,North Carolina,NA,0,NA,NA,NA,1,NA,NA,NA,NA,NA,NA,NA,NA,NA,NA,NA
37065,Edgecombe County,NC,North Carolina,NA,0,NA,NA,NA,1,NA,NA,NA,NA,NA,NA,NA,NA,NA,NA,NA
37067,Forsyth County,NC,North Carolina,fcpublichealth,1,NA,Yes,Yes,1,NA,NA,NA,9.08E+17,Forsyth County Updated COVID-19 Data - 11/24/2021  https://t.co/MV7wkcjBRb,11/24/2021,14:46:04,https://twitter.com/fcpublichealth/status/1463594788981293061,2021,11,24
37069,Franklin County,NC,North Carolina,NA,0,NA,NA,NA,1,NA,NA,NA,NA,NA,NA,NA,NA,NA,NA,NA
37071,Gaston County,NC,North Carolina,NA,0,NA,NA,NA,1,NA,NA,NA,NA,NA,NA,NA,NA,NA,NA,NA
37073,Gates County,NC,North Carolina,arhs_nc,1,NA,Yes,Yes,1,NA,NA,Albemarle Regional Health Services - North Carolina,1267151060,https://t.co/HwFKhggk0k,11/24/2021,9:02:37,https://twitter.com/ARHS_NC/status/1463508355465555976,2021,11,24
37075,Graham County,NC,North Carolina,NA,0,NA,NA,NA,1,NA,NA,NA,NA,NA,NA,NA,NA,NA,NA,NA
37077,Granville County,NC,North Carolina,NA,0,NA,NA,NA,0,NA,DoubleCheck,NA,NA,NA,NA,NA,NA,NA,NA,NA
37079,Greene County,NC,North Carolina,NA,0,NA,NA,NA,1,NA,NA,NA,NA,NA,NA,NA,NA,NA,NA,NA
37081,Guilford County,NC,North Carolina,NA,0,NA,NA,NA,0,NA,DoubleCheck,NA,NA,NA,NA,NA,NA,NA,NA,NA
37083,Halifax County,NC,North Carolina,hcphs_nc,1,DoubleCheck,No,No,0,NA,DoubleCheck,NA,NA,NA,NA,NA,NA,NA,NA,NA
37085,Harnett County,NC,North Carolina,harnettcohd,1,NA,Yes,Yes,1,NA,NA,NA,1.28E+18,Preparing to make stuffing Thanksgiving? Learn all about stuffing and food safety here:   https://t.co/itn2PUZIZv  https://t.co/PRBAMbCu6S,11/24/2021,9:45:00,https://twitter.com/HarnettCoHD/status/1463519022008385538,2021,11,24
37087,Haywood County,NC,North Carolina,NA,0,NA,NA,NA,0,NA,DoubleCheck,NA,NA,NA,NA,NA,NA,NA,NA,NA
37089,Henderson County,NC,North Carolina,NA,0,NA,NA,NA,0,NA,DoubleCheck,NA,NA,NA,NA,NA,NA,NA,NA,NA
37091,Hertford County,NC,North Carolina,arhs_nc,1,NA,Yes,Yes,1,NA,NA,Albemarle Regional Health Services - North Carolina,1267151060,https://t.co/HwFKhggk0k,11/24/2021,9:02:37,https://twitter.com/ARHS_NC/status/1463508355465555976,2021,11,24
37093,Hoke County,NC,North Carolina,hokecohd,1,NA,Yes,Yes,0,NA,DoubleCheck,NA,8.46E+17,6 Tips to Stay Healthy this Flu Season!  https://t.co/Z56mjzY9NH,11/10/2021,10:54:35,https://twitter.com/HokeCoHD/status/1458463103750971396,2021,11,10
37095,Hyde County,NC,North Carolina,NA,0,NA,NA,NA,1,NA,NA,NA,NA,NA,NA,NA,NA,NA,NA,NA
37097,Iredell County,NC,North Carolina,NA,0,NA,NA,NA,1,NA,NA,NA,NA,NA,NA,NA,NA,NA,NA,NA
37099,Jackson County,NC,North Carolina,NA,0,NA,NA,NA,1,NA,NA,NA,NA,NA,NA,NA,NA,NA,NA,NA
37101,Johnston County,NC,North Carolina,NA,0,NA,NA,NA,0,NA,DoubleCheck,NA,NA,NA,NA,NA,NA,NA,NA,NA
37103,Jones County,NC,North Carolina,NA,0,NA,NA,NA,1,NA,NA,NA,NA,NA,NA,NA,NA,NA,NA,NA
37105,Lee County,NC,North Carolina,NA,0,NA,NA,NA,1,NA,NA,NA,NA,NA,NA,NA,NA,NA,NA,NA
37107,Lenoir County,NC,North Carolina,NA,0,NA,NA,NA,0,NA,DoubleCheck,NA,NA,NA,NA,NA,NA,NA,NA,NA
37109,Lincoln County,NC,North Carolina,NA,0,NA,NA,NA,1,NA,NA,NA,NA,NA,NA,NA,NA,NA,NA,NA
37111,McDowell County,NC,North Carolina,mcdowellhealth,1,DoubleCheck,No,No,1,NA,NA,NA,NA,NA,NA,NA,NA,NA,NA,NA
37113,Macon County,NC,North Carolina,maconhealth,1,DoubleCheck,No,No,0,NA,DoubleCheck,NA,NA,NA,NA,NA,NA,NA,NA,NA
37115,Madison County,NC,North Carolina,NA,0,NA,NA,NA,1,NA,NA,NA,NA,NA,NA,NA,NA,NA,NA,NA
37117,Martin County,NC,North Carolina,NA,0,NA,NA,NA,0,NA,DoubleCheck,NA,NA,NA,NA,NA,NA,NA,NA,NA
37119,Mecklenburg County,NC,North Carolina,NA,0,NA,NA,NA,1,NA,NA,NA,NA,NA,NA,NA,NA,NA,NA,NA
37121,Mitchell County,NC,North Carolina,NA,0,NA,NA,NA,0,NA,DoubleCheck,NA,NA,NA,NA,NA,NA,NA,NA,NA
37123,Montgomery County,NC,North Carolina,NA,0,NA,NA,NA,1,NA,NA,NA,NA,NA,NA,NA,NA,NA,NA,NA
37125,Moore County,NC,North Carolina,NA,0,NA,NA,NA,1,NA,NA,NA,NA,NA,NA,NA,NA,NA,NA,NA
37127,Nash County,NC,North Carolina,NA,0,NA,NA,NA,1,NA,NA,NA,NA,NA,NA,NA,NA,NA,NA,NA
37129,New Hanover County,NC,North Carolina,nhchealth,1,NA,Yes,Yes,1,NA,NA,NA,284197247,"Please see the FDA alert regarding an Outbreak Investigation of Salmonella Oranienburg: Whole, Fresh Onions (October 2021)  https://t.co/6T0cSNBQST",10/21/2021,15:38:15,https://twitter.com/nhchealth/status/1451271633235111937,2021,10,21
37131,Northampton County,NC,North Carolina,NA,0,NA,NA,NA,1,NA,NA,NA,NA,NA,NA,NA,NA,NA,NA,NA
37133,Onslow County,NC,North Carolina,ochealthdept,1,NA,Yes,Yes,1,NA,NA,NA,153821993,"The American Academy of Pediatrics strongly recommends against bed sharing with an infant. Bed sharing is when someone sleeps on the same surface with a baby, such as a chair, sofa, or bed.   https://t.co/7Ee43K8jse. #SafeSleepNC  https://t.co/uiaeBicRBZ",10/19/2021,9:40:42,https://twitter.com/OCHealthDept/status/1450456879352717314,2021,10,19
37135,Orange County,NC,North Carolina,orangehealthnc,1,NA,Yes,Yes,0,NA,DoubleCheck,NA,478811816,"Orange County Health News for November 24, 2021:  https://t.co/g0LHm9ruIb  https://t.co/8hNY2jpCrX",11/24/2021,13:45:02,https://twitter.com/OrangeHealthNC/status/1463579430048223233,2021,11,24
37137,Pamlico County,NC,North Carolina,NA,0,NA,NA,NA,1,NA,NA,NA,NA,NA,NA,NA,NA,NA,NA,NA
37139,Pasquotank County,NC,North Carolina,arhs_nc,1,NA,Yes,Yes,1,NA,NA,Albemarle Regional Health Services - North Carolina,1267151060,https://t.co/HwFKhggk0k,11/24/2021,9:02:37,https://twitter.com/ARHS_NC/status/1463508355465555976,2021,11,24
37141,Pender County,NC,North Carolina,NA,0,NA,NA,NA,1,NA,NA,NA,NA,NA,NA,NA,NA,NA,NA,NA
37143,Perquimans County,NC,North Carolina,arhs_nc,1,NA,Yes,Yes,1,NA,NA,Albemarle Regional Health Services - North Carolina,1267151060,https://t.co/HwFKhggk0k,11/24/2021,9:02:37,https://twitter.com/ARHS_NC/status/1463508355465555976,2021,11,24
37145,Person County,NC,North Carolina,NA,0,NA,NA,NA,1,NA,NA,NA,NA,NA,NA,NA,NA,NA,NA,NA
37147,Pitt County,NC,North Carolina,NA,0,NA,NA,NA,1,NA,NA,NA,NA,NA,NA,NA,NA,NA,NA,NA
37149,Polk County,NC,North Carolina,NA,0,NA,NA,NA,0,NA,DoubleCheck,NA,NA,NA,NA,NA,NA,NA,NA,NA
37151,Randolph County,NC,North Carolina,NA,0,NA,NA,NA,0,NA,DoubleCheck,NA,NA,NA,NA,NA,NA,NA,NA,NA
37153,Richmond County,NC,North Carolina,NA,0,NA,NA,NA,1,NA,NA,NA,NA,NA,NA,NA,NA,NA,NA,NA
37155,Robeson County,NC,North Carolina,NA,0,NA,NA,NA,0,NA,DoubleCheck,NA,NA,NA,NA,NA,NA,NA,NA,NA
37157,Rockingham County,NC,North Carolina,rcdhhs,1,NA,Yes,Yes,0,NA,DoubleCheck,NA,1.31E+18,"""The pandemic has made these past two years 'different' to say the least. Words cannot describe how important our public health workers are to the health and well-being of our community."" Trey Wright, Rockingham County Health Director.  https://t.co/h4FbZ4UGlA",11/22/2021,10:32:39,https://twitter.com/RCDHHS/status/1462806236517253120,2021,11,22
37159,Rowan County,NC,North Carolina,NA,0,NA,NA,NA,1,NA,NA,NA,NA,NA,NA,NA,NA,NA,NA,NA
37161,Rutherford County,NC,North Carolina,NA,0,NA,NA,NA,0,NA,DoubleCheck,NA,NA,NA,NA,NA,NA,NA,NA,NA
37163,Sampson County,NC,North Carolina,NA,0,NA,NA,NA,1,NA,NA,NA,NA,NA,NA,NA,NA,NA,NA,NA
37165,Scotland County,NC,North Carolina,NA,0,NA,NA,NA,1,NA,NA,NA,NA,NA,NA,NA,NA,NA,NA,NA
37167,Stanly County,NC,North Carolina,NA,0,NA,NA,NA,1,NA,NA,NA,NA,NA,NA,NA,NA,NA,NA,NA
37169,Stokes County,NC,North Carolina,stokes_health,1,DoubleCheck,No,No,0,NA,DoubleCheck,NA,NA,NA,NA,NA,NA,NA,NA,NA
37171,Surry County,NC,North Carolina,NA,0,NA,NA,NA,1,NA,NA,NA,NA,NA,NA,NA,NA,NA,NA,NA
37173,Swain County,NC,North Carolina,NA,0,NA,NA,NA,0,NA,DoubleCheck,NA,NA,NA,NA,NA,NA,NA,NA,NA
37175,Transylvania County,NC,North Carolina,NA,0,NA,NA,NA,0,NA,DoubleCheck,NA,NA,NA,NA,NA,NA,NA,NA,NA
37177,Tyrrell County,NC,North Carolina,NA,0,NA,NA,NA,0,NA,DoubleCheck,NA,NA,NA,NA,NA,NA,NA,NA,NA
37179,Union County,NC,North Carolina,NA,0,NA,NA,NA,0,NA,DoubleCheck,NA,NA,NA,NA,NA,NA,NA,NA,NA
37181,Vance County,NC,North Carolina,NA,0,NA,NA,NA,0,NA,DoubleCheck,NA,NA,NA,NA,NA,NA,NA,NA,NA
37183,Wake County,NC,North Carolina,NA,0,NA,NA,NA,1,NA,NA,NA,NA,NA,NA,NA,NA,NA,NA,NA
37185,Warren County,NC,North Carolina,NA,0,NA,NA,NA,1,NA,NA,NA,NA,NA,NA,NA,NA,NA,NA,NA
37187,Washington County,NC,North Carolina,NA,0,NA,NA,NA,0,NA,DoubleCheck,NA,NA,NA,NA,NA,NA,NA,NA,NA
37189,Watauga County,NC,North Carolina,NA,0,NA,NA,NA,0,NA,DoubleCheck,NA,NA,NA,NA,NA,NA,NA,NA,NA
37191,Wayne County,NC,North Carolina,NA,0,NA,NA,NA,1,NA,NA,NA,NA,NA,NA,NA,NA,NA,NA,NA
37193,Wilkes County,NC,North Carolina,NA,0,NA,NA,NA,0,NA,DoubleCheck,NA,NA,NA,NA,NA,NA,NA,NA,NA
37195,Wilson County,NC,North Carolina,wilsoncountyhd,1,DoubleCheck,No,No,0,NA,DoubleCheck,NA,NA,NA,NA,NA,NA,NA,NA,NA
37197,Yadkin County,NC,North Carolina,NA,0,NA,NA,NA,0,NA,DoubleCheck,NA,NA,NA,NA,NA,NA,NA,NA,NA
37199,Yancey County,NC,North Carolina,healthyancey,1,DoubleCheck,No,No,1,NA,NA,NA,NA,NA,NA,NA,NA,NA,NA,NA
38001,Adams County,ND,North Dakota,NA,0,NA,NA,NA,0,NA,NA,NA,NA,NA,NA,NA,NA,NA,NA,NA
38003,Barnes County,ND,North Dakota,NA,0,NA,NA,NA,0,NA,NA,NA,NA,NA,NA,NA,NA,NA,NA,NA
38005,Benson County,ND,North Dakota,NA,0,NA,NA,NA,0,NA,NA,NA,NA,NA,NA,NA,NA,NA,NA,NA
38007,Billings County,ND,North Dakota,NA,0,NA,NA,NA,0,NA,NA,NA,NA,NA,NA,NA,NA,NA,NA,NA
38009,Bottineau County,ND,North Dakota,NA,0,NA,NA,NA,0,NA,NA,NA,NA,NA,NA,NA,NA,NA,NA,NA
38011,Bowman County,ND,North Dakota,NA,0,NA,NA,NA,0,NA,NA,NA,NA,NA,NA,NA,NA,NA,NA,NA
38013,Burke County,ND,North Dakota,NA,0,NA,NA,NA,0,NA,NA,NA,NA,NA,NA,NA,NA,NA,NA,NA
38015,Burleigh County,ND,North Dakota,bbpublichealth,1,NA,Yes,Yes,1,NA,NA,NA,9.84E+17,It’s important to have Narcan with your AED. BBPH provides training to recognize symptoms of an opioid overdose and administration of Narcan. This training is available at no cost. If you are interested in a Narcan training contact Sue at 701.355.1597 or skahler@bismarcknd.gov.  https://t.co/0j1GYfzmQD,11/24/2021,17:00:54,https://twitter.com/BBPublicHealth/status/1463628722465128455,2021,11,24
38017,Cass County,ND,North Dakota,NA,0,NA,NA,NA,0,NA,NA,NA,NA,NA,NA,NA,NA,NA,NA,NA
38019,Cavalier County,ND,North Dakota,NA,0,NA,NA,NA,0,NA,NA,NA,NA,NA,NA,NA,NA,NA,NA,NA
38021,Dickey County,ND,North Dakota,NA,0,NA,NA,NA,0,NA,NA,NA,NA,NA,NA,NA,NA,NA,NA,NA
38023,Divide County,ND,North Dakota,NA,0,NA,NA,NA,0,NA,NA,NA,NA,NA,NA,NA,NA,NA,NA,NA
38025,Dunn County,ND,North Dakota,NA,0,NA,NA,NA,0,NA,NA,NA,NA,NA,NA,NA,NA,NA,NA,NA
38027,Eddy County,ND,North Dakota,NA,0,NA,NA,NA,0,NA,NA,NA,NA,NA,NA,NA,NA,NA,NA,NA
38029,Emmons County,ND,North Dakota,NA,0,NA,NA,NA,1,NA,NA,NA,NA,NA,NA,NA,NA,NA,NA,NA
38031,Foster County,ND,North Dakota,NA,0,NA,NA,NA,0,NA,NA,NA,NA,NA,NA,NA,NA,NA,NA,NA
38033,Golden Valley County,ND,North Dakota,NA,0,NA,NA,NA,0,NA,NA,NA,NA,NA,NA,NA,NA,NA,NA,NA
38035,Grand Forks County,ND,North Dakota,NA,0,NA,NA,NA,1,NA,NA,NA,NA,NA,NA,NA,NA,NA,NA,NA
38037,Grant County,ND,North Dakota,NA,0,NA,NA,NA,0,NA,NA,NA,NA,NA,NA,NA,NA,NA,NA,NA
38039,Griggs County,ND,North Dakota,NA,0,NA,NA,NA,0,NA,NA,NA,NA,NA,NA,NA,NA,NA,NA,NA
38041,Hettinger County,ND,North Dakota,NA,0,NA,NA,NA,0,NA,NA,NA,NA,NA,NA,NA,NA,NA,NA,NA
38043,Kidder County,ND,North Dakota,NA,0,NA,NA,NA,1,NA,NA,NA,NA,NA,NA,NA,NA,NA,NA,NA
38045,LaMoure County,ND,North Dakota,countylamoure,1,DoubleCheck,No,No,1,NA,NA,NA,NA,NA,NA,NA,NA,NA,NA,NA
38047,Logan County,ND,North Dakota,NA,0,NA,NA,NA,0,NA,NA,NA,NA,NA,NA,NA,NA,NA,NA,NA
38049,McHenry County,ND,North Dakota,NA,0,NA,NA,NA,0,NA,NA,NA,NA,NA,NA,NA,NA,NA,NA,NA
38051,McIntosh County,ND,North Dakota,NA,0,NA,NA,NA,0,NA,NA,NA,NA,NA,NA,NA,NA,NA,NA,NA
38053,McKenzie County,ND,North Dakota,NA,0,NA,NA,NA,0,NA,NA,NA,NA,NA,NA,NA,NA,NA,NA,NA
38055,McLean County,ND,North Dakota,NA,0,NA,NA,NA,0,NA,NA,NA,NA,NA,NA,NA,NA,NA,NA,NA
38057,Mercer County,ND,North Dakota,NA,0,NA,NA,NA,0,NA,NA,NA,NA,NA,NA,NA,NA,NA,NA,NA
38059,Morton County,ND,North Dakota,NA,0,NA,NA,NA,0,NA,NA,NA,NA,NA,NA,NA,NA,NA,NA,NA
38061,Mountrail County,ND,North Dakota,NA,0,NA,NA,NA,0,NA,NA,NA,NA,NA,NA,NA,NA,NA,NA,NA
38063,Nelson County,ND,North Dakota,NA,0,NA,NA,NA,0,NA,NA,NA,NA,NA,NA,NA,NA,NA,NA,NA
38065,Oliver County,ND,North Dakota,NA,0,NA,NA,NA,0,NA,NA,NA,NA,NA,NA,NA,NA,NA,NA,NA
38067,Pembina County,ND,North Dakota,NA,0,NA,NA,NA,0,NA,NA,NA,NA,NA,NA,NA,NA,NA,NA,NA
38069,Pierce County,ND,North Dakota,NA,0,NA,NA,NA,0,NA,NA,NA,NA,NA,NA,NA,NA,NA,NA,NA
38071,Ramsey County,ND,North Dakota,NA,0,NA,NA,NA,0,NA,NA,NA,NA,NA,NA,NA,NA,NA,NA,NA
38073,Ransom County,ND,North Dakota,NA,0,NA,NA,NA,1,NA,NA,NA,NA,NA,NA,NA,NA,NA,NA,NA
38075,Renville County,ND,North Dakota,NA,0,NA,NA,NA,0,NA,NA,NA,NA,NA,NA,NA,NA,NA,NA,NA
38077,Richland County,ND,North Dakota,NA,0,NA,NA,NA,1,NA,NA,NA,NA,NA,NA,NA,NA,NA,NA,NA
38079,Rolette County,ND,North Dakota,NA,0,NA,NA,NA,1,Emergency Management Agency,NA,NA,NA,NA,NA,NA,NA,NA,NA,NA
38081,Sargent County,ND,North Dakota,NA,0,NA,NA,NA,0,NA,NA,NA,NA,NA,NA,NA,NA,NA,NA,NA
38083,Sheridan County,ND,North Dakota,NA,0,NA,NA,NA,0,NA,NA,NA,NA,NA,NA,NA,NA,NA,NA,NA
38085,Sioux County,ND,North Dakota,NA,0,NA,NA,NA,0,NA,NA,NA,NA,NA,NA,NA,NA,NA,NA,NA
38087,Slope County,ND,North Dakota,NA,0,NA,NA,NA,0,NA,NA,NA,NA,NA,NA,NA,NA,NA,NA,NA
38089,Stark County,ND,North Dakota,NA,0,NA,NA,NA,0,NA,NA,NA,NA,NA,NA,NA,NA,NA,NA,NA
38091,Steele County,ND,North Dakota,NA,0,NA,NA,NA,1,NA,NA,NA,NA,NA,NA,NA,NA,NA,NA,NA
38093,Stutsman County,ND,North Dakota,NA,0,NA,NA,NA,0,NA,NA,NA,NA,NA,NA,NA,NA,NA,NA,NA
38095,Towner County,ND,North Dakota,NA,0,NA,NA,NA,0,NA,NA,NA,NA,NA,NA,NA,NA,NA,NA,NA
38097,Traill County,ND,North Dakota,NA,0,NA,NA,NA,0,NA,NA,NA,NA,NA,NA,NA,NA,NA,NA,NA
38099,Walsh County,ND,North Dakota,NA,0,NA,NA,NA,0,NA,NA,NA,NA,NA,NA,NA,NA,NA,NA,NA
38101,Ward County,ND,North Dakota,NA,0,NA,NA,NA,0,NA,NA,NA,NA,NA,NA,NA,NA,NA,NA,NA
38103,Wells County,ND,North Dakota,NA,0,NA,NA,NA,1,NA,NA,NA,NA,NA,NA,NA,NA,NA,NA,NA
38105,Williams County,ND,North Dakota,NA,0,NA,NA,NA,1,Emergency Management Agency,NA,NA,NA,NA,NA,NA,NA,NA,NA,NA
39001,Adams County,OH,Ohio,NA,0,NA,NA,NA,1,NA,NA,NA,NA,NA,NA,NA,NA,NA,NA,NA
39003,Allen County,OH,Ohio,acpublichealth,1,NA,Yes,Yes,1,NA,NA,NA,2165304451,"Allen County Public Health will be closed Thursday, November 25th and Friday, November 26th in observance of Thanksgiving. Additionally, there will NOT be a COVID-19 Vaccination Clinic held on Friday, November 26th.  https://t.co/VHkxdsBC7b",11/23/2021,13:18:12,https://twitter.com/ACPublicHealth/status/1463210288761774087,2021,11,23
39005,Ashland County,OH,Ohio,ashlandcounty,1,DoubleCheck,No,No,1,NA,NA,NA,NA,NA,NA,NA,NA,NA,NA,NA
39007,Ashtabula County,OH,Ohio,ashtabulad,1,DoubleCheck,No,No,1,NA,No_tweets,NA,NA,NA,NA,NA,NA,NA,NA,NA
39009,Athens County,OH,Ohio,acchd_oh,1,NA,Yes,Yes,1,NA,NA,NA,1.24E+18,https://t.co/XI3NPSpZtf,11/23/2021,7:34:24,https://twitter.com/ACCHD_OH/status/1463123767413071875,2021,11,23
39011,Auglaize County,OH,Ohio,auglaizehealth,1,DoubleCheck,No,No,1,NA,NA,NA,NA,NA,NA,NA,NA,NA,NA,NA
39013,Belmont County,OH,Ohio,NA,0,NA,NA,NA,1,NA,NA,NA,NA,NA,NA,NA,NA,NA,NA,NA
39015,Brown County,OH,Ohio,bchd_georgetown,1,DoubleCheck,No,No,1,NA,NA,NA,NA,NA,NA,NA,NA,NA,NA,NA
39017,Butler County,OH,Ohio,butlercounty_hd,1,NA,Yes,Yes,1,NA,NA,NA,8.04E+17,Transportation is vital for a healthy community. Take this survey to spark change and improve affordability and accessibility of transportation. Survey:  https://t.co/M5aNXoNcJT  https://t.co/DfoSdgeKZu,11/22/2021,18:00:00,https://twitter.com/ButlerCounty_HD/status/1462918816388710410,2021,11,22
39019,Carroll County,OH,Ohio,carrolllhd,1,NA,No,No,1,NA,NA,NA,350991831,July Health Observances  https://t.co/w0hzubH5iM,7/1/2019,10:45:39,https://twitter.com/carrolllhd/status/1145705028491075584,2019,7,1
39021,Champaign County,OH,Ohio,NA,0,NA,NA,NA,0,NA,NA,NA,NA,NA,NA,NA,NA,NA,NA,NA
39023,Clark County,OH,Ohio,clarkcohealth,1,NA,Yes,Yes,0,NA,NA,NA,374021283,Be sure to exercise proper food safety this Thanksgiving:   1. Store Turkey Properly 2. Thaw Turkey Safely 3. Handle Turkey Correctly to Prevent the Spread of Germs 4. Cook Stuffing Thoroughly 5. Cook Turkey Thoroughly 6. Take Care of Leftovers  Read more:  https://t.co/2QBfzWktgo  https://t.co/z7aeQWXusE,11/24/2021,11:22:11,https://twitter.com/clarkcohealth/status/1463543481591382017,2021,11,24
39025,Clermont County,OH,Ohio,ccphohio,1,NA,Yes,Yes,1,NA,NA,NA,9.47E+17,We still have a few open appointments for our vaccine clinic this afternoon at @fflsd Anyone 5 and older can get vaccinated. Find appointments on @ArmorVax or call 513-735-8500  https://t.co/8uhbPdBh40,11/19/2021,9:28:03,https://twitter.com/ccphohio/status/1461702817324978178,2021,11,19
39027,Clinton County,OH,Ohio,NA,0,NA,NA,NA,1,NA,NA,NA,NA,NA,NA,NA,NA,NA,NA,NA
39029,Columbiana County,OH,Ohio,NA,0,NA,NA,NA,1,NA,NA,NA,NA,NA,NA,NA,NA,NA,NA,NA
39031,Coshocton County,OH,Ohio,NA,0,NA,NA,NA,1,NA,NA,NA,NA,NA,NA,NA,NA,NA,NA,NA
39033,Crawford County,OH,Ohio,NA,0,NA,NA,NA,1,NA,NA,NA,NA,NA,NA,NA,NA,NA,NA,NA
39035,Cuyahoga County,OH,Ohio,ccbh_net,1,NA,Yes,Yes,1,NA,NA,NA,462917435,https://t.co/6OsbCzXOCH,11/23/2021,14:49:34,https://twitter.com/CCBH_Net/status/1463233283316195329,2021,11,23
39037,Darke County,OH,Ohio,darkecohealth,1,NA,Yes,Yes,1,NA,NA,NA,223895148,Here are the COVID-19 and vaccination numbers being reported to ODH. There are 114 new cases being reported since last Tuesday.  Reminder the Darke County General Health District will only be posting COVID-19 numbers and vaccination rates on a weekly basis (Monday)  https://t.co/g8TeH1Sk9U,11/23/2021,14:05:07,https://twitter.com/DarkeCoHealth/status/1463222094720864257,2021,11,23
39039,Defiance County,OH,Ohio,dcghd,1,NA,Yes,Yes,1,NA,NA,NA,1694546894,"Defiance County Health Department will be hosting a pediatric COVID-19 vaccine clinic for children 5-11 years old on Monday, November 29 from 3:30-5:30pm at Defiance County Health Department. This is a walk-in clinic, no appointment needed. For questions, please call 419-784-3818  https://t.co/xa3ZLqSGDl",11/24/2021,13:00:21,https://twitter.com/DCGHD/status/1463568184934547457,2021,11,24
39041,Delaware County,OH,Ohio,delawarehealth,1,NA,Yes,Yes,1,NA,NA,NA,92343143,The COVID-19 weekly reports will be postponed due to the holiday week. Have a very happy &amp; healthy Thanksgiving!  https://t.co/6jPgFoYoFg,11/24/2021,13:30:00,https://twitter.com/DelawareHealth/status/1463575647570341889,2021,11,24
39043,Erie County,OH,Ohio,NA,0,NA,NA,NA,1,NA,NA,NA,NA,NA,NA,NA,NA,NA,NA,NA
39045,Fairfield County,OH,Ohio,NA,0,NA,NA,NA,1,NA,NA,NA,NA,NA,NA,NA,NA,NA,NA,NA
39047,Fayette County,OH,Ohio,faycohd,1,DoubleCheck,No,No,1,NA,NA,NA,NA,NA,NA,NA,NA,NA,NA,NA
39049,Franklin County,OH,Ohio,fc_publichealth,1,NA,Yes,Yes,0,NA,NA,NA,111407706,"Finally, a huge shoutout and thank you to our awesome staff that stood outside for most of today. You are nothing short of incredible!  Have a great holiday week everyone! #testgiving  https://t.co/rgFDRRJw3m",11/22/2021,17:15:08,https://twitter.com/FC_PublicHealth/status/1462907527222501386,2021,11,22
39051,Fulton County,OH,Ohio,NA,0,NA,NA,NA,1,NA,NA,NA,NA,NA,NA,NA,NA,NA,NA,NA
39053,Gallia County,OH,Ohio,galliahealth,1,NA,No,No,1,NA,NA,NA,887203764,The Gallia County Health Department celebrated #TakeOurChildrenToWorkDay yesterday!,4/26/2019,10:17:14,https://twitter.com/GalliaHealth/status/1121780276588417024,2019,4,26
39055,Geauga County,OH,Ohio,NA,0,NA,NA,NA,1,NA,NA,NA,NA,NA,NA,NA,NA,NA,NA,NA
39057,Greene County,OH,Ohio,greenecoph,1,NA,Yes,Yes,1,NA,NA,NA,606508957,Got questions about #OhioVax2School? Visit  https://t.co/WvQsnddNUH or call 1- 833-4-ASK-ODH to learn more about the program and how you can enter! #COVID19  https://t.co/Qyxv7j6QbA,11/24/2021,16:01:01,https://twitter.com/GreeneCoPH/status/1463613649365438464,2021,11,24
39059,Guernsey County,OH,Ohio,guernseyctyhd,1,NA,Yes,No,1,NA,NA,NA,1.14E+18,PLEASE SEE THE IMAGE BELOW FOR OUR UPDATED VACCINE SCHEDULE: TUESDAY: Child Vaccines by appointment only  THURSDAY: Child Vaccines by appointment only FRIDAY: Pfizer Walk-Ins &amp; Child Vaccines by Appointment  - Children ages 12 and over may receive the Pfizer vaccine.  https://t.co/5R5zXOH0u4,8/6/2021,15:19:03,https://twitter.com/GuernseyCTYHD/status/1423725322428682243,2021,8,6
39061,Hamilton County,OH,Ohio,hamcohealth,1,NA,Yes,Yes,1,NA,NA,NA,16812696,Have a safe and healthy holiday!  https://t.co/csZEM9wSH4,11/24/2021,12:04:10,https://twitter.com/HamCoHealth/status/1463554045629583370,2021,11,24
39063,Hancock County,OH,Ohio,hancockhealth,1,NA,Yes,Yes,1,NA,NA,NA,4898353000,https://t.co/Am8UlH8Xa2,11/19/2021,9:35:06,https://twitter.com/HancockHealth/status/1461704592736104448,2021,11,19
39065,Hardin County,OH,Ohio,NA,0,NA,NA,NA,1,NA,NA,NA,NA,NA,NA,NA,NA,NA,NA,NA
39067,Harrison County,OH,Ohio,NA,0,NA,NA,NA,1,NA,NA,NA,NA,NA,NA,NA,NA,NA,NA,NA
39069,Henry County,OH,Ohio,henrycountyhd,1,NA,Yes,Yes,1,NA,NA,NA,1275524940,Here is the weekly COVID dashboard for Henry County.  https://t.co/pfPOE203WS,11/24/2021,17:00:13,https://twitter.com/HenryCountyHD/status/1463628546694434819,2021,11,24
39071,Highland County,OH,Ohio,NA,0,NA,NA,NA,1,NA,NA,NA,NA,NA,NA,NA,NA,NA,NA,NA
39073,Hocking County,OH,Ohio,hockinghealth,1,DoubleCheck,No,No,1,NA,NA,NA,NA,NA,NA,NA,NA,NA,NA,NA
39075,Holmes County,OH,Ohio,holmescohealth,1,DoubleCheck,No,No,1,NA,NA,NA,NA,NA,NA,NA,NA,NA,NA,NA
39077,Huron County,OH,Ohio,NA,0,NA,NA,NA,1,NA,NA,NA,NA,NA,NA,NA,NA,NA,NA,NA
39079,Jackson County,OH,Ohio,NA,0,NA,NA,NA,1,NA,NA,NA,NA,NA,NA,NA,NA,NA,NA,NA
39081,Jefferson County,OH,Ohio,jeffcohd,1,DoubleCheck,No,No,1,NA,NA,NA,NA,NA,NA,NA,NA,NA,NA,NA
39083,Knox County,OH,Ohio,NA,0,NA,NA,NA,1,NA,NA,NA,NA,NA,NA,NA,NA,NA,NA,NA
39085,Lake County,OH,Ohio,lchealthdist,1,NA,Yes,Yes,1,NA,NA,NA,73162642,"It is never okay to drink and drive. Even if you’ve had only one alcoholic beverage, designate a sober driver or plan to use public transportation or a ride service to get home safely. Go to  https://t.co/PNRo6uClXM for more info. #Thanksgiving #BuzzedDrivingisDrunkDriving  https://t.co/FcXDdLmH2u",11/24/2021,16:00:02,https://twitter.com/LCHealthDist/status/1463613402278817796,2021,11,24
39087,Lawrence County,OH,Ohio,NA,0,NA,NA,NA,1,NA,NA,NA,NA,NA,NA,NA,NA,NA,NA,NA
39089,Licking County,OH,Ohio,NA,0,NA,NA,NA,1,NA,NA,NA,NA,NA,NA,NA,NA,NA,NA,NA
39091,Logan County,OH,Ohio,logancohealth,1,NA,Yes,Yes,1,NA,NA,NA,1394515124,"We're Hiring an Outreach Specialist!  Join our team and enjoy a flexible, family friendly environment!    https://t.co/cNx4dZ0jCN  https://t.co/mYxeQN5j1P",11/23/2021,8:06:04,https://twitter.com/LoganCoHealth/status/1463131736875876361,2021,11,23
39093,Lorain County,OH,Ohio,NA,0,NA,NA,NA,1,NA,NA,NA,NA,NA,NA,NA,NA,NA,NA,NA
39095,Lucas County,OH,Ohio,toledolucashd,1,NA,Yes,Yes,1,NA,NA,NA,403628387,"‼️🚨UPDATE: ALL #COVID19 TEST KITS ARE GONE as of 12:00 pm Wednesday, Nov 24 🚨‼️ We hope to get additional kits before the Christmas holiday.",11/24/2021,12:29:12,https://twitter.com/ToledoLucasHD/status/1463560344341827591,2021,11,24
39097,Madison County,OH,Ohio,madisoncountyph,1,NA,Yes,Yes,1,NA,NA,NA,209056126,"It may be tough to buckle your belt after Thanksgiving dinner, but your seat belt will always fit! #BuckleUp. Every Trip. Every Time.  https://t.co/eStCsN7lvf",11/24/2021,15:07:02,https://twitter.com/MadisonCountyPH/status/1463600063465365512,2021,11,24
39099,Mahoning County,OH,Ohio,mahoninghealth,1,NA,Yes,Yes,1,NA,NA,NA,856369932,https://t.co/xbEUUe4LhF,11/24/2021,11:01:08,https://twitter.com/mahoninghealth/status/1463538181878517777,2021,11,24
39101,Marion County,OH,Ohio,NA,0,NA,NA,NA,1,NA,NA,NA,NA,NA,NA,NA,NA,NA,NA,NA
39103,Medina County,OH,Ohio,medinahealth,1,NA,Yes,Yes,1,NA,NA,NA,36956369,Preparing a holiday meal this Thanksgiving? Cook your turkey thoroughly and always use a food thermometer. Learn more about meal prep for the holidays:   https://t.co/vMK7Xplcne.  https://t.co/yspPtgvBy7,11/24/2021,16:01:11,https://twitter.com/MedinaHealth/status/1463613693178966020,2021,11,24
39105,Meigs County,OH,Ohio,meigshealthdept,1,NA,Yes,Yes,1,NA,NA,NA,884458754,Covid-19 Vaccine Booster Shots  https://t.co/UZmNLyJGHf,11/23/2021,10:33:56,https://twitter.com/MeigsHealthDept/status/1463168950712381450,2021,11,23
39107,Mercer County,OH,Ohio,mercountyhealth,1,NA,Yes,No,1,NA,NA,NA,1.23E+18,Ohio currently has zero confirmed cases of #COVID19. We continue to work with ODH &amp; CDC. MCHD is prepared and we urge citizens to be prepared and not scared.  https://t.co/dt7Es7FaUF,3/4/2020,12:44:52,https://twitter.com/MerCountyHealth/status/1235259931588206592,2020,3,4
39109,Miami County,OH,Ohio,miamicountyph,1,NA,Yes,Yes,1,NA,NA,NA,71439098,Miami County Public Health will be closed Thursday November 25 and Friday November 26 in observance of the Thanksgiving holiday. Regular hours resume Monday November 29.  https://t.co/RYKGjwpGME,11/24/2021,8:45:00,https://twitter.com/MiamiCountyPH/status/1463503922329489409,2021,11,24
39111,Monroe County,OH,Ohio,NA,0,NA,NA,NA,1,NA,NA,NA,NA,NA,NA,NA,NA,NA,NA,NA
39113,Montgomery County,OH,Ohio,publichealthdmc,1,NA,Yes,Yes,1,NA,NA,NA,146039003,"All Public Health locations and services will be closed Thursday, November 25 and Friday, November 26 for Thanksgiving. Normal operations will resume Monday, November 29. #HappyThanksgiving #HappyTurkeyDay #Dayton  https://t.co/TlurmqVY6U",11/24/2021,16:00:35,https://twitter.com/PublicHealthDMC/status/1463613540846215170,2021,11,24
39115,Morgan County,OH,Ohio,NA,0,NA,NA,NA,1,NA,NA,NA,NA,NA,NA,NA,NA,NA,NA,NA
39117,Morrow County,OH,Ohio,morrowcountyhd,1,DoubleCheck,No,No,1,NA,NA,NA,NA,NA,NA,NA,NA,NA,NA,NA
39119,Muskingum County,OH,Ohio,zmchd,1,NA,Yes,Yes,1,NA,NA,NA,2544184801,"COVID-19 Deaths 186, Cases &amp; Update in Muskingum County The link to today's Muskingum County COVID-19 Update from the Unified Command Center:   https://t.co/TFHHmV5JE5  https://t.co/F8f8Z0i56q",11/24/2021,16:18:02,https://twitter.com/ZMCHD/status/1463617932848771075,2021,11,24
39121,Noble County,OH,Ohio,noblecohd,1,NA,Yes,Yes,1,NA,NA,NA,1.24E+18,https://t.co/IdVUnSrwdl,11/22/2021,10:01:30,https://twitter.com/NobleCoHD/status/1462798400030752773,2021,11,22
39123,Ottawa County,OH,Ohio,NA,0,NA,NA,NA,1,NA,NA,NA,NA,NA,NA,NA,NA,NA,NA,NA
39125,Paulding County,OH,Ohio,NA,0,NA,NA,NA,1,NA,NA,NA,NA,NA,NA,NA,NA,NA,NA,NA
39127,Perry County,OH,Ohio,perrycountyheal,1,DoubleCheck,No,No,1,NA,NA,NA,NA,NA,NA,NA,NA,NA,NA,NA
39129,Pickaway County,OH,Ohio,pc_publichealth,1,NA,Yes,Yes,1,NA,NA,NA,1.14E+18,"As of 8:00 AM, 11/24/2021, these are our current numbers in Pickaway County. Please note, because of the holiday closing tomorrow our numbers only reflect the past six days. These numbers do not include those in the prison system, and are community only.  https://t.co/fxUJVRGKmL",11/24/2021,12:46:44,https://twitter.com/PC_PublicHealth/status/1463564759064850445,2021,11,24
39131,Pike County,OH,Ohio,pikehealth,1,DoubleCheck,No,No,1,NA,NA,NA,NA,NA,NA,NA,NA,NA,NA,NA
39133,Portage County,OH,Ohio,NA,0,NA,NA,NA,1,NA,NA,NA,NA,NA,NA,NA,NA,NA,NA,NA
39135,Preble County,OH,Ohio,preblecohealth,1,NA,Yes,Yes,1,NA,NA,NA,1425525014,Thinking about all that food preparation for Thanksgiving?? Click on the link for some good tips for food safety!!  https://t.co/ZwkYDe8dXp  https://t.co/vZoQdlMojt,11/24/2021,9:15:06,https://twitter.com/PrebleCoHealth/status/1463511497280266242,2021,11,24
39137,Putnam County,OH,Ohio,putnamcohealth,1,NA,Yes,Yes,1,NA,NA,NA,2289939458,"The PCHD and its partners are working with Center for Marketing and Opinion Research to conduct a health survey. If you receive a call, please take time to complete the survey! Participants are randomly selected. If you receive a call, the caller ID will read: CMO Research.  https://t.co/pETlF5k8F6",10/20/2021,11:33:23,https://twitter.com/PutnamCoHealth/status/1450847624970620930,2021,10,20
39139,Richland County,OH,Ohio,richlandhealth1,1,NA,Yes,Yes,1,NA,NA,NA,552029891,"Richland Public Health will be closed Thursday, November 25, and Friday, November 26, for the holiday.  https://t.co/aLl3J6h9re",11/24/2021,10:05:14,https://twitter.com/RichlandHealth1/status/1463524115109740556,2021,11,24
39141,Ross County,OH,Ohio,rosscohealth,1,NA,Yes,Yes,1,NA,NA,NA,180394769,You have time to be partially vaccinated from COVID-19 this holiday season! Our clinic is open next week from 8 a.m. to 4 p.m. with evening hours on Tuesday! #Getvaccinated #Covid19vaccine  https://t.co/EPkZqo8nQc,11/24/2021,17:00:13,https://twitter.com/rosscohealth/status/1463628546857967621,2021,11,24
39143,Sandusky County,OH,Ohio,sanduskycohd,1,DoubleCheck,No,No,1,NA,NA,NA,NA,NA,NA,NA,NA,NA,NA,NA
39145,Scioto County,OH,Ohio,countyscioto,1,DoubleCheck,No,No,1,NA,NA,NA,NA,NA,NA,NA,NA,NA,NA,NA
39147,Seneca County,OH,Ohio,NA,0,NA,NA,NA,1,NA,NA,NA,NA,NA,NA,NA,NA,NA,NA,NA
39149,Shelby County,OH,Ohio,NA,0,NA,NA,NA,1,NA,NA,NA,NA,NA,NA,NA,NA,NA,NA,NA
39151,Stark County,OH,Ohio,health_stark,1,NA,Yes,Yes,1,NA,NA,NA,1.06E+18,"Want to see if your business, school, or non-profit qualifies for items to make your environment safer? Visit  https://t.co/4kZBs0OTnl to locate your business.  https://t.co/mYVd5cwv60",11/24/2021,13:45:03,https://twitter.com/health_stark/status/1463579435131617284,2021,11,24
39153,Summit County,OH,Ohio,NA,0,NA,NA,NA,1,NA,NA,NA,NA,NA,NA,NA,NA,NA,NA,NA
39155,Trumbull County,OH,Ohio,trumbull_health,1,NA,Yes,NA,1,NA,NA,NA,NA,NA,NA,NA,NA,2021,11,25
39157,Tuscarawas County,OH,Ohio,tchdnow,1,NA,Yes,Yes,1,NA,NA,NA,9.61E+17,"Don’t let a pre-Thanksgiving party squash your holiday meal. Here is a reminder that drinking &amp; driving don't mix. From 2015-2019, 135 drivers involved  in fatal crashes on Thanksgiving eve were alcohol-impaired. If you’ve been drinking, don't drive.  #SafeCommunitiesofTuscCounty  https://t.co/W9Y3AbLM7N",11/24/2021,14:29:00,https://twitter.com/TCHDNow/status/1463590492227076097,2021,11,24
39159,Union County,OH,Ohio,unioncohealth,1,NA,Yes,Yes,1,NA,NA,NA,620326861,"With Thanksgiving a little over a week away, here are some great community resources to make sure everyone gets a great Thanksgiving feast this year! ❤  https://t.co/tAD7ScKigE",11/17/2021,15:05:08,https://twitter.com/unioncohealth/status/1461062872092528650,2021,11,17
39161,Van Wert County,OH,Ohio,NA,0,NA,NA,NA,1,NA,NA,NA,NA,NA,NA,NA,NA,NA,NA,NA
39163,Vinton County,OH,Ohio,NA,0,NA,NA,NA,1,NA,NA,NA,NA,NA,NA,NA,NA,NA,NA,NA
39165,Warren County,OH,Ohio,warrencohealth,1,NA,Yes,Yes,1,NA,NA,NA,577380112,https://t.co/5399JHaLWX,11/24/2021,18:00:04,https://twitter.com/WarrenCoHealth/status/1463643609492828164,2021,11,24
39167,Washington County,OH,Ohio,NA,0,NA,NA,NA,1,NA,NA,NA,NA,NA,NA,NA,NA,NA,NA,NA
39169,Wayne County,OH,Ohio,healthwayne,1,NA,Yes,Yes,1,NA,NA,NA,1.17E+18,https://t.co/dW2IUfE7Nx,11/24/2021,8:35:28,https://twitter.com/HealthWayne/status/1463501525913853957,2021,11,24
39171,Williams County,OH,Ohio,NA,0,NA,NA,NA,1,NA,NA,NA,NA,NA,NA,NA,NA,NA,NA,NA
39173,Wood County,OH,Ohio,wchdohio,1,NA,Yes,Yes,1,NA,NA,NA,19712828,"Here's today's COVID-19 case update. Get additional information including cases by ZIP code, cases per 100,000 and how to report possible COVID-19 illness at  https://t.co/bQ01j7RV2r  https://t.co/N8iFssxa1o",11/24/2021,17:13:50,https://twitter.com/WCHDOhio/status/1463631974942261254,2021,11,24
39175,Wyandot County,OH,Ohio,wyandothealth,1,NA,Yes,Yes,1,NA,NA,NA,2573376955,Don't be a turkey this Thanksgiving. #BuckleUp. Every Trip. Every Time.  https://t.co/icbjQs46bx,11/24/2021,15:36:00,https://twitter.com/WyandotHealth/status/1463607353509511171,2021,11,24
40001,Adair County,OK,Oklahoma,NA,0,NA,NA,NA,1,NA,NA,NA,NA,NA,NA,NA,NA,NA,NA,NA
40003,Alfalfa County,OK,Oklahoma,NA,0,NA,NA,NA,0,NA,NA,NA,NA,NA,NA,NA,NA,NA,NA,NA
40005,Atoka County,OK,Oklahoma,NA,0,NA,NA,NA,1,NA,NA,NA,NA,NA,NA,NA,NA,NA,NA,NA
40007,Beaver County,OK,Oklahoma,NA,0,NA,NA,NA,1,NA,NA,NA,NA,NA,NA,NA,NA,NA,NA,NA
40009,Beckham County,OK,Oklahoma,swochd5,1,NA,Yes,No,1,NA,NA,Southwest Oklahoma County Health Departments,1.24E+18,"These numbers represent data collected for Oklahoma and the ten counties served by the county health departments of District 5 for Wednesday, September 30, 2020. For more information, please visit  https://t.co/dc0CCWr4YL.  https://t.co/rx4lo0LW82",9/30/2020,12:27:24,https://twitter.com/SWOCHD5/status/1311341889396903936,2020,9,30
40011,Blaine County,OK,Oklahoma,NA,0,NA,NA,NA,1,NA,NA,NA,NA,NA,NA,NA,NA,NA,NA,NA
40013,Bryan County,OK,Oklahoma,NA,0,NA,NA,NA,1,NA,NA,NA,NA,NA,NA,NA,NA,NA,NA,NA
40015,Caddo County,OK,Oklahoma,swochd5,1,NA,Yes,No,1,NA,NA,Southwest Oklahoma County Health Departments,1.24E+18,"These numbers represent data collected for Oklahoma and the ten counties served by the county health departments of District 5 for Wednesday, September 30, 2020. For more information, please visit  https://t.co/dc0CCWr4YL.  https://t.co/rx4lo0LW82",9/30/2020,12:27:24,https://twitter.com/SWOCHD5/status/1311341889396903936,2020,9,30
40017,Canadian County,OK,Oklahoma,NA,0,NA,NA,NA,1,NA,NA,NA,NA,NA,NA,NA,NA,NA,NA,NA
40019,Carter County,OK,Oklahoma,NA,0,NA,NA,NA,1,NA,NA,NA,NA,NA,NA,NA,NA,NA,NA,NA
40021,Cherokee County,OK,Oklahoma,NA,0,NA,NA,NA,1,NA,NA,NA,NA,NA,NA,NA,NA,NA,NA,NA
40023,Choctaw County,OK,Oklahoma,NA,0,NA,NA,NA,1,NA,NA,NA,NA,NA,NA,NA,NA,NA,NA,NA
40025,Cimarron County,OK,Oklahoma,NA,0,NA,NA,NA,0,NA,NA,NA,NA,NA,NA,NA,NA,NA,NA,NA
40027,Cleveland County,OK,Oklahoma,clecountyhealth,1,NA,Yes,No,1,NA,NA,NA,7.26E+17,Our Food Handler Class for food workers in #Norman and #Moore needing valid food handler permits (Sec.13-807 and Sec.8-604) is now available entirely online! Complete the food handler training on any device at  https://t.co/D35M2MkTRE.  https://t.co/0x92zHBcZr,7/19/2021,14:13:00,https://twitter.com/CleCountyHealth/status/1417185722218401793,2021,7,19
40029,Coal County,OK,Oklahoma,NA,0,NA,NA,NA,1,NA,NA,NA,NA,NA,NA,NA,NA,NA,NA,NA
40031,Comanche County,OK,Oklahoma,swochd5,1,NA,Yes,No,1,NA,NA,Southwest Oklahoma County Health Departments,1.24E+18,"These numbers represent data collected for Oklahoma and the ten counties served by the county health departments of District 5 for Wednesday, September 30, 2020. For more information, please visit  https://t.co/dc0CCWr4YL.  https://t.co/rx4lo0LW82",9/30/2020,12:27:24,https://twitter.com/SWOCHD5/status/1311341889396903936,2020,9,30
40033,Cotton County,OK,Oklahoma,swochd5,1,NA,Yes,No,1,NA,NA,Southwest Oklahoma County Health Departments,1.24E+18,"These numbers represent data collected for Oklahoma and the ten counties served by the county health departments of District 5 for Wednesday, September 30, 2020. For more information, please visit  https://t.co/dc0CCWr4YL.  https://t.co/rx4lo0LW82",9/30/2020,12:27:24,https://twitter.com/SWOCHD5/status/1311341889396903936,2020,9,30
40035,Craig County,OK,Oklahoma,NA,0,NA,NA,NA,1,NA,NA,NA,NA,NA,NA,NA,NA,NA,NA,NA
40037,Creek County,OK,Oklahoma,NA,0,NA,NA,NA,1,NA,NA,NA,NA,NA,NA,NA,NA,NA,NA,NA
40039,Custer County,OK,Oklahoma,NA,0,NA,NA,NA,1,NA,NA,NA,NA,NA,NA,NA,NA,NA,NA,NA
40041,Delaware County,OK,Oklahoma,NA,0,NA,NA,NA,1,NA,NA,NA,NA,NA,NA,NA,NA,NA,NA,NA
40043,Dewey County,OK,Oklahoma,NA,0,NA,NA,NA,0,NA,NA,NA,NA,NA,NA,NA,NA,NA,NA,NA
40045,Ellis County,OK,Oklahoma,NA,0,NA,NA,NA,0,NA,NA,NA,NA,NA,NA,NA,NA,NA,NA,NA
40047,Garfield County,OK,Oklahoma,NA,0,NA,NA,NA,1,NA,NA,NA,NA,NA,NA,NA,NA,NA,NA,NA
40049,Garvin County,OK,Oklahoma,NA,0,NA,NA,NA,1,NA,NA,NA,NA,NA,NA,NA,NA,NA,NA,NA
40051,Grady County,OK,Oklahoma,NA,0,NA,NA,NA,1,NA,NA,NA,NA,NA,NA,NA,NA,NA,NA,NA
40053,Grant County,OK,Oklahoma,NA,0,NA,NA,NA,1,NA,NA,NA,NA,NA,NA,NA,NA,NA,NA,NA
40055,Greer County,OK,Oklahoma,swochd5,1,NA,Yes,No,1,NA,NA,Southwest Oklahoma County Health Departments,1.24E+18,"These numbers represent data collected for Oklahoma and the ten counties served by the county health departments of District 5 for Wednesday, September 30, 2020. For more information, please visit  https://t.co/dc0CCWr4YL.  https://t.co/rx4lo0LW82",9/30/2020,12:27:24,https://twitter.com/SWOCHD5/status/1311341889396903936,2020,9,30
40057,Harmon County,OK,Oklahoma,swochd5,1,NA,Yes,No,1,NA,NA,Southwest Oklahoma County Health Departments,1.24E+18,"These numbers represent data collected for Oklahoma and the ten counties served by the county health departments of District 5 for Wednesday, September 30, 2020. For more information, please visit  https://t.co/dc0CCWr4YL.  https://t.co/rx4lo0LW82",9/30/2020,12:27:24,https://twitter.com/SWOCHD5/status/1311341889396903936,2020,9,30
40059,Harper County,OK,Oklahoma,NA,0,NA,NA,NA,1,NA,NA,NA,NA,NA,NA,NA,NA,NA,NA,NA
40061,Haskell County,OK,Oklahoma,NA,0,NA,NA,NA,1,NA,NA,NA,NA,NA,NA,NA,NA,NA,NA,NA
40063,Hughes County,OK,Oklahoma,NA,0,NA,NA,NA,1,NA,NA,NA,NA,NA,NA,NA,NA,NA,NA,NA
40065,Jackson County,OK,Oklahoma,swochd5,1,NA,Yes,No,1,NA,NA,Southwest Oklahoma County Health Departments,1.24E+18,"These numbers represent data collected for Oklahoma and the ten counties served by the county health departments of District 5 for Wednesday, September 30, 2020. For more information, please visit  https://t.co/dc0CCWr4YL.  https://t.co/rx4lo0LW82",9/30/2020,12:27:24,https://twitter.com/SWOCHD5/status/1311341889396903936,2020,9,30
40067,Jefferson County,OK,Oklahoma,NA,0,NA,NA,NA,1,NA,NA,NA,NA,NA,NA,NA,NA,NA,NA,NA
40069,Johnston County,OK,Oklahoma,NA,0,NA,NA,NA,1,NA,NA,NA,NA,NA,NA,NA,NA,NA,NA,NA
40071,Kay County,OK,Oklahoma,NA,0,NA,NA,NA,1,NA,NA,NA,NA,NA,NA,NA,NA,NA,NA,NA
40073,Kingfisher County,OK,Oklahoma,NA,0,NA,NA,NA,1,NA,NA,NA,NA,NA,NA,NA,NA,NA,NA,NA
40075,Kiowa County,OK,Oklahoma,swochd5,1,NA,Yes,No,1,NA,NA,Southwest Oklahoma County Health Departments,1.24E+18,"These numbers represent data collected for Oklahoma and the ten counties served by the county health departments of District 5 for Wednesday, September 30, 2020. For more information, please visit  https://t.co/dc0CCWr4YL.  https://t.co/rx4lo0LW82",9/30/2020,12:27:24,https://twitter.com/SWOCHD5/status/1311341889396903936,2020,9,30
40077,Latimer County,OK,Oklahoma,NA,0,NA,NA,NA,1,NA,NA,NA,NA,NA,NA,NA,NA,NA,NA,NA
40079,Le Flore County,OK,Oklahoma,NA,0,NA,NA,NA,1,NA,NA,NA,NA,NA,NA,NA,NA,NA,NA,NA
40081,Lincoln County,OK,Oklahoma,NA,0,NA,NA,NA,1,NA,NA,NA,NA,NA,NA,NA,NA,NA,NA,NA
40083,Logan County,OK,Oklahoma,NA,0,NA,NA,NA,1,NA,NA,NA,NA,NA,NA,NA,NA,NA,NA,NA
40085,Love County,OK,Oklahoma,NA,0,NA,NA,NA,1,NA,NA,NA,NA,NA,NA,NA,NA,NA,NA,NA
40087,McClain County,OK,Oklahoma,NA,0,NA,NA,NA,1,NA,NA,NA,NA,NA,NA,NA,NA,NA,NA,NA
40089,McCurtain County,OK,Oklahoma,NA,0,NA,NA,NA,1,NA,NA,NA,NA,NA,NA,NA,NA,NA,NA,NA
40091,McIntosh County,OK,Oklahoma,NA,0,NA,NA,NA,1,NA,NA,NA,NA,NA,NA,NA,NA,NA,NA,NA
40093,Major County,OK,Oklahoma,NA,0,NA,NA,NA,1,NA,NA,NA,NA,NA,NA,NA,NA,NA,NA,NA
40095,Marshall County,OK,Oklahoma,NA,0,NA,NA,NA,1,NA,NA,NA,NA,NA,NA,NA,NA,NA,NA,NA
40097,Mayes County,OK,Oklahoma,NA,0,NA,NA,NA,1,NA,NA,NA,NA,NA,NA,NA,NA,NA,NA,NA
40099,Murray County,OK,Oklahoma,NA,0,NA,NA,NA,1,NA,NA,NA,NA,NA,NA,NA,NA,NA,NA,NA
40101,Muskogee County,OK,Oklahoma,NA,0,NA,NA,NA,1,NA,NA,NA,NA,NA,NA,NA,NA,NA,NA,NA
40103,Noble County,OK,Oklahoma,NA,0,NA,NA,NA,1,NA,NA,NA,NA,NA,NA,NA,NA,NA,NA,NA
40105,Nowata County,OK,Oklahoma,NA,0,NA,NA,NA,0,NA,NA,NA,NA,NA,NA,NA,NA,NA,NA,NA
40107,Okfuskee County,OK,Oklahoma,NA,0,NA,NA,NA,1,NA,NA,NA,NA,NA,NA,NA,NA,NA,NA,NA
40109,Oklahoma County,OK,Oklahoma,okchealth,1,NA,Yes,Yes,1,NA,NA,NA,84328935,https://t.co/NMWVqK9gK5,11/24/2021,17:11:46,https://twitter.com/okchealth/status/1463631453762330624,2021,11,24
40111,Okmulgee County,OK,Oklahoma,NA,0,NA,NA,NA,1,NA,NA,NA,NA,NA,NA,NA,NA,NA,NA,NA
40113,Osage County,OK,Oklahoma,NA,0,NA,NA,NA,1,NA,NA,NA,NA,NA,NA,NA,NA,NA,NA,NA
40115,Ottawa County,OK,Oklahoma,NA,0,NA,NA,NA,1,NA,NA,NA,NA,NA,NA,NA,NA,NA,NA,NA
40117,Pawnee County,OK,Oklahoma,NA,0,NA,NA,NA,1,NA,NA,NA,NA,NA,NA,NA,NA,NA,NA,NA
40119,Payne County,OK,Oklahoma,NA,0,NA,NA,NA,1,NA,NA,NA,NA,NA,NA,NA,NA,NA,NA,NA
40121,Pittsburg County,OK,Oklahoma,NA,0,NA,NA,NA,1,NA,NA,NA,NA,NA,NA,NA,NA,NA,NA,NA
40123,Pontotoc County,OK,Oklahoma,NA,0,NA,NA,NA,1,NA,NA,NA,NA,NA,NA,NA,NA,NA,NA,NA
40125,Pottawatomie County,OK,Oklahoma,NA,0,NA,NA,NA,1,NA,NA,NA,NA,NA,NA,NA,NA,NA,NA,NA
40127,Pushmataha County,OK,Oklahoma,NA,0,NA,NA,NA,1,NA,NA,NA,NA,NA,NA,NA,NA,NA,NA,NA
40129,Roger Mills County,OK,Oklahoma,NA,0,NA,NA,NA,1,Emergency Management Agency,NA,NA,NA,NA,NA,NA,NA,NA,NA,NA
40131,Rogers County,OK,Oklahoma,NA,0,NA,NA,NA,1,NA,NA,NA,NA,NA,NA,NA,NA,NA,NA,NA
40133,Seminole County,OK,Oklahoma,NA,0,NA,NA,NA,1,NA,NA,NA,NA,NA,NA,NA,NA,NA,NA,NA
40135,Sequoyah County,OK,Oklahoma,NA,0,NA,NA,NA,1,NA,NA,NA,NA,NA,NA,NA,NA,NA,NA,NA
40137,Stephens County,OK,Oklahoma,NA,0,NA,NA,NA,1,NA,NA,NA,NA,NA,NA,NA,NA,NA,NA,NA
40139,Texas County,OK,Oklahoma,NA,0,NA,NA,NA,1,NA,NA,NA,NA,NA,NA,NA,NA,NA,NA,NA
40141,Tillman County,OK,Oklahoma,swochd5,1,NA,Yes,No,1,NA,NA,Southwest Oklahoma County Health Departments,1.24E+18,"These numbers represent data collected for Oklahoma and the ten counties served by the county health departments of District 5 for Wednesday, September 30, 2020. For more information, please visit  https://t.co/dc0CCWr4YL.  https://t.co/rx4lo0LW82",9/30/2020,12:27:24,https://twitter.com/SWOCHD5/status/1311341889396903936,2020,9,30
40143,Tulsa County,OK,Oklahoma,tulsahealthdept,1,NA,Yes,Yes,1,NA,NA,NA,40081866,Guidance here: 🟢 Green/Low Risk:  https://t.co/jW9QCW8bNq  🟡 Yellow/Moderate Risk:  https://t.co/OIg1eAY3RF  🟠 Orange/High Risk:  https://t.co/LrOLR1ghFL,11/24/2021,16:11:21,https://twitter.com/TulsaHealthDept/status/1463616251931074564,2021,11,24
40145,Wagoner County,OK,Oklahoma,NA,0,NA,NA,NA,1,NA,NA,NA,NA,NA,NA,NA,NA,NA,NA,NA
40147,Washington County,OK,Oklahoma,NA,0,NA,NA,NA,1,NA,NA,NA,NA,NA,NA,NA,NA,NA,NA,NA
40149,Washita County,OK,Oklahoma,swochd5,1,NA,Yes,No,0,NA,NA,Southwest Oklahoma County Health Departments,1.24E+18,"These numbers represent data collected for Oklahoma and the ten counties served by the county health departments of District 5 for Wednesday, September 30, 2020. For more information, please visit  https://t.co/dc0CCWr4YL.  https://t.co/rx4lo0LW82",9/30/2020,12:27:24,https://twitter.com/SWOCHD5/status/1311341889396903936,2020,9,30
40151,Woods County,OK,Oklahoma,NA,0,NA,NA,NA,1,NA,NA,NA,NA,NA,NA,NA,NA,NA,NA,NA
40153,Woodward County,OK,Oklahoma,NA,0,NA,NA,NA,1,NA,NA,NA,NA,NA,NA,NA,NA,NA,NA,NA
41001,Baker County,OR,Oregon,NA,0,NA,NA,NA,1,NA,NA,NA,NA,NA,NA,NA,NA,NA,NA,NA
41003,Benton County,OR,Oregon,NA,0,NA,NA,NA,1,NA,NA,NA,NA,NA,NA,NA,NA,NA,NA,NA
41005,Clackamas County,OR,Oregon,NA,0,NA,NA,NA,0,NA,NA,NA,NA,NA,NA,NA,NA,NA,NA,NA
41007,Clatsop County,OR,Oregon,NA,0,NA,NA,NA,1,NA,NA,NA,NA,NA,NA,NA,NA,NA,NA,NA
41009,Columbia County,OR,Oregon,NA,0,NA,NA,NA,1,NA,NA,NA,NA,NA,NA,NA,NA,NA,NA,NA
41011,Coos County,OR,Oregon,NA,0,NA,NA,NA,1,NA,NA,NA,NA,NA,NA,NA,NA,NA,NA,NA
41013,Crook County,OR,Oregon,NA,0,NA,NA,NA,1,NA,NA,NA,NA,NA,NA,NA,NA,NA,NA,NA
41015,Curry County,OR,Oregon,NA,0,NA,NA,NA,0,NA,NA,NA,NA,NA,NA,NA,NA,NA,NA,NA
41017,Deschutes County,OR,Oregon,NA,0,NA,NA,NA,1,NA,NA,NA,NA,NA,NA,NA,NA,NA,NA,NA
41019,Douglas County,OR,Oregon,NA,0,NA,NA,NA,0,NA,NA,NA,NA,NA,NA,NA,NA,NA,NA,NA
41021,Gilliam County,OR,Oregon,NA,0,NA,NA,NA,1,NA,NA,North Central Public Health District - Oregon,NA,NA,NA,NA,NA,NA,NA,NA
41023,Grant County,OR,Oregon,NA,0,NA,NA,NA,1,NA,NA,NA,NA,NA,NA,NA,NA,NA,NA,NA
41025,Harney County,OR,Oregon,NA,0,NA,NA,NA,1,NA,NA,NA,NA,NA,NA,NA,NA,NA,NA,NA
41027,Hood River County,OR,Oregon,NA,0,NA,NA,NA,1,NA,NA,NA,NA,NA,NA,NA,NA,NA,NA,NA
41029,Jackson County,OR,Oregon,NA,0,NA,NA,NA,1,NA,NA,NA,NA,NA,NA,NA,NA,NA,NA,NA
41031,Jefferson County,OR,Oregon,NA,0,NA,NA,NA,1,NA,NA,NA,NA,NA,NA,NA,NA,NA,NA,NA
41033,Josephine County,OR,Oregon,jocoph,1,DoubleCheck,No,No,1,NA,NA,NA,NA,NA,NA,NA,NA,NA,NA,NA
41035,Klamath County,OR,Oregon,NA,0,NA,NA,NA,1,NA,NA,NA,NA,NA,NA,NA,NA,NA,NA,NA
41037,Lake County,OR,Oregon,NA,0,NA,NA,NA,1,NA,NA,NA,NA,NA,NA,NA,NA,NA,NA,NA
41039,Lane County,OR,Oregon,lanecoph,1,NA,Yes,Yes,1,NA,NA,NA,3098339162,🛍 Consejos útiles para hacer compras más seguras durante las festividades decembrinas  --- #CovidUpdates #COVID19PH #coronavirus #covid #COVID19 #GetTheVax  https://t.co/m5BgbCFGH7,11/23/2021,20:44:54,https://twitter.com/LaneCoPH/status/1463322701867614211,2021,11,23
41041,Lincoln County,OR,Oregon,lcph_or,1,DoubleCheck,No,No,1,NA,NA,NA,NA,NA,NA,NA,NA,NA,NA,NA
41043,Linn County,OR,Oregon,NA,0,NA,NA,NA,1,NA,NA,NA,NA,NA,NA,NA,NA,NA,NA,NA
41045,Malheur County,OR,Oregon,malheurhealth,1,NA,Yes,Yes,1,NA,NA,NA,1.35E+18,Outdoor mask requirement lifted  https://t.co/wrhy7kvHmc,11/23/2021,15:57:55,https://twitter.com/MalheurHealth/status/1463250481963315206,2021,11,23
41047,Marion County,OR,Oregon,marionco_health,1,DoubleCheck,No,No,1,NA,NA,NA,NA,NA,NA,NA,NA,NA,NA,NA
41049,Morrow County,OR,Oregon,moco_health,1,NA,Yes,No,1,NA,NA,NA,1.06E+18,The uncertainity from COVID-19 affects all of us in different ways. It is OK to ask for help. Contact your provider or access free mental health resources online at:  https://t.co/CZ1XkATgia   #healthymc #COVID19 #mentalhealth  https://t.co/bk0IMwUlYz,10/2/2020,10:01:02,https://twitter.com/moco_health/status/1312029831278874625,2020,10,2
41051,Multnomah County,OR,Oregon,multcohealth,1,NA,Yes,Yes,1,NA,NA,NA,36180193,"The vaccine is safe and effective. Before being authorized, scientists reviewed data from clinical trials of thousands of kids ages 5 and up. #GetTheFacts  Learn more about vaccine trials:  https://t.co/5glToJXl6H  https://t.co/uiz05jq7mu",11/24/2021,16:41:11,https://twitter.com/MultCoHealth/status/1463623758267265033,2021,11,24
41053,Polk County,OR,Oregon,NA,0,NA,NA,NA,1,NA,NA,NA,NA,NA,NA,NA,NA,NA,NA,NA
41055,Sherman County,OR,Oregon,NA,0,NA,NA,NA,1,NA,NA,North Central Public Health District - Oregon,NA,NA,NA,NA,NA,NA,NA,NA
41057,Tillamook County,OR,Oregon,NA,0,NA,NA,NA,1,NA,NA,NA,NA,NA,NA,NA,NA,NA,NA,NA
41059,Umatilla County,OR,Oregon,ucohealth,1,NA,Yes,No,1,NA,NA,NA,2815100030,"Practice social distancing by putting space between yourself and others. Continue to practice healthy habits, like washing your hands for at least 20 seconds and staying home if you’re sick, to help slow the spread of #COVID19. Learn more:  https://t.co/cGIlG8DDyg  https://t.co/WGPY1GQgMK",6/18/2020,11:14:10,https://twitter.com/UCoHealth/status/1273635120738562048,2020,6,18
41061,Union County,OR,Oregon,NA,0,NA,NA,NA,0,NA,NA,NA,NA,NA,NA,NA,NA,NA,NA,NA
41063,Wallowa County,OR,Oregon,NA,0,NA,NA,NA,0,NA,NA,NA,NA,NA,NA,NA,NA,NA,NA,NA
41065,Wasco County,OR,Oregon,NA,0,NA,NA,NA,1,NA,NA,North Central Public Health District - Oregon,NA,NA,NA,NA,NA,NA,NA,NA
41067,Washington County,OR,Oregon,NA,0,NA,NA,NA,1,NA,NA,NA,NA,NA,NA,NA,NA,NA,NA,NA
41069,Wheeler County,OR,Oregon,NA,0,NA,NA,NA,0,NA,NA,NA,NA,NA,NA,NA,NA,NA,NA,NA
41071,Yamhill County,OR,Oregon,NA,0,NA,NA,NA,1,NA,NA,NA,NA,NA,NA,NA,NA,NA,NA,NA
42001,Adams County,PA,Pennsylvania,NA,0,NA,NA,NA,NA,NA,NA,NA,NA,NA,NA,NA,NA,NA,NA,NA
42003,Allegheny County,PA,Pennsylvania,healthallegheny,1,NA,Yes,Yes,NA,NA,NA,NA,1.23E+18,* There will be no 24-hour update tomorrow as staff observe the Thanksgiving holiday. A 48-hour update will be issued on Friday.,11/24/2021,12:01:57,https://twitter.com/HealthAllegheny/status/1463553485689999360,2021,11,24
42005,Armstrong County,PA,Pennsylvania,NA,0,NA,NA,NA,1,NA,NA,NA,NA,NA,NA,NA,NA,NA,NA,NA
42007,Beaver County,PA,Pennsylvania,NA,0,NA,NA,NA,NA,NA,NA,NA,NA,NA,NA,NA,NA,NA,NA,NA
42009,Bedford County,PA,Pennsylvania,NA,0,NA,NA,NA,NA,NA,NA,NA,NA,NA,NA,NA,NA,NA,NA,NA
42011,Berks County,PA,Pennsylvania,NA,0,NA,NA,NA,NA,NA,NA,NA,NA,NA,NA,NA,NA,NA,NA,NA
42013,Blair County,PA,Pennsylvania,NA,0,NA,NA,NA,NA,NA,NA,NA,NA,NA,NA,NA,NA,NA,NA,NA
42015,Bradford County,PA,Pennsylvania,NA,0,NA,NA,NA,NA,NA,NA,NA,NA,NA,NA,NA,NA,NA,NA,NA
42017,Bucks County,PA,Pennsylvania,NA,0,NA,NA,NA,NA,NA,NA,NA,NA,NA,NA,NA,NA,NA,NA,NA
42019,Butler County,PA,Pennsylvania,NA,0,NA,NA,NA,NA,NA,NA,NA,NA,NA,NA,NA,NA,NA,NA,NA
42021,Cambria County,PA,Pennsylvania,NA,0,NA,NA,NA,NA,NA,NA,NA,NA,NA,NA,NA,NA,NA,NA,NA
42023,Cameron County,PA,Pennsylvania,NA,0,NA,NA,NA,NA,NA,NA,NA,NA,NA,NA,NA,NA,NA,NA,NA
42025,Carbon County,PA,Pennsylvania,NA,0,NA,NA,NA,NA,NA,NA,NA,NA,NA,NA,NA,NA,NA,NA,NA
42027,Centre County,PA,Pennsylvania,NA,0,NA,NA,NA,NA,NA,NA,NA,NA,NA,NA,NA,NA,NA,NA,NA
42029,Chester County,PA,Pennsylvania,chescohealth,1,NA,Yes,Yes,NA,NA,NA,NA,16329609,"Feasting with family is part of many holiday celebrations! Especially Thanksgiving! Follow tips from the @CDC to help prevent food poisoning, or foodborne illness, during the holidays:  https://t.co/qaz94vz0Xx  https://t.co/suul4vHePP",11/23/2021,12:58:38,https://twitter.com/ChescoHealth/status/1463205363155623943,2021,11,23
42031,Clarion County,PA,Pennsylvania,NA,0,NA,NA,NA,NA,NA,NA,NA,NA,NA,NA,NA,NA,NA,NA,NA
42033,Clearfield County,PA,Pennsylvania,NA,0,NA,NA,NA,NA,NA,NA,NA,NA,NA,NA,NA,NA,NA,NA,NA
42035,Clinton County,PA,Pennsylvania,NA,0,NA,NA,NA,NA,NA,NA,NA,NA,NA,NA,NA,NA,NA,NA,NA
42037,Columbia County,PA,Pennsylvania,NA,0,NA,NA,NA,NA,NA,NA,NA,NA,NA,NA,NA,NA,NA,NA,NA
42039,Crawford County,PA,Pennsylvania,NA,0,NA,NA,NA,NA,NA,NA,NA,NA,NA,NA,NA,NA,NA,NA,NA
42041,Cumberland County,PA,Pennsylvania,NA,0,NA,NA,NA,NA,NA,NA,NA,NA,NA,NA,NA,NA,NA,NA,NA
42043,Dauphin County,PA,Pennsylvania,NA,0,NA,NA,NA,NA,NA,NA,NA,NA,NA,NA,NA,NA,NA,NA,NA
42045,Delaware County,PA,Pennsylvania,NA,0,NA,NA,NA,NA,NA,NA,NA,NA,NA,NA,NA,NA,NA,NA,NA
42047,Elk County,PA,Pennsylvania,NA,0,NA,NA,NA,NA,NA,NA,NA,NA,NA,NA,NA,NA,NA,NA,NA
42049,Erie County,PA,Pennsylvania,eriepahealth,1,NA,Yes,Yes,NA,NA,NA,NA,4568763382,Press briefing on COVID-19 updates    https://t.co/t6k355kjTu,11/24/2021,14:55:28,https://twitter.com/EriePAHealth/status/1463597155508228106,2021,11,24
42051,Fayette County,PA,Pennsylvania,NA,0,NA,NA,NA,NA,NA,NA,NA,NA,NA,NA,NA,NA,NA,NA,NA
42053,Forest County,PA,Pennsylvania,NA,0,NA,NA,NA,NA,NA,NA,NA,NA,NA,NA,NA,NA,NA,NA,NA
42055,Franklin County,PA,Pennsylvania,NA,0,NA,NA,NA,NA,NA,NA,NA,NA,NA,NA,NA,NA,NA,NA,NA
42057,Fulton County,PA,Pennsylvania,NA,0,NA,NA,NA,NA,NA,NA,NA,NA,NA,NA,NA,NA,NA,NA,NA
42059,Greene County,PA,Pennsylvania,NA,0,NA,NA,NA,NA,NA,NA,NA,NA,NA,NA,NA,NA,NA,NA,NA
42061,Huntingdon County,PA,Pennsylvania,NA,0,NA,NA,NA,NA,NA,NA,NA,NA,NA,NA,NA,NA,NA,NA,NA
42063,Indiana County,PA,Pennsylvania,NA,0,NA,NA,NA,NA,NA,NA,NA,NA,NA,NA,NA,NA,NA,NA,NA
42065,Jefferson County,PA,Pennsylvania,NA,0,NA,NA,NA,NA,NA,NA,NA,NA,NA,NA,NA,NA,NA,NA,NA
42067,Juniata County,PA,Pennsylvania,NA,0,NA,NA,NA,NA,NA,NA,NA,NA,NA,NA,NA,NA,NA,NA,NA
42069,Lackawanna County,PA,Pennsylvania,NA,0,NA,NA,NA,NA,NA,NA,NA,NA,NA,NA,NA,NA,NA,NA,NA
42071,Lancaster County,PA,Pennsylvania,NA,0,NA,NA,NA,NA,NA,NA,NA,NA,NA,NA,NA,NA,NA,NA,NA
42073,Lawrence County,PA,Pennsylvania,NA,0,NA,NA,NA,NA,NA,NA,NA,NA,NA,NA,NA,NA,NA,NA,NA
42075,Lebanon County,PA,Pennsylvania,NA,0,NA,NA,NA,NA,NA,NA,NA,NA,NA,NA,NA,NA,NA,NA,NA
42077,Lehigh County,PA,Pennsylvania,NA,0,NA,NA,NA,NA,NA,NA,NA,NA,NA,NA,NA,NA,NA,NA,NA
42079,Luzerne County,PA,Pennsylvania,NA,0,NA,NA,NA,NA,NA,NA,NA,NA,NA,NA,NA,NA,NA,NA,NA
42081,Lycoming County,PA,Pennsylvania,NA,0,NA,NA,NA,NA,NA,NA,NA,NA,NA,NA,NA,NA,NA,NA,NA
42083,McKean County,PA,Pennsylvania,NA,0,NA,NA,NA,NA,NA,NA,NA,NA,NA,NA,NA,NA,NA,NA,NA
42085,Mercer County,PA,Pennsylvania,NA,0,NA,NA,NA,NA,NA,NA,NA,NA,NA,NA,NA,NA,NA,NA,NA
42087,Mifflin County,PA,Pennsylvania,NA,0,NA,NA,NA,NA,NA,NA,NA,NA,NA,NA,NA,NA,NA,NA,NA
42089,Monroe County,PA,Pennsylvania,NA,0,NA,NA,NA,NA,NA,NA,NA,NA,NA,NA,NA,NA,NA,NA,NA
42091,Montgomery County,PA,Pennsylvania,montco_ph,1,NA,Yes,Yes,NA,NA,NA,NA,1.24E+18,"The Testing Positivity Rate for Montgomery County has decreased to 4%. Source: UT Health, School of Public Health",11/24/2021,18:24:40,https://twitter.com/MontCo_PH/status/1463649802684616709,2021,11,24
42093,Montour County,PA,Pennsylvania,NA,0,NA,NA,NA,NA,NA,NA,NA,NA,NA,NA,NA,NA,NA,NA,NA
42095,Northampton County,PA,Pennsylvania,NA,0,NA,NA,NA,NA,NA,NA,NA,NA,NA,NA,NA,NA,NA,NA,NA
42097,Northumberland County,PA,Pennsylvania,NA,0,NA,NA,NA,NA,NA,NA,NA,NA,NA,NA,NA,NA,NA,NA,NA
42099,Perry County,PA,Pennsylvania,NA,0,NA,NA,NA,NA,NA,NA,NA,NA,NA,NA,NA,NA,NA,NA,NA
42101,Philadelphia County,PA,Pennsylvania,NA,0,NA,NA,NA,NA,NA,NA,NA,NA,NA,NA,NA,NA,NA,NA,NA
42103,Pike County,PA,Pennsylvania,NA,0,NA,NA,NA,NA,NA,NA,NA,NA,NA,NA,NA,NA,NA,NA,NA
42105,Potter County,PA,Pennsylvania,NA,0,NA,NA,NA,NA,NA,NA,NA,NA,NA,NA,NA,NA,NA,NA,NA
42107,Schuylkill County,PA,Pennsylvania,NA,0,NA,NA,NA,NA,NA,NA,NA,NA,NA,NA,NA,NA,NA,NA,NA
42109,Snyder County,PA,Pennsylvania,NA,0,NA,NA,NA,NA,NA,NA,NA,NA,NA,NA,NA,NA,NA,NA,NA
42111,Somerset County,PA,Pennsylvania,NA,0,NA,NA,NA,NA,NA,NA,NA,NA,NA,NA,NA,NA,NA,NA,NA
42113,Sullivan County,PA,Pennsylvania,NA,0,NA,NA,NA,NA,NA,NA,NA,NA,NA,NA,NA,NA,NA,NA,NA
42115,Susquehanna County,PA,Pennsylvania,NA,0,NA,NA,NA,NA,NA,NA,NA,NA,NA,NA,NA,NA,NA,NA,NA
42117,Tioga County,PA,Pennsylvania,NA,0,NA,NA,NA,NA,NA,NA,NA,NA,NA,NA,NA,NA,NA,NA,NA
42119,Union County,PA,Pennsylvania,NA,0,NA,NA,NA,NA,NA,NA,NA,NA,NA,NA,NA,NA,NA,NA,NA
42121,Venango County,PA,Pennsylvania,NA,0,NA,NA,NA,NA,NA,NA,NA,NA,NA,NA,NA,NA,NA,NA,NA
42123,Warren County,PA,Pennsylvania,NA,0,NA,NA,NA,NA,NA,NA,NA,NA,NA,NA,NA,NA,NA,NA,NA
42125,Washington County,PA,Pennsylvania,NA,0,NA,NA,NA,NA,NA,NA,NA,NA,NA,NA,NA,NA,NA,NA,NA
42127,Wayne County,PA,Pennsylvania,NA,0,NA,NA,NA,NA,NA,NA,NA,NA,NA,NA,NA,NA,NA,NA,NA
42129,Westmoreland County,PA,Pennsylvania,NA,0,NA,NA,NA,NA,NA,NA,NA,NA,NA,NA,NA,NA,NA,NA,NA
42131,Wyoming County,PA,Pennsylvania,NA,0,NA,NA,NA,NA,NA,NA,NA,NA,NA,NA,NA,NA,NA,NA,NA
42133,York County,PA,Pennsylvania,NA,0,NA,NA,NA,NA,NA,NA,NA,NA,NA,NA,NA,NA,NA,NA,NA
44001,Bristol County,RI,Rhode Island,NA,0,NA,NA,NA,0,NA,NA,NA,NA,NA,NA,NA,NA,NA,NA,NA
44003,Kent County,RI,Rhode Island,NA,0,NA,NA,NA,0,NA,NA,NA,NA,NA,NA,NA,NA,NA,NA,NA
44005,Newport County,RI,Rhode Island,NA,0,NA,NA,NA,0,NA,NA,NA,NA,NA,NA,NA,NA,NA,NA,NA
44007,Providence County,RI,Rhode Island,providencechc,1,DoubleCheck,No,No,0,NA,NA,NA,NA,NA,NA,NA,NA,NA,NA,NA
44009,Washington County,RI,Rhode Island,NA,0,NA,NA,NA,0,NA,NA,NA,NA,NA,NA,NA,NA,NA,NA,NA
45001,Abbeville County,SC,South Carolina,NA,0,NA,NA,NA,NA,NA,NA,NA,NA,NA,NA,NA,NA,NA,NA,NA
45003,Aiken County,SC,South Carolina,NA,0,NA,NA,NA,NA,NA,NA,NA,NA,NA,NA,NA,NA,NA,NA,NA
45005,Allendale County,SC,South Carolina,NA,0,NA,NA,NA,NA,NA,NA,NA,NA,NA,NA,NA,NA,NA,NA,NA
45007,Anderson County,SC,South Carolina,NA,0,NA,NA,NA,NA,NA,NA,NA,NA,NA,NA,NA,NA,NA,NA,NA
45009,Bamberg County,SC,South Carolina,NA,0,NA,NA,NA,NA,NA,NA,NA,NA,NA,NA,NA,NA,NA,NA,NA
45011,Barnwell County,SC,South Carolina,NA,0,NA,NA,NA,NA,NA,NA,NA,NA,NA,NA,NA,NA,NA,NA,NA
45013,Beaufort County,SC,South Carolina,NA,0,NA,NA,NA,NA,NA,NA,NA,NA,NA,NA,NA,NA,NA,NA,NA
45015,Berkeley County,SC,South Carolina,NA,0,NA,NA,NA,NA,NA,NA,NA,NA,NA,NA,NA,NA,NA,NA,NA
45017,Calhoun County,SC,South Carolina,NA,0,NA,NA,NA,NA,NA,NA,NA,NA,NA,NA,NA,NA,NA,NA,NA
45019,Charleston County,SC,South Carolina,NA,0,NA,NA,NA,NA,NA,NA,NA,NA,NA,NA,NA,NA,NA,NA,NA
45021,Cherokee County,SC,South Carolina,NA,0,NA,NA,NA,NA,NA,NA,NA,NA,NA,NA,NA,NA,NA,NA,NA
45023,Chester County,SC,South Carolina,NA,0,NA,NA,NA,NA,NA,NA,NA,NA,NA,NA,NA,NA,NA,NA,NA
45025,Chesterfield County,SC,South Carolina,NA,0,NA,NA,NA,NA,NA,NA,NA,NA,NA,NA,NA,NA,NA,NA,NA
45027,Clarendon County,SC,South Carolina,NA,0,NA,NA,NA,NA,NA,NA,NA,NA,NA,NA,NA,NA,NA,NA,NA
45029,Colleton County,SC,South Carolina,NA,0,NA,NA,NA,NA,NA,NA,NA,NA,NA,NA,NA,NA,NA,NA,NA
45031,Darlington County,SC,South Carolina,NA,0,NA,NA,NA,NA,NA,NA,NA,NA,NA,NA,NA,NA,NA,NA,NA
45033,Dillon County,SC,South Carolina,NA,0,NA,NA,NA,NA,NA,NA,NA,NA,NA,NA,NA,NA,NA,NA,NA
45035,Dorchester County,SC,South Carolina,NA,0,NA,NA,NA,NA,NA,NA,NA,NA,NA,NA,NA,NA,NA,NA,NA
45037,Edgefield County,SC,South Carolina,NA,0,NA,NA,NA,NA,NA,NA,NA,NA,NA,NA,NA,NA,NA,NA,NA
45039,Fairfield County,SC,South Carolina,NA,0,NA,NA,NA,NA,NA,NA,NA,NA,NA,NA,NA,NA,NA,NA,NA
45041,Florence County,SC,South Carolina,NA,0,NA,NA,NA,NA,NA,NA,NA,NA,NA,NA,NA,NA,NA,NA,NA
45043,Georgetown County,SC,South Carolina,NA,0,NA,NA,NA,NA,NA,NA,NA,NA,NA,NA,NA,NA,NA,NA,NA
45045,Greenville County,SC,South Carolina,NA,0,NA,NA,NA,NA,NA,NA,NA,NA,NA,NA,NA,NA,NA,NA,NA
45047,Greenwood County,SC,South Carolina,NA,0,NA,NA,NA,NA,NA,NA,NA,NA,NA,NA,NA,NA,NA,NA,NA
45049,Hampton County,SC,South Carolina,NA,0,NA,NA,NA,NA,NA,NA,NA,NA,NA,NA,NA,NA,NA,NA,NA
45051,Horry County,SC,South Carolina,NA,0,NA,NA,NA,NA,NA,NA,NA,NA,NA,NA,NA,NA,NA,NA,NA
45053,Jasper County,SC,South Carolina,NA,0,NA,NA,NA,NA,NA,NA,NA,NA,NA,NA,NA,NA,NA,NA,NA
45055,Kershaw County,SC,South Carolina,NA,0,NA,NA,NA,NA,NA,NA,NA,NA,NA,NA,NA,NA,NA,NA,NA
45057,Lancaster County,SC,South Carolina,NA,0,NA,NA,NA,NA,NA,NA,NA,NA,NA,NA,NA,NA,NA,NA,NA
45059,Laurens County,SC,South Carolina,NA,0,NA,NA,NA,NA,NA,NA,NA,NA,NA,NA,NA,NA,NA,NA,NA
45061,Lee County,SC,South Carolina,NA,0,NA,NA,NA,NA,NA,NA,NA,NA,NA,NA,NA,NA,NA,NA,NA
45063,Lexington County,SC,South Carolina,NA,0,NA,NA,NA,NA,NA,NA,NA,NA,NA,NA,NA,NA,NA,NA,NA
45065,McCormick County,SC,South Carolina,NA,0,NA,NA,NA,NA,NA,NA,NA,NA,NA,NA,NA,NA,NA,NA,NA
45067,Marion County,SC,South Carolina,NA,0,NA,NA,NA,NA,NA,NA,NA,NA,NA,NA,NA,NA,NA,NA,NA
45069,Marlboro County,SC,South Carolina,NA,0,NA,NA,NA,NA,NA,NA,NA,NA,NA,NA,NA,NA,NA,NA,NA
45071,Newberry County,SC,South Carolina,NA,0,NA,NA,NA,NA,NA,NA,NA,NA,NA,NA,NA,NA,NA,NA,NA
45073,Oconee County,SC,South Carolina,NA,0,NA,NA,NA,NA,NA,NA,NA,NA,NA,NA,NA,NA,NA,NA,NA
45075,Orangeburg County,SC,South Carolina,NA,0,NA,NA,NA,NA,NA,NA,NA,NA,NA,NA,NA,NA,NA,NA,NA
45077,Pickens County,SC,South Carolina,NA,0,NA,NA,NA,NA,NA,NA,NA,NA,NA,NA,NA,NA,NA,NA,NA
45079,Richland County,SC,South Carolina,NA,0,NA,NA,NA,NA,NA,NA,NA,NA,NA,NA,NA,NA,NA,NA,NA
45081,Saluda County,SC,South Carolina,NA,0,NA,NA,NA,NA,NA,NA,NA,NA,NA,NA,NA,NA,NA,NA,NA
45083,Spartanburg County,SC,South Carolina,NA,0,NA,NA,NA,NA,NA,NA,NA,NA,NA,NA,NA,NA,NA,NA,NA
45085,Sumter County,SC,South Carolina,NA,0,NA,NA,NA,NA,NA,NA,NA,NA,NA,NA,NA,NA,NA,NA,NA
45087,Union County,SC,South Carolina,NA,0,NA,NA,NA,NA,NA,NA,NA,NA,NA,NA,NA,NA,NA,NA,NA
45089,Williamsburg County,SC,South Carolina,NA,0,NA,NA,NA,NA,NA,NA,NA,NA,NA,NA,NA,NA,NA,NA,NA
45091,York County,SC,South Carolina,NA,0,NA,NA,NA,NA,NA,NA,NA,NA,NA,NA,NA,NA,NA,NA,NA
46003,Aurora County,SD,South Dakota,NA,0,NA,NA,NA,NA,NA,NA,NA,NA,NA,NA,NA,NA,NA,NA,NA
46005,Beadle County,SD,South Dakota,NA,0,NA,NA,NA,NA,NA,NA,NA,NA,NA,NA,NA,NA,NA,NA,NA
46007,Bennett County,SD,South Dakota,NA,0,NA,NA,NA,NA,NA,NA,NA,NA,NA,NA,NA,NA,NA,NA,NA
46009,Bon Homme County,SD,South Dakota,NA,0,NA,NA,NA,NA,NA,NA,NA,NA,NA,NA,NA,NA,NA,NA,NA
46011,Brookings County,SD,South Dakota,NA,0,NA,NA,NA,NA,NA,NA,NA,NA,NA,NA,NA,NA,NA,NA,NA
46013,Brown County,SD,South Dakota,NA,0,NA,NA,NA,NA,NA,NA,NA,NA,NA,NA,NA,NA,NA,NA,NA
46015,Brule County,SD,South Dakota,NA,0,NA,NA,NA,NA,NA,NA,NA,NA,NA,NA,NA,NA,NA,NA,NA
46017,Buffalo County,SD,South Dakota,NA,0,NA,NA,NA,NA,NA,NA,NA,NA,NA,NA,NA,NA,NA,NA,NA
46019,Butte County,SD,South Dakota,NA,0,NA,NA,NA,NA,NA,NA,NA,NA,NA,NA,NA,NA,NA,NA,NA
46021,Campbell County,SD,South Dakota,NA,0,NA,NA,NA,NA,NA,NA,NA,NA,NA,NA,NA,NA,NA,NA,NA
46023,Charles Mix County,SD,South Dakota,NA,0,NA,NA,NA,NA,NA,NA,NA,NA,NA,NA,NA,NA,NA,NA,NA
46025,Clark County,SD,South Dakota,NA,0,NA,NA,NA,NA,NA,NA,NA,NA,NA,NA,NA,NA,NA,NA,NA
46027,Clay County,SD,South Dakota,NA,0,NA,NA,NA,NA,NA,NA,NA,NA,NA,NA,NA,NA,NA,NA,NA
46029,Codington County,SD,South Dakota,NA,0,NA,NA,NA,NA,NA,NA,NA,NA,NA,NA,NA,NA,NA,NA,NA
46031,Corson County,SD,South Dakota,NA,0,NA,NA,NA,NA,NA,NA,NA,NA,NA,NA,NA,NA,NA,NA,NA
46033,Custer County,SD,South Dakota,NA,0,NA,NA,NA,NA,NA,NA,NA,NA,NA,NA,NA,NA,NA,NA,NA
46035,Davison County,SD,South Dakota,NA,0,NA,NA,NA,NA,NA,NA,NA,NA,NA,NA,NA,NA,NA,NA,NA
46037,Day County,SD,South Dakota,NA,0,NA,NA,NA,NA,NA,NA,NA,NA,NA,NA,NA,NA,NA,NA,NA
46039,Deuel County,SD,South Dakota,NA,0,NA,NA,NA,NA,NA,NA,NA,NA,NA,NA,NA,NA,NA,NA,NA
46041,Dewey County,SD,South Dakota,NA,0,NA,NA,NA,NA,NA,NA,NA,NA,NA,NA,NA,NA,NA,NA,NA
46043,Douglas County,SD,South Dakota,NA,0,NA,NA,NA,NA,NA,NA,NA,NA,NA,NA,NA,NA,NA,NA,NA
46045,Edmunds County,SD,South Dakota,NA,0,NA,NA,NA,NA,NA,NA,NA,NA,NA,NA,NA,NA,NA,NA,NA
46047,Fall River County,SD,South Dakota,NA,0,NA,NA,NA,NA,NA,NA,NA,NA,NA,NA,NA,NA,NA,NA,NA
46049,Faulk County,SD,South Dakota,NA,0,NA,NA,NA,NA,NA,NA,NA,NA,NA,NA,NA,NA,NA,NA,NA
46051,Grant County,SD,South Dakota,NA,0,NA,NA,NA,NA,NA,NA,NA,NA,NA,NA,NA,NA,NA,NA,NA
46053,Gregory County,SD,South Dakota,NA,0,NA,NA,NA,NA,NA,NA,NA,NA,NA,NA,NA,NA,NA,NA,NA
46055,Haakon County,SD,South Dakota,NA,0,NA,NA,NA,NA,NA,NA,NA,NA,NA,NA,NA,NA,NA,NA,NA
46057,Hamlin County,SD,South Dakota,NA,0,NA,NA,NA,NA,NA,NA,NA,NA,NA,NA,NA,NA,NA,NA,NA
46059,Hand County,SD,South Dakota,NA,0,NA,NA,NA,NA,NA,NA,NA,NA,NA,NA,NA,NA,NA,NA,NA
46061,Hanson County,SD,South Dakota,NA,0,NA,NA,NA,NA,NA,NA,NA,NA,NA,NA,NA,NA,NA,NA,NA
46063,Harding County,SD,South Dakota,NA,0,NA,NA,NA,NA,NA,NA,NA,NA,NA,NA,NA,NA,NA,NA,NA
46065,Hughes County,SD,South Dakota,NA,0,NA,NA,NA,NA,NA,NA,NA,NA,NA,NA,NA,NA,NA,NA,NA
46067,Hutchinson County,SD,South Dakota,NA,0,NA,NA,NA,NA,NA,NA,NA,NA,NA,NA,NA,NA,NA,NA,NA
46069,Hyde County,SD,South Dakota,NA,0,NA,NA,NA,NA,NA,NA,NA,NA,NA,NA,NA,NA,NA,NA,NA
46071,Jackson County,SD,South Dakota,NA,0,NA,NA,NA,NA,NA,NA,NA,NA,NA,NA,NA,NA,NA,NA,NA
46073,Jerauld County,SD,South Dakota,NA,0,NA,NA,NA,NA,NA,NA,NA,NA,NA,NA,NA,NA,NA,NA,NA
46075,Jones County,SD,South Dakota,NA,0,NA,NA,NA,NA,NA,NA,NA,NA,NA,NA,NA,NA,NA,NA,NA
46077,Kingsbury County,SD,South Dakota,NA,0,NA,NA,NA,NA,NA,NA,NA,NA,NA,NA,NA,NA,NA,NA,NA
46079,Lake County,SD,South Dakota,NA,0,NA,NA,NA,NA,NA,NA,NA,NA,NA,NA,NA,NA,NA,NA,NA
46081,Lawrence County,SD,South Dakota,NA,0,NA,NA,NA,NA,NA,NA,NA,NA,NA,NA,NA,NA,NA,NA,NA
46083,Lincoln County,SD,South Dakota,NA,0,NA,NA,NA,NA,NA,NA,NA,NA,NA,NA,NA,NA,NA,NA,NA
46085,Lyman County,SD,South Dakota,NA,0,NA,NA,NA,NA,NA,NA,NA,NA,NA,NA,NA,NA,NA,NA,NA
46087,McCook County,SD,South Dakota,NA,0,NA,NA,NA,NA,NA,NA,NA,NA,NA,NA,NA,NA,NA,NA,NA
46089,McPherson County,SD,South Dakota,NA,0,NA,NA,NA,NA,NA,NA,NA,NA,NA,NA,NA,NA,NA,NA,NA
46091,Marshall County,SD,South Dakota,NA,0,NA,NA,NA,NA,NA,NA,NA,NA,NA,NA,NA,NA,NA,NA,NA
46093,Meade County,SD,South Dakota,NA,0,NA,NA,NA,NA,NA,NA,NA,NA,NA,NA,NA,NA,NA,NA,NA
46095,Mellette County,SD,South Dakota,NA,0,NA,NA,NA,NA,NA,NA,NA,NA,NA,NA,NA,NA,NA,NA,NA
46097,Miner County,SD,South Dakota,NA,0,NA,NA,NA,NA,NA,NA,NA,NA,NA,NA,NA,NA,NA,NA,NA
46099,Minnehaha County,SD,South Dakota,NA,0,NA,NA,NA,NA,NA,NA,NA,NA,NA,NA,NA,NA,NA,NA,NA
46101,Moody County,SD,South Dakota,NA,0,NA,NA,NA,NA,NA,NA,NA,NA,NA,NA,NA,NA,NA,NA,NA
46102,Oglala Lakota County,SD,South Dakota,NA,0,NA,NA,NA,NA,NA,NA,NA,NA,NA,NA,NA,NA,NA,NA,NA
46103,Pennington County,SD,South Dakota,NA,0,NA,NA,NA,NA,NA,NA,NA,NA,NA,NA,NA,NA,NA,NA,NA
46105,Perkins County,SD,South Dakota,NA,0,NA,NA,NA,NA,NA,NA,NA,NA,NA,NA,NA,NA,NA,NA,NA
46107,Potter County,SD,South Dakota,NA,0,NA,NA,NA,NA,NA,NA,NA,NA,NA,NA,NA,NA,NA,NA,NA
46109,Roberts County,SD,South Dakota,NA,0,NA,NA,NA,NA,NA,NA,NA,NA,NA,NA,NA,NA,NA,NA,NA
46111,Sanborn County,SD,South Dakota,NA,0,NA,NA,NA,NA,NA,NA,NA,NA,NA,NA,NA,NA,NA,NA,NA
46115,Spink County,SD,South Dakota,NA,0,NA,NA,NA,NA,NA,NA,NA,NA,NA,NA,NA,NA,NA,NA,NA
46117,Stanley County,SD,South Dakota,NA,0,NA,NA,NA,NA,NA,NA,NA,NA,NA,NA,NA,NA,NA,NA,NA
46119,Sully County,SD,South Dakota,NA,0,NA,NA,NA,NA,NA,NA,NA,NA,NA,NA,NA,NA,NA,NA,NA
46121,Todd County,SD,South Dakota,NA,0,NA,NA,NA,NA,NA,NA,NA,NA,NA,NA,NA,NA,NA,NA,NA
46123,Tripp County,SD,South Dakota,NA,0,NA,NA,NA,NA,NA,NA,NA,NA,NA,NA,NA,NA,NA,NA,NA
46125,Turner County,SD,South Dakota,NA,0,NA,NA,NA,NA,NA,NA,NA,NA,NA,NA,NA,NA,NA,NA,NA
46127,Union County,SD,South Dakota,NA,0,NA,NA,NA,NA,NA,NA,NA,NA,NA,NA,NA,NA,NA,NA,NA
46129,Walworth County,SD,South Dakota,NA,0,NA,NA,NA,NA,NA,NA,NA,NA,NA,NA,NA,NA,NA,NA,NA
46135,Yankton County,SD,South Dakota,NA,0,NA,NA,NA,NA,NA,NA,NA,NA,NA,NA,NA,NA,NA,NA,NA
46137,Ziebach County,SD,South Dakota,NA,0,NA,NA,NA,NA,NA,NA,NA,NA,NA,NA,NA,NA,NA,NA,NA
47001,Anderson County,TN,Tennessee,NA,0,NA,NA,NA,NA,NA,NA,NA,NA,NA,NA,NA,NA,NA,NA,NA
47003,Bedford County,TN,Tennessee,NA,0,NA,NA,NA,NA,NA,NA,NA,NA,NA,NA,NA,NA,NA,NA,NA
47005,Benton County,TN,Tennessee,NA,0,NA,NA,NA,NA,NA,NA,NA,NA,NA,NA,NA,NA,NA,NA,NA
47007,Bledsoe County,TN,Tennessee,NA,0,NA,NA,NA,NA,NA,NA,NA,NA,NA,NA,NA,NA,NA,NA,NA
47009,Blount County,TN,Tennessee,NA,0,NA,NA,NA,NA,NA,NA,NA,NA,NA,NA,NA,NA,NA,NA,NA
47011,Bradley County,TN,Tennessee,NA,0,NA,NA,NA,NA,NA,NA,NA,NA,NA,NA,NA,NA,NA,NA,NA
47013,Campbell County,TN,Tennessee,NA,0,NA,NA,NA,NA,NA,NA,NA,NA,NA,NA,NA,NA,NA,NA,NA
47015,Cannon County,TN,Tennessee,NA,0,NA,NA,NA,NA,NA,NA,NA,NA,NA,NA,NA,NA,NA,NA,NA
47017,Carroll County,TN,Tennessee,NA,0,NA,NA,NA,NA,NA,NA,NA,NA,NA,NA,NA,NA,NA,NA,NA
47019,Carter County,TN,Tennessee,NA,0,NA,NA,NA,NA,NA,NA,NA,NA,NA,NA,NA,NA,NA,NA,NA
47021,Cheatham County,TN,Tennessee,NA,0,NA,NA,NA,NA,NA,NA,NA,NA,NA,NA,NA,NA,NA,NA,NA
47023,Chester County,TN,Tennessee,NA,0,NA,NA,NA,NA,NA,NA,NA,NA,NA,NA,NA,NA,NA,NA,NA
47025,Claiborne County,TN,Tennessee,NA,0,NA,NA,NA,NA,NA,NA,NA,NA,NA,NA,NA,NA,NA,NA,NA
47027,Clay County,TN,Tennessee,NA,0,NA,NA,NA,NA,NA,NA,NA,NA,NA,NA,NA,NA,NA,NA,NA
47029,Cocke County,TN,Tennessee,NA,0,NA,NA,NA,NA,NA,NA,NA,NA,NA,NA,NA,NA,NA,NA,NA
47031,Coffee County,TN,Tennessee,NA,0,NA,NA,NA,NA,NA,NA,NA,NA,NA,NA,NA,NA,NA,NA,NA
47033,Crockett County,TN,Tennessee,NA,0,NA,NA,NA,NA,NA,NA,NA,NA,NA,NA,NA,NA,NA,NA,NA
47035,Cumberland County,TN,Tennessee,NA,0,NA,NA,NA,NA,NA,NA,NA,NA,NA,NA,NA,NA,NA,NA,NA
47037,Davidson County,TN,Tennessee,NA,0,NA,NA,NA,NA,NA,NA,NA,NA,NA,NA,NA,NA,NA,NA,NA
47039,Decatur County,TN,Tennessee,NA,0,NA,NA,NA,NA,NA,NA,NA,NA,NA,NA,NA,NA,NA,NA,NA
47041,DeKalb County,TN,Tennessee,NA,0,NA,NA,NA,NA,NA,NA,NA,NA,NA,NA,NA,NA,NA,NA,NA
47043,Dickson County,TN,Tennessee,NA,0,NA,NA,NA,NA,NA,NA,NA,NA,NA,NA,NA,NA,NA,NA,NA
47045,Dyer County,TN,Tennessee,NA,0,NA,NA,NA,NA,NA,NA,NA,NA,NA,NA,NA,NA,NA,NA,NA
47047,Fayette County,TN,Tennessee,NA,0,NA,NA,NA,NA,NA,NA,NA,NA,NA,NA,NA,NA,NA,NA,NA
47049,Fentress County,TN,Tennessee,NA,0,NA,NA,NA,NA,NA,NA,NA,NA,NA,NA,NA,NA,NA,NA,NA
47051,Franklin County,TN,Tennessee,NA,0,NA,NA,NA,NA,NA,NA,NA,NA,NA,NA,NA,NA,NA,NA,NA
47053,Gibson County,TN,Tennessee,NA,0,NA,NA,NA,NA,NA,NA,NA,NA,NA,NA,NA,NA,NA,NA,NA
47055,Giles County,TN,Tennessee,NA,0,NA,NA,NA,NA,NA,NA,NA,NA,NA,NA,NA,NA,NA,NA,NA
47057,Grainger County,TN,Tennessee,NA,0,NA,NA,NA,NA,NA,NA,NA,NA,NA,NA,NA,NA,NA,NA,NA
47059,Greene County,TN,Tennessee,NA,0,NA,NA,NA,NA,NA,NA,NA,NA,NA,NA,NA,NA,NA,NA,NA
47061,Grundy County,TN,Tennessee,NA,0,NA,NA,NA,NA,NA,NA,NA,NA,NA,NA,NA,NA,NA,NA,NA
47063,Hamblen County,TN,Tennessee,NA,0,NA,NA,NA,NA,NA,NA,NA,NA,NA,NA,NA,NA,NA,NA,NA
47065,Hamilton County,TN,Tennessee,hamiltonhealth,1,NA,Yes,Yes,NA,NA,NA,NA,80338148,"**FOR IMMEDIATE RELEASE** November 24, 2021  Hamilton County Health Department to Begin Administering Booster Shots for Anyone Age 18+, No Appointment Necessary  Link:  https://t.co/1sAVS8rpVh  https://t.co/lsjafC4wHc",11/24/2021,12:52:36,https://twitter.com/HamiltonHealth/status/1463566235610849283,2021,11,24
47067,Hancock County,TN,Tennessee,NA,0,NA,NA,NA,NA,NA,NA,NA,NA,NA,NA,NA,NA,NA,NA,NA
47069,Hardeman County,TN,Tennessee,NA,0,NA,NA,NA,NA,NA,NA,NA,NA,NA,NA,NA,NA,NA,NA,NA
47071,Hardin County,TN,Tennessee,NA,0,NA,NA,NA,NA,NA,NA,NA,NA,NA,NA,NA,NA,NA,NA,NA
47073,Hawkins County,TN,Tennessee,NA,0,NA,NA,NA,NA,NA,NA,NA,NA,NA,NA,NA,NA,NA,NA,NA
47075,Haywood County,TN,Tennessee,NA,0,NA,NA,NA,NA,NA,NA,NA,NA,NA,NA,NA,NA,NA,NA,NA
47077,Henderson County,TN,Tennessee,NA,0,NA,NA,NA,NA,NA,NA,NA,NA,NA,NA,NA,NA,NA,NA,NA
47079,Henry County,TN,Tennessee,NA,0,NA,NA,NA,NA,NA,NA,NA,NA,NA,NA,NA,NA,NA,NA,NA
47081,Hickman County,TN,Tennessee,NA,0,NA,NA,NA,NA,NA,NA,NA,NA,NA,NA,NA,NA,NA,NA,NA
47083,Houston County,TN,Tennessee,NA,0,NA,NA,NA,NA,NA,NA,NA,NA,NA,NA,NA,NA,NA,NA,NA
47085,Humphreys County,TN,Tennessee,NA,0,NA,NA,NA,NA,NA,NA,NA,NA,NA,NA,NA,NA,NA,NA,NA
47087,Jackson County,TN,Tennessee,NA,0,NA,NA,NA,NA,NA,NA,NA,NA,NA,NA,NA,NA,NA,NA,NA
47089,Jefferson County,TN,Tennessee,NA,0,NA,NA,NA,NA,NA,NA,NA,NA,NA,NA,NA,NA,NA,NA,NA
47091,Johnson County,TN,Tennessee,NA,0,NA,NA,NA,NA,NA,NA,NA,NA,NA,NA,NA,NA,NA,NA,NA
47093,Knox County,TN,Tennessee,NA,0,NA,NA,NA,NA,NA,NA,NA,NA,NA,NA,NA,NA,NA,NA,NA
47095,Lake County,TN,Tennessee,NA,0,NA,NA,NA,NA,NA,NA,NA,NA,NA,NA,NA,NA,NA,NA,NA
47097,Lauderdale County,TN,Tennessee,NA,0,NA,NA,NA,NA,NA,NA,NA,NA,NA,NA,NA,NA,NA,NA,NA
47099,Lawrence County,TN,Tennessee,NA,0,NA,NA,NA,NA,NA,NA,NA,NA,NA,NA,NA,NA,NA,NA,NA
47101,Lewis County,TN,Tennessee,NA,0,NA,NA,NA,NA,NA,NA,NA,NA,NA,NA,NA,NA,NA,NA,NA
47103,Lincoln County,TN,Tennessee,NA,0,NA,NA,NA,NA,NA,NA,NA,NA,NA,NA,NA,NA,NA,NA,NA
47105,Loudon County,TN,Tennessee,NA,0,NA,NA,NA,NA,NA,NA,NA,NA,NA,NA,NA,NA,NA,NA,NA
47107,McMinn County,TN,Tennessee,NA,0,NA,NA,NA,NA,NA,NA,NA,NA,NA,NA,NA,NA,NA,NA,NA
47109,McNairy County,TN,Tennessee,NA,0,NA,NA,NA,NA,NA,NA,NA,NA,NA,NA,NA,NA,NA,NA,NA
47111,Macon County,TN,Tennessee,NA,0,NA,NA,NA,NA,NA,NA,NA,NA,NA,NA,NA,NA,NA,NA,NA
47113,Madison County,TN,Tennessee,jmcrhealthdept,1,NA,Yes,Yes,NA,NA,NA,NA,1.05E+18,"#CoronavirusUpdate: As of 10 a.m. today, we now have 18,562 confirmed cases of #COVID19 in Madison County—up 53 since Wednesday, Nov. 17, 2021.   📍 17,893 Recovered 📍 46 Not Recovered 📍 88 Better 📍 220 Unknown 📍 315 Deaths 📍 354 Active Cases (including unknowns)  https://t.co/Mt0St9rp4F",11/24/2021,11:05:54,https://twitter.com/JMCRHealthDept/status/1463539383634640899,2021,11,24
47115,Marion County,TN,Tennessee,NA,0,NA,NA,NA,NA,NA,NA,NA,NA,NA,NA,NA,NA,NA,NA,NA
47117,Marshall County,TN,Tennessee,NA,0,NA,NA,NA,NA,NA,NA,NA,NA,NA,NA,NA,NA,NA,NA,NA
47119,Maury County,TN,Tennessee,NA,0,NA,NA,NA,NA,NA,NA,NA,NA,NA,NA,NA,NA,NA,NA,NA
47121,Meigs County,TN,Tennessee,NA,0,NA,NA,NA,NA,NA,NA,NA,NA,NA,NA,NA,NA,NA,NA,NA
47123,Monroe County,TN,Tennessee,NA,0,NA,NA,NA,NA,NA,NA,NA,NA,NA,NA,NA,NA,NA,NA,NA
47125,Montgomery County,TN,Tennessee,NA,0,NA,NA,NA,NA,NA,NA,NA,NA,NA,NA,NA,NA,NA,NA,NA
47127,Moore County,TN,Tennessee,NA,0,NA,NA,NA,NA,NA,NA,NA,NA,NA,NA,NA,NA,NA,NA,NA
47129,Morgan County,TN,Tennessee,NA,0,NA,NA,NA,NA,NA,NA,NA,NA,NA,NA,NA,NA,NA,NA,NA
47131,Obion County,TN,Tennessee,NA,0,NA,NA,NA,NA,NA,NA,NA,NA,NA,NA,NA,NA,NA,NA,NA
47133,Overton County,TN,Tennessee,NA,0,NA,NA,NA,NA,NA,NA,NA,NA,NA,NA,NA,NA,NA,NA,NA
47135,Perry County,TN,Tennessee,NA,0,NA,NA,NA,NA,NA,NA,NA,NA,NA,NA,NA,NA,NA,NA,NA
47137,Pickett County,TN,Tennessee,NA,0,NA,NA,NA,NA,NA,NA,NA,NA,NA,NA,NA,NA,NA,NA,NA
47139,Polk County,TN,Tennessee,NA,0,NA,NA,NA,NA,NA,NA,NA,NA,NA,NA,NA,NA,NA,NA,NA
47141,Putnam County,TN,Tennessee,NA,0,NA,NA,NA,NA,NA,NA,NA,NA,NA,NA,NA,NA,NA,NA,NA
47143,Rhea County,TN,Tennessee,NA,0,NA,NA,NA,NA,NA,NA,NA,NA,NA,NA,NA,NA,NA,NA,NA
47145,Roane County,TN,Tennessee,NA,0,NA,NA,NA,NA,NA,NA,NA,NA,NA,NA,NA,NA,NA,NA,NA
47147,Robertson County,TN,Tennessee,NA,0,NA,NA,NA,NA,NA,NA,NA,NA,NA,NA,NA,NA,NA,NA,NA
47149,Rutherford County,TN,Tennessee,NA,0,NA,NA,NA,NA,NA,NA,NA,NA,NA,NA,NA,NA,NA,NA,NA
47151,Scott County,TN,Tennessee,NA,0,NA,NA,NA,NA,NA,NA,NA,NA,NA,NA,NA,NA,NA,NA,NA
47153,Sequatchie County,TN,Tennessee,NA,0,NA,NA,NA,NA,NA,NA,NA,NA,NA,NA,NA,NA,NA,NA,NA
47155,Sevier County,TN,Tennessee,NA,0,NA,NA,NA,NA,NA,NA,NA,NA,NA,NA,NA,NA,NA,NA,NA
47157,Shelby County,TN,Tennessee,shelbytnhealth,1,NA,Yes,Yes,NA,NA,NA,NA,488793283,"In observance of the Thanksgiving holiday, the Shelby County Health Department will not provide the COVID-19 update Thursday, November 25 through Sunday, November 28. We will resume the update Monday, November 29.  https://t.co/1TekwNT2eH",11/24/2021,17:00:43,https://twitter.com/ShelbyTNHealth/status/1463628675451179009,2021,11,24
47159,Smith County,TN,Tennessee,NA,0,NA,NA,NA,NA,NA,NA,NA,NA,NA,NA,NA,NA,NA,NA,NA
47161,Stewart County,TN,Tennessee,NA,0,NA,NA,NA,NA,NA,NA,NA,NA,NA,NA,NA,NA,NA,NA,NA
47163,Sullivan County,TN,Tennessee,sullivanhealth,1,NA,Yes,Yes,NA,NA,NA,NA,65088327,THE BOOSTER VACCINATIONS ARE AVAILABLE TO EVERYONE 18 AND UP!  CALL US AT (423) 279-2777 TO SCHEDULE! ☎️   or  Visit  https://t.co/w0xA79As2P to book your COVID-19 shot today! 📲,11/24/2021,15:30:23,https://twitter.com/SullivanHealth/status/1463605940771557385,2021,11,24
47165,Sumner County,TN,Tennessee,healthysumner,1,NA,Yes,No,NA,NA,NA,NA,9.49E+17,Way to go @SumnerCoCSH!,8/20/2021,22:21:28,https://twitter.com/HealthySumner/status/1428905060587737089,2021,8,20
47167,Tipton County,TN,Tennessee,NA,0,NA,NA,NA,NA,NA,NA,NA,NA,NA,NA,NA,NA,NA,NA,NA
47169,Trousdale County,TN,Tennessee,NA,0,NA,NA,NA,NA,NA,NA,NA,NA,NA,NA,NA,NA,NA,NA,NA
47171,Unicoi County,TN,Tennessee,NA,0,NA,NA,NA,NA,NA,NA,NA,NA,NA,NA,NA,NA,NA,NA,NA
47173,Union County,TN,Tennessee,NA,0,NA,NA,NA,NA,NA,NA,NA,NA,NA,NA,NA,NA,NA,NA,NA
47175,Van Buren County,TN,Tennessee,NA,0,NA,NA,NA,NA,NA,NA,NA,NA,NA,NA,NA,NA,NA,NA,NA
47177,Warren County,TN,Tennessee,NA,0,NA,NA,NA,NA,NA,NA,NA,NA,NA,NA,NA,NA,NA,NA,NA
47179,Washington County,TN,Tennessee,NA,0,NA,NA,NA,NA,NA,NA,NA,NA,NA,NA,NA,NA,NA,NA,NA
47181,Wayne County,TN,Tennessee,NA,0,NA,NA,NA,NA,NA,NA,NA,NA,NA,NA,NA,NA,NA,NA,NA
47183,Weakley County,TN,Tennessee,NA,0,NA,NA,NA,NA,NA,NA,NA,NA,NA,NA,NA,NA,NA,NA,NA
47185,White County,TN,Tennessee,NA,0,NA,NA,NA,NA,NA,NA,NA,NA,NA,NA,NA,NA,NA,NA,NA
47187,Williamson County,TN,Tennessee,NA,0,NA,NA,NA,NA,NA,NA,NA,NA,NA,NA,NA,NA,NA,NA,NA
47189,Wilson County,TN,Tennessee,NA,0,NA,NA,NA,NA,NA,NA,NA,NA,NA,NA,NA,NA,NA,NA,NA
48001,Anderson County,TX,Texas,NA,0,NA,NA,NA,NA,NA,NA,NA,NA,NA,NA,NA,NA,NA,NA,NA
48003,Andrews County,TX,Texas,NA,0,NA,NA,NA,NA,NA,NA,NA,NA,NA,NA,NA,NA,NA,NA,NA
48005,Angelina County,TX,Texas,acchdus,1,NA,Yes,Yes,NA,NA,NA,NA,9.18E+17,https://t.co/snjdBiYPfl,11/23/2021,20:16:06,https://twitter.com/acchdus/status/1463315456870203398,2021,11,23
48007,Aransas County,TX,Texas,NA,0,NA,NA,NA,NA,NA,NA,NA,NA,NA,NA,NA,NA,NA,NA,NA
48009,Archer County,TX,Texas,NA,0,NA,NA,NA,NA,NA,NA,NA,NA,NA,NA,NA,NA,NA,NA,NA
48011,Armstrong County,TX,Texas,NA,0,NA,NA,NA,NA,NA,NA,NA,NA,NA,NA,NA,NA,NA,NA,NA
48013,Atascosa County,TX,Texas,NA,0,NA,NA,NA,1,NA,NA,NA,NA,NA,NA,NA,NA,NA,NA,NA
48015,Austin County,TX,Texas,auspublichealth,1,NA,Yes,Yes,NA,NA,NA,NA,870535057,Get vaccinated 👉  https://t.co/J7VmYzANq1  https://t.co/nnIdx7IadP,11/24/2021,16:00:01,https://twitter.com/AusPublicHealth/status/1463613400563343366,2021,11,24
48017,Bailey County,TX,Texas,NA,0,NA,NA,NA,NA,NA,NA,NA,NA,NA,NA,NA,NA,NA,NA,NA
48019,Bandera County,TX,Texas,NA,0,NA,NA,NA,NA,NA,NA,NA,NA,NA,NA,NA,NA,NA,NA,NA
48021,Bastrop County,TX,Texas,NA,0,NA,NA,NA,NA,NA,NA,NA,NA,NA,NA,NA,NA,NA,NA,NA
48023,Baylor County,TX,Texas,NA,0,NA,NA,NA,NA,NA,NA,NA,NA,NA,NA,NA,NA,NA,NA,NA
48025,Bee County,TX,Texas,NA,0,NA,NA,NA,NA,NA,NA,NA,NA,NA,NA,NA,NA,NA,NA,NA
48027,Bell County,TX,Texas,NA,0,NA,NA,NA,NA,NA,NA,NA,NA,NA,NA,NA,NA,NA,NA,NA
48029,Bexar County,TX,Texas,sametrohealth,1,NA,Yes,Yes,NA,NA,NA,NA,85343799,"In observance of the Thanksgiving Holiday, the Alamodome Drive-Thru Vaccine Clinic will be closed on Thursday, November 25, 2021 and Friday, November 26, 2021. We will reopen with regular hours on Wednesday, December 2 from 12pm to 8pm.  https://t.co/zJ9js8OXWs",11/24/2021,16:01:11,https://twitter.com/SAMetroHealth/status/1463613694244442113,2021,11,24
48031,Blanco County,TX,Texas,NA,0,NA,NA,NA,NA,NA,NA,NA,NA,NA,NA,NA,NA,NA,NA,NA
48033,Borden County,TX,Texas,NA,0,NA,NA,NA,NA,NA,NA,NA,NA,NA,NA,NA,NA,NA,NA,NA
48035,Bosque County,TX,Texas,NA,0,NA,NA,NA,NA,NA,NA,NA,NA,NA,NA,NA,NA,NA,NA,NA
48037,Bowie County,TX,Texas,NA,0,NA,NA,NA,NA,NA,NA,NA,NA,NA,NA,NA,NA,NA,NA,NA
48039,Brazoria County,TX,Texas,NA,0,NA,NA,NA,NA,NA,NA,NA,NA,NA,NA,NA,NA,NA,NA,NA
48041,Brazos County,TX,Texas,brazoscohd,1,NA,Yes,Yes,NA,NA,NA,NA,1037445721,We want to hear from you! Fill out our survey today.    https://t.co/TS9rOgiC9S (English)    https://t.co/76aTPEGMpX (Español),11/19/2021,11:47:28,https://twitter.com/BrazosCoHD/status/1461737904686915586,2021,11,19
48043,Brewster County,TX,Texas,NA,0,NA,NA,NA,NA,NA,NA,NA,NA,NA,NA,NA,NA,NA,NA,NA
48045,Briscoe County,TX,Texas,NA,0,NA,NA,NA,NA,NA,NA,NA,NA,NA,NA,NA,NA,NA,NA,NA
48047,Brooks County,TX,Texas,NA,0,NA,NA,NA,NA,NA,NA,NA,NA,NA,NA,NA,NA,NA,NA,NA
48049,Brown County,TX,Texas,NA,0,NA,NA,NA,NA,NA,NA,NA,NA,NA,NA,NA,NA,NA,NA,NA
48051,Burleson County,TX,Texas,NA,0,NA,NA,NA,NA,NA,NA,NA,NA,NA,NA,NA,NA,NA,NA,NA
48053,Burnet County,TX,Texas,NA,0,NA,NA,NA,NA,NA,NA,NA,NA,NA,NA,NA,NA,NA,NA,NA
48055,Caldwell County,TX,Texas,NA,0,NA,NA,NA,NA,NA,NA,NA,NA,NA,NA,NA,NA,NA,NA,NA
48057,Calhoun County,TX,Texas,NA,0,NA,NA,NA,NA,NA,NA,NA,NA,NA,NA,NA,NA,NA,NA,NA
48059,Callahan County,TX,Texas,NA,0,NA,NA,NA,NA,NA,NA,NA,NA,NA,NA,NA,NA,NA,NA,NA
48061,Cameron County,TX,Texas,ccph_tx,1,NA,Yes,No,NA,NA,NA,NA,8.70E+17,https://t.co/3VOojbYeXd,4/1/2020,21:07:02,https://twitter.com/CCPH_TX/status/1245518069100929026,2020,4,1
48063,Camp County,TX,Texas,NA,0,NA,NA,NA,NA,NA,NA,NA,NA,NA,NA,NA,NA,NA,NA,NA
48065,Carson County,TX,Texas,NA,0,NA,NA,NA,NA,NA,NA,NA,NA,NA,NA,NA,NA,NA,NA,NA
48067,Cass County,TX,Texas,NA,0,NA,NA,NA,NA,NA,NA,NA,NA,NA,NA,NA,NA,NA,NA,NA
48069,Castro County,TX,Texas,NA,0,NA,NA,NA,NA,NA,NA,NA,NA,NA,NA,NA,NA,NA,NA,NA
48071,Chambers County,TX,Texas,cctxhealthdept,1,NA,Yes,No,NA,NA,NA,NA,2600331032,Information regarding the FREE mobile COVID-19 testing sites will be released soon! Remember - no symptoms will be required for this round of testing.  https://t.co/Gp9wibECit,6/26/2020,13:01:44,https://twitter.com/cctxhealthdept/status/1276561293865037829,2020,6,26
48073,Cherokee County,TX,Texas,NA,0,NA,NA,NA,NA,NA,NA,NA,NA,NA,NA,NA,NA,NA,NA,NA
48075,Childress County,TX,Texas,NA,0,NA,NA,NA,NA,NA,NA,NA,NA,NA,NA,NA,NA,NA,NA,NA
48077,Clay County,TX,Texas,NA,0,NA,NA,NA,NA,NA,NA,NA,NA,NA,NA,NA,NA,NA,NA,NA
48079,Cochran County,TX,Texas,NA,0,NA,NA,NA,NA,NA,NA,NA,NA,NA,NA,NA,NA,NA,NA,NA
48081,Coke County,TX,Texas,NA,0,NA,NA,NA,NA,NA,NA,NA,NA,NA,NA,NA,NA,NA,NA,NA
48083,Coleman County,TX,Texas,NA,0,NA,NA,NA,NA,NA,NA,NA,NA,NA,NA,NA,NA,NA,NA,NA
48085,Collin County,TX,Texas,NA,0,NA,NA,NA,NA,NA,NA,NA,NA,NA,NA,NA,NA,NA,NA,NA
48087,Collingsworth County,TX,Texas,NA,0,NA,NA,NA,NA,NA,NA,NA,NA,NA,NA,NA,NA,NA,NA,NA
48089,Colorado County,TX,Texas,NA,0,NA,NA,NA,NA,NA,NA,NA,NA,NA,NA,NA,NA,NA,NA,NA
48091,Comal County,TX,Texas,NA,0,NA,NA,NA,NA,NA,NA,NA,NA,NA,NA,NA,NA,NA,NA,NA
48093,Comanche County,TX,Texas,NA,0,NA,NA,NA,NA,NA,NA,NA,NA,NA,NA,NA,NA,NA,NA,NA
48095,Concho County,TX,Texas,NA,0,NA,NA,NA,NA,NA,NA,NA,NA,NA,NA,NA,NA,NA,NA,NA
48097,Cooke County,TX,Texas,NA,0,NA,NA,NA,NA,NA,NA,NA,NA,NA,NA,NA,NA,NA,NA,NA
48099,Coryell County,TX,Texas,NA,0,NA,NA,NA,NA,NA,NA,NA,NA,NA,NA,NA,NA,NA,NA,NA
48101,Cottle County,TX,Texas,NA,0,NA,NA,NA,NA,NA,NA,NA,NA,NA,NA,NA,NA,NA,NA,NA
48103,Crane County,TX,Texas,NA,0,NA,NA,NA,NA,NA,NA,NA,NA,NA,NA,NA,NA,NA,NA,NA
48105,Crockett County,TX,Texas,NA,0,NA,NA,NA,NA,NA,NA,NA,NA,NA,NA,NA,NA,NA,NA,NA
48107,Crosby County,TX,Texas,NA,0,NA,NA,NA,NA,NA,NA,NA,NA,NA,NA,NA,NA,NA,NA,NA
48109,Culberson County,TX,Texas,NA,0,NA,NA,NA,NA,NA,NA,NA,NA,NA,NA,NA,NA,NA,NA,NA
48111,Dallam County,TX,Texas,NA,0,NA,NA,NA,NA,NA,NA,NA,NA,NA,NA,NA,NA,NA,NA,NA
48113,Dallas County,TX,Texas,dchhs,1,NA,Yes,Yes,NA,NA,NA,NA,28599776,"🚑‼️Mañana puedes recibir la vacuna del #COVID19 totalmente GRATIS de 10 am -2 pm. Tendremos la primera, la segunda y la vacuna de refuerzo disponibles y vacunas para niños de 5 a 11 años.   Al vacunarse recibirá una tarjeta de regalo por $25 de Walmart ✅ Te esperamos!",11/21/2021,22:23:46,https://twitter.com/DCHHS/status/1462622810719805444,2021,11,21
48113,Dallas County,TX,Texas,dchhs,1,NA,Yes,Yes,NA,NA,NA,NA,28599776,"🚑‼️We’ll be hosting a FREE #COVID19 💉clinic tomorrow @ Trinity Basin Prep from 10 am - 2 pm. We’ll administer 1st, 2nd &amp; 3rd doses and vaccines for children 5-11 #GetVaccinated   Claim a $25 Walmart gift card after receiving the 💉. Details ⬇️⬇️‼️  https://t.co/FBA9rdcB2s",11/21/2021,22:23:46,https://twitter.com/DCHHS/status/1462622808631087112,2021,11,21
48115,Dawson County,TX,Texas,NA,0,NA,NA,NA,NA,NA,NA,NA,NA,NA,NA,NA,NA,NA,NA,NA
48117,Deaf Smith County,TX,Texas,NA,0,NA,NA,NA,NA,NA,NA,NA,NA,NA,NA,NA,NA,NA,NA,NA
48119,Delta County,TX,Texas,NA,0,NA,NA,NA,NA,NA,NA,NA,NA,NA,NA,NA,NA,NA,NA,NA
48121,Denton County,TX,Texas,wearedcoh,1,DoubleCheck,No,No,NA,NA,NA,NA,NA,NA,NA,NA,NA,NA,NA,NA
48123,DeWitt County,TX,Texas,NA,0,NA,NA,NA,NA,NA,NA,NA,NA,NA,NA,NA,NA,NA,NA,NA
48125,Dickens County,TX,Texas,NA,0,NA,NA,NA,NA,NA,NA,NA,NA,NA,NA,NA,NA,NA,NA,NA
48127,Dimmit County,TX,Texas,NA,0,NA,NA,NA,NA,NA,NA,NA,NA,NA,NA,NA,NA,NA,NA,NA
48129,Donley County,TX,Texas,NA,0,NA,NA,NA,NA,NA,NA,NA,NA,NA,NA,NA,NA,NA,NA,NA
48131,Duval County,TX,Texas,NA,0,NA,NA,NA,NA,NA,NA,NA,NA,NA,NA,NA,NA,NA,NA,NA
48133,Eastland County,TX,Texas,NA,0,NA,NA,NA,NA,NA,NA,NA,NA,NA,NA,NA,NA,NA,NA,NA
48135,Ector County,TX,Texas,NA,0,NA,NA,NA,NA,NA,NA,NA,NA,NA,NA,NA,NA,NA,NA,NA
48137,Edwards County,TX,Texas,NA,0,NA,NA,NA,NA,NA,NA,NA,NA,NA,NA,NA,NA,NA,NA,NA
48139,Ellis County,TX,Texas,NA,0,NA,NA,NA,NA,NA,NA,NA,NA,NA,NA,NA,NA,NA,NA,NA
48141,El Paso County,TX,Texas,NA,0,NA,NA,NA,NA,NA,NA,NA,NA,NA,NA,NA,NA,NA,NA,NA
48143,Erath County,TX,Texas,NA,0,NA,NA,NA,NA,NA,NA,NA,NA,NA,NA,NA,NA,NA,NA,NA
48145,Falls County,TX,Texas,NA,0,NA,NA,NA,NA,NA,NA,NA,NA,NA,NA,NA,NA,NA,NA,NA
48147,Fannin County,TX,Texas,NA,0,NA,NA,NA,NA,NA,NA,NA,NA,NA,NA,NA,NA,NA,NA,NA
48149,Fayette County,TX,Texas,NA,0,NA,NA,NA,NA,NA,NA,NA,NA,NA,NA,NA,NA,NA,NA,NA
48151,Fisher County,TX,Texas,NA,0,NA,NA,NA,NA,NA,NA,NA,NA,NA,NA,NA,NA,NA,NA,NA
48153,Floyd County,TX,Texas,NA,0,NA,NA,NA,NA,NA,NA,NA,NA,NA,NA,NA,NA,NA,NA,NA
48155,Foard County,TX,Texas,NA,0,NA,NA,NA,NA,NA,NA,NA,NA,NA,NA,NA,NA,NA,NA,NA
48157,Fort Bend County,TX,Texas,fortbendhealth,1,NA,Yes,Yes,NA,NA,NA,NA,302236021,"COVID-19 HUB Data report for 11-24-21. Today 133 new cases of #COVID19 and 3 deaths were reported.  The current number of reported active cases is 1,433.  More FBC COVID-19 information can be found at  https://t.co/g8sJlg2xvE.  https://t.co/0Kh6evcZnH",11/24/2021,17:05:02,https://twitter.com/FortBendHealth/status/1463629760605605895,2021,11,24
48159,Franklin County,TX,Texas,NA,0,NA,NA,NA,NA,NA,NA,NA,NA,NA,NA,NA,NA,NA,NA,NA
48161,Freestone County,TX,Texas,NA,0,NA,NA,NA,NA,NA,NA,NA,NA,NA,NA,NA,NA,NA,NA,NA
48163,Frio County,TX,Texas,NA,0,NA,NA,NA,NA,NA,NA,NA,NA,NA,NA,NA,NA,NA,NA,NA
48165,Gaines County,TX,Texas,NA,0,NA,NA,NA,NA,NA,NA,NA,NA,NA,NA,NA,NA,NA,NA,NA
48167,Galveston County,TX,Texas,gchdinfo,1,NA,Yes,Yes,NA,NA,NA,NA,3161549442,"Did you know Coastal Health &amp; Wellness offers medical, dental and counseling services for children, adolescents and adults? AND, we're accepting new patients!  Call us at 409.938.2234 to learn more!  https://t.co/j6AfHlDeLA",11/24/2021,17:45:00,https://twitter.com/GCHDinfo/status/1463639817380503552,2021,11,24
48169,Garza County,TX,Texas,NA,0,NA,NA,NA,NA,NA,NA,NA,NA,NA,NA,NA,NA,NA,NA,NA
48171,Gillespie County,TX,Texas,NA,0,NA,NA,NA,NA,NA,NA,NA,NA,NA,NA,NA,NA,NA,NA,NA
48173,Glasscock County,TX,Texas,NA,0,NA,NA,NA,NA,NA,NA,NA,NA,NA,NA,NA,NA,NA,NA,NA
48175,Goliad County,TX,Texas,NA,0,NA,NA,NA,NA,NA,NA,NA,NA,NA,NA,NA,NA,NA,NA,NA
48177,Gonzales County,TX,Texas,NA,0,NA,NA,NA,NA,NA,NA,NA,NA,NA,NA,NA,NA,NA,NA,NA
48179,Gray County,TX,Texas,NA,0,NA,NA,NA,NA,NA,NA,NA,NA,NA,NA,NA,NA,NA,NA,NA
48181,Grayson County,TX,Texas,graysoncounty,1,NA,Yes,Yes,1,NA,EmergManage,NA,44794344,"Today’s COVID-19 Numbers 📊  Grayson County- Total: 16,491 New: 25 Active: 59 Deaths: 544  For more information including hospitalization rates, view the Grayson County COVID-19 Situation Report-   https://t.co/SvfsBpl2oZ  https://t.co/23DWWQ3JNw",11/24/2021,16:58:52,https://twitter.com/GraysonCounty/status/1463628208847347716,2021,11,24
48183,Gregg County,TX,Texas,NA,0,NA,NA,NA,NA,NA,NA,NA,NA,NA,NA,NA,NA,NA,NA,NA
48185,Grimes County,TX,Texas,NA,0,NA,NA,NA,NA,NA,NA,NA,NA,NA,NA,NA,NA,NA,NA,NA
48187,Guadalupe County,TX,Texas,NA,0,NA,NA,NA,NA,NA,NA,NA,NA,NA,NA,NA,NA,NA,NA,NA
48189,Hale County,TX,Texas,NA,0,NA,NA,NA,NA,NA,NA,NA,NA,NA,NA,NA,NA,NA,NA,NA
48191,Hall County,TX,Texas,NA,0,NA,NA,NA,NA,NA,NA,NA,NA,NA,NA,NA,NA,NA,NA,NA
48193,Hamilton County,TX,Texas,NA,0,NA,NA,NA,NA,NA,NA,NA,NA,NA,NA,NA,NA,NA,NA,NA
48195,Hansford County,TX,Texas,NA,0,NA,NA,NA,NA,NA,NA,NA,NA,NA,NA,NA,NA,NA,NA,NA
48197,Hardeman County,TX,Texas,NA,0,NA,NA,NA,NA,NA,NA,NA,NA,NA,NA,NA,NA,NA,NA,NA
48199,Hardin County,TX,Texas,NA,0,NA,NA,NA,NA,NA,NA,NA,NA,NA,NA,NA,NA,NA,NA,NA
48201,Harris County,TX,Texas,hcphtx,1,NA,Yes,Yes,NA,NA,NA,NA,143092332,"Our testing and COVID-19 Vaccine sites will be closed Thursday 11/25 and Friday 11/26. Although we advise against large family and friends' gatherings, we are aware the temptation might win. In any case, it is best to #KnowYourCOVID19Status and #GetTested before the celebration.  https://t.co/Fst9JfsCD4",11/24/2021,16:00:26,https://twitter.com/hcphtx/status/1463613503705604112,2021,11,24
48203,Harrison County,TX,Texas,NA,0,NA,NA,NA,NA,NA,NA,NA,NA,NA,NA,NA,NA,NA,NA,NA
48205,Hartley County,TX,Texas,NA,0,NA,NA,NA,NA,NA,NA,NA,NA,NA,NA,NA,NA,NA,NA,NA
48207,Haskell County,TX,Texas,NA,0,NA,NA,NA,NA,NA,NA,NA,NA,NA,NA,NA,NA,NA,NA,NA
48209,Hays County,TX,Texas,NA,0,NA,NA,NA,NA,NA,NA,NA,NA,NA,NA,NA,NA,NA,NA,NA
48211,Hemphill County,TX,Texas,NA,0,NA,NA,NA,NA,NA,NA,NA,NA,NA,NA,NA,NA,NA,NA,NA
48213,Henderson County,TX,Texas,NA,0,NA,NA,NA,NA,NA,NA,NA,NA,NA,NA,NA,NA,NA,NA,NA
48215,Hidalgo County,TX,Texas,hidalgohealth,1,NA,Yes,Yes,NA,NA,NA,NA,56421774,⭐️@hidalgohealth partnering with local partners to provide CoVID Vaccine for 5yrs of age and older as posted and vaccine provided at each of the Hidalgo County Clinics call 956 292 7765 for information  @HidalgoCounty @TexasDSHS  https://t.co/fVAZ9FH4a1,11/4/2021,10:21:40,https://twitter.com/hidalgohealth/status/1456265393006202896,2021,11,4
48217,Hill County,TX,Texas,NA,0,NA,NA,NA,NA,NA,NA,NA,NA,NA,NA,NA,NA,NA,NA,NA
48219,Hockley County,TX,Texas,NA,0,NA,NA,NA,NA,NA,NA,NA,NA,NA,NA,NA,NA,NA,NA,NA
48221,Hood County,TX,Texas,NA,0,NA,NA,NA,NA,NA,NA,NA,NA,NA,NA,NA,NA,NA,NA,NA
48223,Hopkins County,TX,Texas,NA,0,NA,NA,NA,NA,NA,NA,NA,NA,NA,NA,NA,NA,NA,NA,NA
48225,Houston County,TX,Texas,NA,0,NA,NA,NA,NA,NA,NA,NA,NA,NA,NA,NA,NA,NA,NA,NA
48227,Howard County,TX,Texas,NA,0,NA,NA,NA,NA,NA,NA,NA,NA,NA,NA,NA,NA,NA,NA,NA
48229,Hudspeth County,TX,Texas,NA,0,NA,NA,NA,NA,NA,NA,NA,NA,NA,NA,NA,NA,NA,NA,NA
48231,Hunt County,TX,Texas,NA,0,NA,NA,NA,NA,NA,NA,NA,NA,NA,NA,NA,NA,NA,NA,NA
48233,Hutchinson County,TX,Texas,NA,0,NA,NA,NA,NA,NA,NA,NA,NA,NA,NA,NA,NA,NA,NA,NA
48235,Irion County,TX,Texas,NA,0,NA,NA,NA,NA,NA,NA,NA,NA,NA,NA,NA,NA,NA,NA,NA
48237,Jack County,TX,Texas,NA,0,NA,NA,NA,NA,NA,NA,NA,NA,NA,NA,NA,NA,NA,NA,NA
48239,Jackson County,TX,Texas,NA,0,NA,NA,NA,NA,NA,NA,NA,NA,NA,NA,NA,NA,NA,NA,NA
48241,Jasper County,TX,Texas,NA,0,NA,NA,NA,NA,NA,NA,NA,NA,NA,NA,NA,NA,NA,NA,NA
48243,Jeff Davis County,TX,Texas,NA,0,NA,NA,NA,NA,NA,NA,NA,NA,NA,NA,NA,NA,NA,NA,NA
48245,Jefferson County,TX,Texas,NA,0,NA,NA,NA,NA,NA,NA,NA,NA,NA,NA,NA,NA,NA,NA,NA
48247,Jim Hogg County,TX,Texas,NA,0,NA,NA,NA,NA,NA,NA,NA,NA,NA,NA,NA,NA,NA,NA,NA
48249,Jim Wells County,TX,Texas,NA,0,NA,NA,NA,NA,NA,NA,NA,NA,NA,NA,NA,NA,NA,NA,NA
48251,Johnson County,TX,Texas,NA,0,NA,NA,NA,NA,NA,NA,NA,NA,NA,NA,NA,NA,NA,NA,NA
48253,Jones County,TX,Texas,NA,0,NA,NA,NA,NA,NA,NA,NA,NA,NA,NA,NA,NA,NA,NA,NA
48255,Karnes County,TX,Texas,NA,0,NA,NA,NA,NA,NA,NA,NA,NA,NA,NA,NA,NA,NA,NA,NA
48257,Kaufman County,TX,Texas,NA,0,NA,NA,NA,NA,NA,NA,NA,NA,NA,NA,NA,NA,NA,NA,NA
48259,Kendall County,TX,Texas,NA,0,NA,NA,NA,NA,NA,NA,NA,NA,NA,NA,NA,NA,NA,NA,NA
48261,Kenedy County,TX,Texas,NA,0,NA,NA,NA,NA,NA,NA,NA,NA,NA,NA,NA,NA,NA,NA,NA
48263,Kent County,TX,Texas,NA,0,NA,NA,NA,NA,NA,NA,NA,NA,NA,NA,NA,NA,NA,NA,NA
48265,Kerr County,TX,Texas,NA,0,NA,NA,NA,NA,NA,NA,NA,NA,NA,NA,NA,NA,NA,NA,NA
48267,Kimble County,TX,Texas,NA,0,NA,NA,NA,NA,NA,NA,NA,NA,NA,NA,NA,NA,NA,NA,NA
48269,King County,TX,Texas,NA,0,NA,NA,NA,NA,NA,NA,NA,NA,NA,NA,NA,NA,NA,NA,NA
48271,Kinney County,TX,Texas,NA,0,NA,NA,NA,NA,NA,NA,NA,NA,NA,NA,NA,NA,NA,NA,NA
48273,Kleberg County,TX,Texas,NA,0,NA,NA,NA,NA,NA,NA,NA,NA,NA,NA,NA,NA,NA,NA,NA
48275,Knox County,TX,Texas,NA,0,NA,NA,NA,NA,NA,NA,NA,NA,NA,NA,NA,NA,NA,NA,NA
48277,Lamar County,TX,Texas,NA,0,NA,NA,NA,NA,NA,NA,NA,NA,NA,NA,NA,NA,NA,NA,NA
48279,Lamb County,TX,Texas,NA,0,NA,NA,NA,NA,NA,NA,NA,NA,NA,NA,NA,NA,NA,NA,NA
48281,Lampasas County,TX,Texas,NA,0,NA,NA,NA,NA,NA,NA,NA,NA,NA,NA,NA,NA,NA,NA,NA
48283,La Salle County,TX,Texas,NA,0,NA,NA,NA,NA,NA,NA,NA,NA,NA,NA,NA,NA,NA,NA,NA
48285,Lavaca County,TX,Texas,NA,0,NA,NA,NA,NA,NA,NA,NA,NA,NA,NA,NA,NA,NA,NA,NA
48287,Lee County,TX,Texas,NA,0,NA,NA,NA,NA,NA,NA,NA,NA,NA,NA,NA,NA,NA,NA,NA
48289,Leon County,TX,Texas,NA,0,NA,NA,NA,NA,NA,NA,NA,NA,NA,NA,NA,NA,NA,NA,NA
48291,Liberty County,TX,Texas,NA,0,NA,NA,NA,NA,NA,NA,NA,NA,NA,NA,NA,NA,NA,NA,NA
48293,Limestone County,TX,Texas,NA,0,NA,NA,NA,NA,NA,NA,NA,NA,NA,NA,NA,NA,NA,NA,NA
48295,Lipscomb County,TX,Texas,NA,0,NA,NA,NA,NA,NA,NA,NA,NA,NA,NA,NA,NA,NA,NA,NA
48297,Live Oak County,TX,Texas,NA,0,NA,NA,NA,NA,NA,NA,NA,NA,NA,NA,NA,NA,NA,NA,NA
48299,Llano County,TX,Texas,NA,0,NA,NA,NA,NA,NA,NA,NA,NA,NA,NA,NA,NA,NA,NA,NA
48301,Loving County,TX,Texas,NA,0,NA,NA,NA,NA,NA,NA,NA,NA,NA,NA,NA,NA,NA,NA,NA
48303,Lubbock County,TX,Texas,NA,0,NA,NA,NA,NA,NA,NA,NA,NA,NA,NA,NA,NA,NA,NA,NA
48305,Lynn County,TX,Texas,NA,0,NA,NA,NA,NA,NA,NA,NA,NA,NA,NA,NA,NA,NA,NA,NA
48307,McCulloch County,TX,Texas,NA,0,NA,NA,NA,NA,NA,NA,NA,NA,NA,NA,NA,NA,NA,NA,NA
48309,McLennan County,TX,Texas,wacohealthdept,1,NA,Yes,Yes,NA,NA,NA,NA,237028256,COVID-19 booster updates: everyone ages 18 and older is now eligible for a booster shot. The Health District offers all 3 vaccines.  https://t.co/b4sgF38OIZ  https://t.co/fx4tdeSUCg,11/24/2021,17:00:37,https://twitter.com/wacohealthdept/status/1463628649232482309,2021,11,24
48311,McMullen County,TX,Texas,NA,0,NA,NA,NA,NA,NA,NA,NA,NA,NA,NA,NA,NA,NA,NA,NA
48313,Madison County,TX,Texas,NA,0,NA,NA,NA,NA,NA,NA,NA,NA,NA,NA,NA,NA,NA,NA,NA
48315,Marion County,TX,Texas,NA,0,NA,NA,NA,NA,NA,NA,NA,NA,NA,NA,NA,NA,NA,NA,NA
48317,Martin County,TX,Texas,NA,0,NA,NA,NA,NA,NA,NA,NA,NA,NA,NA,NA,NA,NA,NA,NA
48319,Mason County,TX,Texas,NA,0,NA,NA,NA,NA,NA,NA,NA,NA,NA,NA,NA,NA,NA,NA,NA
48321,Matagorda County,TX,Texas,NA,0,NA,NA,NA,NA,NA,NA,NA,NA,NA,NA,NA,NA,NA,NA,NA
48323,Maverick County,TX,Texas,NA,0,NA,NA,NA,NA,NA,NA,NA,NA,NA,NA,NA,NA,NA,NA,NA
48325,Medina County,TX,Texas,NA,0,NA,NA,NA,NA,NA,NA,NA,NA,NA,NA,NA,NA,NA,NA,NA
48327,Menard County,TX,Texas,NA,0,NA,NA,NA,NA,NA,NA,NA,NA,NA,NA,NA,NA,NA,NA,NA
48329,Midland County,TX,Texas,NA,0,NA,NA,NA,NA,NA,NA,NA,NA,NA,NA,NA,NA,NA,NA,NA
48331,Milam County,TX,Texas,NA,0,NA,NA,NA,NA,NA,NA,NA,NA,NA,NA,NA,NA,NA,NA,NA
48333,Mills County,TX,Texas,NA,0,NA,NA,NA,NA,NA,NA,NA,NA,NA,NA,NA,NA,NA,NA,NA
48335,Mitchell County,TX,Texas,NA,0,NA,NA,NA,NA,NA,NA,NA,NA,NA,NA,NA,NA,NA,NA,NA
48337,Montague County,TX,Texas,NA,0,NA,NA,NA,NA,NA,NA,NA,NA,NA,NA,NA,NA,NA,NA,NA
48339,Montgomery County,TX,Texas,NA,0,NA,NA,NA,NA,NA,NA,NA,NA,NA,NA,NA,NA,NA,NA,NA
48341,Moore County,TX,Texas,NA,0,NA,NA,NA,NA,NA,NA,NA,NA,NA,NA,NA,NA,NA,NA,NA
48343,Morris County,TX,Texas,NA,0,NA,NA,NA,NA,NA,NA,NA,NA,NA,NA,NA,NA,NA,NA,NA
48345,Motley County,TX,Texas,NA,0,NA,NA,NA,NA,NA,NA,NA,NA,NA,NA,NA,NA,NA,NA,NA
48347,Nacogdoches County,TX,Texas,NA,0,NA,NA,NA,NA,NA,NA,NA,NA,NA,NA,NA,NA,NA,NA,NA
48349,Navarro County,TX,Texas,NA,0,NA,NA,NA,NA,NA,NA,NA,NA,NA,NA,NA,NA,NA,NA,NA
48351,Newton County,TX,Texas,NA,0,NA,NA,NA,NA,NA,NA,NA,NA,NA,NA,NA,NA,NA,NA,NA
48353,Nolan County,TX,Texas,NA,0,NA,NA,NA,NA,NA,NA,NA,NA,NA,NA,NA,NA,NA,NA,NA
48355,Nueces County,TX,Texas,ccpublichealth,1,NA,Yes,Yes,NA,NA,NA,NA,47453990,"Today's update on COVID-19 in @NuecesCo: 82 cases (10 reported by the State [historic data] and 72 reported to the Health District). Of the 82, 21 are confirmed positives, 28 are probable positives and 33 are suspect positives. 👉 Learn More:  https://t.co/o1u7nYxY0d #NuecesKnows  https://t.co/NVzGAdTxsq",11/24/2021,17:47:48,https://twitter.com/ccpublichealth/status/1463640522392838147,2021,11,24
48357,Ochiltree County,TX,Texas,NA,0,NA,NA,NA,NA,NA,NA,NA,NA,NA,NA,NA,NA,NA,NA,NA
48359,Oldham County,TX,Texas,NA,0,NA,NA,NA,NA,NA,NA,NA,NA,NA,NA,NA,NA,NA,NA,NA
48361,Orange County,TX,Texas,NA,0,NA,NA,NA,NA,NA,NA,NA,NA,NA,NA,NA,NA,NA,NA,NA
48363,Palo Pinto County,TX,Texas,NA,0,NA,NA,NA,NA,NA,NA,NA,NA,NA,NA,NA,NA,NA,NA,NA
48365,Panola County,TX,Texas,NA,0,NA,NA,NA,NA,NA,NA,NA,NA,NA,NA,NA,NA,NA,NA,NA
48367,Parker County,TX,Texas,NA,0,NA,NA,NA,NA,NA,NA,NA,NA,NA,NA,NA,NA,NA,NA,NA
48369,Parmer County,TX,Texas,NA,0,NA,NA,NA,NA,NA,NA,NA,NA,NA,NA,NA,NA,NA,NA,NA
48371,Pecos County,TX,Texas,NA,0,NA,NA,NA,NA,NA,NA,NA,NA,NA,NA,NA,NA,NA,NA,NA
48373,Polk County,TX,Texas,NA,0,NA,NA,NA,NA,NA,NA,NA,NA,NA,NA,NA,NA,NA,NA,NA
48375,Potter County,TX,Texas,NA,0,NA,NA,NA,NA,NA,NA,NA,NA,NA,NA,NA,NA,NA,NA,NA
48377,Presidio County,TX,Texas,NA,0,NA,NA,NA,NA,NA,NA,NA,NA,NA,NA,NA,NA,NA,NA,NA
48379,Rains County,TX,Texas,NA,0,NA,NA,NA,NA,NA,NA,NA,NA,NA,NA,NA,NA,NA,NA,NA
48381,Randall County,TX,Texas,NA,0,NA,NA,NA,NA,NA,NA,NA,NA,NA,NA,NA,NA,NA,NA,NA
48383,Reagan County,TX,Texas,NA,0,NA,NA,NA,NA,NA,NA,NA,NA,NA,NA,NA,NA,NA,NA,NA
48385,Real County,TX,Texas,NA,0,NA,NA,NA,NA,NA,NA,NA,NA,NA,NA,NA,NA,NA,NA,NA
48387,Red River County,TX,Texas,NA,0,NA,NA,NA,NA,NA,NA,NA,NA,NA,NA,NA,NA,NA,NA,NA
48389,Reeves County,TX,Texas,NA,0,NA,NA,NA,NA,NA,NA,NA,NA,NA,NA,NA,NA,NA,NA,NA
48391,Refugio County,TX,Texas,NA,0,NA,NA,NA,NA,NA,NA,NA,NA,NA,NA,NA,NA,NA,NA,NA
48393,Roberts County,TX,Texas,NA,0,NA,NA,NA,NA,NA,NA,NA,NA,NA,NA,NA,NA,NA,NA,NA
48395,Robertson County,TX,Texas,NA,0,NA,NA,NA,NA,NA,NA,NA,NA,NA,NA,NA,NA,NA,NA,NA
48397,Rockwall County,TX,Texas,NA,0,NA,NA,NA,NA,NA,NA,NA,NA,NA,NA,NA,NA,NA,NA,NA
48399,Runnels County,TX,Texas,NA,0,NA,NA,NA,NA,NA,NA,NA,NA,NA,NA,NA,NA,NA,NA,NA
48401,Rusk County,TX,Texas,NA,0,NA,NA,NA,NA,NA,NA,NA,NA,NA,NA,NA,NA,NA,NA,NA
48403,Sabine County,TX,Texas,NA,0,NA,NA,NA,NA,NA,NA,NA,NA,NA,NA,NA,NA,NA,NA,NA
48405,San Augustine County,TX,Texas,NA,0,NA,NA,NA,NA,NA,NA,NA,NA,NA,NA,NA,NA,NA,NA,NA
48407,San Jacinto County,TX,Texas,NA,0,NA,NA,NA,NA,NA,NA,NA,NA,NA,NA,NA,NA,NA,NA,NA
48409,San Patricio County,TX,Texas,NA,0,NA,NA,NA,NA,NA,NA,NA,NA,NA,NA,NA,NA,NA,NA,NA
48411,San Saba County,TX,Texas,NA,0,NA,NA,NA,NA,NA,NA,NA,NA,NA,NA,NA,NA,NA,NA,NA
48413,Schleicher County,TX,Texas,NA,0,NA,NA,NA,NA,NA,NA,NA,NA,NA,NA,NA,NA,NA,NA,NA
48415,Scurry County,TX,Texas,NA,0,NA,NA,NA,NA,NA,NA,NA,NA,NA,NA,NA,NA,NA,NA,NA
48417,Shackelford County,TX,Texas,NA,0,NA,NA,NA,NA,NA,NA,NA,NA,NA,NA,NA,NA,NA,NA,NA
48419,Shelby County,TX,Texas,NA,0,NA,NA,NA,NA,NA,NA,NA,NA,NA,NA,NA,NA,NA,NA,NA
48421,Sherman County,TX,Texas,NA,0,NA,NA,NA,NA,NA,NA,NA,NA,NA,NA,NA,NA,NA,NA,NA
48423,Smith County,TX,Texas,NA,0,NA,NA,NA,NA,NA,NA,NA,NA,NA,NA,NA,NA,NA,NA,NA
48425,Somervell County,TX,Texas,NA,0,NA,NA,NA,NA,NA,NA,NA,NA,NA,NA,NA,NA,NA,NA,NA
48427,Starr County,TX,Texas,NA,0,NA,NA,NA,NA,NA,NA,NA,NA,NA,NA,NA,NA,NA,NA,NA
48429,Stephens County,TX,Texas,NA,0,NA,NA,NA,NA,NA,NA,NA,NA,NA,NA,NA,NA,NA,NA,NA
48431,Sterling County,TX,Texas,NA,0,NA,NA,NA,NA,NA,NA,NA,NA,NA,NA,NA,NA,NA,NA,NA
48433,Stonewall County,TX,Texas,NA,0,NA,NA,NA,NA,NA,NA,NA,NA,NA,NA,NA,NA,NA,NA,NA
48435,Sutton County,TX,Texas,NA,0,NA,NA,NA,NA,NA,NA,NA,NA,NA,NA,NA,NA,NA,NA,NA
48437,Swisher County,TX,Texas,NA,0,NA,NA,NA,NA,NA,NA,NA,NA,NA,NA,NA,NA,NA,NA,NA
48439,Tarrant County,TX,Texas,tcphtweets,1,NA,Yes,Yes,NA,NA,NA,NA,3060489966,"Can a flu shot give you flu? No, the flu vaccines given with a flu shot are made with either inactivated (killed) viruses, or with only a single protein from the flu virus. The nasal spray vaccine contains live viruses that are weakened so that they will not cause illness.",11/20/2021,18:30:00,https://twitter.com/TCPHtweets/status/1462201591533088771,2021,11,20
48441,Taylor County,TX,Texas,abilenehealth,1,NA,Yes,Yes,NA,NA,NA,NA,2239805246,For more tips like these visit  https://t.co/oQ9TMt3aOB  #HealthyHabits #TipTuesday #GoodFoodGoodMoves  https://t.co/OEtraZJp64,11/22/2021,9:30:10,https://twitter.com/AbileneHealth/status/1462790514210713603,2021,11,22
48443,Terrell County,TX,Texas,NA,0,NA,NA,NA,NA,NA,NA,NA,NA,NA,NA,NA,NA,NA,NA,NA
48445,Terry County,TX,Texas,NA,0,NA,NA,NA,NA,NA,NA,NA,NA,NA,NA,NA,NA,NA,NA,NA
48447,Throckmorton County,TX,Texas,NA,0,NA,NA,NA,NA,NA,NA,NA,NA,NA,NA,NA,NA,NA,NA,NA
48449,Titus County,TX,Texas,NA,0,NA,NA,NA,NA,NA,NA,NA,NA,NA,NA,NA,NA,NA,NA,NA
48451,Tom Green County,TX,Texas,NA,0,NA,NA,NA,NA,NA,NA,NA,NA,NA,NA,NA,NA,NA,NA,NA
48453,Travis County,TX,Texas,traviscountyhhs,1,NA,Yes,Yes,NA,NA,NA,NA,3145676539,"All Travis County HHS offices and Community Centers will be closed Thursday, November 25th and Friday, November 26th. Happy Thanksgiving!! 🍁🦃 #givethanks #HappyThanksgiving2021  https://t.co/eehlQt181m",11/24/2021,10:49:37,https://twitter.com/TravisCountyHHS/status/1463535283975172098,2021,11,24
48455,Trinity County,TX,Texas,NA,0,NA,NA,NA,NA,NA,NA,NA,NA,NA,NA,NA,NA,NA,NA,NA
48457,Tyler County,TX,Texas,NA,0,NA,NA,NA,NA,NA,NA,NA,NA,NA,NA,NA,NA,NA,NA,NA
48459,Upshur County,TX,Texas,NA,0,NA,NA,NA,NA,NA,NA,NA,NA,NA,NA,NA,NA,NA,NA,NA
48461,Upton County,TX,Texas,NA,0,NA,NA,NA,NA,NA,NA,NA,NA,NA,NA,NA,NA,NA,NA,NA
48463,Uvalde County,TX,Texas,NA,0,NA,NA,NA,NA,NA,NA,NA,NA,NA,NA,NA,NA,NA,NA,NA
48465,Val Verde County,TX,Texas,NA,0,NA,NA,NA,NA,NA,NA,NA,NA,NA,NA,NA,NA,NA,NA,NA
48467,Van Zandt County,TX,Texas,NA,0,NA,NA,NA,NA,NA,NA,NA,NA,NA,NA,NA,NA,NA,NA,NA
48469,Victoria County,TX,Texas,publiccounty,1,NA,No,No,NA,NA,NA,NA,1.02E+18,Open Forum for Quality Improvement (QI) and Innovation  https://t.co/pzHbxK59fG #publichealth via @NNPHI_ORG,10/23/2018,14:58:31,https://twitter.com/PublicCounty/status/1054809309970722818,2018,10,23
48471,Walker County,TX,Texas,NA,0,NA,NA,NA,NA,NA,NA,NA,NA,NA,NA,NA,NA,NA,NA,NA
48473,Waller County,TX,Texas,NA,0,NA,NA,NA,NA,NA,NA,NA,NA,NA,NA,NA,NA,NA,NA,NA
48475,Ward County,TX,Texas,NA,0,NA,NA,NA,NA,NA,NA,NA,NA,NA,NA,NA,NA,NA,NA,NA
48477,Washington County,TX,Texas,NA,0,NA,NA,NA,NA,NA,NA,NA,NA,NA,NA,NA,NA,NA,NA,NA
48479,Webb County,TX,Texas,NA,0,NA,NA,NA,NA,NA,NA,NA,NA,NA,NA,NA,NA,NA,NA,NA
48481,Wharton County,TX,Texas,NA,0,NA,NA,NA,NA,NA,NA,NA,NA,NA,NA,NA,NA,NA,NA,NA
48483,Wheeler County,TX,Texas,NA,0,NA,NA,NA,NA,NA,NA,NA,NA,NA,NA,NA,NA,NA,NA,NA
48485,Wichita County,TX,Texas,wfwcphd,1,DoubleCheck,No,No,NA,NA,NA,NA,NA,NA,NA,NA,NA,NA,NA,NA
48487,Wilbarger County,TX,Texas,NA,0,NA,NA,NA,NA,NA,NA,NA,NA,NA,NA,NA,NA,NA,NA,NA
48489,Willacy County,TX,Texas,NA,0,NA,NA,NA,NA,NA,NA,NA,NA,NA,NA,NA,NA,NA,NA,NA
48491,Williamson County,TX,Texas,wcchd,1,NA,Yes,Yes,NA,NA,NA,NA,329751703,WCCHD has released the 11/24/21 COVID-19 Update -  https://t.co/DgBCnrabuz  https://t.co/xL5DaTmVjC,11/24/2021,18:04:27,https://twitter.com/WCCHD/status/1463644711567114251,2021,11,24
48493,Wilson County,TX,Texas,NA,0,NA,NA,NA,NA,NA,NA,NA,NA,NA,NA,NA,NA,NA,NA,NA
48495,Winkler County,TX,Texas,NA,0,NA,NA,NA,NA,NA,NA,NA,NA,NA,NA,NA,NA,NA,NA,NA
48497,Wise County,TX,Texas,NA,0,NA,NA,NA,NA,NA,NA,NA,NA,NA,NA,NA,NA,NA,NA,NA
48499,Wood County,TX,Texas,NA,0,NA,NA,NA,NA,NA,NA,NA,NA,NA,NA,NA,NA,NA,NA,NA
48501,Yoakum County,TX,Texas,NA,0,NA,NA,NA,NA,NA,NA,NA,NA,NA,NA,NA,NA,NA,NA,NA
48503,Young County,TX,Texas,NA,0,NA,NA,NA,NA,NA,NA,NA,NA,NA,NA,NA,NA,NA,NA,NA
48505,Zapata County,TX,Texas,NA,0,NA,NA,NA,NA,NA,NA,NA,NA,NA,NA,NA,NA,NA,NA,NA
48507,Zavala County,TX,Texas,NA,0,NA,NA,NA,NA,NA,NA,NA,NA,NA,NA,NA,NA,NA,NA,NA
49001,Beaver County,UT,Utah,NA,0,NA,NA,NA,NA,NA,NA,NA,NA,NA,NA,NA,NA,NA,NA,NA
49003,Box Elder County,UT,Utah,NA,0,NA,NA,NA,NA,NA,NA,NA,NA,NA,NA,NA,NA,NA,NA,NA
49005,Cache County,UT,Utah,NA,0,NA,NA,NA,NA,NA,NA,NA,NA,NA,NA,NA,NA,NA,NA,NA
49007,Carbon County,UT,Utah,NA,0,NA,NA,NA,NA,NA,NA,NA,NA,NA,NA,NA,NA,NA,NA,NA
49009,Daggett County,UT,Utah,trico_health,1,NA,Yes,Yes,NA,NA,NA,Tri-County Health Department - Utah,2492160103,"TriCounty Health Department will be closed November 25 and 26, 2021, in observance of Thanksgiving.  TCHD will open again at 7:30 a.m. on Monday November 29, 2021.  https://t.co/tiViBPWyX8",11/24/2021,8:44:01,https://twitter.com/TriCo_Health/status/1463503674156924928,2021,11,24
49011,Davis County,UT,Utah,daviscountyhlth,1,NA,Yes,Yes,NA,NA,NA,NA,253631366,The Davis County Health Department wishes you all a safe and healthy Thanksgiving holiday!  https://t.co/SamStd4mzf,11/24/2021,16:44:12,https://twitter.com/DavisCountyHlth/status/1463624516513386500,2021,11,24
49013,Duchesne County,UT,Utah,trico_health,1,NA,Yes,Yes,NA,NA,NA,Tri-County Health Department - Utah,2492160103,"TriCounty Health Department will be closed November 25 and 26, 2021, in observance of Thanksgiving.  TCHD will open again at 7:30 a.m. on Monday November 29, 2021.  https://t.co/tiViBPWyX8",11/24/2021,8:44:01,https://twitter.com/TriCo_Health/status/1463503674156924928,2021,11,24
49015,Emery County,UT,Utah,NA,0,NA,NA,NA,NA,NA,NA,NA,NA,NA,NA,NA,NA,NA,NA,NA
49017,Garfield County,UT,Utah,NA,0,NA,NA,NA,NA,NA,NA,NA,NA,NA,NA,NA,NA,NA,NA,NA
49019,Grand County,UT,Utah,NA,0,NA,NA,NA,NA,NA,NA,NA,NA,NA,NA,NA,NA,NA,NA,NA
49021,Iron County,UT,Utah,NA,0,NA,NA,NA,NA,NA,NA,NA,NA,NA,NA,NA,NA,NA,NA,NA
49023,Juab County,UT,Utah,NA,0,NA,NA,NA,NA,NA,NA,NA,NA,NA,NA,NA,NA,NA,NA,NA
49025,Kane County,UT,Utah,NA,0,NA,NA,NA,NA,NA,NA,NA,NA,NA,NA,NA,NA,NA,NA,NA
49027,Millard County,UT,Utah,NA,0,NA,NA,NA,NA,NA,NA,NA,NA,NA,NA,NA,NA,NA,NA,NA
49029,Morgan County,UT,Utah,NA,0,NA,NA,NA,NA,NA,NA,NA,NA,NA,NA,NA,NA,NA,NA,NA
49031,Piute County,UT,Utah,NA,0,NA,NA,NA,NA,NA,NA,NA,NA,NA,NA,NA,NA,NA,NA,NA
49033,Rich County,UT,Utah,NA,0,NA,NA,NA,NA,NA,NA,NA,NA,NA,NA,NA,NA,NA,NA,NA
49035,Salt Lake County,UT,Utah,saltlakehealth,1,NA,Yes,Yes,NA,NA,NA,NA,16633440,"In addition to the resource below, you can visit  https://t.co/EoRVwJORoK to find food sites near you with holiday food services.",11/23/2021,13:02:54,https://twitter.com/SaltLakeHealth/status/1463206436675092480,2021,11,23
49037,San Juan County,UT,Utah,NA,0,NA,NA,NA,NA,NA,NA,NA,NA,NA,NA,NA,NA,NA,NA,NA
49039,Sanpete County,UT,Utah,NA,0,NA,NA,NA,NA,NA,NA,NA,NA,NA,NA,NA,NA,NA,NA,NA
49041,Sevier County,UT,Utah,NA,0,NA,NA,NA,NA,NA,NA,NA,NA,NA,NA,NA,NA,NA,NA,NA
49043,Summit County,UT,Utah,summitcountyhd,1,NA,Yes,Yes,NA,NA,NA,NA,7.83E+17,"We encourage individuals who are interested in receiving a booster shot to check with their local pharmacies. For a list of complete locations, please visit:  https://t.co/M0pxdZ1vdt.",11/18/2021,15:33:13,https://twitter.com/SummitCountyHD/status/1461432325695098880,2021,11,18
49045,Tooele County,UT,Utah,NA,0,NA,NA,NA,NA,NA,NA,NA,NA,NA,NA,NA,NA,NA,NA,NA
49047,Uintah County,UT,Utah,trico_health,1,NA,Yes,Yes,NA,NA,NA,Tri-County Health Department - Utah,2492160103,"TriCounty Health Department will be closed November 25 and 26, 2021, in observance of Thanksgiving.  TCHD will open again at 7:30 a.m. on Monday November 29, 2021.  https://t.co/tiViBPWyX8",11/24/2021,8:44:01,https://twitter.com/TriCo_Health/status/1463503674156924928,2021,11,24
49049,Utah County,UT,Utah,uchd,1,NA,Yes,Yes,NA,NA,NA,NA,21318795,"Utah County COVID-19 Help Line 801-851-HELP (4357) M-F, 8:30-4.  https://t.co/AA2tkW67vc",11/24/2021,15:00:13,https://twitter.com/UCHD/status/1463598351274885122,2021,11,24
49051,Wasatch County,UT,Utah,wasatchcountyhd,1,NA,Yes,No,NA,NA,NA,NA,472223089,The Wasatch County Health Department has issued a Warning Advisory for harmful algae at Strawberry Reservoir. Test results on a sample from the reservoir came back above warning level thresholds. Strawberry Reservoir remains open for recreation.  https://t.co/tywcP7ay2g,9/22/2020,17:25:28,https://twitter.com/WasatchCountyHD/status/1308517796612104192,2020,9,22
49053,Washington County,UT,Utah,NA,0,NA,NA,NA,NA,NA,NA,NA,NA,NA,NA,NA,NA,NA,NA,NA
49055,Wayne County,UT,Utah,NA,0,NA,NA,NA,NA,NA,NA,NA,NA,NA,NA,NA,NA,NA,NA,NA
49057,Weber County,UT,Utah,NA,0,NA,NA,NA,NA,NA,NA,NA,NA,NA,NA,NA,NA,NA,NA,NA
50001,Addison County,VT,Vermont,NA,0,NA,NA,NA,0,NA,NA,NA,NA,NA,NA,NA,NA,NA,NA,NA
50003,Bennington County,VT,Vermont,NA,0,NA,NA,NA,1,NA,NA,NA,NA,NA,NA,NA,NA,NA,NA,NA
50005,Caledonia County,VT,Vermont,NA,0,NA,NA,NA,0,NA,NA,NA,NA,NA,NA,NA,NA,NA,NA,NA
50007,Chittenden County,VT,Vermont,NA,0,NA,NA,NA,1,NA,NA,NA,NA,NA,NA,NA,NA,NA,NA,NA
50009,Essex County,VT,Vermont,NA,0,NA,NA,NA,0,NA,NA,NA,NA,NA,NA,NA,NA,NA,NA,NA
50011,Franklin County,VT,Vermont,NA,0,NA,NA,NA,1,NA,NA,NA,NA,NA,NA,NA,NA,NA,NA,NA
50013,Grand Isle County,VT,Vermont,NA,0,NA,NA,NA,1,NA,NA,NA,NA,NA,NA,NA,NA,NA,NA,NA
50015,Lamoille County,VT,Vermont,NA,0,NA,NA,NA,0,NA,NA,NA,NA,NA,NA,NA,NA,NA,NA,NA
50017,Orange County,VT,Vermont,NA,0,NA,NA,NA,0,NA,NA,NA,NA,NA,NA,NA,NA,NA,NA,NA
50019,Orleans County,VT,Vermont,NA,0,NA,NA,NA,0,NA,NA,NA,NA,NA,NA,NA,NA,NA,NA,NA
50021,Rutland County,VT,Vermont,NA,0,NA,NA,NA,0,NA,NA,NA,NA,NA,NA,NA,NA,NA,NA,NA
50023,Washington County,VT,Vermont,NA,0,NA,NA,NA,0,NA,NA,NA,NA,NA,NA,NA,NA,NA,NA,NA
50025,Windham County,VT,Vermont,NA,0,NA,NA,NA,0,NA,NA,NA,NA,NA,NA,NA,NA,NA,NA,NA
50027,Windsor County,VT,Vermont,NA,0,NA,NA,NA,0,NA,NA,NA,NA,NA,NA,NA,NA,NA,NA,NA
51001,Accomack County,VA,Virginia,NA,0,NA,NA,NA,NA,NA,NA,NA,NA,NA,NA,NA,NA,NA,NA,NA
51003,Albemarle County,VA,Virginia,NA,0,NA,NA,NA,NA,NA,NA,NA,NA,NA,NA,NA,NA,NA,NA,NA
51005,Alleghany County,VA,Virginia,NA,0,NA,NA,NA,NA,NA,NA,NA,NA,NA,NA,NA,NA,NA,NA,NA
51007,Amelia County,VA,Virginia,NA,0,NA,NA,NA,NA,NA,NA,NA,NA,NA,NA,NA,NA,NA,NA,NA
51009,Amherst County,VA,Virginia,NA,0,NA,NA,NA,NA,NA,NA,NA,NA,NA,NA,NA,NA,NA,NA,NA
51011,Appomattox County,VA,Virginia,NA,0,NA,NA,NA,NA,NA,NA,NA,NA,NA,NA,NA,NA,NA,NA,NA
51013,Arlington County,VA,Virginia,arlingtondhs,1,DoubleCheck,No,No,NA,NA,NA,NA,NA,NA,NA,NA,NA,NA,NA,NA
51015,Augusta County,VA,Virginia,augustahealthva,1,NA,Yes,Yes,NA,NA,NA,NA,946029018,"Thank you to Amy Ghaemmaghami, Outpatient Behavioral Health Coordinator, for talking with @WHSV_StephanieP about mental health awareness during the holidays.  https://t.co/9iKfuF10Ws",11/24/2021,9:01:15,https://twitter.com/AugustaHealthVA/status/1463508010593095680,2021,11,24
51017,Bath County,VA,Virginia,NA,0,NA,NA,NA,NA,NA,NA,NA,NA,NA,NA,NA,NA,NA,NA,NA
51019,Bedford County,VA,Virginia,NA,0,NA,NA,NA,NA,NA,NA,NA,NA,NA,NA,NA,NA,NA,NA,NA
51021,Bland County,VA,Virginia,NA,0,NA,NA,NA,NA,NA,NA,NA,NA,NA,NA,NA,NA,NA,NA,NA
51023,Botetourt County,VA,Virginia,NA,0,NA,NA,NA,NA,NA,NA,NA,NA,NA,NA,NA,NA,NA,NA,NA
51025,Brunswick County,VA,Virginia,NA,0,NA,NA,NA,NA,NA,NA,NA,NA,NA,NA,NA,NA,NA,NA,NA
51027,Buchanan County,VA,Virginia,NA,0,NA,NA,NA,NA,NA,NA,NA,NA,NA,NA,NA,NA,NA,NA,NA
51029,Buckingham County,VA,Virginia,NA,0,NA,NA,NA,NA,NA,NA,NA,NA,NA,NA,NA,NA,NA,NA,NA
51031,Campbell County,VA,Virginia,NA,0,NA,NA,NA,NA,NA,NA,NA,NA,NA,NA,NA,NA,NA,NA,NA
51033,Caroline County,VA,Virginia,NA,0,NA,NA,NA,NA,NA,NA,NA,NA,NA,NA,NA,NA,NA,NA,NA
51035,Carroll County,VA,Virginia,NA,0,NA,NA,NA,NA,NA,NA,NA,NA,NA,NA,NA,NA,NA,NA,NA
51036,Charles City County,VA,Virginia,NA,0,NA,NA,NA,NA,NA,NA,NA,NA,NA,NA,NA,NA,NA,NA,NA
51037,Charlotte County,VA,Virginia,NA,0,NA,NA,NA,NA,NA,NA,NA,NA,NA,NA,NA,NA,NA,NA,NA
51041,Chesterfield County,VA,Virginia,NA,0,NA,NA,NA,NA,NA,NA,NA,NA,NA,NA,NA,NA,NA,NA,NA
51043,Clarke County,VA,Virginia,NA,0,NA,NA,NA,NA,NA,NA,NA,NA,NA,NA,NA,NA,NA,NA,NA
51045,Craig County,VA,Virginia,NA,0,NA,NA,NA,NA,NA,NA,NA,NA,NA,NA,NA,NA,NA,NA,NA
51047,Culpeper County,VA,Virginia,NA,0,NA,NA,NA,NA,NA,NA,NA,NA,NA,NA,NA,NA,NA,NA,NA
51049,Cumberland County,VA,Virginia,NA,0,NA,NA,NA,NA,NA,NA,NA,NA,NA,NA,NA,NA,NA,NA,NA
51051,Dickenson County,VA,Virginia,NA,0,NA,NA,NA,NA,NA,NA,NA,NA,NA,NA,NA,NA,NA,NA,NA
51053,Dinwiddie County,VA,Virginia,NA,0,NA,NA,NA,NA,NA,NA,NA,NA,NA,NA,NA,NA,NA,NA,NA
51057,Essex County,VA,Virginia,NA,0,NA,NA,NA,NA,NA,NA,NA,NA,NA,NA,NA,NA,NA,NA,NA
51059,Fairfax County,VA,Virginia,fairfaxhealth,1,NA,Yes,Yes,NA,NA,NA,NA,117134352,Some reminders about staying safe from COVID-19 as you prepare to celebrate Thanksgiving:  https://t.co/OwUdAp9XgD  https://t.co/ufOiruUaFz,11/24/2021,18:10:02,https://twitter.com/fairfaxhealth/status/1463646120429633536,2021,11,24
51061,Fauquier County,VA,Virginia,NA,0,NA,NA,NA,NA,NA,NA,NA,NA,NA,NA,NA,NA,NA,NA,NA
51063,Floyd County,VA,Virginia,NA,0,NA,NA,NA,NA,NA,NA,NA,NA,NA,NA,NA,NA,NA,NA,NA
51065,Fluvanna County,VA,Virginia,NA,0,NA,NA,NA,NA,NA,NA,NA,NA,NA,NA,NA,NA,NA,NA,NA
51067,Franklin County,VA,Virginia,NA,0,NA,NA,NA,NA,NA,NA,NA,NA,NA,NA,NA,NA,NA,NA,NA
51069,Frederick County,VA,Virginia,NA,0,NA,NA,NA,NA,NA,NA,NA,NA,NA,NA,NA,NA,NA,NA,NA
51071,Giles County,VA,Virginia,NA,0,NA,NA,NA,NA,NA,NA,NA,NA,NA,NA,NA,NA,NA,NA,NA
51073,Gloucester County,VA,Virginia,NA,0,NA,NA,NA,NA,NA,NA,NA,NA,NA,NA,NA,NA,NA,NA,NA
51075,Goochland County,VA,Virginia,NA,0,NA,NA,NA,NA,NA,NA,NA,NA,NA,NA,NA,NA,NA,NA,NA
51077,Grayson County,VA,Virginia,NA,0,NA,NA,NA,NA,NA,NA,NA,NA,NA,NA,NA,NA,NA,NA,NA
51079,Greene County,VA,Virginia,NA,0,NA,NA,NA,NA,NA,NA,NA,NA,NA,NA,NA,NA,NA,NA,NA
51081,Greensville County,VA,Virginia,NA,0,NA,NA,NA,NA,NA,NA,NA,NA,NA,NA,NA,NA,NA,NA,NA
51083,Halifax County,VA,Virginia,NA,0,NA,NA,NA,NA,NA,NA,NA,NA,NA,NA,NA,NA,NA,NA,NA
51085,Hanover County,VA,Virginia,NA,0,NA,NA,NA,NA,NA,NA,NA,NA,NA,NA,NA,NA,NA,NA,NA
51087,Henrico County,VA,Virginia,NA,0,NA,NA,NA,NA,NA,NA,NA,NA,NA,NA,NA,NA,NA,NA,NA
51089,Henry County,VA,Virginia,NA,0,NA,NA,NA,NA,NA,NA,NA,NA,NA,NA,NA,NA,NA,NA,NA
51091,Highland County,VA,Virginia,NA,0,NA,NA,NA,NA,NA,NA,NA,NA,NA,NA,NA,NA,NA,NA,NA
51093,Isle of Wight County,VA,Virginia,NA,0,NA,NA,NA,NA,NA,NA,NA,NA,NA,NA,NA,NA,NA,NA,NA
51095,James City County,VA,Virginia,NA,0,NA,NA,NA,NA,NA,NA,NA,NA,NA,NA,NA,NA,NA,NA,NA
51097,King and Queen County,VA,Virginia,NA,0,NA,NA,NA,NA,NA,NA,NA,NA,NA,NA,NA,NA,NA,NA,NA
51099,King George County,VA,Virginia,NA,0,NA,NA,NA,NA,NA,NA,NA,NA,NA,NA,NA,NA,NA,NA,NA
51101,King William County,VA,Virginia,NA,0,NA,NA,NA,NA,NA,NA,NA,NA,NA,NA,NA,NA,NA,NA,NA
51103,Lancaster County,VA,Virginia,NA,0,NA,NA,NA,NA,NA,NA,NA,NA,NA,NA,NA,NA,NA,NA,NA
51105,Lee County,VA,Virginia,NA,0,NA,NA,NA,NA,NA,NA,NA,NA,NA,NA,NA,NA,NA,NA,NA
51107,Loudoun County,VA,Virginia,loudouncohealth,1,NA,Yes,Yes,NA,NA,NA,NA,242339104,Both the Loudoun County COVID info hotline and the vaccination clinic will be closed starting at 1pm on Wednesday November 24th for Thanksgiving weekend. Happy Thanksgiving!  https://t.co/9z6Y6V3Q1d,11/23/2021,17:38:00,https://twitter.com/LoudounCoHealth/status/1463275667928272900,2021,11,23
51109,Louisa County,VA,Virginia,NA,0,NA,NA,NA,NA,NA,NA,NA,NA,NA,NA,NA,NA,NA,NA,NA
51111,Lunenburg County,VA,Virginia,NA,0,NA,NA,NA,NA,NA,NA,NA,NA,NA,NA,NA,NA,NA,NA,NA
51113,Madison County,VA,Virginia,NA,0,NA,NA,NA,NA,NA,NA,NA,NA,NA,NA,NA,NA,NA,NA,NA
51115,Mathews County,VA,Virginia,NA,0,NA,NA,NA,NA,NA,NA,NA,NA,NA,NA,NA,NA,NA,NA,NA
51117,Mecklenburg County,VA,Virginia,NA,0,NA,NA,NA,NA,NA,NA,NA,NA,NA,NA,NA,NA,NA,NA,NA
51119,Middlesex County,VA,Virginia,NA,0,NA,NA,NA,NA,NA,NA,NA,NA,NA,NA,NA,NA,NA,NA,NA
51121,Montgomery County,VA,Virginia,NA,0,NA,NA,NA,NA,NA,NA,NA,NA,NA,NA,NA,NA,NA,NA,NA
51125,Nelson County,VA,Virginia,NA,0,NA,NA,NA,NA,NA,NA,NA,NA,NA,NA,NA,NA,NA,NA,NA
51127,New Kent County,VA,Virginia,NA,0,NA,NA,NA,NA,NA,NA,NA,NA,NA,NA,NA,NA,NA,NA,NA
51131,Northampton County,VA,Virginia,NA,0,NA,NA,NA,NA,NA,NA,NA,NA,NA,NA,NA,NA,NA,NA,NA
51133,Northumberland County,VA,Virginia,NA,0,NA,NA,NA,NA,NA,NA,NA,NA,NA,NA,NA,NA,NA,NA,NA
51135,Nottoway County,VA,Virginia,NA,0,NA,NA,NA,NA,NA,NA,NA,NA,NA,NA,NA,NA,NA,NA,NA
51137,Orange County,VA,Virginia,NA,0,NA,NA,NA,NA,NA,NA,NA,NA,NA,NA,NA,NA,NA,NA,NA
51139,Page County,VA,Virginia,NA,0,NA,NA,NA,NA,NA,NA,NA,NA,NA,NA,NA,NA,NA,NA,NA
51141,Patrick County,VA,Virginia,NA,0,NA,NA,NA,NA,NA,NA,NA,NA,NA,NA,NA,NA,NA,NA,NA
51143,Pittsylvania County,VA,Virginia,NA,0,NA,NA,NA,NA,NA,NA,NA,NA,NA,NA,NA,NA,NA,NA,NA
51145,Powhatan County,VA,Virginia,NA,0,NA,NA,NA,NA,NA,NA,NA,NA,NA,NA,NA,NA,NA,NA,NA
51147,Prince Edward County,VA,Virginia,NA,0,NA,NA,NA,NA,NA,NA,NA,NA,NA,NA,NA,NA,NA,NA,NA
51149,Prince George County,VA,Virginia,NA,0,NA,NA,NA,NA,NA,NA,NA,NA,NA,NA,NA,NA,NA,NA,NA
51153,Prince William County,VA,Virginia,NA,0,NA,NA,NA,NA,NA,NA,NA,NA,NA,NA,NA,NA,NA,NA,NA
51155,Pulaski County,VA,Virginia,NA,0,NA,NA,NA,NA,NA,NA,NA,NA,NA,NA,NA,NA,NA,NA,NA
51157,Rappahannock County,VA,Virginia,NA,0,NA,NA,NA,NA,NA,NA,NA,NA,NA,NA,NA,NA,NA,NA,NA
51159,Richmond County,VA,Virginia,NA,0,NA,NA,NA,NA,NA,NA,NA,NA,NA,NA,NA,NA,NA,NA,NA
51161,Roanoke County,VA,Virginia,NA,0,NA,NA,NA,NA,NA,NA,NA,NA,NA,NA,NA,NA,NA,NA,NA
51163,Rockbridge County,VA,Virginia,NA,0,NA,NA,NA,NA,NA,NA,NA,NA,NA,NA,NA,NA,NA,NA,NA
51165,Rockingham County,VA,Virginia,NA,0,NA,NA,NA,NA,NA,NA,NA,NA,NA,NA,NA,NA,NA,NA,NA
51167,Russell County,VA,Virginia,NA,0,NA,NA,NA,NA,NA,NA,NA,NA,NA,NA,NA,NA,NA,NA,NA
51169,Scott County,VA,Virginia,NA,0,NA,NA,NA,NA,NA,NA,NA,NA,NA,NA,NA,NA,NA,NA,NA
51171,Shenandoah County,VA,Virginia,NA,0,NA,NA,NA,NA,NA,NA,NA,NA,NA,NA,NA,NA,NA,NA,NA
51173,Smyth County,VA,Virginia,NA,0,NA,NA,NA,NA,NA,NA,NA,NA,NA,NA,NA,NA,NA,NA,NA
51175,Southampton County,VA,Virginia,NA,0,NA,NA,NA,NA,NA,NA,NA,NA,NA,NA,NA,NA,NA,NA,NA
51177,Spotsylvania County,VA,Virginia,NA,0,NA,NA,NA,NA,NA,NA,NA,NA,NA,NA,NA,NA,NA,NA,NA
51179,Stafford County,VA,Virginia,NA,0,NA,NA,NA,NA,NA,NA,NA,NA,NA,NA,NA,NA,NA,NA,NA
51181,Surry County,VA,Virginia,NA,0,NA,NA,NA,NA,NA,NA,NA,NA,NA,NA,NA,NA,NA,NA,NA
51183,Sussex County,VA,Virginia,NA,0,NA,NA,NA,NA,NA,NA,NA,NA,NA,NA,NA,NA,NA,NA,NA
51185,Tazewell County,VA,Virginia,NA,0,NA,NA,NA,NA,NA,NA,NA,NA,NA,NA,NA,NA,NA,NA,NA
51187,Warren County,VA,Virginia,NA,0,NA,NA,NA,NA,NA,NA,NA,NA,NA,NA,NA,NA,NA,NA,NA
51191,Washington County,VA,Virginia,NA,0,NA,NA,NA,NA,NA,NA,NA,NA,NA,NA,NA,NA,NA,NA,NA
51193,Westmoreland County,VA,Virginia,NA,0,NA,NA,NA,NA,NA,NA,NA,NA,NA,NA,NA,NA,NA,NA,NA
51195,Wise County,VA,Virginia,NA,0,NA,NA,NA,NA,NA,NA,NA,NA,NA,NA,NA,NA,NA,NA,NA
51197,Wythe County,VA,Virginia,NA,0,NA,NA,NA,NA,NA,NA,NA,NA,NA,NA,NA,NA,NA,NA,NA
51199,York County,VA,Virginia,NA,0,NA,NA,NA,NA,NA,NA,NA,NA,NA,NA,NA,NA,NA,NA,NA
51510,Alexandria city,VA,Virginia,alexandriavagov,1,NA,Yes,Yes,NA,NA,CountyGeneral,NA,29287545,"@GiggsyTheCorgi It's hard to tell from your photo what area of FB this is or how you arrived at it, but it looks to be out of our control. It's not a view of the main APD Facebook page that we're seeing when not logged in either. Are you able to share a more complete screenshot or URL?",11/24/2021,15:30:29,https://twitter.com/AlexandriaVAGov/status/1463605966793056260,2021,11,24
51515,Bedford city,VA,Virginia,NA,0,NA,NA,NA,NA,NA,NA,NA,NA,NA,NA,NA,NA,NA,NA,NA
51520,Bristol city,VA,Virginia,NA,0,NA,NA,NA,NA,NA,NA,NA,NA,NA,NA,NA,NA,NA,NA,NA
51530,Buena Vista city,VA,Virginia,NA,0,NA,NA,NA,NA,NA,NA,NA,NA,NA,NA,NA,NA,NA,NA,NA
51540,Charlottesville city,VA,Virginia,NA,0,NA,NA,NA,NA,NA,NA,NA,NA,NA,NA,NA,NA,NA,NA,NA
51550,Chesapeake city,VA,Virginia,NA,0,NA,NA,NA,NA,NA,NA,NA,NA,NA,NA,NA,NA,NA,NA,NA
51570,Colonial Heights city,VA,Virginia,NA,0,NA,NA,NA,NA,NA,NA,NA,NA,NA,NA,NA,NA,NA,NA,NA
51580,Covington city,VA,Virginia,NA,0,NA,NA,NA,NA,NA,NA,NA,NA,NA,NA,NA,NA,NA,NA,NA
51590,Danville city,VA,Virginia,NA,0,NA,NA,NA,NA,NA,NA,NA,NA,NA,NA,NA,NA,NA,NA,NA
51595,Emporia city,VA,Virginia,NA,0,NA,NA,NA,NA,NA,NA,NA,NA,NA,NA,NA,NA,NA,NA,NA
51600,Fairfax city,VA,Virginia,NA,0,NA,NA,NA,NA,NA,NA,NA,NA,NA,NA,NA,NA,NA,NA,NA
51610,Falls Church city,VA,Virginia,NA,0,NA,NA,NA,NA,NA,NA,NA,NA,NA,NA,NA,NA,NA,NA,NA
51620,Franklin city,VA,Virginia,NA,0,NA,NA,NA,NA,NA,NA,NA,NA,NA,NA,NA,NA,NA,NA,NA
51630,Fredericksburg city,VA,Virginia,NA,0,NA,NA,NA,NA,NA,NA,NA,NA,NA,NA,NA,NA,NA,NA,NA
51640,Galax city,VA,Virginia,NA,0,NA,NA,NA,NA,NA,NA,NA,NA,NA,NA,NA,NA,NA,NA,NA
51650,Hampton city,VA,Virginia,NA,0,NA,NA,NA,NA,NA,NA,NA,NA,NA,NA,NA,NA,NA,NA,NA
51660,Harrisonburg city,VA,Virginia,NA,0,NA,NA,NA,NA,NA,NA,NA,NA,NA,NA,NA,NA,NA,NA,NA
51670,Hopewell city,VA,Virginia,NA,0,NA,NA,NA,NA,NA,NA,NA,NA,NA,NA,NA,NA,NA,NA,NA
51678,Lexington city,VA,Virginia,NA,0,NA,NA,NA,NA,NA,NA,NA,NA,NA,NA,NA,NA,NA,NA,NA
51680,Lynchburg city,VA,Virginia,NA,0,NA,NA,NA,NA,NA,NA,NA,NA,NA,NA,NA,NA,NA,NA,NA
51683,Manassas city,VA,Virginia,NA,0,NA,NA,NA,NA,NA,NA,NA,NA,NA,NA,NA,NA,NA,NA,NA
51685,Manassas Park city,VA,Virginia,NA,0,NA,NA,NA,NA,NA,NA,NA,NA,NA,NA,NA,NA,NA,NA,NA
51690,Martinsville city,VA,Virginia,NA,0,NA,NA,NA,NA,NA,NA,NA,NA,NA,NA,NA,NA,NA,NA,NA
51700,Newport News city,VA,Virginia,NA,0,NA,NA,NA,NA,NA,NA,NA,NA,NA,NA,NA,NA,NA,NA,NA
51710,Norfolk city,VA,Virginia,NA,0,NA,NA,NA,NA,NA,NA,NA,NA,NA,NA,NA,NA,NA,NA,NA
51720,Norton city,VA,Virginia,NA,0,NA,NA,NA,NA,NA,NA,NA,NA,NA,NA,NA,NA,NA,NA,NA
51730,Petersburg city,VA,Virginia,NA,0,NA,NA,NA,NA,NA,NA,NA,NA,NA,NA,NA,NA,NA,NA,NA
51735,Poquoson city,VA,Virginia,NA,0,NA,NA,NA,NA,NA,NA,NA,NA,NA,NA,NA,NA,NA,NA,NA
51740,Portsmouth city,VA,Virginia,NA,0,NA,NA,NA,NA,NA,NA,NA,NA,NA,NA,NA,NA,NA,NA,NA
51750,Radford city,VA,Virginia,NA,0,NA,NA,NA,NA,NA,NA,NA,NA,NA,NA,NA,NA,NA,NA,NA
51760,Richmond city,VA,Virginia,NA,0,NA,NA,NA,NA,NA,NA,NA,NA,NA,NA,NA,NA,NA,NA,NA
51770,Roanoke city,VA,Virginia,NA,0,NA,NA,NA,NA,NA,NA,NA,NA,NA,NA,NA,NA,NA,NA,NA
51775,Salem city,VA,Virginia,NA,0,NA,NA,NA,NA,NA,NA,NA,NA,NA,NA,NA,NA,NA,NA,NA
51790,Staunton city,VA,Virginia,NA,0,NA,NA,NA,NA,NA,NA,NA,NA,NA,NA,NA,NA,NA,NA,NA
51800,Suffolk city,VA,Virginia,NA,0,NA,NA,NA,NA,NA,NA,NA,NA,NA,NA,NA,NA,NA,NA,NA
51810,Virginia Beach city,VA,Virginia,NA,0,NA,NA,NA,NA,NA,NA,NA,NA,NA,NA,NA,NA,NA,NA,NA
51820,Waynesboro city,VA,Virginia,NA,0,NA,NA,NA,NA,NA,NA,NA,NA,NA,NA,NA,NA,NA,NA,NA
51830,Williamsburg city,VA,Virginia,NA,0,NA,NA,NA,NA,NA,NA,NA,NA,NA,NA,NA,NA,NA,NA,NA
51840,Winchester city,VA,Virginia,NA,0,NA,NA,NA,NA,NA,NA,NA,NA,NA,NA,NA,NA,NA,NA,NA
53001,Adams County,WA,Washington,adamscountyihcs,1,DoubleCheck,No,No,1,NA,Outdated-Add District,NA,NA,NA,NA,NA,NA,NA,NA,NA
53003,Asotin County,WA,Washington,NA,0,NA,NA,NA,1,NA,NA,NA,NA,NA,NA,NA,NA,NA,NA,NA
53005,Benton County,WA,Washington,NA,0,NA,NA,NA,1,NA,NA,NA,NA,NA,NA,NA,NA,NA,NA,NA
53007,Chelan County,WA,Washington,NA,0,NA,NA,NA,0,NA,NA,NA,NA,NA,NA,NA,NA,NA,NA,NA
53009,Clallam County,WA,Washington,clallamhealth,1,NA,Yes,Yes,1,NA,NA,NA,538573293,"Have a safe and happy holiday!  Our offices will reopen Monday, November 29th.  https://t.co/uGhfRoRaqm",11/24/2021,16:20:37,https://twitter.com/ClallamHealth/status/1463618583150219266,2021,11,24
53011,Clark County,WA,Washington,clarkcowa_ph,1,NA,Yes,Yes,1,NA,NA,NA,36480720,"•538 total deaths to date (495 confirmed, 43 suspect) •12 additional confirmed deaths since the last update: •1 man in his 50s •2 men in their 60s •4 men in their 70s •1 man 80+ years old •1 woman in her 50s •3 women 80+ years old 4/4",11/24/2021,18:24:32,https://twitter.com/ClarkCoWA_PH/status/1463649767594942465,2021,11,24
53013,Columbia County,WA,Washington,NA,0,NA,NA,NA,1,NA,NA,NA,NA,NA,NA,NA,NA,NA,NA,NA
53015,Cowlitz County,WA,Washington,NA,0,NA,NA,NA,1,NA,NA,NA,NA,NA,NA,NA,NA,NA,NA,NA
53017,Douglas County,WA,Washington,NA,0,NA,NA,NA,0,NA,NA,NA,NA,NA,NA,NA,NA,NA,NA,NA
53019,Ferry County,WA,Washington,ferryhealth,1,DoubleCheck,No,No,1,NA,NA,Northeast Tri-County Health District - Washington,NA,NA,NA,NA,NA,NA,NA,NA
53021,Franklin County,WA,Washington,NA,0,NA,NA,NA,1,NA,NA,NA,NA,NA,NA,NA,NA,NA,NA,NA
53023,Garfield County,WA,Washington,NA,0,NA,NA,NA,1,NA,NA,NA,NA,NA,NA,NA,NA,NA,NA,NA
53025,Grant County,WA,Washington,gchd_wa,1,NA,Yes,Yes,1,NA,NA,NA,3141022311,"We don’t mean to throw a peel 🍌 in your plans 😬 Due to staffing our vaccine and testing event has been moved to Tuesday, November 23 🗓  We are so sorry ☹️  We hope to see you Tuesday!   Stay tuned 📺 for details!   #grantcountywashington #mariokart #changeofplans #Covid_19  https://t.co/JZVUWKNUCd",11/19/2021,21:17:43,https://twitter.com/GCHD_WA/status/1461881409375653891,2021,11,19
53027,Grays Harbor County,WA,Washington,NA,0,NA,NA,NA,1,NA,NA,NA,NA,NA,NA,NA,NA,NA,NA,NA
53029,Island County,WA,Washington,NA,0,NA,NA,NA,1,NA,NA,NA,NA,NA,NA,NA,NA,NA,NA,NA
53031,Jefferson County,WA,Washington,NA,0,NA,NA,NA,1,NA,NA,NA,NA,NA,NA,NA,NA,NA,NA,NA
53033,King County,WA,Washington,kcpubhealth,1,NA,Yes,Yes,1,NA,NA,NA,145036955,"Es importante mantener la calidad del aire limpio, especialmente cuando nos reunimos en espacios cerrados. También es importante que sigamos usando mascarillas y que nos vacunemos.  Más información sobre la calidad del aire en espacios cerrados en  https://t.co/wfo8wB8dIo  https://t.co/xRfAO4apQa",11/24/2021,17:00:37,https://twitter.com/KCPubHealth/status/1463628647068094466,2021,11,24
53035,Kitsap County,WA,Washington,kitsaphealth,1,NA,Yes,Yes,1,NA,NA,NA,180922539,COVID-19 Weekly Outlook: Tips for safer holiday gatherings; vaccination or test now required for large events.  https://t.co/RJw0aznNqj,11/19/2021,19:12:19,https://twitter.com/KitsapHealth/status/1461849853651263492,2021,11,19
53037,Kittitas County,WA,Washington,NA,0,NA,NA,NA,1,NA,NA,NA,NA,NA,NA,NA,NA,NA,NA,NA
53039,Klickitat County,WA,Washington,healthklickitat,1,NA,Yes,No,1,NA,NA,NA,1.24E+18,Watch “The Coronavirus Explained &amp; What You Should Do”  https://t.co/3nb3LURq7C,3/19/2020,15:00:26,https://twitter.com/HealthKlickitat/status/1240714767871823872,2020,3,19
53041,Lewis County,WA,Washington,lcphss,1,NA,Yes,Yes,1,NA,NA,NA,1.05E+18,Resident open participation URL:  https://t.co/vXOC7fqU1P Business open participation URL:  https://t.co/rlByKEkD9S  https://t.co/H1jbLriDZa,11/24/2021,17:20:03,https://twitter.com/LCPHSS/status/1463633540122243076,2021,11,24
53043,Lincoln County,WA,Washington,NA,0,NA,NA,NA,0,NA,NA,NA,NA,NA,NA,NA,NA,NA,NA,NA
53045,Mason County,WA,Washington,healthymc,1,DoubleCheck,No,No,1,NA,NA,NA,NA,NA,NA,NA,NA,NA,NA,NA
53047,Okanogan County,WA,Washington,NA,0,NA,NA,NA,1,NA,NA,NA,NA,NA,NA,NA,NA,NA,NA,NA
53049,Pacific County,WA,Washington,NA,0,NA,NA,NA,1,NA,NA,NA,NA,NA,NA,NA,NA,NA,NA,NA
53051,Pend Oreille County,WA,Washington,NA,0,NA,NA,NA,1,NA,NA,Northeast Tri-County Health District - Washington,NA,NA,NA,NA,NA,NA,NA,NA
53053,Pierce County,WA,Washington,tpchd,1,NA,Yes,Yes,1,NA,NA,NA,450941611,"🏫 Kids learn best in classrooms. If you want to keep them there, you need to keep them safe from COVID-19. You can find vaccine doses for kids 5-11 at any of our vaccine clinic listings marked with a 🦕. ➡️  https://t.co/CjMA3TJDyq  https://t.co/qhGIGZmuuM",11/24/2021,15:01:18,https://twitter.com/TPCHD/status/1463598621383970827,2021,11,24
53055,San Juan County,WA,Washington,sjcpublichealth,1,DoubleCheck,No,No,1,NA,NA,NA,NA,NA,NA,NA,NA,NA,NA,NA
53057,Skagit County,WA,Washington,NA,0,NA,NA,NA,1,NA,NA,NA,NA,NA,NA,NA,NA,NA,NA,NA
53059,Skamania County,WA,Washington,NA,0,NA,NA,NA,1,NA,NA,NA,NA,NA,NA,NA,NA,NA,NA,NA
53061,Snohomish County,WA,Washington,NA,0,NA,NA,NA,1,NA,NA,NA,NA,NA,NA,NA,NA,NA,NA,NA
53063,Spokane County,WA,Washington,NA,0,NA,NA,NA,1,NA,NA,NA,NA,NA,NA,NA,NA,NA,NA,NA
53065,Stevens County,WA,Washington,NA,0,NA,NA,NA,1,NA,NA,Northeast Tri-County Health District - Washington,NA,NA,NA,NA,NA,NA,NA,NA
53067,Thurston County,WA,Washington,thurstonhealth,1,NA,Yes,Yes,1,NA,NA,NA,937440919,"Thurston County COVID-19 data for 11/23/2021 ▫️New COVID-19 cases: 45    7-day case count: 470 ▫️New Deaths: 3 - men in their 50's, 60's and 70's    7-day death count: 8 ▫️New Hospitalizations: 4    7-day hospitalization count: 8 Complete COVID-19 data👉 https://t.co/PpN96knKwb  https://t.co/FmREgqdJ9V",11/24/2021,18:00:07,https://twitter.com/ThurstonHealth/status/1463643622876790792,2021,11,24
53069,Wahkiakum County,WA,Washington,NA,0,NA,NA,NA,1,NA,NA,NA,NA,NA,NA,NA,NA,NA,NA,NA
53071,Walla Walla County,WA,Washington,wwcdch,1,DoubleCheck,No,No,1,NA,NA,NA,NA,NA,NA,NA,NA,NA,NA,NA
53073,Whatcom County,WA,Washington,NA,0,NA,NA,NA,1,NA,NA,NA,NA,NA,NA,NA,NA,NA,NA,NA
53075,Whitman County,WA,Washington,whitman_health,1,NA,Yes,No,1,NA,NA,NA,1.10E+18,https://t.co/7twDaBgK5b,11/25/2020,13:01:30,https://twitter.com/whitman_health/status/1331659290151690243,2020,11,25
53077,Yakima County,WA,Washington,yakima_health,1,DoubleCheck,No,No,1,NA,NA,NA,NA,NA,NA,NA,NA,NA,NA,NA
54001,Barbour County,WV,West Virginia,NA,0,NA,NA,NA,1,NA,NA,NA,NA,NA,NA,NA,NA,NA,NA,NA
54003,Berkeley County,WV,West Virginia,NA,0,NA,NA,NA,1,NA,NA,NA,NA,NA,NA,NA,NA,NA,NA,NA
54005,Boone County,WV,West Virginia,NA,0,NA,NA,NA,1,NA,NA,NA,NA,NA,NA,NA,NA,NA,NA,NA
54007,Braxton County,WV,West Virginia,NA,0,NA,NA,NA,1,NA,NA,NA,NA,NA,NA,NA,NA,NA,NA,NA
54009,Brooke County,WV,West Virginia,NA,0,NA,NA,NA,1,NA,NA,NA,NA,NA,NA,NA,NA,NA,NA,NA
54011,Cabell County,WV,West Virginia,NA,0,NA,NA,NA,1,NA,NA,NA,NA,NA,NA,NA,NA,NA,NA,NA
54013,Calhoun County,WV,West Virginia,NA,0,NA,NA,NA,1,NA,NA,Mid-Ohio Valley Health Department - West Virginia,NA,NA,NA,NA,NA,NA,NA,NA
54015,Clay County,WV,West Virginia,NA,0,NA,NA,NA,1,NA,NA,NA,NA,NA,NA,NA,NA,NA,NA,NA
54017,Doddridge County,WV,West Virginia,NA,0,NA,NA,NA,1,NA,NA,NA,NA,NA,NA,NA,NA,NA,NA,NA
54019,Fayette County,WV,West Virginia,NA,0,NA,NA,NA,0,NA,NA,NA,NA,NA,NA,NA,NA,NA,NA,NA
54021,Gilmer County,WV,West Virginia,NA,0,NA,NA,NA,1,NA,NA,NA,NA,NA,NA,NA,NA,NA,NA,NA
54023,Grant County,WV,West Virginia,NA,0,NA,NA,NA,0,NA,NA,NA,NA,NA,NA,NA,NA,NA,NA,NA
54025,Greenbrier County,WV,West Virginia,NA,0,NA,NA,NA,1,NA,NA,NA,NA,NA,NA,NA,NA,NA,NA,NA
54027,Hampshire County,WV,West Virginia,NA,0,NA,NA,NA,1,NA,NA,NA,NA,NA,NA,NA,NA,NA,NA,NA
54029,Hancock County,WV,West Virginia,NA,0,NA,NA,NA,1,NA,NA,NA,NA,NA,NA,NA,NA,NA,NA,NA
54031,Hardy County,WV,West Virginia,NA,0,NA,NA,NA,1,NA,NA,NA,NA,NA,NA,NA,NA,NA,NA,NA
54033,Harrison County,WV,West Virginia,NA,0,NA,NA,NA,1,NA,NA,NA,NA,NA,NA,NA,NA,NA,NA,NA
54035,Jackson County,WV,West Virginia,NA,0,NA,NA,NA,1,NA,NA,NA,NA,NA,NA,NA,NA,NA,NA,NA
54037,Jefferson County,WV,West Virginia,NA,0,NA,NA,NA,1,NA,NA,NA,NA,NA,NA,NA,NA,NA,NA,NA
54039,Kanawha County,WV,West Virginia,kchealth1,1,NA,Yes,Yes,1,NA,NA,NA,2964686201,"COVID-19 vaccine.  Mr. Campbell is photographed by Rebecca Kiger of Wheeling, WV, for TIME Magazine.  For the full list of TIME's Top 100 Photos of 2021, visit:  https://t.co/RZBI4bAfBS  https://t.co/hzclzz0psX",11/24/2021,11:43:21,https://twitter.com/KCHealth1/status/1463548806897627136,2021,11,24
54041,Lewis County,WV,West Virginia,NA,0,NA,NA,NA,1,NA,NA,NA,NA,NA,NA,NA,NA,NA,NA,NA
54043,Lincoln County,WV,West Virginia,lincolncountyh2,1,DoubleCheck,No,No,1,NA,NA,NA,NA,NA,NA,NA,NA,NA,NA,NA
54045,Logan County,WV,West Virginia,NA,0,NA,NA,NA,1,NA,NA,NA,NA,NA,NA,NA,NA,NA,NA,NA
54047,McDowell County,WV,West Virginia,NA,0,NA,NA,NA,1,NA,NA,NA,NA,NA,NA,NA,NA,NA,NA,NA
54049,Marion County,WV,West Virginia,marioncolhdwv,1,DoubleCheck,No,No,1,NA,NA,NA,NA,NA,NA,NA,NA,NA,NA,NA
54051,Marshall County,WV,West Virginia,NA,0,NA,NA,NA,1,NA,NA,NA,NA,NA,NA,NA,NA,NA,NA,NA
54053,Mason County,WV,West Virginia,NA,0,NA,NA,NA,1,NA,NA,NA,NA,NA,NA,NA,NA,NA,NA,NA
54055,Mercer County,WV,West Virginia,NA,0,NA,NA,NA,1,NA,NA,NA,NA,NA,NA,NA,NA,NA,NA,NA
54057,Mineral County,WV,West Virginia,NA,0,NA,NA,NA,1,NA,NA,NA,NA,NA,NA,NA,NA,NA,NA,NA
54059,Mingo County,WV,West Virginia,NA,0,NA,NA,NA,1,NA,NA,NA,NA,NA,NA,NA,NA,NA,NA,NA
54061,Monongalia County,WV,West Virginia,NA,0,NA,NA,NA,1,NA,NA,NA,NA,NA,NA,NA,NA,NA,NA,NA
54063,Monroe County,WV,West Virginia,NA,0,NA,NA,NA,1,NA,NA,NA,NA,NA,NA,NA,NA,NA,NA,NA
54065,Morgan County,WV,West Virginia,NA,0,NA,NA,NA,1,NA,NA,NA,NA,NA,NA,NA,NA,NA,NA,NA
54067,Nicholas County,WV,West Virginia,NA,0,NA,NA,NA,1,NA,NA,NA,NA,NA,NA,NA,NA,NA,NA,NA
54069,Ohio County,WV,West Virginia,NA,0,NA,NA,NA,1,NA,NA,NA,NA,NA,NA,NA,NA,NA,NA,NA
54071,Pendleton County,WV,West Virginia,NA,0,NA,NA,NA,1,NA,NA,NA,NA,NA,NA,NA,NA,NA,NA,NA
54073,Pleasants County,WV,West Virginia,NA,0,NA,NA,NA,1,NA,NA,Mid-Ohio Valley Health Department - West Virginia,NA,NA,NA,NA,NA,NA,NA,NA
54075,Pocahontas County,WV,West Virginia,NA,0,NA,NA,NA,1,NA,NA,NA,NA,NA,NA,NA,NA,NA,NA,NA
54077,Preston County,WV,West Virginia,NA,0,NA,NA,NA,1,NA,NA,NA,NA,NA,NA,NA,NA,NA,NA,NA
54079,Putnam County,WV,West Virginia,NA,0,NA,NA,NA,1,NA,NA,NA,NA,NA,NA,NA,NA,NA,NA,NA
54081,Raleigh County,WV,West Virginia,NA,0,NA,NA,NA,1,NA,NA,NA,NA,NA,NA,NA,NA,NA,NA,NA
54083,Randolph County,WV,West Virginia,NA,0,NA,NA,NA,1,NA,NA,NA,NA,NA,NA,NA,NA,NA,NA,NA
54085,Ritchie County,WV,West Virginia,NA,0,NA,NA,NA,1,NA,NA,Mid-Ohio Valley Health Department - West Virginia,NA,NA,NA,NA,NA,NA,NA,NA
54087,Roane County,WV,West Virginia,NA,0,NA,NA,NA,1,NA,NA,Mid-Ohio Valley Health Department - West Virginia,NA,NA,NA,NA,NA,NA,NA,NA
54089,Summers County,WV,West Virginia,NA,0,NA,NA,NA,1,NA,NA,NA,NA,NA,NA,NA,NA,NA,NA,NA
54091,Taylor County,WV,West Virginia,NA,0,NA,NA,NA,1,NA,NA,NA,NA,NA,NA,NA,NA,NA,NA,NA
54093,Tucker County,WV,West Virginia,NA,0,NA,NA,NA,1,NA,NA,NA,NA,NA,NA,NA,NA,NA,NA,NA
54095,Tyler County,WV,West Virginia,NA,0,NA,NA,NA,1,NA,NA,NA,NA,NA,NA,NA,NA,NA,NA,NA
54097,Upshur County,WV,West Virginia,NA,0,NA,NA,NA,1,NA,NA,NA,NA,NA,NA,NA,NA,NA,NA,NA
54099,Wayne County,WV,West Virginia,NA,0,NA,NA,NA,1,NA,NA,NA,NA,NA,NA,NA,NA,NA,NA,NA
54101,Webster County,WV,West Virginia,NA,0,NA,NA,NA,1,NA,NA,NA,NA,NA,NA,NA,NA,NA,NA,NA
54103,Wetzel County,WV,West Virginia,NA,0,NA,NA,NA,1,NA,NA,NA,NA,NA,NA,NA,NA,NA,NA,NA
54105,Wirt County,WV,West Virginia,NA,0,NA,NA,NA,1,NA,NA,Mid-Ohio Valley Health Department - West Virginia,NA,NA,NA,NA,NA,NA,NA,NA
54107,Wood County,WV,West Virginia,NA,0,NA,NA,NA,1,NA,NA,Mid-Ohio Valley Health Department - West Virginia,NA,NA,NA,NA,NA,NA,NA,NA
54109,Wyoming County,WV,West Virginia,NA,0,NA,NA,NA,0,NA,NA,NA,NA,NA,NA,NA,NA,NA,NA,NA
55001,Adams County,WI,Wisconsin,NA,0,NA,NA,NA,1,NA,NA,NA,NA,NA,NA,NA,NA,NA,NA,NA
55003,Ashland County,WI,Wisconsin,NA,0,NA,NA,NA,1,NA,NA,NA,NA,NA,NA,NA,NA,NA,NA,NA
55005,Barron County,WI,Wisconsin,NA,0,NA,NA,NA,1,NA,NA,NA,NA,NA,NA,NA,NA,NA,NA,NA
55007,Bayfield County,WI,Wisconsin,NA,0,NA,NA,NA,1,NA,NA,NA,NA,NA,NA,NA,NA,NA,NA,NA
55009,Brown County,WI,Wisconsin,browncohealth,1,NA,Yes,Yes,1,NA,NA,NA,93679149,Brown County Public Health would like to wish a Happy Thanksgiving to all who celebrate this holiday! Our offices will be closed Thursday 11/25 and Friday 11/26 in observance of the holiday.    #StayHealthyBC  https://t.co/k23zJmHgkJ,11/24/2021,13:53:31,https://twitter.com/BrownCoHealth/status/1463581563900334093,2021,11,24
55011,Buffalo County,WI,Wisconsin,NA,0,NA,NA,NA,1,NA,NA,NA,NA,NA,NA,NA,NA,NA,NA,NA
55013,Burnett County,WI,Wisconsin,NA,0,NA,NA,NA,1,NA,NA,NA,NA,NA,NA,NA,NA,NA,NA,NA
55015,Calumet County,WI,Wisconsin,NA,0,NA,NA,NA,1,NA,NA,NA,NA,NA,NA,NA,NA,NA,NA,NA
55017,Chippewa County,WI,Wisconsin,NA,0,NA,NA,NA,1,NA,NA,NA,NA,NA,NA,NA,NA,NA,NA,NA
55019,Clark County,WI,Wisconsin,clark4health,1,DoubleCheck,No,No,1,NA,NA,NA,NA,NA,NA,NA,NA,NA,NA,NA
55021,Columbia County,WI,Wisconsin,NA,0,NA,NA,NA,1,NA,NA,NA,NA,NA,NA,NA,NA,NA,NA,NA
55023,Crawford County,WI,Wisconsin,NA,0,NA,NA,NA,1,NA,NA,NA,NA,NA,NA,NA,NA,NA,NA,NA
55025,Dane County,WI,Wisconsin,NA,0,NA,NA,NA,1,NA,NA,NA,NA,NA,NA,NA,NA,NA,NA,NA
55027,Dodge County,WI,Wisconsin,NA,0,NA,NA,NA,1,NA,NA,NA,NA,NA,NA,NA,NA,NA,NA,NA
55029,Door County,WI,Wisconsin,doorcohealth,1,NA,No,No,1,NA,NA,NA,1068766112,Check out May Mental Health Parent Cafes!  https://t.co/DZejxt40kO,4/29/2019,13:00:08,https://twitter.com/DoorCoHealth/status/1122908434486255616,2019,4,29
55031,Douglas County,WI,Wisconsin,NA,0,NA,NA,NA,0,NA,NA,NA,NA,NA,NA,NA,NA,NA,NA,NA
55033,Dunn County,WI,Wisconsin,NA,0,NA,NA,NA,0,NA,NA,NA,NA,NA,NA,NA,NA,NA,NA,NA
55035,Eau Claire County,WI,Wisconsin,NA,0,NA,NA,NA,1,NA,NA,NA,NA,NA,NA,NA,NA,NA,NA,NA
55037,Florence County,WI,Wisconsin,NA,0,NA,NA,NA,1,NA,NA,NA,NA,NA,NA,NA,NA,NA,NA,NA
55039,Fond du Lac County,WI,Wisconsin,fonddulaccounty,1,NA,Yes,Yes,1,NA,NA,NA,1.09E+18,"Friendly reminder that there will NOT be mobile COVID-19 testing at the fairgrounds on Thursday. Testing will resume Monday, November 29th at 8:00am.  ➡More community testing sites here:  https://t.co/mmtFVvjaP6  https://t.co/1yHSmslusk",11/23/2021,14:35:03,https://twitter.com/fonddulaccounty/status/1463229626591940609,2021,11,23
55041,Forest County,WI,Wisconsin,NA,0,NA,NA,NA,1,NA,NA,NA,NA,NA,NA,NA,NA,NA,NA,NA
55043,Grant County,WI,Wisconsin,NA,0,NA,NA,NA,1,NA,NA,NA,NA,NA,NA,NA,NA,NA,NA,NA
55045,Green County,WI,Wisconsin,NA,0,NA,NA,NA,1,NA,NA,NA,NA,NA,NA,NA,NA,NA,NA,NA
55047,Green Lake County,WI,Wisconsin,NA,0,NA,NA,NA,1,NA,NA,NA,NA,NA,NA,NA,NA,NA,NA,NA
55049,Iowa County,WI,Wisconsin,NA,0,NA,NA,NA,1,NA,NA,NA,NA,NA,NA,NA,NA,NA,NA,NA
55051,Iron County,WI,Wisconsin,NA,0,NA,NA,NA,1,NA,NA,NA,NA,NA,NA,NA,NA,NA,NA,NA
55053,Jackson County,WI,Wisconsin,NA,0,NA,NA,NA,1,NA,NA,NA,NA,NA,NA,NA,NA,NA,NA,NA
55055,Jefferson County,WI,Wisconsin,jeffcohealthwi,1,DoubleCheck,No,No,1,NA,NA,NA,NA,NA,NA,NA,NA,NA,NA,NA
55057,Juneau County,WI,Wisconsin,NA,0,NA,NA,NA,1,NA,NA,NA,NA,NA,NA,NA,NA,NA,NA,NA
55059,Kenosha County,WI,Wisconsin,NA,0,NA,NA,NA,1,NA,NA,NA,NA,NA,NA,NA,NA,NA,NA,NA
55061,Kewaunee County,WI,Wisconsin,NA,0,NA,NA,NA,0,NA,NA,NA,NA,NA,NA,NA,NA,NA,NA,NA
55063,La Crosse County,WI,Wisconsin,NA,0,NA,NA,NA,1,NA,NA,NA,NA,NA,NA,NA,NA,NA,NA,NA
55065,Lafayette County,WI,Wisconsin,NA,0,NA,NA,NA,1,NA,NA,NA,NA,NA,NA,NA,NA,NA,NA,NA
55067,Langlade County,WI,Wisconsin,NA,0,NA,NA,NA,1,NA,NA,NA,NA,NA,NA,NA,NA,NA,NA,NA
55069,Lincoln County,WI,Wisconsin,NA,0,NA,NA,NA,1,NA,NA,NA,NA,NA,NA,NA,NA,NA,NA,NA
55071,Manitowoc County,WI,Wisconsin,NA,0,NA,NA,NA,1,NA,NA,NA,NA,NA,NA,NA,NA,NA,NA,NA
55073,Marathon County,WI,Wisconsin,NA,0,NA,NA,NA,1,NA,NA,NA,NA,NA,NA,NA,NA,NA,NA,NA
55075,Marinette County,WI,Wisconsin,NA,0,NA,NA,NA,0,NA,NA,NA,NA,NA,NA,NA,NA,NA,NA,NA
55077,Marquette County,WI,Wisconsin,NA,0,NA,NA,NA,1,NA,NA,NA,NA,NA,NA,NA,NA,NA,NA,NA
55078,Menominee County,WI,Wisconsin,NA,0,NA,NA,NA,1,NA,NA,NA,NA,NA,NA,NA,NA,NA,NA,NA
55079,Milwaukee County,WI,Wisconsin,mkecodhhs,1,NA,Yes,Yes,1,NA,NA,NA,900605474,"In light of last week's verdict at the trial in Kenosha and yesterday’s tragic events at the Waukesha holiday parade, you may be in need of #mentalhealth support. You are not alone. Please call Milwaukee County's 24/7 crisis line at 414-257-7222 to get help today.  https://t.co/y18Y5APVJv",11/22/2021,14:52:24,https://twitter.com/MkeCoDHHS/status/1462871605642678273,2021,11,22
55081,Monroe County,WI,Wisconsin,NA,0,NA,NA,NA,1,NA,NA,NA,NA,NA,NA,NA,NA,NA,NA,NA
55083,Oconto County,WI,Wisconsin,NA,0,NA,NA,NA,1,NA,NA,NA,NA,NA,NA,NA,NA,NA,NA,NA
55085,Oneida County,WI,Wisconsin,oneidacohealth,1,NA,No,No,1,NA,NA,NA,35807883,"Oneida County Health Department is seeking qualified candidates to perform various clerical duties in support of the WIC department that includes interaction with the public, ensuring that...  https://t.co/aPBCZkC65L",4/26/2019,10:29:41,https://twitter.com/oneidacohealth/status/1121783410777833472,2019,4,26
55087,Outagamie County,WI,Wisconsin,outagamied,1,NA,No,No,1,NA,NA,NA,1.08E+18,"Stay cool during the heat this week, check out our list of public cooling locations.   https://t.co/U1ZPKDZNsq",7/17/2019,15:36:04,https://twitter.com/OutagamieD/status/1151576318494068736,2019,7,17
55089,Ozaukee County,WI,Wisconsin,washozph,1,NA,Yes,Yes,1,NA,NA,NA,1410553722,Multisystem Inflammatory Syndrome in Children is a delayed immune response related to COVID-19. It can be serious but most children who were diagnosed have gotten better with medical care. Watch for symptoms.  https://t.co/t99CIeuI5o  https://t.co/s6l4ei5rUc,11/23/2021,9:26:26,https://twitter.com/WashOzPH/status/1463151962594193410,2021,11,23
55091,Pepin County,WI,Wisconsin,NA,0,NA,NA,NA,1,NA,NA,NA,NA,NA,NA,NA,NA,NA,NA,NA
55093,Pierce County,WI,Wisconsin,NA,0,NA,NA,NA,1,NA,NA,NA,NA,NA,NA,NA,NA,NA,NA,NA
55095,Polk County,WI,Wisconsin,NA,0,NA,NA,NA,1,NA,NA,NA,NA,NA,NA,NA,NA,NA,NA,NA
55097,Portage County,WI,Wisconsin,NA,0,NA,NA,NA,1,NA,NA,NA,NA,NA,NA,NA,NA,NA,NA,NA
55099,Price County,WI,Wisconsin,NA,0,NA,NA,NA,1,NA,NA,NA,NA,NA,NA,NA,NA,NA,NA,NA
55101,Racine County,WI,Wisconsin,NA,0,NA,NA,NA,1,NA,NA,NA,NA,NA,NA,NA,NA,NA,NA,NA
55103,Richland County,WI,Wisconsin,NA,0,NA,NA,NA,1,NA,NA,NA,NA,NA,NA,NA,NA,NA,NA,NA
55105,Rock County,WI,Wisconsin,NA,0,NA,NA,NA,1,NA,NA,NA,NA,NA,NA,NA,NA,NA,NA,NA
55107,Rusk County,WI,Wisconsin,NA,0,NA,NA,NA,1,NA,NA,NA,NA,NA,NA,NA,NA,NA,NA,NA
55109,St. Croix County,WI,Wisconsin,NA,0,NA,NA,NA,0,NA,NA,NA,NA,NA,NA,NA,NA,NA,NA,NA
55111,Sauk County,WI,Wisconsin,saukcohealth,1,NA,Yes,No,1,NA,NA,NA,259353274,"Let’s fight this new public health threat with compassion and science, not fear and discrimination. You CANNOT tell if someone has a risk of spreading novel coronavirus by what they look like. #COVIDー19 #publichealth  https://t.co/9wNKLn8Y2D",3/3/2020,12:15:35,https://twitter.com/saukcohealth/status/1234890175362347012,2020,3,3
55113,Sawyer County,WI,Wisconsin,NA,0,NA,NA,NA,1,NA,NA,NA,NA,NA,NA,NA,NA,NA,NA,NA
55115,Shawano County,WI,Wisconsin,NA,0,NA,NA,NA,1,NA,NA,NA,NA,NA,NA,NA,NA,NA,NA,NA
55117,Sheboygan County,WI,Wisconsin,sheboygandph,1,NA,Yes,Yes,1,NA,NA,NA,1.00E+18,Thanksgiving is around the corner! After your big meal get outside and enjoy some fresh air.     Explore a Wisconsin trail near you:  https://t.co/USoYsJcpcj  https://t.co/bFQgmuou00,11/22/2021,11:10:05,https://twitter.com/SheboyganDPH/status/1462815657217638405,2021,11,22
55119,Taylor County,WI,Wisconsin,NA,0,NA,NA,NA,1,NA,NA,NA,NA,NA,NA,NA,NA,NA,NA,NA
55121,Trempealeau County,WI,Wisconsin,NA,0,NA,NA,NA,1,NA,NA,NA,NA,NA,NA,NA,NA,NA,NA,NA
55123,Vernon County,WI,Wisconsin,NA,0,NA,NA,NA,1,NA,NA,NA,NA,NA,NA,NA,NA,NA,NA,NA
55125,Vilas County,WI,Wisconsin,NA,0,NA,NA,NA,1,NA,NA,NA,NA,NA,NA,NA,NA,NA,NA,NA
55127,Walworth County,WI,Wisconsin,NA,0,NA,NA,NA,1,NA,NA,NA,NA,NA,NA,NA,NA,NA,NA,NA
55129,Washburn County,WI,Wisconsin,NA,0,NA,NA,NA,1,NA,NA,NA,NA,NA,NA,NA,NA,NA,NA,NA
55131,Washington County,WI,Wisconsin,NA,0,NA,NA,NA,1,NA,NA,NA,NA,NA,NA,NA,NA,NA,NA,NA
55133,Waukesha County,WI,Wisconsin,NA,0,NA,NA,NA,1,NA,NA,NA,NA,NA,NA,NA,NA,NA,NA,NA
55135,Waupaca County,WI,Wisconsin,NA,0,NA,NA,NA,1,NA,NA,NA,NA,NA,NA,NA,NA,NA,NA,NA
55137,Waushara County,WI,Wisconsin,NA,0,NA,NA,NA,1,NA,NA,NA,NA,NA,NA,NA,NA,NA,NA,NA
55139,Winnebago County,WI,Wisconsin,winnebagohealth,1,NA,Yes,Yes,1,NA,NA,NA,101849417,"Come work with us! We're hiring two Community Health Strategists. For more info, visit   https://t.co/JuFhljmjtj  https://t.co/SkUFR7Z7H4",10/6/2021,15:57:08,https://twitter.com/WinnebagoHealth/status/1445840567129231368,2021,10,6
55141,Wood County,WI,Wisconsin,NA,0,NA,NA,NA,1,NA,NA,NA,NA,NA,NA,NA,NA,NA,NA,NA
56001,Albany County,WY,Wyoming,NA,0,NA,NA,NA,1,NA,NA,NA,NA,NA,NA,NA,NA,NA,NA,NA
56003,Big Horn County,WY,Wyoming,NA,0,NA,NA,NA,1,NA,NA,NA,NA,NA,NA,NA,NA,NA,NA,NA
56005,Campbell County,WY,Wyoming,cchwyo,1,NA,Yes,Yes,1,NA,NA,NA,43130254,"Say hello to Ryan Larsen, a System Administrator who works in the CCH Information Technology department:  https://t.co/pcW70I6lvd  Thank you, Ryan, for providing extraordinary service to your colleagues and our patients. We appreciate you!",11/23/2021,17:11:27,https://twitter.com/cchwyo/status/1463268985995153413,2021,11,23
56007,Carbon County,WY,Wyoming,NA,0,NA,NA,NA,1,NA,NA,NA,NA,NA,NA,NA,NA,NA,NA,NA
56009,Converse County,WY,Wyoming,NA,0,NA,NA,NA,1,NA,NA,NA,NA,NA,NA,NA,NA,NA,NA,NA
56011,Crook County,WY,Wyoming,NA,0,NA,NA,NA,1,NA,NA,NA,NA,NA,NA,NA,NA,NA,NA,NA
56013,Fremont County,WY,Wyoming,NA,0,NA,NA,NA,1,NA,NA,NA,NA,NA,NA,NA,NA,NA,NA,NA
56015,Goshen County,WY,Wyoming,NA,0,NA,NA,NA,0,NA,NA,NA,NA,NA,NA,NA,NA,NA,NA,NA
56017,Hot Springs County,WY,Wyoming,NA,0,NA,NA,NA,1,NA,NA,NA,NA,NA,NA,NA,NA,NA,NA,NA
56019,Johnson County,WY,Wyoming,NA,0,NA,NA,NA,1,NA,NA,NA,NA,NA,NA,NA,NA,NA,NA,NA
56021,Laramie County,WY,Wyoming,NA,0,NA,NA,NA,1,NA,NA,NA,NA,NA,NA,NA,NA,NA,NA,NA
56023,Lincoln County,WY,Wyoming,NA,0,NA,NA,NA,1,NA,NA,NA,NA,NA,NA,NA,NA,NA,NA,NA
56025,Natrona County,WY,Wyoming,NA,0,NA,NA,NA,1,NA,NA,NA,NA,NA,NA,NA,NA,NA,NA,NA
56027,Niobrara County,WY,Wyoming,NA,0,NA,NA,NA,1,NA,NA,NA,NA,NA,NA,NA,NA,NA,NA,NA
56029,Park County,WY,Wyoming,NA,0,NA,NA,NA,1,Individual Public Health Officer,NA,NA,NA,NA,NA,NA,NA,NA,NA,NA
56031,Platte County,WY,Wyoming,NA,0,NA,NA,NA,1,NA,NA,NA,NA,NA,NA,NA,NA,NA,NA,NA
56033,Sheridan County,WY,Wyoming,NA,0,NA,NA,NA,1,NA,NA,NA,NA,NA,NA,NA,NA,NA,NA,NA
56035,Sublette County,WY,Wyoming,NA,0,NA,NA,NA,1,NA,NA,NA,NA,NA,NA,NA,NA,NA,NA,NA
56037,Sweetwater County,WY,Wyoming,sweetwatercoun1,1,DoubleCheck,No,No,1,NA,NA,NA,NA,NA,NA,NA,NA,NA,NA,NA
56039,Teton County,WY,Wyoming,NA,0,NA,NA,NA,1,NA,NA,NA,NA,NA,NA,NA,NA,NA,NA,NA
56041,Uinta County,WY,Wyoming,NA,0,NA,NA,NA,1,NA,NA,NA,NA,NA,NA,NA,NA,NA,NA,NA
56043,Washakie County,WY,Wyoming,NA,0,NA,NA,NA,1,NA,NA,NA,NA,NA,NA,NA,NA,NA,NA,NA
56045,Weston County,WY,Wyoming,NA,0,NA,NA,NA,1,NA,NA,NA,NA,NA,NA,NA,NA,NA,NA,NA
