id,conversation_id,created_at,date,time,timezone,user_id,username,name,place,tweet,language,mentions,urls,photos,replies_count,retweets_count,likes_count,hashtags,cashtags,link,retweet,quote_url,video,thumbnail,near,geo,source,user_rt_id,user_rt,retweet_id,reply_to,retweet_date,translate,trans_src,trans_dest
1463628722465128455,1463628722465128455,2021-11-24 17:00:54 Eastern Standard Time,2021-11-24,17:00:54,-0500,984122778101182469,bbpublichealth,Bismarck-Burleigh Public Health,,It’s important to have Narcan with your AED. BBPH provides training to recognize symptoms of an opioid overdose and administration of Narcan. This training is available at no cost. If you are interested in a Narcan training contact Sue at 701.355.1597 or skahler@bismarcknd.gov.  https://t.co/0j1GYfzmQD,en,[],[],['https://pbs.twimg.com/media/FE_akRWXIAYhfM1.jpg'],0,0,0,[],[],https://twitter.com/BBPublicHealth/status/1463628722465128455,False,,1,https://pbs.twimg.com/media/FE_akRWXIAYhfM1.jpg,,,,,,,[],,,,
1463583621982396425,1463583621982396425,2021-11-24 14:01:42 Eastern Standard Time,2021-11-24,14:01:42,-0500,984122778101182469,bbpublichealth,Bismarck-Burleigh Public Health,,"Our office will be closed Nov. 25 in observation of Thanksgiving. We will reopen with traditional hours on Friday, November 26.  https://t.co/g1UDWNygn7",en,[],[],['https://pbs.twimg.com/media/FE-xjGgWYA0VJRt.jpg'],0,0,0,[],[],https://twitter.com/BBPublicHealth/status/1463583621982396425,False,,1,https://pbs.twimg.com/media/FE-xjGgWYA0VJRt.jpg,,,,,,,[],,,,
1463564346383114247,1463564346383114247,2021-11-24 12:45:06 Eastern Standard Time,2021-11-24,12:45:06,-0500,984122778101182469,bbpublichealth,Bismarck-Burleigh Public Health,,"You’ve got a lot on your plate this time of year, and physical activity can get crowded out. But being active is the key! It can help make up for eating more than usual and reduce stress. Get moving with friends and family, such as taking a walk after a holiday meal.  https://t.co/oKckm7bnEe",en,[],[],['https://pbs.twimg.com/media/FE-gBGUXIAMJ0vV.jpg'],0,0,0,[],[],https://twitter.com/BBPublicHealth/status/1463564346383114247,False,,1,https://pbs.twimg.com/media/FE-gBGUXIAMJ0vV.jpg,,,,,,,[],,,,
1463537945298849800,1463537945298849800,2021-11-24 11:00:12 Eastern Standard Time,2021-11-24,11:00:12,-0500,984122778101182469,bbpublichealth,Bismarck-Burleigh Public Health,,Does your child need a COVID vaccination? BBPH has a limited number of openings at our pediatric drive through clinic on December 1. This clinic will be held at the Bismarck Event Center. Go to  https://t.co/9OR0ljT71I to register or call 355-1540 for assistance or more info.  https://t.co/oL6lcRG7pU,en,[],['http://ow.ly/opQ150GVBVb'],['https://pbs.twimg.com/media/FE-IAUYXMAYsDbf.jpg'],0,0,0,[],[],https://twitter.com/BBPublicHealth/status/1463537945298849800,False,,1,https://pbs.twimg.com/media/FE-IAUYXMAYsDbf.jpg,,,,,,,[],,,,
1463530424802623494,1463530424802623494,2021-11-24 10:30:19 Eastern Standard Time,2021-11-24,10:30:19,-0500,984122778101182469,bbpublichealth,Bismarck-Burleigh Public Health,,"North Dakotans have 696-788 prescriptions per 1,000 population.  When antibiotics aren’t needed, they won’t help you, and the side effects could still cause harm.  https://t.co/g7i2LAsTh1",en,[],[],['https://pbs.twimg.com/media/FE-BKkNWYAYanQC.jpg'],0,0,0,[],[],https://twitter.com/BBPublicHealth/status/1463530424802623494,False,,1,https://pbs.twimg.com/media/FE-BKkNWYAYanQC.jpg,,,,,,,[],,,,
1463492979792957447,1463492979792957447,2021-11-24 08:01:31 Eastern Standard Time,2021-11-24,08:01:31,-0500,984122778101182469,bbpublichealth,Bismarck-Burleigh Public Health,,"If gathering with family for Thanksgiving, here are easy ways to collect your family’s health history:  •Talk to your family •Ask questions •Record info and update it when you learn family health history •Share family health history with your doctor and family members  https://t.co/FgdOkCbTAm",en,[],[],['https://pbs.twimg.com/media/FE9fHCaXoBATZF0.jpg'],0,0,0,[],[],https://twitter.com/BBPublicHealth/status/1463492979792957447,False,,1,https://pbs.twimg.com/media/FE9fHCaXoBATZF0.jpg,,,,,,,[],,,,
1463303889122439179,1463303889122439179,2021-11-23 19:30:08 Eastern Standard Time,2021-11-23,19:30:08,-0500,984122778101182469,bbpublichealth,Bismarck-Burleigh Public Health,,"E-cigarettes and vapes come in thousands of flavors. According to the 2021 National Youth Tobacco Survey (NTYS) “among youth who use flavored e-cigarettes the most frequently used flavors are fruit, candy flavors, then deserts, or other sweets.” For more:  https://t.co/uK2MwNm3KF  https://t.co/dSDdS9pSK5",en,[],['https://www.cdc.gov/mmwr/volumes/70/wr/mm7039a4.htm?s_cid=mm7039a4_w&utm_medium=email&utm_source=govdelivery'],['https://pbs.twimg.com/media/FE6zIgVXsAMQKRr.jpg'],0,0,0,[],[],https://twitter.com/BBPublicHealth/status/1463303889122439179,False,,1,https://pbs.twimg.com/media/FE6zIgVXsAMQKRr.jpg,,,,,,,[],,,,
1463258599761797131,1463258599761797131,2021-11-23 16:30:10 Eastern Standard Time,2021-11-23,16:30:10,-0500,984122778101182469,bbpublichealth,Bismarck-Burleigh Public Health,,"Fit in Favorites. No food is on the naughty list. Choose the dishes you really love and can’t get any other time of year, like your family’s favorite pumpkin pie. Slow down and savor a small serving.  https://t.co/huVNmBBTii",en,[],[],['https://pbs.twimg.com/media/FE6J8PjXEAUX-yD.jpg'],0,0,0,[],[],https://twitter.com/BBPublicHealth/status/1463258599761797131,False,,1,https://pbs.twimg.com/media/FE6J8PjXEAUX-yD.jpg,,,,,,,[],,,,
1463245982091694084,1463245982091694084,2021-11-23 15:40:02 Eastern Standard Time,2021-11-23,15:40:02,-0500,984122778101182469,bbpublichealth,Bismarck-Burleigh Public Health,,"The Surgeon General’s Community Toolkit for Addressing Health Misinformation provides guidance and resources for health care providers, educators, librarians, faith leaders, and community members to understand, identify, and stop health misinformation -  https://t.co/N36vg5QE0C.  https://t.co/zyJsJzywlz",en,[],['https://www.hhs.gov/sites/default/files/health-misinformation-toolkit-english.pdf'],['https://pbs.twimg.com/media/FE5-dxdXIAIeF2Y.jpg'],0,0,0,[],[],https://twitter.com/BBPublicHealth/status/1463245982091694084,False,,1,https://pbs.twimg.com/media/FE5-dxdXIAIeF2Y.jpg,,,,,,,[],,,,
1463221179175559174,1463221179175559174,2021-11-23 14:01:29 Eastern Standard Time,2021-11-23,14:01:29,-0500,984122778101182469,bbpublichealth,Bismarck-Burleigh Public Health,,We’re proud to be a #BeAntibioticsAware partner for U.S. Antibiotic Awareness Week! Learn how you can participate:  https://t.co/VzH8p3lQao #USAAW21  https://t.co/uoxoZPRzAX,en,[],['https://bit.ly/3042qDw'],['https://pbs.twimg.com/media/FE5n6C3WQAMKUpK.jpg'],0,0,0,"['beantibioticsaware', 'usaaw21']",[],https://twitter.com/BBPublicHealth/status/1463221179175559174,False,,1,https://pbs.twimg.com/media/FE5n6C3WQAMKUpK.jpg,,,,,,,[],,,,
1463130614136201220,1463130614136201220,2021-11-23 08:01:36 Eastern Standard Time,2021-11-23,08:01:36,-0500,984122778101182469,bbpublichealth,Bismarck-Burleigh Public Health,,"Does your family have a history of cancer, heart disease, diabetes, osteoporosis or other potentially life-altering conditions? Share that information when you all gather for Thanksgiving to help ensure future Thanksgivings with all your family.  https://t.co/lWRpRg0dEC",en,[],[],['https://pbs.twimg.com/media/FE4VilHXEAA-6Xu.jpg'],0,0,0,[],[],https://twitter.com/BBPublicHealth/status/1463130614136201220,False,,1,https://pbs.twimg.com/media/FE4VilHXEAA-6Xu.jpg,,,,,,,[],,,,
1462941498534764544,1462941498534764544,2021-11-22 19:30:08 Eastern Standard Time,2021-11-22,19:30:08,-0500,984122778101182469,bbpublichealth,Bismarck-Burleigh Public Health,,#Antibiotics are critical tools for treating life-threatening conditions such as pneumonia and sepsis. Get medical care immediately if you suspect #sepsis. #BeAntibioticsAware  https://t.co/WnDZYgVSHQ  #USAAW21  https://t.co/xMupWhSX3p,en,[],['http://bit.ly/2xMluHC'],['https://pbs.twimg.com/tweet_video_thumb/FE1piVTX0AYSulZ.jpg'],0,0,0,"['antibiotics', 'sepsis', 'beantibioticsaware', 'usaaw21']",[],https://twitter.com/BBPublicHealth/status/1462941498534764544,False,,1,https://pbs.twimg.com/tweet_video_thumb/FE1piVTX0AYSulZ.jpg,,,,,,,[],,,,
1462903910587371527,1462903910587371527,2021-11-22 17:00:46 Eastern Standard Time,2021-11-22,17:00:46,-0500,984122778101182469,bbpublichealth,Bismarck-Burleigh Public Health,,Guiding Principles for the Care of People with or at Risk for Diabetes helps identify and synthesize areas of agreement among guidelines to guide primary care providers and health care teams to deliver care to adults with or at risk for diabetes -  https://t.co/Rnji6JYh56.  https://t.co/mzmpdIiZNZ,en,[],['https://www.niddk.nih.gov/health-information/professionals/clinical-tools-patient-management/diabetes/guiding-principles-care-people-risk-diabetes'],['https://pbs.twimg.com/media/FE1HWkRWUAUytig.jpg'],0,0,0,[],[],https://twitter.com/BBPublicHealth/status/1462903910587371527,False,,1,https://pbs.twimg.com/media/FE1HWkRWUAUytig.jpg,,,,,,,[],,,,
1462858744153481223,1462858744153481223,2021-11-22 14:01:17 Eastern Standard Time,2021-11-22,14:01:17,-0500,984122778101182469,bbpublichealth,Bismarck-Burleigh Public Health,,Talking openly and honestly with your children about this topic and your household expectations is one of the most effective ways to prevent marijuana use in your child. Learn more ➡ at  https://t.co/JIEz0BYVJB  https://t.co/j1vK9wwNbR,en,[],['http://parentslead.org'],['https://pbs.twimg.com/media/FE0eRrOXsAsL200.png'],0,0,0,[],[],https://twitter.com/BBPublicHealth/status/1462858744153481223,False,,1,https://pbs.twimg.com/media/FE0eRrOXsAsL200.png,,,,,,,[],,,,
1462828546913714180,1462828546913714180,2021-11-22 12:01:18 Eastern Standard Time,2021-11-22,12:01:18,-0500,984122778101182469,bbpublichealth,Bismarck-Burleigh Public Health,,"On Public Health Thank You Day, we want to recognize all of the individuals who have helped make a difference during this challenging time. Thank you for time and talent during the past year, and for your support during the rest of 2021 and into 2022.  https://t.co/owR2oIR2dD",en,[],[],['https://pbs.twimg.com/media/FE0Cz3oX0AMKgWW.jpg'],0,2,2,[],[],https://twitter.com/BBPublicHealth/status/1462828546913714180,False,,1,https://pbs.twimg.com/media/FE0Cz3oX0AMKgWW.jpg,,,,,,,[],,,,
1462803445371609089,1462803445371609089,2021-11-22 10:21:33 Eastern Standard Time,2021-11-22,10:21:33,-0500,984122778101182469,bbpublichealth,Bismarck-Burleigh Public Health,,CDC has released a new infographic that illustrates steps for determining close contacts within the K–12 school setting. The infographic also contains recommendations for close contacts quarantine -  https://t.co/9frFsZun3o  https://t.co/AOfjYtiUwZ,en,[],['https://www.cdc.gov/coronavirus/2019-ncov/daily-life-coping/K-12-infographic.html'],['https://pbs.twimg.com/media/FEzr-0GXEAMvL0d.jpg'],0,0,1,[],[],https://twitter.com/BBPublicHealth/status/1462803445371609089,False,,1,https://pbs.twimg.com/media/FEzr-0GXEAMvL0d.jpg,,,,,,,[],,,,
1462798413318467591,1462798413318467591,2021-11-22 10:01:33 Eastern Standard Time,2021-11-22,10:01:33,-0500,984122778101182469,bbpublichealth,Bismarck-Burleigh Public Health,,Eat slowly. It takes at least 20 minutes for your brain to realize you’re full.  https://t.co/U2ozkhefF8,en,[],[],['https://pbs.twimg.com/media/FEznZ5iXEAgqcPk.jpg'],0,0,1,[],[],https://twitter.com/BBPublicHealth/status/1462798413318467591,False,,1,https://pbs.twimg.com/media/FEznZ5iXEAgqcPk.jpg,,,,,,,[],,,,
1462768171778293763,1462768171778293763,2021-11-22 08:01:23 Eastern Standard Time,2021-11-22,08:01:23,-0500,984122778101182469,bbpublichealth,Bismarck-Burleigh Public Health,,Ready to thaw your Turkey? Use these tips to help thaw your poultry safely:  https://t.co/1yyy9SGwOo.  https://t.co/JgZzmqSyyR,en,[],['https://www.fsis.usda.gov/food-safety/safe-food-handling-and-preparation/poultry/turkey-basics-safe-thawing'],['https://pbs.twimg.com/media/FEzL5nYXMAAAkzX.jpg'],0,0,0,[],[],https://twitter.com/BBPublicHealth/status/1462768171778293763,False,,1,https://pbs.twimg.com/media/FEzL5nYXMAAAkzX.jpg,,,,,,,[],,,,
1462579097268375558,1462579097268375558,2021-11-21 19:30:04 Eastern Standard Time,2021-11-21,19:30:04,-0500,984122778101182469,bbpublichealth,Bismarck-Burleigh Public Health,,Parents/caregivers: Have a sick child? Antibiotics aren’t always the answer. Use the right tool:  https://t.co/kUoiHw405o #USAAW21 #BeAntibioticsAware  https://t.co/XSN6HrKK0k,en,[],['http://bit.ly/2NcGbCR'],['https://pbs.twimg.com/media/FEwf8CsXMAAUwjT.jpg'],0,0,0,"['usaaw21', 'beantibioticsaware']",[],https://twitter.com/BBPublicHealth/status/1462579097268375558,False,,1,https://pbs.twimg.com/media/FEwf8CsXMAAUwjT.jpg,,,,,,,[],,,,
1462533809786789894,1462533809786789894,2021-11-21 16:30:07 Eastern Standard Time,2021-11-21,16:30:07,-0500,984122778101182469,bbpublichealth,Bismarck-Burleigh Public Health,,Don’t skip meals to save up for a feast. You’ll be really hungry and more likely to overeat.  https://t.co/KacVG4dRFp,en,[],[],['https://pbs.twimg.com/media/FEv2v8TXIAIGCKv.jpg'],0,0,0,[],[],https://twitter.com/BBPublicHealth/status/1462533809786789894,False,,1,https://pbs.twimg.com/media/FEv2v8TXIAIGCKv.jpg,,,,,,,[],,,,
