id,conversation_id,created_at,date,time,timezone,user_id,username,name,place,tweet,language,mentions,urls,photos,replies_count,retweets_count,likes_count,hashtags,cashtags,link,retweet,quote_url,video,thumbnail,near,geo,source,user_rt_id,user_rt,retweet_id,reply_to,retweet_date,translate,trans_src,trans_dest
1404485974613106689,1404485974613106689,2021-06-14 13:08:45 Eastern Daylight Time,2021-06-14,13:08:45,-0500,596771292,marinhhs,MarinHealth&HumanSvc,,Choose the right job and find needed resources. #MarinCity virtual job and resource fair! Access free resources and get help to prepare for your next job.  https://t.co/t4qXUSf5Jx,en,[],[],['https://pbs.twimg.com/media/E328gJjVkAQjdEw.jpg'],0,3,4,['marincity'],[],https://twitter.com/MarinHHS/status/1404485974613106689,False,,1,https://pbs.twimg.com/media/E328gJjVkAQjdEw.jpg,,,,,,,[],,,,
1403478115762855939,1403478115762855939,2021-06-11 18:23:52 Eastern Daylight Time,2021-06-11,18:23:52,-0500,596771292,marinhhs,MarinHealth&HumanSvc,,"Community alert about operational changes for #CareerPointMarin, effective July 1st. Full details available in the news release:  https://t.co/wtciwToKqb",en,[],['http://marincounty.org/main/county-press-releases/press-releases/2021/hhs-careerpointchanges-061121'],[],0,1,1,['careerpointmarin'],[],https://twitter.com/MarinHHS/status/1403478115762855939,False,https://twitter.com/maringov/status/1403471396081070081,0,,,,,,,,[],,,,
1403062562120339459,1403062562120339459,2021-06-10 14:52:37 Eastern Daylight Time,2021-06-10,14:52:37,-0500,596771292,marinhhs,MarinHealth&HumanSvc,,Congrats to 2021 grads! #CelebrateSafely,en,[],[],[],0,0,1,['celebratesafely'],[],https://twitter.com/MarinHHS/status/1403062562120339459,False,https://twitter.com/maringov/status/1402751082737004546,0,,,,,,,,[],,,,
1403042469009235968,1403042469009235968,2021-06-10 13:32:46 Eastern Daylight Time,2021-06-10,13:32:46,-0500,596771292,marinhhs,MarinHealth&HumanSvc,,Come work with us! #MarinJobs #PublicHealth,en,[],[],[],0,0,1,"['marinjobs', 'publichealth']",[],https://twitter.com/MarinHHS/status/1403042469009235968,False,https://twitter.com/maringovjobs/status/1402294867276054539,0,,,,,,,,[],,,,
1403024780345757696,1403024780345757696,2021-06-10 12:22:29 Eastern Daylight Time,2021-06-10,12:22:29,-0500,596771292,marinhhs,MarinHealth&HumanSvc,,"We are pleased to announce the promotion of Teresa Higuera to the position of Social Services Unit Supervisor, Children and Family Services. Congrats Teresa! #EmployeeSpotlight  https://t.co/FuobsjaONh  https://t.co/ByUz8XNPMc",en,[],['https://foster.marinhhs.org/'],['https://pbs.twimg.com/media/E3iLTKfVkAAaUht.jpg'],0,0,1,['employeespotlight'],[],https://twitter.com/MarinHHS/status/1403024780345757696,False,,1,https://pbs.twimg.com/media/E3iLTKfVkAAaUht.jpg,,,,,,,[],,,,
1402302260743315460,1402302260743315460,2021-06-08 12:31:27 Eastern Daylight Time,2021-06-08,12:31:27,-0500,596771292,marinhhs,MarinHealth&HumanSvc,,"Join us as we discuss key actions that #Marin residents can take to make our community safe from gun violence. Gun Safety in Marin: Let's Start the Conversation. When: June 17, 2021 at 6:00-7:30 pm.  https://t.co/84O0p7ZUxH",en,[],[],['https://pbs.twimg.com/media/E3X5ab4UcAULTXx.jpg'],0,3,6,['marin'],[],https://twitter.com/MarinHHS/status/1402302260743315460,False,,1,https://pbs.twimg.com/media/E3X5ab4UcAULTXx.jpg,,,,,,,[],,,,
1400944695946072067,1400944695946072067,2021-06-04 18:36:58 Eastern Daylight Time,2021-06-04,18:36:58,-0500,596771292,marinhhs,MarinHealth&HumanSvc,,"As of early June, 40% of #Marin's foster children are placed in homes outside of Marin due to the lack of local resource families. For more information and to register for the June 9 or July 7 orientation meetings, visit  https://t.co/tWiLSnSlwK.  https://t.co/mmHVgd5oD9  https://t.co/RIPHrDuEzY",en,[],"['http://FosterOurFutureMarin.org', 'http://marincounty.org/main/county-press-releases/press-releases/2021/hhs-fosteryouths-060421']",['https://pbs.twimg.com/media/E3EnfsRUcAMbqkG.jpg'],0,7,7,['marin'],[],https://twitter.com/MarinHHS/status/1400944695946072067,False,,1,https://pbs.twimg.com/media/E3EnfsRUcAMbqkG.jpg,,,,,,,[],,,,
1400226010306551808,1400226010306551808,2021-06-02 19:01:10 Eastern Daylight Time,2021-06-02,19:01:10,-0500,596771292,marinhhs,MarinHealth&HumanSvc,,"We are pleased to announce that Rosie Hernandez has been promoted to the position of Children and Family Services Unit Supervisor, Social Services Division. Congrats Rosie! #MarinHHS #EmployeeSpotlight  https://t.co/IbVWAdCHJY",en,[],[],['https://pbs.twimg.com/media/E26aHKyVcAMhkET.jpg'],0,1,6,"['marinhhs', 'employeespotlight']",[],https://twitter.com/MarinHHS/status/1400226010306551808,False,,1,https://pbs.twimg.com/media/E26aHKyVcAMhkET.jpg,,,,,,,[],,,,
1400124259817558019,1400124259817558019,2021-06-02 12:16:51 Eastern Daylight Time,2021-06-02,12:16:51,-0500,596771292,marinhhs,MarinHealth&HumanSvc,,Come work with us! #PublicHealth #MarinJobs,en,[],[],[],0,1,1,"['publichealth', 'marinjobs']",[],https://twitter.com/MarinHHS/status/1400124259817558019,False,https://twitter.com/maringovjobs/status/1400120421916229632,0,,,,,,,,[],,,,
1399760546493202435,1399760546493202435,2021-06-01 12:11:35 Eastern Daylight Time,2021-06-01,12:11:35,-0500,596771292,marinhhs,MarinHealth&HumanSvc,,Come work for @MarinHHS! #SocialWorker,en,"[{'screen_name': 'marinhhs', 'name': 'marinhealth&humansvc', 'id': '596771292'}]",[],[],0,2,4,['socialworker'],[],https://twitter.com/MarinHHS/status/1399760546493202435,False,https://twitter.com/maringovjobs/status/1399757978295808012,0,,,,,,,,[],,,,
1398104829700972544,1398104829700972544,2021-05-27 22:32:21 Eastern Daylight Time,2021-05-27,22:32:21,-0500,596771292,marinhhs,MarinHealth&HumanSvc,,"Need support? Trained counselors at the Crisis Text Line are here to help. They will help you by asking questions, empathizing, and actively listening. Text MARIN to 741741 for free, 24/7, confidential support. #CrisisTextLine #MarinCounty #MentalHealthMatters  https://t.co/a5QNh72a0k",en,[],[],['https://pbs.twimg.com/media/E2cQww-VUAEjndo.jpg'],0,1,4,"['crisistextline', 'marincounty', 'mentalhealthmatters']",[],https://twitter.com/MarinHHS/status/1398104829700972544,False,,1,https://pbs.twimg.com/media/E2cQww-VUAEjndo.jpg,,,,,,,[],,,,
1396914647559593988,1396914647559593988,2021-05-24 15:43:00 Eastern Daylight Time,2021-05-24,15:43:00,-0500,596771292,marinhhs,MarinHealth&HumanSvc,,"If you are ever in need of support, Crisis Text Line is there to offer help. Connect with a trained Crisis Counselor and share your feelings in full confidentiality. For a safe space to talk, Text MARIN to 741741 for free, 24/7, confidential support. #CrisisTextLine #MarinCounty  https://t.co/YzPWWiQWw4",en,[],[],['https://pbs.twimg.com/media/E2LWVSpVEAAA2ry.jpg'],0,3,2,"['crisistextline', 'marincounty']",[],https://twitter.com/MarinHHS/status/1396914647559593988,False,,1,https://pbs.twimg.com/media/E2LWVSpVEAAA2ry.jpg,,,,,,,[],,,,
