id,conversation_id,created_at,date,time,timezone,user_id,username,name,place,tweet,language,mentions,urls,photos,replies_count,retweets_count,likes_count,hashtags,cashtags,link,retweet,quote_url,video,thumbnail,near,geo,source,user_rt_id,user_rt,retweet_id,reply_to,retweet_date,translate,trans_src,trans_dest
1329122800775393280,1329122800775393280,2020-11-18 13:02:24 Eastern Standard Time,2020-11-18,13:02:24,-0500,94647670,healthymc,Mason County Health,,"November 18 is #WorldCOPDDay. Smoking causes COPD, which robs the lungs of air. People with COPD have trouble breathing and slowly start to die from lack of air. It’s never too early or never too late to start being smoke-free. Visit  https://t.co/cnrq7008i5 for resources.  https://t.co/sKV4hjIla9",en,[],['https://smokefree.gov/'],['https://pbs.twimg.com/tweet_video_thumb/EnH-I3uW8AASUoa.jpg'],0,1,0,['worldcopdday'],[],https://twitter.com/HealthyMC/status/1329122800775393280,False,,1,https://pbs.twimg.com/tweet_video_thumb/EnH-I3uW8AASUoa.jpg,,,,,,,[],,,,
1326586791286202375,1326586791286202375,2020-11-11 13:05:12 Eastern Standard Time,2020-11-11,13:05:12,-0500,94647670,healthymc,Mason County Health,,"Hoy es el Dia de los Veteranos. ¿Sabía que la tasa actual de fumadores entre veteranos es más alta que el promedio nacional para adultos? Si usted o un ser querido quiere dejar de fumar, obtenga recursos gratuitos en  https://t.co/C9Qs00oUeP de la @FDATobacco.  https://t.co/8crah9rlsN",es,"[{'screen_name': 'fdatobacco', 'name': 'fda tobacco', 'id': '158006058'}]",['http://smokefree.gov/veterans'],['https://pbs.twimg.com/media/Emj7p91XUAICLzF.jpg'],0,0,0,[],[],https://twitter.com/HealthyMC/status/1326586791286202375,False,,1,https://pbs.twimg.com/media/Emj7p91XUAICLzF.jpg,,,,,,,[],,,,
1326586062802706434,1326586062802706434,2020-11-11 13:02:18 Eastern Standard Time,2020-11-11,13:02:18,-0500,94647670,healthymc,Mason County Health,,"Today we celebrate #VeteransDay. Did you know, the current smoking rate among veterans is higher than the national adult average? If you or a loved one are ready to be smoke-free, visit  https://t.co/C9Qs00oUeP for free resources via @FDATobacco.  https://t.co/9D2nkdDVI0",en,"[{'screen_name': 'fdatobacco', 'name': 'fda tobacco', 'id': '158006058'}]",['http://smokefree.gov/veterans'],['https://pbs.twimg.com/media/Emj6_leWMAIf9-6.jpg'],0,0,0,['veteransday'],[],https://twitter.com/HealthyMC/status/1326586062802706434,False,,1,https://pbs.twimg.com/media/Emj6_leWMAIf9-6.jpg,,,,,,,[],,,,
1326223587146141701,1326223587146141701,2020-11-10 13:01:57 Eastern Standard Time,2020-11-10,13:01:57,-0500,94647670,healthymc,Mason County Health,,Cigarette smokers are 30%-40% more likely to develop type 2 diabetes compared to non-smokers. During #NationalDiabetesMonth – and every month – help decrease your chances of developing diabetes by living smoke-free. Visit  https://t.co/nD7lhaiU7j for resources via @FDATobacco  https://t.co/nX2qcZM8Lk,en,"[{'screen_name': 'fdatobacco', 'name': 'fda tobacco', 'id': '158006058'}]",['https://smokefree.gov'],['https://pbs.twimg.com/media/EmexUtMWEAEygLO.jpg'],0,0,0,['nationaldiabetesmonth'],[],https://twitter.com/HealthyMC/status/1326223587146141701,False,,1,https://pbs.twimg.com/media/EmexUtMWEAEygLO.jpg,,,,,,,[],,,,
1324049030494752769,1324049030494752769,2020-11-04 13:01:03 Eastern Standard Time,2020-11-04,13:01:03,-0500,94647670,healthymc,Mason County Health,,November is #NationalDiabetesMonth. Smoking cigarettes increases the risk of developing type 2 diabetes and makes it more difficult to manage. Check out  https://t.co/nD7lhaiU7j to learn more about why it’s important to stay smoke-free via @FDATobacco  https://t.co/9j8N8Bp4mZ,en,"[{'screen_name': 'fdatobacco', 'name': 'fda tobacco', 'id': '158006058'}]",['https://smokefree.gov'],['https://pbs.twimg.com/tweet_video_thumb/El_3kr4WkAMkI1a.jpg'],0,1,0,['nationaldiabetesmonth'],[],https://twitter.com/HealthyMC/status/1324049030494752769,False,,1,https://pbs.twimg.com/tweet_video_thumb/El_3kr4WkAMkI1a.jpg,,,,,,,[],,,,
1268573756471025666,1268573756471025666,2020-06-04 12:02:07 Eastern Daylight Time,2020-06-04,12:02:07,-0500,94647670,healthymc,Mason County Health,,June is #CataractAwarenessMonth. Smoking causes cataracts. Being smoke-free can benefit your health at any age. Protect your 👀👀 and stay smoke-free.  https://t.co/17trm93KvP via @FDATobacco  https://t.co/EU5qC4AVKp,en,"[{'screen_name': 'fdatobacco', 'name': 'fda tobacco', 'id': '158006058'}]",['https://60plus.smokefree.gov/'],['https://pbs.twimg.com/media/EZrhG5AWkAEvKCQ.jpg'],0,0,0,['cataractawarenessmonth'],[],https://twitter.com/HealthyMC/status/1268573756471025666,False,,1,https://pbs.twimg.com/media/EZrhG5AWkAEvKCQ.jpg,,,,,,,[],,,,
1268211474591354881,1268211474591354881,2020-06-03 12:02:32 Eastern Daylight Time,2020-06-03,12:02:32,-0500,94647670,healthymc,Mason County Health,,Sabía que las investigaciones muestran que las personas que dejan de #fumar de una vez y por todas sienten menos #estrés que las que continúan fumando. Tome el primer paso para romper el hábito:  https://t.co/nD7lhaiU7j de la @FDATobacco #MensHealthMonth #MesdelaSaluddelHombre  https://t.co/RlDASwow5u,es,"[{'screen_name': 'fdatobacco', 'name': 'fda tobacco', 'id': '158006058'}]",['https://smokefree.gov'],['https://pbs.twimg.com/media/EZmXnWkWsAgzqJ7.jpg'],0,0,0,"['fumar', 'estrés', 'menshealthmonth', 'mesdelasaluddelhombre']",[],https://twitter.com/HealthyMC/status/1268211474591354881,False,,1,https://pbs.twimg.com/media/EZmXnWkWsAgzqJ7.jpg,,,,,,,[],,,,
1268211468404756480,1268211468404756480,2020-06-03 12:02:30 Eastern Daylight Time,2020-06-03,12:02:30,-0500,94647670,healthymc,Mason County Health,,#DYK research shows that people who quit smoking for good feel less stress than people who continue to smoke? #MensHealthMonth Start your journey to being smoke-free:  https://t.co/nD7lhaiU7j via @FDATobacco  https://t.co/Xc4sqy4Vrq,en,"[{'screen_name': 'fdatobacco', 'name': 'fda tobacco', 'id': '158006058'}]",['https://smokefree.gov'],['https://pbs.twimg.com/media/EZmXm_4WAAUoDlE.jpg'],0,0,0,"['dyk', 'menshealthmonth']",[],https://twitter.com/HealthyMC/status/1268211468404756480,False,,1,https://pbs.twimg.com/media/EZmXm_4WAAUoDlE.jpg,,,,,,,[],,,,
1267939258310053894,1267939258310053894,2020-06-02 18:00:51 Eastern Daylight Time,2020-06-02,18:00:51,-0500,94647670,healthymc,Mason County Health,,"Vaccinating children on time is the best way to protect them from vaccine preventable diseases, like measles and pertussis. Call your doctor to see how they’re making clinics safe during #COVID19. #VaccinesWork  https://t.co/ftRlrMUvzp",en,[],[],['https://pbs.twimg.com/media/EZigCT9WsAI5Gpj.jpg'],0,1,0,"['covid19', 'vaccineswork']",[],https://twitter.com/HealthyMC/status/1267939258310053894,False,,1,https://pbs.twimg.com/media/EZigCT9WsAI5Gpj.jpg,,,,,,,[],,,,
1267848838947254277,1267848838947254277,2020-06-02 12:01:33 Eastern Daylight Time,2020-06-02,12:01:33,-0500,94647670,healthymc,Mason County Health,,¿Sabía que 2 de cada 3 #hombres adultos que fuman desean dejar de hacerlo? Encuentre recursos que lo ayudarán a romper el hábito para siempre:  https://t.co/nD7lhaiU7j de la @FDATobacco #MensHealthMonth #MesdelaSaluddelHombre  https://t.co/qLgngs8s2s,es,"[{'screen_name': 'fdatobacco', 'name': 'fda tobacco', 'id': '158006058'}]",['https://smokefree.gov'],['https://pbs.twimg.com/media/EZhNzL0XgAYeNgF.jpg'],0,0,0,"['hombres', 'menshealthmonth', 'mesdelasaluddelhombre']",[],https://twitter.com/HealthyMC/status/1267848838947254277,False,,1,https://pbs.twimg.com/media/EZhNzL0XgAYeNgF.jpg,,,,,,,[],,,,
1267577792348250116,1267577792348250116,2020-06-01 18:04:30 Eastern Daylight Time,2020-06-01,18:04:30,-0500,94647670,healthymc,Mason County Health,,Stay up to date on your child’s vaccinations during #COVID19. Clinics have changed their safety procedures to make it safer for kids to get needed vaccines – call your doctor today! #CallYourPediatrician  https://t.co/dJCzynKTrQ,en,[],[],['https://pbs.twimg.com/media/EZdXSOuWAAE4eBu.jpg'],1,0,1,"['covid19', 'callyourpediatrician']",[],https://twitter.com/HealthyMC/status/1267577792348250116,False,,1,https://pbs.twimg.com/media/EZdXSOuWAAE4eBu.jpg,,,,,,,[],,,,
1267486428361080834,1267486428361080834,2020-06-01 12:01:27 Eastern Daylight Time,2020-06-01,12:01:27,-0500,94647670,healthymc,Mason County Health,,Junio es el Mes de la Salud del #Hombre. Dedique tiempo este mes para aprender cómo el tabaquismo puede afectar la salud y el bienestar de los hombres y busque recursos que lo ayudarán a dejar de fumar:  https://t.co/nD7lhaiU7j de la @FDATobacco #MesdelaSaluddelHombre  https://t.co/TgPYrPYZlr,es,"[{'screen_name': 'fdatobacco', 'name': 'fda tobacco', 'id': '158006058'}]",['https://smokefree.gov'],['https://pbs.twimg.com/media/EZcELv_XsAAUpD1.jpg'],0,1,0,"['hombre', 'mesdelasaluddelhombre']",[],https://twitter.com/HealthyMC/status/1267486428361080834,False,,1,https://pbs.twimg.com/media/EZcELv_XsAAUpD1.jpg,,,,,,,[],,,,
1267486422958735360,1267486422958735360,2020-06-01 12:01:26 Eastern Daylight Time,2020-06-01,12:01:26,-0500,94647670,healthymc,Mason County Health,,June is #MensHealthMonth. Take time this month to learn how smoking can impact the health and well-being of men and find resources to help you stay smoke-free:  https://t.co/nD7lhaiU7j via @FDATobacco  https://t.co/vSSaLTtwwe,en,"[{'screen_name': 'fdatobacco', 'name': 'fda tobacco', 'id': '158006058'}]",['https://smokefree.gov'],['https://pbs.twimg.com/media/EZcELz6XkAAsupr.jpg'],0,1,0,['menshealthmonth'],[],https://twitter.com/HealthyMC/status/1267486422958735360,False,,1,https://pbs.twimg.com/media/EZcELz6XkAAsupr.jpg,,,,,,,[],,,,
1266081941054525440,1266081941054525440,2020-05-28 15:00:32 Eastern Daylight Time,2020-05-28,15:00:32,-0500,94647670,healthymc,Mason County Health,,"Stay Safe, Stay Healthy, Stay Vaccinated! Talk with your doctor or clinic today about the immunizations your child needs to stay healthy, and to see what safety measures they put in place to protect your family during COVID-19. #StaySafeStayVaccinated  https://t.co/Iqs2mVdPRg",en,[],[],['https://pbs.twimg.com/media/EZIG0NfXQAAeAqx.jpg'],0,0,0,['staysafestayvaccinated'],[],https://twitter.com/HealthyMC/status/1266081941054525440,False,,1,https://pbs.twimg.com/media/EZIG0NfXQAAeAqx.jpg,,,,,,,[],,,,
1266043588263190528,1266043588263190528,2020-05-28 12:28:08 Eastern Daylight Time,2020-05-28,12:28:08,-0500,94647670,healthymc,Mason County Health,,"It’s easier to quit vaping when you have an enormous support system. We’ve got that *and* an easy-to-use, confidential text-to-quit service. Text VAPEFREEWA to 88709.  https://t.co/L6IvYGzmoU",en,[],[],['https://pbs.twimg.com/media/EZHj7waX0AEcxAr.jpg'],0,0,0,[],[],https://twitter.com/HealthyMC/status/1266043588263190528,False,,1,https://pbs.twimg.com/media/EZHj7waX0AEcxAr.jpg,,,,,,,[],,,,
1262413629619666950,1262413629619666950,2020-05-18 12:03:58 Eastern Daylight Time,2020-05-18,12:03:58,-0500,94647670,healthymc,Mason County Health,,Ready to quit JUUL? You’ve got this. And we’ve got your back. Text VAPEFREEWA to 88709 for an easy-to-use (and free) support system at your fingertips.  https://t.co/LJ1dPcTEb6,en,[],[],['https://pbs.twimg.com/media/EYT-gXeXQAUcDxB.jpg'],0,0,0,[],[],https://twitter.com/HealthyMC/status/1262413629619666950,False,,1,https://pbs.twimg.com/media/EYT-gXeXQAUcDxB.jpg,,,,,,,[],,,,
1260238646348832768,1260238646348832768,2020-05-12 12:01:22 Eastern Daylight Time,2020-05-12,12:01:22,-0500,94647670,healthymc,Mason County Health,,"As we learn more about #COVID19 we're finding that smoking can make it harder for you to recover, and makes you more likely to get severely ill. Vaping may also dangerously damage lung health. Get free quitting support at 1-800-QUIT-NOW or  https://t.co/NXXoEynltN.  https://t.co/gso6Ivn7gF",en,[],['http://doh.wa.gov/quit'],['https://pbs.twimg.com/media/EX1EXshXkAMbbg6.jpg'],0,0,0,['covid19'],[],https://twitter.com/HealthyMC/status/1260238646348832768,False,,1,https://pbs.twimg.com/media/EX1EXshXkAMbbg6.jpg,,,,,,,[],,,,
1230990859157549056,1230990859157549056,2020-02-21 18:01:06 Eastern Standard Time,2020-02-21,18:01:06,-0500,94647670,healthymc,Mason County Health,,Ready to quit JUUL? You’ve got this. And we’ve got your back. Text VAPEFREEWA to 88709 for an easy-to-use (and free) support system at your fingertips.  https://t.co/owov6WhXZS,en,[],[],['https://pbs.twimg.com/tweet_video_thumb/ERVbqaqX0AEG_nJ.jpg'],0,2,1,[],[],https://twitter.com/HealthyMC/status/1230990859157549056,False,,1,https://pbs.twimg.com/tweet_video_thumb/ERVbqaqX0AEG_nJ.jpg,,,,,,,[],,,,
1230628498072535043,1230628498072535043,2020-02-20 18:01:12 Eastern Standard Time,2020-02-20,18:01:12,-0500,94647670,healthymc,Mason County Health,,"3 million+ young people use e-cigarettes, like JUUL, which means they’re all at risk for nicotine addiction — but there are ways to help. Youth and young adults can text VAPEFREEWA to 88709 to join This is Quitting, a free text-to-quit program from @truthinitiative  https://t.co/WEVEY2ZiFA",en,"[{'screen_name': 'truthinitiative', 'name': 'truth initiative', 'id': '38691916'}]",[],['https://pbs.twimg.com/media/ERQSGMQXkAA8pgX.jpg'],0,0,0,[],[],https://twitter.com/HealthyMC/status/1230628498072535043,False,,1,https://pbs.twimg.com/media/ERQSGMQXkAA8pgX.jpg,,,,,,,[],,,,
1230265977641881600,1230265977641881600,2020-02-19 18:00:40 Eastern Standard Time,2020-02-19,18:00:40,-0500,94647670,healthymc,Mason County Health,,"Young e-cigarette users are 4x more likely to start smoking cigarettes than their peers who don’t vape. But quitting e-cigarettes is possible. Youth and young adults can text VAPEFREEWA to 88709 to join This is Quitting, a free text-to-quit program from Truth Initiative  https://t.co/GGbpupanzQ",en,[],[],['https://pbs.twimg.com/media/ERLIYsAWkAI3wbz.jpg'],0,0,0,[],[],https://twitter.com/HealthyMC/status/1230265977641881600,False,,1,https://pbs.twimg.com/media/ERLIYsAWkAI3wbz.jpg,,,,,,,[],,,,
1230188281926545408,1230188281926545408,2020-02-19 12:51:56 Eastern Standard Time,2020-02-19,12:51:56,-0500,94647670,healthymc,Mason County Health,, https://t.co/YStMkLhxTx,und,[],[],['https://pbs.twimg.com/media/ERKBt7TVUAInC5M.png'],0,0,1,[],[],https://twitter.com/HealthyMC/status/1230188281926545408,False,,1,https://pbs.twimg.com/media/ERKBt7TVUAInC5M.png,,,,,,,[],,,,
1229903482989268992,1229903482989268992,2020-02-18 18:00:15 Eastern Standard Time,2020-02-18,18:00:15,-0500,94647670,healthymc,Mason County Health,,"In response to the youth vaping epidemic, @truthinitiative created This is Quitting, a free text message e-cigarette quit program. Youth and young adults can access the program by texting VAPEFREEWA to 88709.  https://t.co/9SmdEu3pmX",en,"[{'screen_name': 'truthinitiative', 'name': 'truth initiative', 'id': '38691916'}]",[],['https://pbs.twimg.com/media/ERF-swuXUAcxhNq.jpg'],0,0,3,[],[],https://twitter.com/HealthyMC/status/1229903482989268992,False,,1,https://pbs.twimg.com/media/ERF-swuXUAcxhNq.jpg,,,,,,,[],,,,
1226945244106756097,1226945244106756097,2020-02-10 14:05:16 Eastern Standard Time,2020-02-10,14:05:16,-0500,94647670,healthymc,Mason County Health,,Don’t wait until your teen tries marijuana to talk about it. Lots of great advice in this guide for parents!  https://t.co/lgzNUG9QzK  https://t.co/tp1vOb0cIj,en,[],['http://learnaboutmarijuanawa.org/parentpreventionbooklet2014.pdf'],['https://pbs.twimg.com/media/EQb8MowXYAYCatG.png'],0,0,1,[],[],https://twitter.com/HealthyMC/status/1226945244106756097,False,,1,https://pbs.twimg.com/media/EQb8MowXYAYCatG.png,,,,,,,[],,,,
1225858064248705025,1225858064248705025,2020-02-07 14:05:12 Eastern Standard Time,2020-02-07,14:05:12,-0500,94647670,healthymc,Mason County Health,,"The “marijuana talk” can be hard, but it’s necessary. These tips can help make it a success.  https://t.co/Vh4RMVeeIu  https://t.co/SZ4Vps8LWX",en,[],['http://bit.ly/1Jeebu1'],['https://pbs.twimg.com/media/EQMfabfW4AYJToQ.png'],0,0,1,[],[],https://twitter.com/HealthyMC/status/1225858064248705025,False,,1,https://pbs.twimg.com/media/EQMfabfW4AYJToQ.png,,,,,,,[],,,,
1225486371550355459,1225486371550355459,2020-02-06 13:28:14 Eastern Standard Time,2020-02-06,13:28:14,-0500,94647670,healthymc,Mason County Health,, https://t.co/wdGcduyw7F #UndertheInfluenceofYou  https://t.co/QTsZQ7yb7q,und,[],['http://StartTalkingNow.org'],['https://pbs.twimg.com/media/EQHNWqdWkAECeOH.jpg'],0,0,0,['undertheinfluenceofyou'],[],https://twitter.com/HealthyMC/status/1225486371550355459,False,,1,https://pbs.twimg.com/media/EQHNWqdWkAECeOH.jpg,,,,,,,[],,,,
1225484107364360192,1225484107364360192,2020-02-06 13:19:14 Eastern Standard Time,2020-02-06,13:19:14,-0500,94647670,healthymc,Mason County Health,,Empiece a hablar sobre marihuana. Asegúrese de que ellos le cuenten primero a usted.  https://t.co/5ZM1cJYqEV  https://t.co/epcH1naGAU,es,[],['https://www.starttalkingnow.org/padres'],[],0,0,0,[],[],https://twitter.com/HealthyMC/status/1225484107364360192,False,,1,https://pbs.twimg.com/ext_tw_video_thumb/1225484057007525888/pu/img/CaQu-t9YPMU1K8ks.jpg,,,,,,,[],,,,
1225133284121874437,1225133284121874437,2020-02-05 14:05:11 Eastern Standard Time,2020-02-05,14:05:11,-0500,94647670,healthymc,Mason County Health,, https://t.co/lEJM3E5xOW,und,[],['https://www.facebook.com/cdctobaccofree/videos/2460529544276264/'],[],0,0,0,[],[],https://twitter.com/HealthyMC/status/1225133284121874437,False,,0,,,,,,,,[],,,,
1224767106513690624,1224767106513690624,2020-02-04 13:50:07 Eastern Standard Time,2020-02-04,13:50:07,-0500,94647670,healthymc,Mason County Health,, https://t.co/MMpT56eC56,und,[],['https://twitter.com/CDCTobaccoFree/status/1221867854083039234'],[],0,0,0,[],[],https://twitter.com/HealthyMC/status/1224767106513690624,False,https://twitter.com/CDCTobaccoFree/status/1221867854083039234,0,,,,,,,,[],,,,
1224388636990263297,1224388636990263297,2020-02-03 12:46:13 Eastern Standard Time,2020-02-03,12:46:13,-0500,94647670,healthymc,Mason County Health,,"""Currently the risk to the general public is low. At this time, there are a small number of individual cases in the U.S. To minimize the risk of spread, health officials are working with healthcare providers...""  https://t.co/fTzEEqf2G5",en,[],['https://www.doh.wa.gov/Portals/1/Documents/1600/NovelCoronavirusFactSheet.pdf?fbclid=IwAR0_87SDHROd_fkmZjbPUQEdEgN8wqcQLcgK38YHMcna_DFdG4hGw6U_jpI'],[],0,0,0,[],[],https://twitter.com/HealthyMC/status/1224388636990263297,False,,0,,,,,,,,[],,,,
1221207402898477056,1221207402898477056,2020-01-25 18:05:08 Eastern Standard Time,2020-01-25,18:05:08,-0500,94647670,healthymc,Mason County Health,,"¿Sabía que fumar durante el embarazo puede causar complicaciones como un parto prematuro y bebés que nacen con bajo peso? Si espera un bebé, aprenda a dejar de fumar con los consejos y recursos gratis del sitio web  https://t.co/RnqFbpCd8h de la @FDATobacco  https://t.co/dMqUJXblsX",es,"[{'screen_name': 'fdatobacco', 'name': 'fda tobacco', 'id': '158006058'}]",['https://espanol.smokefree.gov/'],['https://pbs.twimg.com/media/EPKZqR4VAAAO2y2.jpg'],0,0,0,[],[],https://twitter.com/HealthyMC/status/1221207402898477056,False,,1,https://pbs.twimg.com/media/EPKZqR4VAAAO2y2.jpg,,,,,,,[],,,,
1221206272621629443,1221206272621629443,2020-01-25 18:00:38 Eastern Standard Time,2020-01-25,18:00:38,-0500,94647670,healthymc,Mason County Health,,#DYK Smoking during pregnancy can cause complications such as premature birth and babies with low birth weight. Learn how to have a smoke-free pregnancy with free tips and resources at  https://t.co/znyb4snxnA via @FDATobacco  https://t.co/9ikwsO6BE3,en,"[{'screen_name': 'fdatobacco', 'name': 'fda tobacco', 'id': '158006058'}]",['https://women.smokefree.gov/'],['https://pbs.twimg.com/media/EPKYohLWAAATVdj.jpg'],0,0,0,['dyk'],[],https://twitter.com/HealthyMC/status/1221206272621629443,False,,1,https://pbs.twimg.com/media/EPKYohLWAAATVdj.jpg,,,,,,,[],,,,
1220479610195992582,1220479610195992582,2020-01-23 17:53:09 Eastern Standard Time,2020-01-23,17:53:09,-0500,94647670,healthymc,Mason County Health,,"Enero es el Mes Nacional para la Prevención de los Defectos de Nacimiento. Ayude a evitar los defectos de nacimiento. ¡No fume! Si está embarazada 🤰 y necesita ayuda para dejar de fumar, visite  https://t.co/RnqFbpCd8h de la @FDATobacco  https://t.co/Sy3DlRMVer",es,"[{'screen_name': 'fdatobacco', 'name': 'fda tobacco', 'id': '158006058'}]",['https://espanol.smokefree.gov/'],['https://pbs.twimg.com/media/EPADvLxXsAAOKjZ.jpg'],0,0,0,[],[],https://twitter.com/HealthyMC/status/1220479610195992582,False,,1,https://pbs.twimg.com/media/EPADvLxXsAAOKjZ.jpg,,,,,,,[],,,,
1220479420173037568,1220479420173037568,2020-01-23 17:52:23 Eastern Standard Time,2020-01-23,17:52:23,-0500,94647670,healthymc,Mason County Health,,"January is National Birth Defects Month. Help prevent birth defects by staying smoke-free. If you are pregnant 🤰🤰 and need quit resources and tips, visit  https://t.co/znyb4snxnA via @FDATobacco  https://t.co/RLAaxjOjpG",en,"[{'screen_name': 'fdatobacco', 'name': 'fda tobacco', 'id': '158006058'}]",['https://women.smokefree.gov/'],['https://pbs.twimg.com/media/EPADkGOXUAAUN9L.jpg'],0,0,3,[],[],https://twitter.com/HealthyMC/status/1220479420173037568,False,,1,https://pbs.twimg.com/media/EPADkGOXUAAUN9L.jpg,,,,,,,[],,,,
1214607875361984513,1214607875361984513,2020-01-07 13:00:58 Eastern Standard Time,2020-01-07,13:00:58,-0500,94647670,healthymc,Mason County Health,, https://t.co/dp6iWPhXae  https://t.co/21xg71I26z,und,[],['https://smokefree.gov/smokefreetxt'],['https://pbs.twimg.com/media/ENsnbQIWoAEVZbT.jpg'],0,0,0,[],[],https://twitter.com/HealthyMC/status/1214607875361984513,False,,1,https://pbs.twimg.com/media/ENsnbQIWoAEVZbT.jpg,,,,,,,[],,,,
1214326372899753984,1214326372899753984,2020-01-06 18:22:23 Eastern Standard Time,2020-01-06,18:22:23,-0500,94647670,healthymc,Mason County Health,,Get ready to quit with tips and information to prepare you for becoming smokefree with the quitSTART app:  https://t.co/YsQJ53ACMF  https://t.co/fbKgQ9GDYf,en,[],['https://www.cdc.gov/tobacco/campaign/tips/quit-smoking/quitstart-app/index.html?s_cid=OSH_tips_D9871'],['https://pbs.twimg.com/media/ENonZiWU0AAqugq.jpg'],0,0,0,[],[],https://twitter.com/HealthyMC/status/1214326372899753984,False,,1,https://pbs.twimg.com/media/ENonZiWU0AAqugq.jpg,,,,,,,[],,,,
1214247272638078981,1214247234549604354,2020-01-06 13:08:04 Eastern Standard Time,2020-01-06,13:08:04,-0500,94647670,healthymc,Mason County Health,,Current shellfish growing area classifications can viewed on this interactive map:  https://t.co/OIwuwuIXGH  https://t.co/V7VmcGJiY5,en,[],['https://fortress.wa.gov/doh/oswpviewer/index.html'],['https://pbs.twimg.com/media/ENnfbkYU4AA7NrY.jpg'],0,0,0,[],[],https://twitter.com/HealthyMC/status/1214247272638078981,False,,1,https://pbs.twimg.com/media/ENnfbkYU4AA7NrY.jpg,,,,,,,[],,,,
1214247234549604354,1214247234549604354,2020-01-06 13:07:54 Eastern Standard Time,2020-01-06,13:07:54,-0500,94647670,healthymc,Mason County Health,,"Last quarter, Mason County environmental health officials were able to upgrade 222 acres of shellfish growing area to approved for harvesting. The upgrades occurred in Oakland Bay with 172 acres, Hammersley Inlet with 44 acres and finally Hood Canal with 6 acres.",en,[],[],[],1,1,0,[],[],https://twitter.com/HealthyMC/status/1214247234549604354,False,,0,,,,,,,,[],,,,
1213158329779937280,1213158329779937280,2020-01-03 13:00:59 Eastern Standard Time,2020-01-03,13:00:59,-0500,94647670,healthymc,Mason County Health,,Time for a change? Get a better gift this year. Get resources and support to help you quit smoking in the New Year. Make your smoke-free plan:  https://t.co/32DJAUxjlm  https://t.co/ALDbySKgyE,en,[],['http://cdc.gov/quit'],['https://pbs.twimg.com/media/ENYBEeBWwAIh5xx.png'],0,0,1,[],[],https://twitter.com/HealthyMC/status/1213158329779937280,False,,1,https://pbs.twimg.com/media/ENYBEeBWwAIh5xx.png,,,,,,,[],,,,
1212282450304479233,1212282450304479233,2020-01-01 03:00:33 Eastern Standard Time,2020-01-01,03:00:33,-0500,94647670,healthymc,Mason County Health,,"Did you know? No matter how long you’ve smoked, you can start to see the health benefits of quitting almost right away. Make 2020 your year to quit!  https://t.co/KFl7UwtF9N",en,[],[],['https://pbs.twimg.com/media/ENLkdmKWsAAr4a5.png'],0,0,0,[],[],https://twitter.com/HealthyMC/status/1212282450304479233,False,,1,https://pbs.twimg.com/media/ENLkdmKWsAAr4a5.png,,,,,,,[],,,,
1212071069647081473,1212071069647081473,2019-12-31 13:00:36 Eastern Standard Time,2019-12-31,13:00:36,-0500,94647670,healthymc,Mason County Health,,"Emergency department visits associated with possible electronic cigarette (e-cigarette), or vaping, product use-associated lung injury (EVALI) are declining. Despite progress in the investigation and response, the outbreak has not ended.  https://t.co/X6A0Ob9UMF",en,[],['https://www.nejm.org/doi/full/10.1056/NEJMsr1915313'],[],0,0,1,[],[],https://twitter.com/HealthyMC/status/1212071069647081473,False,,0,,,,,,,,[],,,,
