id,conversation_id,created_at,date,time,timezone,user_id,username,name,place,tweet,language,mentions,urls,photos,replies_count,retweets_count,likes_count,hashtags,cashtags,link,retweet,quote_url,video,thumbnail,near,geo,source,user_rt_id,user_rt,retweet_id,reply_to,retweet_date,translate,trans_src,trans_dest
1080131617023238144,1080131617023238144,2019-01-01 11:00:20 Eastern Standard Time,2019-01-01,11:00:20,-0500,35807883,oneidacohealth,Oneida County Health,,Happy New Year!  Start 2019 off with health and safety in mind by testing your home for radon.  #newyear #radonactionmonth   Here’s how:  https://t.co/Y7o0NxxPex,en,[],['http://b.link/lowradon'],[],0,0,0,"['newyear', 'radonactionmonth']",[],https://twitter.com/oneidacohealth/status/1080131617023238144,False,,0,,,,,,,,[],,,,
1079790226657210370,1079790226657210370,2018-12-31 12:23:46 Eastern Standard Time,2018-12-31,12:23:46,-0500,35807883,oneidacohealth,Oneida County Health,,"Are you interested in joining a highly effective team?    OCHD is hiring for an LTE Community Health Specialist to coordinate a prevention and health management grant, focusing on diabetes and...  https://t.co/OOGqIe6aGG",en,[],['https://www.facebook.com/OneidaCountyHealthDepartment/posts/2084268211611147'],[],0,0,0,[],[],https://twitter.com/oneidacohealth/status/1079790226657210370,False,,0,,,,,,,,[],,,,
1078714687645249536,1078714687645249536,2018-12-28 13:09:57 Eastern Standard Time,2018-12-28,13:09:57,-0500,35807883,oneidacohealth,Oneida County Health,, https://t.co/RPs9VfXHW8,und,[],['https://www.facebook.com/OneidaCountyHealthDepartment/posts/2079842848720350'],[],0,0,0,[],[],https://twitter.com/oneidacohealth/status/1078714687645249536,False,,0,,,,,,,,[],,,,
1077989801847070720,1077989801847070720,2018-12-26 13:09:31 Eastern Standard Time,2018-12-26,13:09:31,-0500,35807883,oneidacohealth,Oneida County Health,,"EXPANDED RECALL: Jennie-O Turkey Store Sales, Inc. Recalls Raw Ground Turkey Products due to Possible Salmonella Reading Contamination.  https://t.co/Tt9yyXqHDp",en,[],['https://www.fsis.usda.gov/wps/portal/fsis/topics/recalls-and-public-health-alerts/recall-case-archive/archive/2018/recall-124-2018-release'],[],0,0,0,[],[],https://twitter.com/oneidacohealth/status/1077989801847070720,False,,0,,,,,,,,[],,,,
1077172096680235008,1077172096680235008,2018-12-24 07:00:15 Eastern Standard Time,2018-12-24,07:00:15,-0500,35807883,oneidacohealth,Oneida County Health,,"Traveling with food this holiday season?  Here’s how to transport meats, treats, and everything in between.  https://t.co/PzPn2fK50G",en,[],['http://b.link/travelingwithfood'],[],0,1,0,[],[],https://twitter.com/oneidacohealth/status/1077172096680235008,False,,0,,,,,,,,[],,,,
1076120577478414337,1076120577478414337,2018-12-21 09:21:53 Eastern Standard Time,2018-12-21,09:21:53,-0500,35807883,oneidacohealth,Oneida County Health,,Dietary indiscretion — Ten tips to avoid holiday poisoning in pets and people | Food Safety News  https://t.co/829LahOiOg,en,[],['https://www.foodsafetynews.com/2018/12/dietary-indiscretion-ten-tips-to-avoid-holiday-poisoning-in-pets-and-people/'],[],0,0,0,[],[],https://twitter.com/oneidacohealth/status/1076120577478414337,False,,0,,,,,,,,[],,,,
1075420538904944643,1075420538904944643,2018-12-19 11:00:11 Eastern Standard Time,2018-12-19,11:00:11,-0500,35807883,oneidacohealth,Oneida County Health,,It’s not too late for a flu shot!  Here’s where to find one:  #fightflu  https://t.co/jiCqG2LPBj,en,[],['http://b.link/vaccinefinder'],[],0,0,0,['fightflu'],[],https://twitter.com/oneidacohealth/status/1075420538904944643,False,,0,,,,,,,,[],,,,
1075043053180719104,1075043053180719104,2018-12-18 10:00:11 Eastern Standard Time,2018-12-18,10:00:11,-0500,35807883,oneidacohealth,Oneida County Health,,Sending a food gift by mail? Here’s how to ship with safety in mind:  https://t.co/N8o3yAAUA8,en,[],['http://b.link/mailingfood'],[],0,0,0,[],[],https://twitter.com/oneidacohealth/status/1075043053180719104,False,,0,,,,,,,,[],,,,
1074684431447875584,1074684431447875584,2018-12-17 10:15:09 Eastern Standard Time,2018-12-17,10:15:09,-0500,35807883,oneidacohealth,Oneida County Health,,"Cold, dry air isn’t fun for any of us to breathe, but it’s especially hard on folks with lung diseases.  Here’s how to help protect yourself during cold snaps.  https://t.co/y4Hr5kuwU5",en,[],['http://b.link/coldweatherandlungs'],[],0,0,0,[],[],https://twitter.com/oneidacohealth/status/1074684431447875584,False,,0,,,,,,,,[],,,,
1073592271407378433,1073592271407378433,2018-12-14 09:55:18 Eastern Standard Time,2018-12-14,09:55:18,-0500,35807883,oneidacohealth,Oneida County Health,,"Traveling for the holidays? While the season for cyanobacterial harmful algal blooms is over in Wisconsin, you might still find them in warmer climates. If water looks scummy or is discolored, stay out and don’t let your kids or pets swim in it....  https://t.co/dI2QKKmPek",en,[],['http://b.link/bgalgae'],[],0,0,0,[],[],https://twitter.com/oneidacohealth/status/1073592271407378433,False,,0,,,,,,,,[],,,,
1073230350309044224,1073230350309044224,2018-12-13 09:57:09 Eastern Standard Time,2018-12-13,09:57:09,-0500,35807883,oneidacohealth,Oneida County Health,,Curious about the safety of that holiday purchase?  Check out the Consumer Product Safety Commission’s website for recall information on everything from toys to lawn mowers.  https://t.co/vIsq01QQ8T,en,[],['http://b.link/recalls'],[],0,0,0,[],[],https://twitter.com/oneidacohealth/status/1073230350309044224,False,,0,,,,,,,,[],,,,
1073221154289131520,1073221154289131520,2018-12-13 09:20:37 Eastern Standard Time,2018-12-13,09:20:37,-0500,35807883,oneidacohealth,Oneida County Health,,Del Monte Foods Announces Limited Recall of Canned Fiesta Corn Seasoned with Red &amp; Green Peppers Due to Under Processing  https://t.co/AX2B4E9Cec,en,[],['https://www.fda.gov/Safety/Recalls/ucm628259.htm'],[],0,0,0,[],[],https://twitter.com/oneidacohealth/status/1073221154289131520,False,,0,,,,,,,,[],,,,
1072867265287081990,1072867265287081990,2018-12-12 09:54:23 Eastern Standard Time,2018-12-12,09:54:23,-0500,35807883,oneidacohealth,Oneida County Health,,"Before you head out on the ice this winter, skim these safety basics, including what to do if you fall through.  https://t.co/nAPFt5I4bL",en,[],['http://b.link/icesafety'],[],0,0,0,[],[],https://twitter.com/oneidacohealth/status/1072867265287081990,False,,0,,,,,,,,[],,,,
1072505316355526660,1072505316355526660,2018-12-11 09:56:08 Eastern Standard Time,2018-12-11,09:56:08,-0500,35807883,oneidacohealth,Oneida County Health,,"In Wisconsin, a big winter storm could always be around the corner.  Are you ready?  https://t.co/w4H66GW366",en,[],['http://b.link/winterstormprep'],[],0,0,0,[],[],https://twitter.com/oneidacohealth/status/1072505316355526660,False,,0,,,,,,,,[],,,,
1072496860483502082,1072496860483502082,2018-12-11 09:22:32 Eastern Standard Time,2018-12-11,09:22:32,-0500,35807883,oneidacohealth,Oneida County Health,,"When you prepare homemade cookie dough, cake mixes, or even bread, you may be tempted to taste a bite before it is fully cooked. But steer clear of this temptation—eating or tasting unbaked products that are intended to be...  https://t.co/cioPTkg6hn",en,[],['https://www.cdc.gov/features/no-raw-dough/index.html'],[],0,0,0,[],[],https://twitter.com/oneidacohealth/status/1072496860483502082,False,,0,,,,,,,,[],,,,
